Post.id,Post.blog_id,Post.title,Post.pagename,Post.menu,Post.content,Post.public,Keyword.id,Keyword.keyword,Keyword.url,Keyword.visible,Arbitrary.keyword
,180,アーユルヴェーダのマッサージ,,,"エステにいくと色々なオイルがあるみたいですね。チョコレート・アロエ・グリーンティーなど美味しそうな香りがたくさんあります。お客様も、その日の気分が違うので、「今日はオレンジ」「疲れを癒す香り」とか注文があると思うのでたくさん用意してあると思うんですよね。行ったことがないのでわからない(^_^;)エステに行くと効果があるのは、むくみ・セルライトを揉みほぐし、血行をよくし体の循環(血液など)がよくなるとのことでした。顔は人が一番見る部分で、健康に不具合などがあると顔に出るので一番注意しないといけない場所となっています。マッサージすると、ハリのある肌に改めて戻すことができます。エステは美肌を手に入れられる魔法のような場所ですね。お風呂からでたら冬の時期は、お肌がカサカサ・肌が引っ張られる感じたことありませんか？？それは肌が保湿を欲しがっている証拠だと思われます。夏場とかは必要があるのかないのかわかりませんが、乾燥肌タイプの人はボディークリームは必需品となります。ちなみに顔の洗顔が終わった瞬間に肌の乾燥が始まっているので、頭&rarr;身体&rarr;顔の洗い順のほうが良いと思われます。で、洗顔したらすぐに保湿することをお勧めします。ボディークリームの話に戻って、ボディークリームはたくさんの種類が販売されていますが、成分が肌に合わないと潤いどころか、痒くなるので、1度「かゆっ」と思ったら変えたほうが良いと思います。痒すぎて肌が大変なことになったら、次の日でも良いので皮膚科に行き見てもらいましょう。病気はサプリで改善できます。
",1,,おなら臭いあの子に撃退,http://onara.co.jp/,1,0
,181,新宿の歯科クリニック,,,エステのありがたみは、男性にはわからないでしょう。エステを受けること自体、特別で幸せなことなのです。エステを受けるということは、自分はきれいになるということでもあるのです。女性は誰だって、きれいになりたいです。結婚式をするにあたっては、ブライダルエステという特別なエステを受けられます。結婚式をするのだから、それにふさわしいよう、特別にきれいにするということです。ブライダルエステが少々お高いのは、特別な価値があるからなのでしょう。ブライダルエステは、実に全身ありとあらゆるところをきれいにします。そのため、数時間くらいで終わることは、まずありません。実に何度も何度も、結婚のためにきれいのために、足繁く通わないといけません。その間も、結婚式のリハーサルとかもあるので、なかなか日程が合わないことでしょう。ただ、結婚式の前に通ってこそのブライダルエステなので、意地でも通いたいものです。こうして苦労に苦労を重ねてきれいになると、旦那の幸せそうな顔を見ることが出来ます。,1,,おなら臭さにさようなら,http://onara.co.jp/,1,0
,177,整理整頓のコツ,,,オフィスでは長時間座ってることが多いですよね。同じ姿勢を保ってると腰が痛い・首がこるなどの症状がでてくることがあると思います。そこで、長時間座ってても大丈夫な椅子があれば欲しくありませんか？？健康的な姿勢を長時間続けることができる椅子をイギリスで開発されました。健康的な姿勢を保つために、浅く座り背筋を伸ばす・深く座り90&deg;などの座り方をしている人が多くいることでしょう。しかし、この椅子はイギリスの整骨院の方が作ったので安心して使うことができると思います。座った時に、背中をまっすぐにして、太ももが水平からした方向に27度傾いているのが正しい姿勢と言われているようです。高さや座高が調節できるので、オフィスで仕事をする人には、欲しい椅子だと思います。ついでに家にも欲しいですよね。春になり、今年の04月から社会人になるので借りていたアパートの部屋の脱臭を行ないました。次の人が不快な思いをしないようにするのもマナーですよね。,1,,おなら臭いあの子に撃退,http://onara.co.jp/,1,0
,175,美容ってのは際限がない,,biyou,お仕事の忙しい繁忙期ではついつい髪を染めるのを忘れがちなんですよね。 白髪が多いんじゃない？なんて同僚も注意しにくいし、定期的に髪は染めておく必要があります。 体の細胞を染めるだけあって、ヘアカラートリートメントはあまり肌によくない成分を使っていることが多いです。 美容院さんによっては、その辺りにこだわりがあるところも多く、肌にも髪にもやさしいカラー剤があるんだとか。 通販で見たことがあるのでは、海藻の成分を使用し、体への負担が少ないタイプがありました。 健康を維持することが美容にもつながっていくもので、ウォーキングシューズやウェアを買って運動に励む女性も多いですよね。 大きめの公園に行くと、走っている人が沢山いて、太もも回りがまずいことになってきた自分も何かしなければと考えちゃいます。 特別お金をたくさん掛けなくても、普段の運動と睡眠を確保しておけばそれなりに美しさは保てたりするんですよね。スペインが発祥のジャーメインドカプチーニ は王室御用達のセレブ向け高級ブランド。気になるあなたも一度体験してみてはいかがでしょうか。ケータイでカラコン簡単購入！このサイトからカラコンを注文すれば、即日出荷してくれてしかも送料は無料！度ありでも激安なのに、さらに期間限定セールも随時開催しています。売り上げベストも載っているので、人気のカラコンがチェックしやすいというのも評価高いですよね！通いやすいメンズエステ、頼みやすいメンズ脱毛ならこのお店。男性でもムダ毛が気になるもの。ヒゲ剃り跡の青さや手やヒジなどの伸びすぎた毛を、こちらのメンズエステ店で気軽に脱毛処理しませんか。無料カウンセリングは年中無休で受け付けてもらえるので、気になったときにすぐ相談できます。普通の白髪染めは地肌も髪も傷めますが、利尻ヘアカラートリートメントならそんな心配はありません。TVCMでも流されている利用者の声、嘘ではないんですよ。使い捨てコンタクトレンズの代表的激安サイト！消耗品かつ日常必需品のコンタクト、できるだけ安く買いたいなら激安サイト比較は当たり前。その中でも激安な上に品質も良いのがこのサイト。ディファインやカラコン、ハードコンタクトさえ激安な使えるサイトです。,1,,おなら臭さにさようなら,http://onara.co.jp/,1,0
,124,きつねに騙されないようにね,,biyou,キツネって、よく人に憑くっていいますよね。はっきり言って、憑いてほしいかもｗｗｗｗだって動物大好きなんだもん！キツネって超カワイイじゃーんvvv私くらいヘビーに動物を愛しちゃってる人も少ないんじゃないかな？？こうやって明るく振舞ってるけど、沢山飼ったことある分、沢山悲しい別れもしてきたんだよー。。。でもね、くよくよしてもしょうがないと思う！それより、世の中には人間の愛情のカケラも知らないコ達がたっくさんいるんだから、その中からひとり(一匹とは言わないぞ！)でも多くの動物と触れあって心を通じ合わせたいよ！人間のために命や健康や自由が損なわれてる動物たちがいっぱいいることも覚えておかなきゃ！おキツネ様の霊だって、人間に土地を奪われたから憑いちゃったのかもよー？？でもちゃんと祀ってあげれば祟りも治まるのかな？キツネちゃんのためなら毎日手をあわせてあげてもいいなあ(笑)動物の霊だって、慰めてあげないとカワイそうだよね！,1,,おなら臭いあの子に撃退,http://onara.co.jp/,1,0
,125,コンタクトレンズの変更性,,biyou,コンタクトレンズを装着するには、医師の診察が欠かせません。 コンタクトレンズで目にトラブルを抱える人の多くが、眼科医による検査を受けずに購入する人（度なしカラコンなど）や、レンズの手入れをしていない人、使用方法を間違えている人だそうです。 カラーコンタクトはファッションアイテムとしてすでにメジャーな存在ですが、使用するには注意が必要ですね。 しかし、ということは、カラーコンタクトを普段使用しているあの芸能人たちは、定期的に眼科医に診察してもらっているということになるわけですね。 多忙な身でしょうが、健康管理も仕事の一端といったところでしょうか。 テレビや映画で、鮮やかで美しい目をした白人系を見ますが、ああした本来青や緑の目を持っている方々でも、より美しく見せるために色つきのコンタクトを装着することもあるそうです。そのような方々でさえカラコンを入れるのですから、黒い目の私がカラコンに憧れるのはきっと不思議な話ではありませんよね。,1,,おなら臭さにさようなら,http://onara.co.jp/,1,0
,126,さつまいもでお腹スッキリ,,biyou,サツマイモは秋にはいっぱい出てきます。八百屋さんやスーパーで安く手に入り、おかずにもおやつにもなる万能選手です。食物繊維も豊富なので、おなかも毎日すっきりしてます。ただ、いつも同じサツマイモなので、いまいち新鮮味がなくなてきました。というわけで、今度家族みんなでサツマイモを掘りに行きます。実家が農家でサツマイモを栽培していたならよかったのですが、実家が作っているのはスイカでした。そこで、サツマイモを掘れるところに行ってきます。関東圏内なら、千葉県や埼玉県、茨城県で掘れるところがあるようです。掘ったサツマイモを規定数いくらで買う、といった感じのものらしく、料金はだいたい1000円前後くらいのようです。場所によってはお弁当の持ち込みもやってたり、そのままサツマイモを食べることができたりするので、どこに行くのか悩みます。おいしいサツマイモをたくさん食べられるところがいいですが、どこもおいしいでしょうしね。サツマイモは普段はふかして食べています。うちには蒸し器があるので、いつも作っています。でもさすがに蒸すだけだと飽きてしまうので、アルミホイルで包んで焼いてみたり、ぶつ切りにして煮物にしたり天ぷらにしています。今度はスイートポテトにも挑戦してみようと思います。サツマイモはおやつにもおかずにも便利な食材です。栄養も豊富で、家族みんなが健康になってます。みなさんも、秋の旬のサツマイモをたくさん食べてみてはいかがでしょうか？,1,,おなら臭いあの子に撃退,http://onara.co.jp/,1,0
,6,臭いを撃退,,datsumou,サプリメントは健康にいいので、摂れば摂るほどより健康になっていく。そう思っている方は多いかもしれない。だが、何事も程々というように、サプリメントも摂りすぎてはいけないのである。一日の摂取目安量があるとはいえ、人の体質は人それぞれであるため、飲みすぎたか足りないかはいまいち分かりづらい。足りないならまだしも、摂りすぎていると恐ろしいことに健康被害が出てしまうのだ。例えばビタミンCである。ビタミンCのサプリメントは人気であるため、愛飲者も多いことだろう。人間は体内でビタミンCを作り出すことができず、常に不足し続けるからだ。不足した分を食事だけで補うのが到底難しいので、サプリメントとしての摂取が注目されたのである。ビタミンCを摂ることで、抗酸化作用と免疫力を強化し、いつまでも若々しく炒られる。また、ビタミンCは水溶性ビタミンのため、過剰摂取した分はすぐに体外に排出される。過剰摂取になることは滅多にないことだが、１日に３０００㎎以上を摂取してしまうと、過剰摂取による副作用が出てくる。主な症状は胸焼けや吐き気、頭痛に下痢で、どれも思い病気ではないものの日常生活に支障をきたすだろう。とはいえ、ビタミンCの副作用の症状は、摂取を控えればすぐに収まってしまうので比較的安全なほうである。ビタミンCはストレスなどで大量に消耗されてしまうため、サプリメントに頼るだけでなく生活環境を見直すのも、健康のためになることだろう。,1,,おなら臭さにさようなら,http://onara.co.jp/,1,0
,12,サプリも大事。,,shibou,サプリメントを摂取しています。食事もちゃんととっていますが、アレルギーが多いので、どうしても栄養面で不安があります。ほかの食材で栄養を補おうとしてみましたが、成分の少ないものだと、相当な量を食べないといけないので、どうしても食べきれなくなります。毎日少しずつ摂ったとしても、いずれは不足するかもしれないのです。どうにか解決したいので、医者と相談してサプリメントを始めることにしました。本当はサプリメントに頼りたくはないのですが、栄養失調になってしまうよりはいいと思ったので、始めることとなりました。一つだけだと栄養が偏って、健康被害が出るかもしれないということなので、いくつかの種類を同時に摂るようにとのことでした。また、サプリはあくまでサプリなので、食事をおろそかにしないようにとも言われました。疑いながらも摂り始めてみましたが、効果は意外なほど早くあらわれました。毎朝の寝起きの悪さや倦怠感が治ったり、関節痛が軽くなったりと、あっという間でした。今まで効果のほどは疑ってましたが、今ではなぜみんな摂っているのかがわかる気がします。ただ、これ以上増やそうとは思っていません。これ以上増やすと、食事がおろそかになり、サプリメントだけを摂る生活になってしまいそうだからです。やはりご飯はご飯でおいしく食べたいので、これからも食事とサプリメントとのバランスは守っていこうと思っています。特に、これからの季節のおいしいものも食べたいですしね。,1,,おなら臭さにさようなら,http://onara.co.jp/,1,0
,7,シリコンのような人工物を胸に入れる豊胸手術には抵抗がある。彼女は脂肪注入方式で胸を大きくしたいようだ。美容外科の先生に、豊胸手術は脂肪注入でやりたいというと、彼女は幸か不幸か脂肪が少なすぎるとのこと。次の日から彼女はひたすらカロリー高いものを食べ続けていたが、全く太る気配なし。私食べても太らない体質なの～って人間は本当に存在するんですね。これじゃいつになったら豊胸手術できるのやら。彼女と水泳勝負をするのだけど、本気で勝ちたいからムダ毛処理までしてプールに来た。彼女は県大会でそこそこの成績を収めた猛者なので、男といえど本気を出しても勝てないかも。しかし想定外だったのは彼女も無駄毛処理を完璧にしてきていたということだ。よく考えたら、競泳やっている人間が本気出したら無駄毛も処理するわな。私の高校では最近脱毛の口コミで持ちきり！授業中もこっそりわき毛の処理方法について議論したり、脱毛部なんてものを設立した強者もいた。それだけ高校生は脱毛に対する熱意というか、意識が高いんですね。中学に上がった頃からわき毛が生えてきて、私のわき毛脱毛デビューはその時でした。生まれて初めてのカミソリはちょっと怖かったけれど、あのジョリジョリ感は病み付きになるよね。生まれつきまつ毛に綿棒が乗るくらいボリュームあって、度ありカラコンと組み合わさると相当顔面にインパクトが出るよ。グレーでも赤でもカラコンの色は沢山あって、似合う色を選ぶのが難しい。逆にどんな色のカラコンが良いのか、選ぶ楽しみってのもありますけどね。私がカラコンを作るとしたら、マニア向けにクリアカラーのカラーコンタクトを開発するよ。色があると思う人にはあるし、無いという夢のない人には色の見えないカラコンです。,,supli,シンプルかつ広々とした空間で生活したいから格安の廃品回収に手伝ってもらったよ。まずはベッド。これだって敷布団にしたらいらないし、タンスも衣装ケースがあるから別にいらない。自転車やバイクも歩いたほうが健康的だからいらないよね。鍋もヤカンも廃品回収に出したし、あとは僕の内臓で必要のない臓器を引き取ってもらえば完了ですね。お客さんへの資料をプリントアウトしたり、スキャニングしたりで大活躍のコピー機ですが、これがけっこう維持費もかかる。私の会社ではプリンターを購入した時から通販でリサイクルトナーを使っている。リサイクルという名前がちょっとエコっぽいし、価格的に見てメーカー純正のものよりかなりお得。年間に直すと何万円か得しているのだと総務部長から聞いたことがありますね。商品の写真は充実しているし、社長である私の自伝も数百ページにわたって載せてある自慢のホームページがある。だがサイトへの顧客流入数が少なすぎるんだよね。こんな良いサイトがなぜ無視されるのかseo業者に聞いてみたら、最適化をしなければサイトの内容が充実していても効果が薄いようだ。ウェブサイトの上位化においては最適化のテクが大切だから、これからseoについて勉強しなきゃ。メジャーな商売に参入するのはほぼ不可能だが、隙間産業で会社設立すればまだまだ戦えるはず。僕がニュービジネスとして着目しているのはシケモクを利用したタバコ産業。道端や吸い殻捨てからシケモクを回収、それを新しく巻きなおして販売するという方法。タバコは税金とか法的に難しい部分もあるが、いつかこの商売が当たり前になるよう、今年中には会社設立してみたいですね。,1,,おなら臭いあの子に撃退,http://onara.co.jp/,1,0
,61,長く続くアルバイト,,poster,それに、気風のいいお客さんだったりすると高級ブランドのバッグをプレゼントしてくれたりっていうサプライズもあったりして。幾度となくバイトをクビになったりバックレたりで、職が安定しない。今回もダメかな？と不安な気持ちで、お仕事を探してみました。仕事自体は結構あるし、アルバイト経験も豊富なので面接は余裕。僕ってなぜか第一印象がものすごくよくて、それからしだいにボロが出てくるタイプなんですね。でもヒューマンには良いお仕事が目白押しなので、今回の仕事は長続きしそうだ。,1,,滋賀のアルバイト情報,http://2010-shiga-kyujin.com/?,1,0
,59,秘密のアルバイト,,money,それほど貧乏だったわけでもないのだが、中学の頃からすでに働いているという知り合いがいた。 いつも遊びに誘ったり一緒に給食を食べたりしていたが、あえて一人を好むやつで、ちょっと非合法なアルバイトをしていたらしい。 何でも組織がどうのとか、機関が云々と話し出すとアベレージ30分は取られるからあまり話さないのだが、仕事の内容はあまり教えないのに饒舌なやつだったね。 高校生になってからはそのアルバイトの話を全くしなくなったが、もうしなくてもよくなったという話だから、実家も安定してきたのかな。 中学生くらいにできるアルバイトなんてたかが知れていると思うが、今は全く働きたくない俺も小さい頃はとにかく働きたくて毎日ウズウズしてたわ。 だって自分の実力でお金が手に入るのだから、アルバイト先があれば飛びついたはずだよ。 お金があれば欲しいものは何だって手に入るし、あれほどお金や物に執着していた時期はなかったね。 高校生にもなると、努力しても欲しいものは手に入らないと思うようになってしまい、次第にお金を使わずに幸せになる方法ばかり考えてしまっていた。 今では片っ端から荷物を処分して、交友関係も絶ったのでものすごく身軽で今にでも空を飛べそうなくらいに体が軽い！ 祖母は自分とは真逆で物や人間との関係に執着しすぎて、ゴミ屋敷を作り上げ、近所には迷惑をかけるし、 知り合いとのしがらみが多すぎて偏屈なババァになっちまった。 物も人間も、多けりゃいいってもんじゃないのだということを教えてくれたのも婆さんなんだよな。 死ぬ気配がないのが腹立たしいが、多少人に恨まれるような人間になるのが長生きのコツだよクソガキ！ とありがたい説教を聞いてからは自分に素直に生きられるようになれた。 今年も敬老の日にはアルバイトでためた一か月分のバイト代をすべてつぎ込んで菊の花をプレゼントしてやるわ！歯科衛生士の国家試験で毎年学生を全員合格させている大阪の専門学校といえば、こちらです。3年制なので、在学中に歯科衛生士として必要な技術と知識がしっかり学べるのも大きな特徴。 ゲームを引き立てるサウンドを、映像とともに学ぶことができるサウンドの専門学校が、この学校です。ゲーム効果音やBGMなど、この学校で技術を学んで、あなたのアイデアが詰まったサウンドを世に出してみたくはありませんか？ 超高齢社会や人手不足を考えれば、作業療法士の専門学校へ進学を希望するのは社会に適応した賢い選択と言えるのではないでしょうか。なにより、人の役に立ちたいという気高い意識が輝いています。,1,,滋賀のアルバイトサイト,http://2010-shiga-kyujin.com/?,1,0
