Post.id,Post.blog_id,Post.title,Post.pagename,Post.menu,Post.content,Post.public,Keyword.id,Keyword.keyword,Keyword.url,Keyword.visible,Arbitrary.keyword,,
,158,女性が多い場所,,,女性が多く通う作業療法士の専門学校に行けば、俺も彼女作れるかも。カリキュラムの特徴としては、作業療法士に必要な技能や知識を身につけるのは当たり前。それプラス、実習内容がだいぶレベル高くて、そのおかげか就職した後に技能不足で困ることが少ない。それが理由だと思うけど、就職率についても高い専門学校だから、オープンキャンパスに行くと人が沢山いたね。マッサージ 求人千葉、神奈川方面で在宅マッサージの求人を探している鍼灸あん摩マッサージ指圧師の資格をお持ちの方。ここで就職活動をしてみませんか？今の日本には歩くことすらままならない在宅患者の人が大勢いる中で、あなたの鍼灸あん摩マッサージ指圧師の能力を遺憾なく発揮できる場所がこちら。中洲 求人大阪の求人でエステティシャンやネイリストを募集してるんです。長年ネイリストや美容師としての修業を積んだベテランのあなた、あるいはこれから美容業界に入っていく若手の方もこのサイトは必見。無料のアイリスト講座もあるから、まずは登録することが業界への第一歩です。薬剤師 転職あん摩マッサージ指圧師や鍼灸師の技能があるなら訪問マッサージ求人で仕事探ししましょう。すごく訪問してマッサージ的なことしたい人って増えてるんですよ。僕は訪問マッサージされたい方なんですけどね。ホテルとかであん摩マッサージ指圧師を呼んだことがあるけど、やっぱ訪問されると興奮するよね。キタ?って感じがして、僕もマッサージ師になりたくなった。LED 蛍光灯 ラピッド看護師の資格がある人って、いろんな病院から引く手あまた。だから看護師求人を探しても候補が沢山だよね。ここの看護師求人から、働く病院の環境や給与面での待遇をチェック。あなたの求める条件に合致するようなら、求人が埋まる前に連絡を。私は薬剤師の資格をもっている。資格を取得した時は本当に嬉しかったし、これから病院でバリバリ働けると思うと胸が躍った。でも現実はドラッグストアの薬剤管理だった。あんなに苦労したのに薬局という事に納得できなかったし、詰まらない仕事なので近いうちに転職しようと思っている。そのための求人を探しているところだ。,1,,恵比寿の美容院はこちら,http://www.lens.ne.jp/,1,0,,
,137,エステとか化粧とか,,,女性だと美容機器やエステに興味のある人は多いんじゃないかと思います。でも男でもああいうマッサージなんかはやってもらいたい気もするんですよね。肌が美しくなるとかそういうのはあまり興味ないですが、健康とかストレス解消という意味では面白そうですね。たしかメンズエステとかいうやつもあって、それなら堂々と入れるんですけど。ナルシストとか思われるのも嫌だし、ある程度顔が良くないとちょっと恥ずかしいなぁ。速水もこみちや竹中直人みたいなカッコいい人なら気兼ねなく行けるんだろうな。それにしても女性ってほぼ毎日化粧してますよね。姉も朝起きてやることは洗顔と化粧です。男からすると化粧ってのはどういう手順でやるのか分からないんですけど、あんなにたくさんの化粧道具を使う必要があるのか？使い方をいちいち覚えないといけないなんて面倒くさすぎる。でも男のオカマっぽい人で化粧のプロもいたりするからああいう人たちはどういう経緯でその道に走ったのか気になりますよね。ホストの人だと男でも脱毛したり、美容機器を使っていることってありますけど、女性よりも男の方が物事に執着しがちなので、やり始めると際限ないでしょうね。暇さえあれば美容機器や脱毛のことばかりかんがえたり、メンズエステの店を探したりこれだとまるっきりオカマなんですが、ホストからオカマになる人も多いんでしょうか？Vラインの脱毛だったらここをオススメするでしょう。理由は価格と実績です。夏になって、水着を着た時に恥ずかしい思いをしなくていいように、早いうちにVラインの脱毛をいざというときにメガネは必要だけど、普段のコンタクトレンズは通販で買うのがお買い得だし、何よりも便利。洗浄液って持って帰るの重いから嫌なんだよね。豊富な種類を取り扱っていて、しかも国内既製品だけを扱うという安全性を重視したコンタクトレンズの通販サイトはこちらです。お値段も安いのに安全に使えるなら、ここで買うっきゃないでしょ！,1,,恵比寿で人気の美容院,http://www.lens.ne.jp/,1,0,,
,159,美容の流行,,,女性はもちろん、最近では男の人でも美容にこだわっている人っていますよね。男だとほとんどの場合、ホストなんかが多いかと思いますが、男が一度こだわりだすと際限がない。毎週のようにメンズエステに通ったり、脱毛したりですごい美容にお金かけてる人はいそう。芸能人だったりすると、今は地デジで肌荒れもよく見えるので化粧している男性芸能人も普通かな。化粧をする男ってなると、ちょっとホストや芸能人とも違う存在になってきますが、そういう人たちに限ってめちゃくちゃ詳しかったりすごい技術を持ってたりするのが不思議。顔をキャンパスとして、絵を描くようにメイクしていくものだって聞いたことありますが、そう考えると化粧の世界も奥が深いんでしょうね。どんなものにも流行り廃りってありますが、十年後のメイクってどんな感じになっているんだろう。 バブル期のメイクっていうと、派手な口紅に厚化粧のイメージがすごく強いですが、 今はなんていうんでしょうね。一歩距離を置いてみると、マンガやアニメのキャラクターっぽいように思えます。 とにかく目を大きく見せるようなメイク技法は、少女マンガのそれに近いかも。 一重まぶたを二重にするのは昔からあったみたいですが、プチ整形というのか。 まぶたを糸で縫って強引に二重にするという方法があるんだとか。 ちょっとお金持ちの男の子で、まぶたのプチ整形をした人がいました。 元々けっこうかっこいい方だったんですが、何が気に入らなかったんだろうかねぇ？すぐに印象を変えたいなら、カラーコンタクトが良いと思います。髪型を変えるよりも手軽です。コチラのサイトがおすすめです。コンタクトもカラーコンタクトも消耗品だから、まとめてお得に買っちゃおう！まとめて買えば送料が安くなるんだよ、だからこの際いっぱい買っちゃえ♪ミネラルファンデーションでさらに美しい肌を手にするなら、こちら。シーズンごとに異なるミネラルファンデーションで、自然で美しい肌を演出しましょう。ファンデーションなのに肌が潤い、敏感肌の方にもお使いいただけるミラクルファンデ。このファンデをつけていれば、エイジングケアも期待できます。加齢臭は石鹸で変わる！専用の石鹸を使用すれば、ニオイは気にならなくなるはず。女性も男性も、クサいなんて言われたくないならこちら！なんとモデルからでも人気のカラーコンタクトが探せちゃう、女子のビューティー度向上のためのサイトはこちらです！好きなモデルに近づきたいなら、ココでお揃いのカラコンと盛りヘアアイテムGetしちゃえ！,1,,恵比寿の美容院はこちら,http://www.lens.ne.jp/,1,0,,
,12,自宅より脱毛はエステ,,datsumou,小学校から大学、そして会社に就職してからも僕のあだ名は肉でした。僕自身それを気に入っていた面もあったものの、転んで立ち上がれなくなったとき、自分の無力さを思い知らされました。いつまでも肉のままではダメだ！しかしダイエットは最初からやるつもりはなく、僕は脂肪吸引一択。デブ仲間もこの美容吸引でデブを卒業していった実績があるし、これを機に彼女でも作ろうかな？私の足は、排水溝を洗うワイヤーブラシみたいなすね毛。剃っても剃っても相変わらず剛毛が生えてきます。これを使えばあちこち掃除ができるのでは？と、彼女からもお褒めの言葉がありました。でもこの剛毛で人を傷つけることもあるし、僕はムダ毛処理してしまいたいんですよ。カミソリを何本もオシャカにしてきた無駄毛。医療レーザー脱毛ならば、あるいは。うっかり海パンをはき忘れてプールに入ってしまったことがあります。当然監視員に怒られてしまいましたが、今度からはしっかりＶライン脱毛をしてくること！なんてかなり本気で怒られましたよ。その方は競泳の選手をやっている人で、水泳仲間も通っている美容外科を紹介してくれた。そこの脱毛はレベルが高くて、レーザー脱毛の技術は日本一らしい。ぶら下がり健康機やスタイリーはくたくたになるまでやりましたよね。でも今は超高性能な美容機器があるから楽してきれいになっちゃいますね。いつか業務用の奴を使いたいわ。カラコンを入れてみたいと思ったらココ！激安なので、興味本位で買っても「損した」なんてことにはなりませんよ！発色もキレイで安全性も高いから、初心者でも満足できると思います。自分を少し変えてみたいとき、張り切ってオシャレしたいときにはカラコンを付けるのが一番です！自覚しづらい自分の体臭や加齢臭は対策しておいたほうがいいですよね。加齢臭の対策に、こちらの石鹸を通販しましょう！ご注文数がますます増加している人気の薬用消臭ボディソープです。人気の秘密は、驚きの防臭効果！この石鹸を使用しただけで、体のニオイが消えたとご利用者から評判が高く、口コミでも話題になっています。体だけでなく洗髪もこれでできるので、単純に石鹸としても使い勝手が良いですよ。この石鹸が洗顔石鹸のランキングで上位をとっている話題の石鹸！小麦を使用していないので、肌が弱い方でも安心してお使いいただけます。天然成分をたっぷり使用しているため、体の中から自然に美しくなれる洗顔石鹸！,1,,恵比寿で人気の美容院,http://www.lens.ne.jp/,1,0,,
,7,美容院のシャンプー,,shibou,床屋や美容院に行ってシャンプーしてもらうとすごく気持ちがいいよね。 ヘッドスパみたいな本格的なものはやってもらったことはないけれど、 誰かからマッサージしてもらうってなんであんなに気持ち良いんだろ。 サルが仲間にグルーミングをするのも、マッサージが気持ち良いと感じる理由と同じかな。 化粧をする動物は聞いたことがないけれど、動物の雄というのはメスよりも派手な外見が多い。 個体差をそこで見せつけるんだろうが、それを考えると女性よりも地味な人間の男は不思議だね。 こぞって女性たちはネイルサロンに行ったり美容機器のカタログを眺めたりするけれど、 男が化粧やまつ毛エクステに興味を持つってのは滅多にない。 自然界の動物に習うとしたら、人間の男はもっと自己主張をするべきなのかな。 男は外見よりも中身で勝負するべきだとか、それっぽいことを言い出した人がまずかったのか。 見た目の磨き方でいうと女性の方がいじる部分が多いから、メンズエステって儲かるのかな。 アンチエイジングやダイエットも、毎日のジョギングや筋トレで筋肉をつけて解決するって人多そう。 全ては女性の価値観が男性の外見をコントロールするんだよな。 無駄毛の多い人はありえないって口をそろえて言い出したら男はみんな脱毛するし。 極端な話、胸の大きい男性がいいとかおかしなこと言い出したら豊胸手術する男が出るかもしれんわ。キレイになりたい、結婚したい、モデルになりたい、あなたの気持ちを叶えられるのは、美容整形なのでしょうか。整形をすることで、明るくなる人と暗くなる人がいるそうです。美しくなっていくのだから、明るく笑顔になれた方がいいですよね。http://www.ik-pridegirl.com/長年メガネを愛用してきた人が急にコンタクトレンズにするとびっくりしますよね。メガネを外したいあなたにぴったりのサイトがここにあります。いつでも若くいるために、最新の技術を使いましょう。フェイスリフトはもう切らない時代です。ちょっとそこ行くパツキンの外人さん、利尻ヘアカラートリートメントで黒っぽい髪に挑戦しないかい？地肌にもやさしい利尻ヘアカラートリートメントは髪は黒くできますが、おなかの中まで真っ黒にできるかはあなた次第！中年マダムから狂信的な支持を得ている利尻ヘアカラートリートメントを、お値打ち価格で手に入れられるサイトはこちら。このサイトなら定番のソフトコンタクトはもちろん、扱いやすくて目に優しいハードコンタクトや遠近両用のコンタクトレンズを通販できるよ！サイトからの注文もOKだけど、電話やFAXからも申し込みOKだからとっても便利！,1,,恵比寿の美容院はこちら,http://www.lens.ne.jp/,1,0,,
,14,寝ている間に,,supli,寝ている間に終わってしまうほど痛みもなく、筆舌にしがたい脱毛タイムを過ごせた…。脱毛には一家言ある姉が美容外科にてレーザー脱毛を終えて帰ってきました。全身を脱毛してきたのか、顔も腕も無駄な毛一本すらない状態。私も脱毛すればあんな美しい肌を手に入れることができるのかと想像していたら、自然と脱毛の予約をしていましたね。爪の長さでギネスを目指しているからネイル用品は欠かせない！薬局に行っていの一番に駆けつけるのがマニキュアとかのネイル用品ですね。毎月爪のお手入れに掛ける金額は3万円くらいかな？最初はちゃんとマニキュア塗ってたんですが、ペンキを塗るのが良いと思います。あれだったら簡単には落ちないし、さっとペンキの缶に詰めを浸すだけだもの。ネイル用品も新製品が続々登場するし、オラワクワクすっぞ！,1,,恵比寿で人気の美容院,http://www.lens.ne.jp/,1,0,,
,144,美容室なら恵比寿おすすめ,,biyou,水中歩行が良いって聞いてプールに通うことにしたんだけど、ムダ毛の処理が面倒くさいんですよ。カミソリでやると肌へのダメージが大きいし、毎週のようにこのやり方で脱毛するのは現実的じゃないかな？美容外科ではレーザーでムダ毛処理をできるみたいで、プールに行く前に行ってみるのもありかも。永久脱毛の仕組みを最近知って、美容外科でレーザーを使ったムダ毛処理をやってきました。生まれて初めてやったレーザー脱毛ですが、一昔前の機械だとかなり痛みがあったようですね。ダイオードタイプのレーザーはほとんど痛くないので、寝っころがっている間にムダ毛処理が終わっていましたよ。 コスプレはセーラー服が人気です。だからセーラー服からムダ毛が見えたら嫌なので、脱毛しましょうね。 セーラー服のコスプレはここが評判です。,1,,恵比寿の美容院はこちら,http://www.lens.ne.jp/,1,0,,
,145,脂肪注入とは？,,biyou,世の中には脂肪吸引というものがあって、体の中にたまっている皮下脂肪を、人工的に取り除くというものです。太ももやおなか周りの皮下脂肪を取り除くことで、スリムな体型になれます。ただ、細いだけが美容ということではありません。ボディラインのメリハリがはっきりしているほうが、よっぽど美容的だと思います。しかし、そのために栄養を摂ったとしても、ボリュームをつけたい部位に行きわたるということはありません。胸のあたりやおしり周りのほかに、ほうれい線やしわが増えてきた顔にほしくても、どうしてもおなか周りに行ってしまいます。そこで頼りになるのが、脂肪注入です。こちらは脂肪吸引とは違い、胸や顔などのボリュームをつけたいところに、人工的に脂肪を注入するというものです。日本では脂肪幹細胞移植とも呼ばれています。脂肪を移植するというのは意外と大変で、またすぐに、無事に癒着するというわけではないのです。３か月程度を様子見して、さらに１年程度経って注入した脂肪が減っていなければ、無事に癒着したということになります。脂肪注入は体質による影響が多いため、すべてがすべて癒着するということはなく、ものすごい減ってしまうということもあれば、なくなってしまうということもあります。その場合は、また脂肪注入をしてもらいます。だいたい２～３か月くらい経ってから、また注入してもらえます。また、注入後はしばらくの間、運動などが禁止されるなどの制約があります。これは、注入した脂肪に悪影響を与えないようにするためなのです。,1,,恵比寿で人気の美容院,http://www.lens.ne.jp/,1,0,,
,146,いい匂いの石鹸,,biyou,石鹸のためならサガルマータでも攻略してみせる！女性ならそれくらいの意気込みで石鹸通販を利用してますよね。このサイトはいいものだけを集めたビューティー＆ヘルスオンラインショップで、中でも美容洗顔石鹸ランキングが高い支持を得ています。ビタミン サプリメント　http://www.endokoro.com/ 　脳梗塞の後遺症にも効果的です。なければ自分で作るつもりだった洗顔石鹸ランキングがこのサイトで確認できます。石鹸については並々ならぬ情熱を持っているので、洗顔石鹸ランキングはいつも役に立っています。お茶石鹸や加齢臭予防の石鹸など、今はまさに石鹸戦国時代ですから、途上国では材料の奪い合いで紛争が起きているくらい。60過ぎたらさすがにババア？でもフェイスリフトで40代くらいに若返った人がいますよ。年齢を感じさせる要素はやっぱり顔のシワ。これがなければ若く見えるので、フェイスリフトは皮膚のたるみを引き上げることでしわやたるみを解決します。最新の美容外科手術では、従来のフェイスリフトよりも低リスクで効果が期待できます。永久脱毛も兼ねた医療レーザー脱毛の威力をあなたも実感してみてください。女性であれば見えにくくて気になる背中や、男性の口髭に医療レーザー脱毛が大活躍します。従来の医療レーザーと比較して脱毛時の痛みが軽減されているので、脱毛は痛いと思っている方には朗報かと。,1,,恵比寿の美容院はこちら,http://www.lens.ne.jp/,1,0,,
,108,脱毛したらもてましたについて,biyou,,先生の脱毛テクがすごくってしかもやさしい！そういう脱毛の口コミを信じて美容外科でレーザー脱毛を頼んでみた。受付スタッフの人たちもみなさん対応が丁寧だったし、肝心の脱毛技術も大満足でしたよ。以前安いエステサロンで脱毛をやってもらった時は処理残しも多かったし、プロにお金を出してもこの程度かとガッカリだったのですが、美容外科の脱毛は違いますね。準備万端じゃないと動けない私は、脱毛をプロに頼むときは脱毛の口コミを参考にします。お店が行う宣伝というのは半分くらいが嘘だと思っているし、やはり口コミしか信用できないね。インターネットには真実しかないと僕のおじいさんも言っていた。本音が出る口コミだからこそ私は信憑性があると思いますね。毎朝会社に行く前にやっていることがあります。それはわき毛チェック。思い出したくもありませんが、わき毛脱毛を怠ったツケで大恥をかいたことがあります。懇親会の帰り、みんなで会社近くのプールまで行ったが、その時にわき毛がボーボー状態。そもそも私の村ではわき毛を剃るという習慣がなかったんですね。でも先輩からはお前の意外なわき毛が見られて楽しかったと喜んでくれました。差し引きゼロってとこかしら？朝の体操をできるかぎり激しい動きでやってみたら服の脇がビリリと破けてしまった。そのときたまたまわき毛を処理しておかなかったものだから赤っ恥かきましたよ。でもワキを露出したファッションというのも上級者向けっぽくていいよね。その日からはワキの脱毛を欠かさずにやるようになったし、真冬でもワキだしスタイルに積極的です。ゾウをも倒すワキガを持っている僕はわきの脱毛は欠かせない。デオドラントスプレーのような軟弱なものは使いたくないので、体臭防止に効果があるというワキ毛脱毛を重点的にお願いしている。美容外科の先生からは、アポクリン汗腺を除去する手術も勧められたが、体にメスを入れるのは恐い。というか宗教上の理由で脱毛しか許されてないんです。,1,,恵比寿で人気の美容院,http://www.lens.ne.jp/,1,0,,
