Post.id,Post.blog_id,Post.title,Post.pagename,Post.menu,Post.content,Post.public,Keyword.id,Keyword.keyword,Keyword.url,Keyword.visible,Arbitrary.keyword
,40,教会式に,,bridal,キリスト教徒ではないので教会に行ったことってないね。外から見ると面白い形をした建物だし、ちょっと入ってみたい気もするなぁ。テレビドラマとかで見る感じだと、キリストの像が設置してあるようだね。ああいう目立つところにご神体を置いていたずらとかされないのかしら？僕が子供だったらのぼって落書きしてたと思いますね。教会はオープンすぎるわ。日本にもキリスト教徒はいるけれど、その数は本当に少ない。かといって熱心な仏教徒も多いわけではない。でも結婚式はキリスト式が圧倒的に多いし、深く考えると変な連中だよな、日本人って。結婚式は仏式が最近人気あるが、僕は無難に教会でやる結婚式が良いよ。滅多に入る機会がない教会に入れるのが楽しみだしね。成人式には家族の誰もがいかなかったようですが、姉は和装髪飾りまでレンタルして和服姿の成人写真を撮影していたね。,1,,結婚式のプチギフト,http://momo-fuku.jp/,1,0
,39,いよいよ本番,,est,これから結婚式本番を後に残すのみですが、最後の準備に大阪のブライダルエステまで行ってきます。このエステティックサロンでは、ブライダルエステ専用メニューがあって、私は痩身と美肌コースをいっぺんに頼みました。もともと鈴木その子レベルのビハディストなんですが、このエステでさらにパワーアップさせてみんなの度肝抜いてやりますよ?。大切なイベントといえばやはり結婚式。とくに親しい友人の結婚式に出席するときは大阪のエステを予約します。それ以外でも毎月エステを利用しているから、社内でも私は美肌の持ち主として知られています。でも私は男なので、肌がきれいで得をしたことってあまりないかな？中学の頃からニキビもほとんど出なかったし、エステの人からも肌がすごくきれいだと褒められるくらいです。一番肌に良いのは睡眠時間とそのタイミングじゃないかと思っています。おにぎりを握るのが下手だった私に彼が秘伝の策を教えてくれました。手で握るのが難しいのならわきの下を利用すればいいと、こういうわけなんですね。今までわきの下のくぼみが何のために存在しているのか考えもしなかったけれど、こういう時に使えるとは天才！でもわきを脱毛しないといけなかったりして、準備に大分手間取ってしまいました。彼に言わせればわき毛があったって、愛情があればなんの文句もないそうですが。わきの新しい使い方も教わったことだし、彼には最高のわきおにぎりをごちそうしてやりますよ！女の子だもん、きれいになりたいよね！カラーコンタクトすれば、あのイメージモデルの女の子みたいにきれいに見えるかな！？無駄毛はワイルドでいいじゃないかって人もいるかもしれませんが、大多数はそうでもないかも。脱毛　大阪のサイトからつるつるの肌に整備してやってください。ジャーメインドカプチーニ は、スペイン王室のために作られた、エステサロンのためのブランドです。まさか東京にブライダルエステなるものがあるとは、おじさん知らなかったよ。ブライダルエステの知名度はまだ低いけれど、ウェディングに興味津々なおじさんとしては流行らせていきたい激熱ワードの一つかしら。このお店では利用者の口コミもあるので、それを参考に素敵な結婚式を作り上げてください。このサイトで、カラーコンタクトレンズを安心安全に通販しよう！カラコン初心者でも買えるように、フリーダイヤルでお悩み相談できます。カラコンのつけ方も掲載中！モバイルサイトもあるから、手軽に気軽に度ありも度なしもカラコン通販できますよ！カラコンで盛り目にしよう,1,,結婚式にはプチギフト,http://momo-fuku.jp/,1,0
,38,新婚で新築,,gift,これから新築を建てるので、長年住んだ自宅は解体工事で潰してもらうことにしました。汚いボロ屋でしたが、いざ解体工事をするとなると妙な気持ちですね。残念ながら期待していたあの鉄球は現れず、弟も父もがっかりしていました。浅間山荘の時以来、鉄球は男のロマンだと思ってましたもん。でも珍しい建設機械をいくつか写真に収められたので良しとするか。明日僕の部屋に彼女がやってくるのですが、準備はばっちりです！彼女の好みのお香は焚いてあるし、アジアン照明もセット。フィリピンやベトナムへ一緒に旅行した時にアジアの雰囲気に惚れちゃったんですよね〜。イメージとしてはドンキーコングの家を描いているつもりなのですが、果たして彼女にこの微妙なニュアンスが通じるか！？ゲームデザイナーやプログラマーって男の子なら小中高と憧れの対象。スポーツ選手になりたいか、ゲームを作る人になりたいかで二分されていた気がする。ゲームを作るには、的な本をざっと目を通してみたが、プログラミングの本だったようでちんぷんかんぷん。情報処理の学校で勉強している人は毎日あんなのやってるのかと思うと目まいがしますわ。日本にもキリスト教徒はいるけれど、その数は本当に少ない。かといって熱心な仏教徒も多いわけではない。でも結婚式はキリスト式が圧倒的に多いし、深く考えると変な連中だよな、日本人って。結婚式は仏式が最近人気あるが、僕は無難に教会でやる結婚式が良いよ。滅多に入る機会がない教会に入れるのが楽しみだしね。,1,,結婚式の必需品プチギフト,http://momo-fuku.jp/,1,0
,19,レストランウェディングで,,live,すごくきれいな着物とドレスだったから、埼玉の結婚写真撮影で結婚式の前日に写真撮っちゃいました。ドレスの色だとかデザインの違いから一つを選ぶってのは好きじゃないんですよね。写真撮影でどうして一着かせいぜい二着程度しか着られないのか…。まあ一度着たら衣装のクリーニング代がかかるからかしら？普段着ではないからクリーニングにも時間がかかるでしょうし。時間的に余裕がある状態で結婚写真を撮りたいよね。結婚式の簡易版として埼玉のフォトウェディングが注目されている。お金のない若い世代や、昔結婚式ができなかった年配の世代まで、多くの人が利用しています。あまり結婚式の形式にこだわらないのであれば、フォトウェディングは超低予算で結婚式ができますからね。レストランウェディングと併用するのがオススメでしょう。,1,,結婚式のプチギフト,http://momo-fuku.jp/,1,0
,18,結婚生活,,cosmetic,すごく長い間同棲していたのに、結婚してからすぐに不仲になってしまったり破局したり。この理由がはっきりとは分かりませんが、結婚=ゴールインというわけで気が抜けてしまうのかな？私も会社と自宅ではノリが全然違いますし、きっと同棲中と結婚後でもそんな理由で本性が出てしまうのでしょうね。それでも長い間付き合ってきて本性が見えないってのもおかしな話ですが…。結婚で必要な指輪って結婚指輪と婚約指輪があって、両方とも買わないといけないみたい。僕の同級生や会社の同期の中でも結婚した人が増えてきて、彼らもこういうものを買うために節約していたのかなと想像します。こういう指輪は給料の三か月分だということが常識みたいになっていましたが、あれも結局結婚指輪を売る店側のステルスマーケティングというやつなのかしら。,1,,結婚式にはプチギフト,http://momo-fuku.jp/,1,0
,17,お得なプチギフト,,collect,せっかく私が貯金した結婚資金を、夫がパチンコで全部使ってしまった。両親には結婚式を挙げると伝えてしまったので、横浜の格安結婚式プランで手をうつことにした。横浜だったら実家から3分だし、結婚式場も近ければ近いほどいいですもんね。おまけに格安だから最低限のシンプルな結婚式。無駄に豪華な結婚式も魅力だけど、けっきょく安いのが正義だもんね。,1,,結婚式の必需品プチギフト,http://momo-fuku.jp/,1,0
,129,たくさんの結婚式,,kekkon,それほど多くの結婚式に参加したわけではないのですが、函館の結婚式場は素敵だったねぇ。函館には旅行でも行ったことがなかったけれど、身内や友人が結婚式場を探していたらオススメしてあげたい。僕は結婚するつもりはないし、多分死ぬまで結婚はできないだろう。むしろ結婚しないのもありじゃね？という風潮になりつつあるのが正直助かっている。私って仏教徒なんだけど、結婚するときは青山の激安教会結婚式を選びました。これがばれたら破門かもしれないというスリリングな気分の中でのウェディングは格別の興奮を得られましたよ。イスラム教徒の友達も激安教会結婚式をやりたいと言ってましたが、イスラムは仏教とは比較にならないくらい戒律がヤバそうですからね。これは大変なことになるぞ…。,1,,結婚式のプチギフト,http://momo-fuku.jp/,1,0
,118,和装もいいですね,,biyou,デパートって買う気が無くても商品を見て回るのが楽しいんだよね。たしか成人式のシーズンだったと思うけど、和装髪飾りが着物コーナーにあって、たまには和服もいいなあ、なんて。本当は就活用のスーツを買うつもりでしたが、和装髪飾りを買っちゃいました〜。就職は最悪起業すればいいし、今はこのキラキラした和装髪飾りで和服デビューする方が大切！妹が親友の結婚式から帰ってきたのは夕方ごろでしたね。手にはブロッコリーくらいの大きさの花を持っていました。聞けば和装ブーケというものらしく、もしかするとブーケトスで上手いことキャッチできたのかもしれませんね。しかしブーケトスも一回だけじゃなく、10個くらいまとめて投げればもっとたくさんの人が幸せをキャッチできるのではないでしょうか？それじゃありがたみが薄れるのかな。,1,,結婚式にはプチギフト,http://momo-fuku.jp/,1,0
,117,おしゃれなプチギフト,,kekkon,どうせあげるなら、オシャレな引出物がいいです。これから結婚式をやるとして、引出物の平均額ってどれくらいが妥当なんでしょうか？こういう時に社会の常識って奴が求められてきますよね。お金があれば良いものを用意するのですが、かといって極端に高いものだと常識知らずだし、もちろん安物でも良くない。だからネットでどんな引出物が人気なのかチェックしてます。こういうところは周囲に流されてみるのが正解かな？着物の時は、その着物に合った髪飾りに変えた方がぜったいオシャレです。お花見に行ったら和服を着ている女性が結構いたね。成人式以来あまり着物を着ている女性を見かけなくてさびしかったが、何時なんどきでも和装髪飾りをつけた着物女性を見るのは心地よいもの。僕も女性だったら毎日和服を着たいのですが、こればかりは無理ですね。着物自体、男が着てはいけないという法律が事実上存在していますし、女の子はうらやましいね。,1,,結婚式の必需品プチギフト,http://momo-fuku.jp/,1,0
,101,フォトウェディングもね,,,なかなか景色の良い撮影スポットがあって、フォトウェディングは埼玉でやりたいと彼女からの提案。僕は写真には詳しくないけれど、被撮影者が意識しない状況での撮影は面白いと思うときがあるね。芸能人の反応ってやっぱり見ていて笑えてくるし。それはさておきフォトウェディングって最近メジャーになってきた新しい結婚のやり方なんですね。まあ結婚式の費用も最低限で住むし、実に合理的。飲み会や結婚式もたまには二次会代行を頼んでみたらマンネリ化を防げるかもしれませんよ。なんせ二次会を盛り上げるプロ集団ですから、普通とは違った二次会ができるはず。大半は一次会で帰ってしまいがちな飲み会でも、プロに頼む二次会代行と聞けばみんなどんなものかと参加したくなるはずです。,1,,結婚式にはプチギフト,http://momo-fuku.jp/,1,0
,58,プレスリリースと経営手法,,poster,ネットが発達すると、知らない方が良かったことを知ってしまう場合がある。 信頼していた企業の黒い裏側をはじめ、外食関係の厨房内での話など、本当かどうかは別として食べに行きたくなくなったお店は多い。 ただし、こういう情報もソースをたどると単なるデマだったり、噂が誇張された果てに作られた話も多い。 知識人の中には、そんな理由からネット上の情報は全てゴミだと言い張る者もおり、あながち間違った意見でもないと思う。 もちろんネット上にはとても役に立ち、かつ信頼できる情報を発信しているところもあるので、全て無価値だというのは言い過ぎだろう。 情報収集をしていて面白いと感じるのは、行政や企業からのプレスリリースをもとにして書かれた記事。 大本のソースを見てしまうのが一番いいのだが、やはり本家のプレスリリースと作られた記事とを比較しながら読むのが興味深い。 単純に事実を事実として伝えるのが一番スマートだが、そんなもの面白くもなんともない。 プレスリリースの一部分だけを切り取って誇張してみたり、都合の悪い部分は隠すか、そもそも報道などしないか。 それによってどんな思惑があって情報発信しているのか見えてくるのが、記事を楽しむ醍醐味だと思う。 昔と違って今はインターネットが発達しているので、プレスリリースの情報がマスコミの人間でなくとも入手できるのが大きい。 かつてプレスリリースは、ある特権階級だったマスコミにしか手にすることができないか、入手が困難だった。 それを一般人でも簡単に閲覧できるのは、二次情報に振り回されないという意味では非常に意義深いことだ。 会社経営などとは無縁の人間からすると、プレスリリースというものは単なる情報にすぎないが、発信する企業としては自社のPRでこれほど魅力的なツールはないだろう。 町工場などの零細企業であっても、魅力的な技術を開発して、それを広く伝えることができれば大企業と勝負することも不可能ではない。 むしろ受け手からすると、大企業の発表よりも聞いたことのない会社が面白いものを発表したという話の方が興味深い。 大企業は宣伝広告に掛ける費用や規模が大きいので、発表されればニュースやＣＭなどでよく目にする。つまり、誰でも知っているような情報にしかならない。 そこへくると中小企業の発表はあまり大きく報道されないので、面白い発表を耳にして、妙な優越感を得るのは自分だけではないはず。 ネットがなかった時代に比べると、ベンチャー企業でも成功をつかむチャンスは増えている。 当然、どこの企業もプレスリリースを利用してＰＲを行いたいと考えているので競争は激しいが、受け手を惹きつけるプレスリリースで一発逆転も狙える。 広報担当に回す社員がいなければ、社長自らが先頭に立って広報の代表者になるのもいいだろう。 他社の真似できない技術を持っているが、それを外部に発表する舞台がないという中小企業は、プレスリリースを通じて世間の認知度を高めてみてはいかがだろうか。レジスターが中古でも、レジスターのソフトがこちらのソフトなら、売上管理にはなんの心配もいりません！売り上げのほかに仕入れや利益の管理、給与の管理までできる万能ソフトだから、これ一つであなたのお店の管理は万全！？社員のコミュニケーションスキルを向上させるには様々な方法、研修がありますが、その中でもコーチングによる効果は大きいです。質問から始まり、話の内容から問題の本質をつかむ能力を獲得、それをヒントに障害をクリアすることができる社員は部署に一人は欲しいところ。コーチングによる社員のコミュニケーションスキル向上で会社の足場を固めましょう。携帯CMSを使ってない企業は遅い！モバイルフォン業界で出遅れるのは致命的ですよ。出遅れちゃった、失敗しちゃったらとりあえず専門業者へGO。高品質で効果的な看板！看板をつくるなら、こちらの看板専門店に任せるのが一番です。電光掲示板のスタンド看板や雰囲気のあるキャストサインなど、バラエティに富んだ看板が勢ぞろい！こちらでオリジナリティあふれる看板を制作すれば、足を止めてくれる人、お店に入ってくれる人がきっとたくさん出てきますよ！,1,,のぼりの製作はこちら,http://www.seriart.co.jp/,1,0
,56,プレスリリースを調べることが好き,,money,プレスリリースを調べたりすることが好きで、よく配信サイトを見ています。そうすると、企業の傾向というか、世の中の傾向がわかります。配信したいサービスの傾向から、女性向けが多いとか、インターネット系が多いとか、世間の流行がわかるようになってきます。企業にとって、プレスリリースやニュースリリースを配信するということは、広報活動にとって大変重要なことなようです。リリースを配信することで、メディアが取り上げてくれる可能性が高くなります。メディアとは、ここではテレビ局とか、雑誌とか新聞とか、ニュースサイトとか。そいうったメディアに取り上げられれば、必然的に露出も上がり、世の中への認知も上がります。世の中への認知が上がるということは、宣伝をしてくれていると同じことになります。テレビでCMをやるとか、新聞広告を出すとか、莫大な費用がかかります。それを、プレスリリースとして配信をすれば、1回数万円くらいで、様々な提携サイトに掲載され、それを見た記者が自分の番組や雑誌の特集などでとりあげてくれるかもしれない。費用対効果が抜群ですよね。記者は、常に記事に出来るような情報を探していて、極端に言うと記事に飢えているような状態みたいです。だから、画期的なサービスとか、新しいサービスとかはどんどんニュースリリースとして配信すべきなのです。ニュースリリースの種類は、やはりサービスのローンチが多いみたい。新商品の発売とかね。あとは講演会とか、展示会とかのリリースもたまに見ますね。今日見たプレスリリースには、きのこの生産販売会社から、「きのこ音頭」のようなものを発表したとありました。園児たちに踊ってもらい、日本を元気にしてほしいという想いを込めて作られたようです。また、きのこを使って食育の勉強を普及する活動をしているということです。プレスリリースに対して、聞きたいことや取材を申し込む場合は、その配信サイトを介して問い合わせができるようになっており。どのサイトが費用対効果が良いか分かるようにもなっているようです。こちらの経理ソフトならポス・レジ機能の他、使える機能が盛り沢山！飲食店で重宝されるポス・レジ機能の他、どんな業種の会社にも必要な収益計算管理機能、勤怠・給与計算管理機能など、役立つ機能が満載の使える経営管理ソフトがこちらにあります！宅でもやれることが増えますね。パソコンについての知識が全くない人でも、lan工事なんて業者に任せてしまえばいいのです。Lan工事をプロに任せれば配線もすっきりだし、設定などもやってくれるのでお年寄りにも人気です。地球環境、そして自分や会社のおサイフの状況を考えるなら、こちらのサイトでリサイクルトナーを激安で買いましょう。安くてエコで品質も良いのなら、使わない理由はありません。ヨーロピアンな看板やごくシンプルな看板、そしてオリジナルのユニークな看板をデザイン・制作してくれるのがこの看板専門会社です。独自の技術でお安くカンタンに看板ができる上に、希望すれば無料のミニサンプルも送ってくれるので品質も確かめられます。,1,,のぼりはお任せ,http://www.seriart.co.jp/,1,0
,55,最近の携帯電話はパソコンみたい,,biz,もうスマートフォンユーザーの数もだいぶ増えてきて、ガラケーを上回ってたりするのかな。 電波が悪いとか、バッテリーの持ちが悪いなんて声も聞こえるけど、それが改善されたらみんなスマフォかな。 ケータイは割と最近使い始めたから、良しあしが分からないけれど、文字を打ち込むのがあんなに面倒だとは思わなかった。 早い人はいるけれど、さすがにキーボードで打つよりも早くケータイを打てる人はいないだろ。 地デジ化して電波の有効利用をするって話だけど、電話回線に余裕が出たって話はあまり聞いたことがないね。 昔は会社がもっと沢山あったように思えるけど、いまはドコモ、ソフトバンク、AUくらいしか知らない。 料金はどこも大差ないので、あとは電波状況で判断するしかないかな。 機種についてはよく知らないし、高性能なcpuを搭載していれば動きは良いけど、その分バッテリーの減りが半端なさそうだね。 毎回機種が進歩していったものを買うようにしているから、みんなどんどん買ってくれ。 俺は成熟しきった製品を買うのが好きなんだ。どうせ買うならポス・レジ機能しかついてないレジより、ポス・レジのほかにシフト管理や仕入れ管理機能までついたレジですよね！この経営管理ソフトなら、それらの機能がすべて備わっている上に、中小規模の企業さんなら確定申告までこれで済ませられちゃいますよ！こちらの会社はただのコーチングだけでなくエグゼクティブコーチングまで行っているので、コーチングをビジネスにしたい方、管理職にある方などから選ばれています。独自の効果的なコーチングシステムを確立しているので、新たな視野を開けますよ。IT機器を増設する、オフィスを移転するときには、配線などの工事を専門的に扱うこの会社にお願いするのはいかがでしょう？オフィスをスッキリ、使いやすくしたいならちょっとした配線でも工事会社へ！看板はお店の個性を表現するものだけど、何よりも人の目を引きお客を集めてくれるものでないと！この会社なら、集客力のある看板のデザインを提案してくれますよ。,1,,のぼりの老舗です。,http://www.seriart.co.jp/,1,0
