Post.id,Post.blog_id,Post.title,Post.pagename,Post.menu,Post.content,Post.public,Keyword.id,Keyword.keyword,Keyword.url,Keyword.visible,Arbitrary.keyword,,
,187,携帯も買い取れる,,,早い人では小学生の頃から持っていた人もいるだろう携帯電話。 最初のうちはこんなもの普及しないだろうと、小さい時分に思っていたものですが、あっさり予想を裏切られ、 今では体に埋め込んででも持っていたいくらいの人が沢山います。 携帯電話の進歩を見てきた人ならば良く知っているはずですが、液晶画面がカラーになって、音が良くなって、 さらにはテレビが見られたりもする携帯電話は時代の流れがよくわかります。 小さいものに沢山の機能を詰め込むのは日本人の本能なんでしょうか。 機能が多すぎてもっと洗練されてもいいと思い始めたあたりで出てきたのがスマートフォンですよね。 まだ持ってはいないのですが、電車やバスの中で画面をこすっている人を見ると欲しいと感じますが、 その反面、まだもうちょっと進歩してからでもいいんじゃないかとも。 ソフトバンクやドコモからスマートフォンは出ていますが、どの会社から何が出ていて、どう違うのかなんてまるで分りません。 そういう人が手を伸ばすのは知名度の高い方と決まっているので、アイフォンの人気を他の機種が超えるのは当分ないのかな。 詳しい人がいたら聞いてみたいけど、それよりも買って使ってみるのが一番理解が早いよね。タイムカードの管理なら、このシステムがイイ！特に飲食店のようなスタッフを大人数で回す会社はすごく便利だと思います。時代は移り変わりゆくもので昔は携帯電話が主流だったのが今やスマートフォンとなりましたね。給湯器もこの法則に当てはまりますが、最新の給湯器は横浜が初なのが多いみたいですよ。この会社なら、携帯買取を高値・見積もり無料・送料無料で行ってくれますよ！しかも法人企業も歓迎受付中！買取だけでなく販売もしているので、最新機種や人気機種を安値で購入することも可能です。格安でオリジナル看板をデザイン！オシャレでお店のイメージにピッタリの看板が、格安で制作してもらえます。洋風に和風、シンプルにワイルドも！夜でも目立つ専用の照明器具もあります。集客を望むなら、見やすくわかりやすい看板は欠かせません。こちらのオリジナル看板制作会社で、格安で集客に効果的な看板を作ってしまいましょう！,1,,ブランドの洋服買取,http://www.pb01.net/,1,0,,
,188,ブランド服とさようなら,,,大学生やってた時は何を勘違いしたのか、ロココ調の服を普段着にしていた。かなり目立っていたと思うが、当時自分としては最先端のファッションでした。社会人になってから自分のセンスが少々異常だということに気が付いてからは全て洋服買取に持って行った。こんなマニアックな趣味の服が果たして売れるのだろうか。不安は多かったものの、意外と高価買取してくれてほっと一安心。趣味を同じくする人が意外と沢山いるようで、かなり今キテるそうですよ、ロココ。実家には誰も使わないのにギターやグランドピアノが置いてある。父が定年退職してから楽器をやり始めた際購入したのですが、三日で飽きて放置したまま。音楽をやるのなら、最初から良い楽器を選んだ方がモチベーションも上がりますよという店員の言葉をうのみにしたのが間違いでしたね。幸い楽器買取のお店に持って行ったら３０万円くらいで売れたのでほっとしました。でも、それだけ高額で売れたということは、購入時の金額も相当なものなんでしょうね。楽器って平気で数十万とか数百万するからあなどれない。,1,,ブランド品の洋服買取,http://www.pb01.net/,1,0,,
,84,年末は良い時期,,recycle,年末の大掃除でシャネルとかプラダとかのブランド用品が出てきたりしませんでした？デザイン的に流行から外れているし、かといって捨てるのもなぁ…。なんて踏ん切りがつかない人はブランド買取をお試しください。僕の彼女もプレゼントしたブランド品は、売ってお金にできるから便利だよね～と絶賛！賢い女性はブランド買取でスッキリ整頓したお部屋をクリエイトしちゃいましょう。中国人の彼女は収入はそんなにないはずなのにブランド品のバッグをいくつも持っています。なぜかヘタれるのが早いのですが、よくこんなブランド品を買ってくるお金があったなぁ…なんて。しかしこれだけブランドものが揃っているとブランド買取に出せば数十万位になるのではないかと期待しています。彼女も買いすぎたから買取に出してしまいたいと言ってましたしね。,1,,ブランド品の買取はこちら,http://www.pb01.net/,1,0,,
,83,リサイクルショップの品揃え,,buy,リサイクルショップ行くとこんなものが実際に売られているのかと思うぐらい古いものもありますし、実際これが本当にリサイクルしたものかと思うくらい、新品に近いものが置いてあってびっくりすることがあります。また自分ではこんなものは売れるはずがないと思ってものが売っていたり、またはこれは絶対売れるだろうと思っているものが置いてなかったりするので、リサイクルショップ行くと本当にギャップを感じられるものです。家で使わなくなったものでも、リサイクルショップに持っていけば案外高く売れたり、または絶対に買い取ってもらえるだろうと思っていたものが全く金額がつかなかったりするなどやはり欲しい人と欲しくない人との差がはっきりと分かれているものも興味深いです。また以前は絶対にリサイクルショップに持ってけば売れるのは間違いないと思っていたものも、最近では全く売れなかったり本当に時代をよく映し出す鏡だなとリサイクルショップにいけばいつも思います。いらなくなったものを売ると言うよりも、大切に扱ってきたものをそこに買い取ってもらうという感覚で私はリサイクルショップを利用するのですが、むしろこのように利用すれば、もっと長く持つのではないかということもリサイクルショップに行けばよく勉強になります。ここに行けば価値のあるものを買うことができるとか自分の欲しかった商品が手に入るというよりかは、もっと大切に扱えばリサイクルショップのように自分の持ち物も価値ある商品としてもっと大切にできるのではないかといつも反省します。,1,,ブランドの洋服買取,http://www.pb01.net/,1,0,,
,82,リサイクルできるもの,,repair,リサイクルが可能なのは、空き缶・ペットボトル・家電・自転車など様々なものがリサイクルできます。着物もリサイクルできる時代になりました。2007年4月からお茶飲料水を販売している会社で「茶殻」をリサイクルするようになりました。通常、工場から排出される「茶殻」は95％の水分を含み、リサイクルさせるには乾燥させないとできません。しかし全体的に乾燥させるためには大量のガスや石炭が必要になります。ガスや石炭を大量に燃やすといらない二酸化炭素のもとになり、環境を良くしようとしているのか、わからなくなってしまします。そこで、水分を含んだままでもリサイクルできるように茶殻の水分を一部含んだ茶配合ボードを作成しました。これにより様々な商品が開発されたようです。茶殻には消臭効果や二酸化炭素の排出を抑える効果があるので、活用した方が環境にも良いので、是非続けて欲しいです。僕は昔から乗り物関係の仕事に就きたいと思っていました。で、結論的にはバイクを廃車する仕事になったんだけど、毎日バイクに囲まれて幸せです。,1,,ブランド品の洋服買取,http://www.pb01.net/,1,0,,
,116,リサイクルマークについて,,recycle,リサイクルマークはたくさんの種類があります。特定のマークやどこでもみるようなマークだったりすると思います。缶・ビンに共通して表示されているのがあります。それは「統一美化マーク」です。空き缶を道路の脇に投げ捨てる「ポイ捨て」が起き、これを防ぐために1970年代に美観を守るために「統一美化マーク」が表示されるようになりました。このマークは、リサイクルの促進・ポイ捨ての防止ができる素晴らしいものです。あとは、誰でも知っているエコマーク。これは焼却しても有毒ガスが発生しない・詰め替えなのでゴミの量が少ない・環境への負担が少ないなどの意味があります。リサイクルマークのおかげで日本はだいぶキレイになりましたね。地球に優しく、というフレーズに心打たれた私はとりあえずエコ活動をしてみようと考えています。まず、できるところからということで断熱塗料ならはいりやすいかなぁ。,1,,ブランド品の買取はこちら,http://www.pb01.net/,1,0,,
,115,不要品の行く場所,,recycle,我が家では不要になった物や買い替えで出た物は全て捨てずにリサイクルをしています、どうしても使えない物や汚い物は処分しますが、まだまだ使える物なので勿体ないからです。リサイクルの方法は幾つか有りますが一番良く使う方法としてはフリーマーケットです、特にフリーで行われている利用料金が掛らないマーケットを良く使います、自治体や子供会などの主催は殆どがタダで出店出来る様になっています。フリーマーケットで売る品物は主に衣類やコップなど生活雑貨が中心です、私はマーケットで出品する時は儲けは気にせず、とにかく売れ残りが無いようにする様に気をつけています、マーケットに出す品物は私にとってもう要らない物ですので持って帰っても使い道がないからです、それでも売れ残りなどは必ず有りますので売れ残った品物は次回に出品したりネットを利用したオークションなどに出品する様にしています。また私も衣類や生活雑貨などを購入する時は新品で購入は殆どせず、マーケットやオークションなども利用して購入します、極たまにですが数万円もする品物が何百円で買えたりしますので、これもオークションやマーケットの魅力だと思います。最近ではパソコンの買い替えをしたくてリサイクルの会社に買い取りをして貰いそのお金に足りない金額をたして新しいパソコンを購入しました、これも同様に捨てるのではなく売って違う物を買うといったリサイクルです、古くなったら直ぐに捨てる人が多い中、私は勿体ない精神が強いのかケチなのかは分かりませんがリサイクルをこれからも続けて行きたいと思います。,1,,ブランドの洋服買取,http://www.pb01.net/,1,0,,
,128,フリーマーケットで売買,recycle,,海外など、いや最近では国内でもよく見掛けるフリーマーケットですが、基本的には安くお買い物をするのに楽しい場所です。出店者との駆け引きも楽しくて、それで思わぬ安値で買えた時には何とも言えない快感があります。また何が出てくるかわからないのもフリーマーケットの魅力のひとつ。朝イチで目当てにしていないアイテムを帰り道で抱えているなんてよくあることで、衝動買いなんてしょっちゅうです。特にヨーロッパの蚤の市はそんなお宝が眠っていて、それがある意味アンティークを覚えるきっかけになったりするものです。私は初めて訪れたイギリスでアンティークの時計を買ったのですが、それをきっかけにしてアンティークにはまっていきました。今思えばですが、もしかしたらアンティーク以上にフリーマーケット自体に惹かれていったのかもしれませんね。あの場の雰囲気が好きな人ならわかるでしょうが、ついつい財布のヒモが緩みます。しばらく住んでいる間に戦利品がどんどん増えていったのは楽しくて懐かしい思い出です。あれから数年、引っ越しするのを機に押し入れを整理していました。ロンドンやパリの蚤の市で買ったアンティークがたくさん出て来て驚きました。もうすっかり忘れていたものもたくさんあって、中には利用価値があまり無いものも。でもなぜか捨てられないのはその頃がとても楽しくて充実していたからでしょうか。日本に帰国して随分経ちましたが、久しぶりにまた行ってみたくなりました。,1,,ブランド品の洋服買取,http://www.pb01.net/,1,0,,
,121,使わない洋服,buy,,使わなくなった洋服やバックをリサイクルショップによく持って行きます。よく行くのが、すべて服の重さで料金が決まり、多少のシミがあっても買い取ってくれるリサイクルショップです。着られるものは1㎏150円で、バックや靴も大丈夫です。なので、古い服でもバンバン持って行けます。1㎏1円ですが、ちりも積もれば山となるでジュースが買えるかなぐらいになります。そういった服は店頭に出せないので、海外に輸出したりリユースしたりするそうです。ブランドものや一度も袖を通していない服は、服の状態で値段を決めてくれるリサイクルショップに持って行きます。査定が厳しいですが、季節もの需要があるものは高く買い取ってくれます。子供の物はすぐにいらなくなるものが多いので、フォーマル用の靴やブーツはリサイクルショップで購入したほうがお得です。色々なリサイクルショップを見て回ると、その店の特徴をつかめて面白いです。家具や日用品を専門に扱っているリサイクルショップも便利です。子供のおもちゃはフリーマーケットで探してみると、意外と安く手に入ります。車や電車のおもちゃ、人形の服やおままごとセットなど、リサイクルショップでは売れなかった商品だと思います。リサイクルショップは少しでも錆びついていたり、部品がなかったりすると買い取ってくれませんが、フリーマーケットで出すと安いでお客さんが買ってくれます。人気があるテレビのおもちゃは、少し高くても買おうと思うので、掘り出し物を見つけに行くフリーマーケットは楽しいです。,1,,ブランド品の買取はこちら,http://www.pb01.net/,1,0,,
,107,有名なフリーマーケット,repair,,とにかく私はフリーマーケットが大好きなのです。多分日本にフリーマーケットがこんなに盛んになる前、まだ１０代のころから自宅の近所で有名なフリーマーケットが開催されていたのもあって、私の人生にフリ－マーケットはがっしり根付いています。なので自分が着なくなったお洋服とかいらなくなった雑貨を部屋の整理毎に出品するということを、当たり前のように行っていますが、何より大好きなのがフリーマーケットの会場をぶらぶらと見て回ることです。今やフリーマーケットも各所で行われていますし、フリーマーケット毎にテーマも設定されていたりもしますよね。なので昔よりもどんなものが出品されているのか予想をすることもできるようになりましたが、やはり「こんなところにこんな物が！」という驚きの品に巡り会うことがフリーマーケットの醍醐味ですよね。何も時価○○万円の超お宝というワケではなく、ずっと自分が気になっていたレアアイテムとか、昔懐かしいアイテムに巡り会えることが私にとっての大発見です。フリーマーケット好きが高じて海外旅行に出かけても日程と時間が許す限りフリーマーケット巡りをしていますが、今までで最高に楽しかったのがロンドン旅行でした。ロンドンってとにかくマーケットが沢山なのですよね。マーケット毎に全く趣が違うのも（超庶民的とかオシャレ系とかアンティーク糸とか）新鮮でした。中でも「このままロンドンに住んでしまいたい」と心から思うくらい、フリーマーケット好きにはたまらない街でした。,1,,ブランド品の洋服買取,http://www.pb01.net/,1,0,,
,180,加齢臭もひどい,,,祖父に父は加齢臭だけでギネス記録取れるほどの悪臭の持ち主。体臭は遺伝するようで、僕も加齢臭のサラブレッドとして周囲からの期待を集めていました。加齢臭予防の石鹸を使おうとしたこともありますが、みんなの期待を裏切るのもどうかと思い断念。この先どれだけ世界の加齢臭マンたちと渡り合っていけるかが大きな課題ですね。日の丸を背負うというプレッシャーに押しつぶされそうになったこともありますが、僕はこの加齢臭を唯一の相棒としてこれからも戦い続けていきます。ボトラーになるまでネトゲにハマっていた頃はビタミンが不足していたのか、吹き出物はすごいし、風邪もひきやすかった。でも働き始めてからはビタミンサプリメントもとるようになって、そこからは体もお肌も丈夫になりましたよ。ビタミンが足りていないときは家族に暴力をふるったり、自傷癖が止まりませんでした。人間ビタミンが不足するとダメですね。みんなも毎日サプリでビタミン摂りましょう。,1,,おなら臭いにおいについて,http://onara.co.jp/,1,0,,
,181,女性の加齢臭…？,,,男性では仕方ないものとして片づけられますが、女性の加齢臭ってすごく厄介ですよね。私の母ももうだいぶ高齢なので、加齢臭が気になるんだとか。まあ臭いがしても父の加齢臭だということにすれば万事解決なのですが、それだと父が死んだ後が厄介。でもデオソープという加齢臭対策用の石鹸があるというので、今度の誕生日にでもプレゼントしてあげたら喜ぶかも。私の会社の部長は加齢臭のきつさで有名で、本人はインドっぽくていいだろ？とどうやら勘違いしているみたいです。隣の部署の課長も加齢臭が半端なくて、どっちの加齢臭が上かでちょっとした議論になります。この二人を見ていると私も早いうちから加齢臭を予防しておかないと周囲に迷惑をかけると思い、加齢臭予防の石鹸を毎日使っています。臭いってやっかいですねぇ。,1,,おならの臭いにさようなら,http://onara.co.jp/,1,0,,
,177,冬も臭い,,,冬場って汗臭さとかが出にくいが、加齢臭ってやつはちゃんとにおってくるからしっかり者だよ。しかもしつこいから普通の石鹸で加齢臭を消そうと思っても石鹸の方が加齢臭臭くなる。加齢臭の原因は食生活や生活リズム等々ありますが、加齢臭の予防をするのだったらそれ専用の石鹸がありますよ。中年を意識し始めたら、この加齢臭対策用のデオソープを使ってみましょう。病気になりやすい、最近頻繁に風邪を引くようになった。野菜は高いし、そんな沢山は食べられないもの。それでも大切なビタミンを摂取する必要がありますね。現実的に考えればこういうビタミンはサプリメントで摂取するのが効果的。飲むだけで高血圧やがんの予防もできるし、ビタミンをきちんととればボケ防止にもなるかも。適度な運動と睡眠、そしてビタミンサプリメントで長寿ギネス記録を目指せ。,1,,おなら臭いにお悩みなら,http://onara.co.jp/,1,0,,
,136,ワキガもやばい,,,頭の毛はすぐになくなってしまったのに、どうしてわき毛は衰えることがないのか？なんだか腹が立ってきて永久脱毛してやった。だって不公平じゃないですか。頭の毛は30代で壊滅したのに、余計な無駄毛だけは生き残っているとか。しかも二度と生えてこないようにと脱毛クリームも使ったが効果なし。ちなみに無駄毛が濃い人の方がレーザーによる永久脱毛もやりやすいんだって。画期的な方法で脂肪吸引を実現いたしました。やり方は簡単。脂肪を減らしたい部分を脂肪吸引機で吸い取ってしまうだけ。肥満解消の最終手段として人気がある手術で、これによって脂肪を吸引すると脂肪が増えないんです。どうやら人間の体にある脂肪は数が決まっていて、それが大きくなるか小さくなるかの違いみたいですね。ナウマンゾウも気絶する私の加齢臭を対策できないものか。社内では僕専用の個室が作られるくらいのにおいで、消臭剤の会社から実験材料として招かれたこともある。加齢臭は中年以降になってから臭うそうなのですが、私はまだ30代中ごろ。今こんなに臭うのだから、50過ぎた頃には歩くクサヤマンと呼ばれていてもおかしくはないね。,1,,おなら臭いにおいについて,http://onara.co.jp/,1,0,,
,158,加齢臭の匂いがする…,,,僕はずっと加齢臭がすごくて、これは天から与えられたバリヤーだと思ってたが、加齢臭石鹸を使ってからはそれが消えた。別に加齢臭が付く石鹸ではなく、加齢臭がなくなるという意味の石鹸ね。あの慣れ親しんだ加齢臭が消えてしまったのはちょっとさびしい気もするけれど、この悲しみを乗り越えてこそ、人間としてもう一段上に行けるんだよね。,1,,おならの臭いにさようなら,http://onara.co.jp/,1,0,,
,14,加齢臭がおなら,,datsumou,ソムリエを目指していた弟でしたが、普段から僕の加齢臭を嗅いでいたせいか鼻がおかしくなり夢を断念…。他人の人生ですら左右してしまう加齢臭は不幸しか生み出しません。これから自分はこの恐るべき加齢臭とともに生きていくしかないのか。そう絶望しかけた時に出会ったのがこの加齢臭石鹸だったんです。効果は試してみてからのお楽しみ！加齢臭の予防効果もあるので未来のオッサンたちにもオススメできます。父が酷い加齢臭もちなので、遺伝的なことを考慮し中学生の時から加齢臭の予防石鹸を使い続けています。おかげで体臭の強くなりはじめる高校時代もミスターノースメルのあだ名で通るほど体臭のしない体質に。鼻の良い犬ですら僕の臭いが分からないので、警察犬を相手にしても逃げ切れる自信ありますよ。プロポリスは花粉症にも効果です。ハチミツは体にいいですからね。,1,,おなら臭いにお悩みなら,http://onara.co.jp/,1,0,,
