Post.id,Post.blog_id,Post.title,Post.pagename,Post.menu,Post.content,Post.public,Keyword.id,Keyword.keyword,Keyword.url,Keyword.visible,Arbitrary.keyword
,213,リサイクルは自然保護,,,大量買い・不要なものは捨てるということをやった結果、二酸化炭素などの大気が増え地球温暖化になってしまいました。少しでも抑えるために現在ではリサイクルできるものはリサイクルするという地域が増えつつあります。リサイクルとは、使用不可になったものを違うものを作る材料にする・同じものをもう一度作り直し再び使用できるようにすることです。家庭でもできるリサイクルを紹介したいと思います！リサイクル可能なのは、缶類・牛乳パック・ペットボトル・電池などになります。家電は、金属・ガラスなどがリサイクル可能ですが廃棄されている方が多いのが現状です。リサイクルは良いことですが、悪いこともあります。良いこと&無駄な資源を減らすことができる・ゴミを燃やないので環境に優しい　悪いこと&資源にまわせるから無駄遣いが増えゴミが増える・再生されたものは高いのでなかなか手が出せない　といったことはありますが、リサイクルをしていくと少しでも環境を良くし・森林伐採が減り環境保全にも繋がるのでご協力お願いします。【457字数】昔からバイクが大好きでしたが、この前事故をしてからトラウマになってしまいました。愛しいバイクもぼろぼろ悲しいのですがバイク廃車しないとね,1,,ブランド品の買取はこちら,http://www.pb01.net/,1,0
,212,資源を大切に,,,地球の限りある資源を有効的に使っていくためにも、リサイクルショップに着なくなった洋服を出すということは経済的だけでなくエコロジーだと思います。昔はよく着なくなった洋服を上の子から下の子へとおさがりをしたりしていましたが、最近は少子化ですし特に子供の成長期にともなって着ることができなくなった洋服はリサイクルショップへと回すのがいいと感じます。リサイクルショップを介して誰かがその服を着る機会を得るかもしれません。服を出した方としては、少額だとしてもリサイクルに出したお金がもらえれば嬉しいものだと思います。特にこの頃は高い洋服を長い間着続けるというよりも、ファストファッションの流行りにともない安い服を短いスパンで購入していくというのが一般的です。短いスパンで着なくなった服がクローゼットの中で眠り続けているより、リサイクルショップに出せば無駄にならずに済むのではないでしょうか。洋服には思い出がつきもので捨てるのに躊躇うこともあると思います。しかしクローゼットの中で着ないのにただ置いてあるだけでは有効ではありませんし、収納スペースもだんだん少なくなってきてしまいます。手元から離れることは名残惜しいかもしれませんが、地球環境と住宅事情のことを考えればリサイクルに回すのが最も効率的ではないかと考えます。家族間でのおさがりが減少してきた今、社会という大きなくくりの中で誰かがその洋服を欲しいと思っているかもしれません。必要な人のところに渡っていくのに、リサイクルショップはその橋渡しをしているのだと思いました。,1,,ブランドの洋服を買い取ります。,http://www.pb01.net/,1,0
,121,洋服もリサイクル,recycle,,着ない洋服・子供の時に来た洋服などタンスの中に埋まっていませんか？大事に大事にしまっておくのも良いのですが、その着ない洋服をタンスに入れておくより、使ってくれる人に渡るほうが嬉しくありませんか？？そこでタンスや地球環境に優しいエコ方法を考えてみたいと思います。小さい頃の服や昔来ていた服があるでしょう。それがもう切れないので、売るか・洋服の一部を使い何か縫い物を使ったり・人形の衣装をつくったりしフリーマーケットで売るのがお金がかからなくて良いでしょう。洋服をお店に買い取って欲しいときは、キレイに新品のような感じに洗濯をすると、ちょっと高く売れるかもしれません。さすがに売れないのが、もうあきらか破れてるとか小さすぎて無理というのは諦めて捨てるか・何かの切れ端に使ったほうが良いかもしれません。,1,,ブランドの洋服買取はこちら,http://www.pb01.net/,1,0
,107,物を大切に,buy,,日本人が一日にゴミを捨てる量は一トンを超えるそうです。このゴミの中には、日用品・食品など様々なものが混じっていることでしょう。そこで今回は食品のゴミが多いと思うので、食品のリサイクルについて書きたいと思います。食品の廃棄物は他の国よりも多く毎日燃やし続けています。その廃棄物を減らすためにはどうしたらいいか考え法律ができたようです。趣旨は、食品関係の廃棄物が多いので処分させる量を減らす・動物の肥料にするなど循環資源の再生利用などを促進させるとのことです。食品の肥料にできるもの・油脂及び油脂製品などは、利用するものに譲り渡すと決められています。大量に食品廃棄物を出した企業は、毎年度、主務大臣に報告をしないといけません。そして必要ならば主務大臣が指導や助言をします。それでもダメな時は、食品業者に勧告・公表及び命令を出すそうです。色々厳しくなりましたね。私はバイクを集めるのが大好きだったのですが、妻はそんな私の趣味が許せないある日、お気に入りのバイク倉庫にいってみたら愛しのバイク達がもぬけの殻どうやらまとめてバイク廃車されたらしい,1,,ブランド品の買取はこちら,http://www.pb01.net/,1,0
,108,自宅でエコ,repair,,普段のライフスタイルの中でできるエコ活動は外出の際はマイボトル、マイ箸を持参し割り箸をなるべく使わないようにすることはエコです。割り箸といっても日本中の人々が利用することによって木が伐採され山が削られてしまいます。木が一本育つのに何十年何百年もの月日がかかってしまいます。夏は毎日のように猛暑が続き寝苦しい日々が続きますがエアコンの温度設定をなるべく27から２８度に設定したりゴーヤを自家栽培すれば食べることもでき緑のカーテンができて2から３度も部屋の温度が下がるそうです。とってもエコです。リサイクルショップやフリーマーケットを利用すればゴミにならずに地球にやさしいですし自家用車をなるべく利用しなければガソリンを使うことがないので地球にやさしく健康やダイエットにも適しています。お風呂のお湯は洗濯をする際に利用すればお水の節約につながります。食器洗い機は電気代と水道代がとてもかかるので食器を洗う前に汚れをふき取り低温で洗うことが最適です。テレビはテレビの横を横切ると分かるのですが電気をたくさん使うので特に見たいものがあまりないときはつけないだけでもとってもエコです。冷蔵庫は食材を常に一定の温度で冷やしているため食材や調味料を詰め込みすぎると必要以上に電気代がかかり、野菜などを腐らせてしまいますので空に近い状態を心がけることが理想です。他にもついついやってしまいがちなことですが顔や歯を洗うときは水を流しっぱなしで洗うのでなくコップに水を入れて洗うことは水道水節約に大きく貢献できます。自宅の掃除って面倒くさくて、気が付くとゴミの中で寝てたりしますよね。不用品処分でそんな日々ともオサラバしましょう！東京、埼玉エリアを活動拠点とし、ゴミ処理や不用品回収のスペシャリストがあなたの不用品を待ちかねています。仏さん以外なら何でも回収！そんな頼れる不用品処分業者といえばここ！引越しをしたら廃品やら粗大ゴミやらが沢山でてきた。流石に新居にゴミを持ってくるのも気がひけるので横浜の業者の人に連絡しておこうと思う。数えただけでも粗大ゴミが数百個早く不用品回収してもらないと今の家がゴミ屋敷と誤解されてテレビに取材されちまう！安くて即日で持って行ってくれるところを探してこよう。不用品処分うちの会社で一番の自慢はコピー機にリサイクルトナーを使っていることです。会社を訪問される方には、さりげなくコピー機を開けてリサイクルトナー入ってますけど？みたいなジェスチャーを見せます。驚いてリアクションが取れないお客さんを社員みんながドヤ顔で迎えるという流れ。愛想笑いが得意なあなたは、ぜひ一度わが社のリサイクルトナーを見に来てくださいね。再生怪人は大抵弱い法則だが、再生トナーは純正品よりも高性能かもしれないですよ。一度使ったトナーを回収してもらうたびに、再生トナー回収の業者さんには心から感謝しています。地球の100年、200年、6億5000万年後のことを考えると、エコって大切ですからね。再生トナーを利用することは小さな行いだが、私の聡明さはそんなことよりももっと偉大だ。,1,,ブランドの洋服を買い取ります。,http://www.pb01.net/,1,0
,97,リサイクルが高額？,,,父が死んだ後はゴミを処分するので1週間くらいかかった。最初のうちは価値のあるものとごみとで分けていたんだけど、格安の廃品回収に電話して全部処分した。ほとんどは下着や服だったし、骨董品も間違いなく偽物。有田焼とか堂々と書いてあるものばかりだし、物を見る目がなかったようです。気にかかるものがいくつかあったけれど、そんなこと気にしていたらゴミ捨てなんてできないですしね。,1,,ブランドの洋服買取はこちら,http://www.pb01.net/,0,0
,57,トランジットのための,,traveler,旅行の準備は一番肝心な作業です。それでは何を持っていけばいいのか、持って行くと便利な物はなんなのか。国内か海外か、一人旅か複数旅か、友人と行くのか家族と行くのか、その時その目的その相手で色々と変わりますね。しかし、数々の形態がある旅行でも共通して用意しておくと助かる物もあります。普段はかさばらず、空気を入れるだけでいいエアー枕や、雨具としてかさばらない折り畳み傘や防寒具としても使えるレインコート、ちょっとした物をいれる時に使え、密閉されるのでこぼれる心配や中の物が水に濡れる心配もないジップロック、突然の体調不良に酔い止めや胃薬や整腸剤や風邪薬といった常備薬。不慮のケガ用にバンドエイドや消毒薬、特に海外に行く方に必要ですが虫に刺されないように虫よけスプレー、幅広い用途に使えるタオル、かさばる服もしまえる圧縮袋、多機能で便利なアーミーナイフ、手洗い代わりにも使えるウェットティシュ、このあたりが様々な旅に共通して準備しておくと、通常の旅路や何かあった時にも役に立つことが多いようです。旅行に出てからあれがない！となると旅行の楽しさも減ってしまいます。折角の旅行を楽しむ為にも、準備は万端にして旅行に臨みたいですね。,1,,吉野川でラフティング,http://www.taoadventure.com/」,1,0
,52,カリブ海の海でバカンス,,ryokana ,旅行先でお金を使うのが嫌なので、基本は野宿ですね。父がホームレスだったので、食べ物の調達にはあまり苦労しません。問題は冬場の寒さでして、2月に北海道へ旅行した時は死にかけました。僕の経験上、東北よりも北へ旅行するのであれば、夏場を除いてはお勧めしませんね。良いなぁと思ったのが南国の国々。ジャングルの中に入れば、食べられる果物や昆虫が沢山いますから、まず腹の心配は無用。野宿初心者という方には、南方のバリ島やカレドニアが特にお勧め。海がきれいで、魚が沢山泳いでいますので、食べ物には本当に困りません。ハワイとかの南国で注意しないといけないのがハブとかの毒蛇。とりわけ野宿旅行をするのであれば、ハンモックはマストアイテムですよ。僕としては、顔面に蚊帳をつけた寝袋を木にぶら下げて寝るのが理想だと思ってます。これだったらヘビや虫などの襲撃から防御できますしね。あと、あるといいのがナタ。ジャングルは道を自分で作るのが基本なので、予備を含めて3本くらいあるといいでしょう。しかし、旅行で最も警戒すべきはやはり人間ということに尽きるでしょう。一度海外で強盗に襲われた時は、手にしたナタで脳天を一撃してやりました。髪の毛の付いたヘルメットが二つに割れて、気絶した瞬間に逃走。海外で強盗に出会ったら、お金でもなんでも全ておいて逃げることが最優先です。命あっての物種ですから。皆さんも安全にしっかり配慮し、楽しい旅行ライフを味わってください。,1,,吉野川のラフティングサイト,http://www.taoadventure.com/」,1,0
,54,楽しかった旅行,,buildinga,この春休みでお金を貯めたらニューカレドニア旅行に行きたいなぁ。彼女は沖縄の人間だからニューカレドニアよりもロシアに行きたいというのだが、普通北国よりも南の島でしょ。しかし沖縄人とニューカレドニア人のどちらが南国人として優れているのかを推し量るいい機会だな。ぜひ彼女にはバナナの早食い競争で現地人と対決してもらいたい！ｆｘでアホ勝ちして、これからリゾートアイランドにて好きなだけバカンスを楽しむ予定です。昔から行きたかったフィジーやニューカレドニアに行ったら、タロイモをお腹いっぱい食べたい。おじいちゃんのオススメはタヒチで、僕のおばあちゃんもタヒチ人なんです。今の嫁さんはフィリピン人だし、うちの家系は南国と縁があるようですね。,1,,吉野川でラフティング,http://www.taoadventure.com/」,1,0
,129,連休が終わった寂しさ,,travel,連休も終わりまして、これからは国民の休日ってのがない期間が続きますな。カレンダーをみると赤い数字が日曜しかないから、ちょっと憂鬱かも。大学にいるころから旅行にはまりまして、格安航空券を買っては四国や沖縄まで旅行していたものです。でも航空会社って有名なところだとANAとかJALだけど、何が違うのかいまだにわからない。旅行するとしても国内旅行がほとんどから、海外の空港ってどんなものなのか気になるな。 映画なんかだとよく出てくるけど、どこの国の空港もそれほど違いはなかったりして。 鉄道が好きな鉄オタがいるように、航空会社の旅客機が好きな人ってのもいるみたいですね。自分としてはイマイチ特徴の薄い旅客機のどこに惹かれるのか不思議なものです。あの数百人を収容できるジャンボジェットの巨体になにかダンディズムのようなものを感じるのか軍用機では戦略爆撃機なんかがジャンボジェット機に近いものがありますけれど、旅客機好きはそういう大型の軍用飛行機も好きだったりするのかな。兵器として使われる航空機では、耐久性がとかく重視されがちなので、 燃費の良さなどは旅客機ほど重視されていないそうです。 そこへくると旅客機というのはコンピューターで実用強度ギリッギリまで贅肉を絞っていて、かなり燃費の良さを向上させているんだとか。お手頃なツアーから贅沢なバカンスまで、ニューカレドニアの旅行プランを幅広く扱っているこちらなら対応可能！結婚式でお困りなら、こちらにお任せ！お友達に無理にやってもらう必要ありません。経験豊富なプロが行うのでお友達がやるよりむしろいいかも！仏式も流行っていますが、結婚式の理想は青山の教会で激安だと俺得ですわ。上手くいけば、カタコトの外人神父が登場するかもしれないし、激安かはともかく教会は青山でないとだめ。青山のあたりって教会が多いし、その中でも激安で結婚式をやれるプランとかないものかしら。,1,,吉野川のラフティングサイト,http://www.taoadventure.com/」,1,0
,118,自転車でどこまでも,,travel,愛用の自転車がパンクしてしまった。 自転車屋に持っていくとフレームからゆがんでいるので修理するよりも買ったほうが安いという流れに。 体重が重いので、もしかするとそっちに原因があるのかもしれない。 生まれた時から太っていたわけではないが、アメリカに行ったら美味い食いもんが山ほどあって太っちまった。 生きるためには食べなければならないんだし仕方ないよな。 それに美容整形の中には脂肪吸引という手術内容があるから、これさえやればどんな肥満体型でもあっというまにジョニーデップ。 脂肪吸引のついでにヒアルロン酸というのを試してみるのもいいかもね。 痩せたらきっと異性が放っておかないだろうから、手術後はちょっとしたコンサート会場みたいなものだろうな。 いかした脱毛専門店が近所にあるから、痩せるだけでなくスキンケアの方も完璧にしておかねば。 健康診断で高血圧気味だといわれ、とにかくすぐに痩せないといけなかったから脂肪吸引をする理由が増えちまったかな。 美容整形は数年前にやってもらって、顔だけはガクト似の超絶イケメンなんだよね。 身長は156センチの小型ガクトってのもありかな。 全てはイケメンに限るし、あとは痩せさえすれば外見では負けなしのストリートガイだぜ。ハネムーンにはセレブが集うと有名な島・タヒチを旅行して二人きりの贅沢なバカンスを味わってみませんか！最後の楽園と言われるタヒチで、夫婦となった二人の最初の旅行を楽しみましょう。将来結婚式をやることになったら涙を誘うようなウェルカムボードを作ってみたいものです。式が終わった後に、今日の結婚式のウェルカムボードって半端なかったよなぁと思わせるようなボードを用意することができれば結婚式は大成功！ウェルカムボードは人生の一ページを彩るすてきな脇役です。,1,,吉野川でラフティング,http://www.taoadventure.com/」,1,0
,117,宿泊先のホテルで,,travel,海に行ったことってありますか？日本は海洋国家ですが、フィジー旅行で見たフィジーの海は日本のそれとはまた違った魅力があります。海の良いところは水がしょっぱいこと。露店で食べ物を買って塩が足りないときは海水をかければしょうゆ代わりにもなる…。これは南国リゾートの裏ワザですので、覚えておいて損はないかと。ムー大陸を研究している僕と彼女とでタヒチまで旅行してきました。学会でムー大陸は完全に無視されていますが、ホンモノの知識人たちはその存在を信じていることはご承知の通りかと思います。タヒチの神秘的な海を見ていたらムー大陸とか正直どうでもよくなって、そのまま彼女とビーチフラッグで遊んでしまいました。ムーの調査はまた今度でいいです。,1,,吉野川のラフティングサイト,http://www.taoadventure.com/」,1,0
,124,海外でも携帯,ryokou,,海外出張へ行ったら携帯電話が使えない！？日本でずっと暮らしていると、携帯電話はどこに行っても使えると誤認している人が多い。まさしく私がそういう人で、慣れない英語でどうにか携帯電話レンタルをしました。苦労して携帯電話を手に入れたのに、あまり使う機会がなかったのは残念のようなホッとしたような…。でも海外旅行や出張には携帯電話レンタルができることをお忘れなく。自宅で鍋パーティーをやるのは毎年恒例。でも20人くらいの鍋だったから火力が悪くてガソリンを使用。結果はご想像の通り、ドカンと一発ハゲ頭ですわ！しかし東京都で大規模修繕をやっている友人がいたので、ちょちょいのちょいで元通り。隣の壁にも爆風でヒビが入っていましたが、まあもともと古い建物なので気が付くはずもないでしょうな。,1,,吉野川でラフティング,http://www.taoadventure.com/」,1,0
,125,旅行で大切なこと,tabi,,海外旅行をする際に重要な事とは何でしょうか？現地の言葉・または公用語として広まっている英語をある程度理解しておく事、信頼できる旅行会社やサービスのいいホテルを取る事、事前に現地の情報を入念に調査 しておく事、確かにそれらの事を気にかけるのは大事です。ただ、これに加えてもう一つ重要な事はなにか、それは『現地人のように振る舞う事』です。旅行客を狙った犯罪や詐欺まがいの事件というのは海外旅行での悩みの種の一つです。しかし、そういった犯罪を行う人達はどうやって対象が旅行者か、旅行者でないかを判別するのでしょうか。皆さんが仮にそういった立場の人間だったとして、ガイドブックを片手に物珍しそうに周囲を見渡す、ブランド物の服や小物に身を包んだ外国の人を見たら、どう思いますか？十中八九、不慣れな旅行者だと思いますよね。このような行為は「私は海外旅行者です、皆さまのカモにしてください」と言っているようなものです。では、そういった被害を防ぐにはどうするか。それが『現地人のように振る舞う事』になります。ガイドブックも見ずに普通に歩いているだけならば外国の人であっても旅行者かどうかまでは以外と判別がつきづらい物です。前日にホテルで綿密に計画を立てたり、携帯電話のアプリで位置検索をしたりと色々と工夫をする事で現地人のような振る舞いはできますの,1,,吉野川のラフティングサイト,http://www.taoadventure.com/」,1,0
,126,入国審査のこと,river,,海外旅行に行ったら入国審査というのがあるそうです。パスポートや荷物の中身を見て、危険なものを持っていないかチェックします。危険なものとは皆さんも知っているように「麻薬」「覚せい剤」など体に良くないもののことです。しかし時たま、風邪薬や一般的なものにも反応するので、どの薬でも注意しておいた方が良いでしょう。検査するのは危険なものだけではなく、食品や楽器などのチェックもします。食品の申請をしないと、持ち込み不可という国があるそうです。申請せずに持ち込むと全て没収＋罰金を支払わないといけません。罰金は、重さにより料金が違うようですね。重ければ重いほど罰金の料金は高くなります。楽器なのですが、ケースを開けてケース内のチェックならいのですが、用心深い方だと楽器の蓋？というあ楽器の中身がみたいという方がいると聞いたことがあります。入国審査は大変ですね。,1,,吉野川でラフティング,http://www.taoadventure.com/」,1,0
