Post.id,Post.blog_id,Post.title,Post.pagename,Post.menu,Post.content,Post.public,Keyword.id,Keyword.keyword,Keyword.url,Keyword.visible,Arbitrary.keyword,,
,13,廃品回収業,,shibou,廃品回収業者というものを、普段街中で見かけることが多いだろう。廃品回収を外付けのスピーカーで宣伝して、狭い路地にも入ってくる連中である。あれらを利用するのは、やめておいたほうがいいかもしれない。最初は無料で回収と言っておきながら、いざ回収の際には別途料金がいると言われ、高い料金を吹っかけられる。回収したらしたで、さらに国内外に転売しているところもある。中には、廃品回収というのは建前で、周辺の金品や物品を物色している連中もおり、すこぶる評判が悪い。いくら処分に困ったものがあっても、これらの街中を走る業者に依頼するのはほめられたものではない。では、処分に困ったものが出てきてしまったら、どうすればいいのだろうか。それは、業者に電話で依頼して、取りに来てもらうということである。この業者というのは、街中を走っている連中ではなく、ちゃんとした会社に所属していて、こちらから連絡しなければ街中で出会うことがないような業者である。廃品回収は、ちゃんと認可を得る必要があり、認可を得た業者なら信用に足るということなのだ。これらの業者はサービスもよく、無料とまではいかないがちゃんとした料金で、不用品を持って行ってくれる。結果的には、こちらのほうがお得でもあるのだ。これからの季節、大掃除で不用品や処分品は、多数出てくることだろう。そんな時は、電話以来で来てくれる業者を探して、そこに依頼するといい。無料見積もりをしてくれるところもあるので、そこで見積もってもらうのもいいだろう。,1,,おなら臭いにおいについて,http://onara.co.jp/,1,0,,
,202,ペットの臭いが,,supli,猫は２匹いますが、どちらもふらふら外に出かけて行って、夜ごろにふらふらと帰ってきます。そんなある日のことなのですが、いつも通り猫の帰りを待っていたところ、ご飯の時間前に帰ってきました。別の猫が。首輪がついているし、とてもきれいだったので、おそらく飼い猫だと思います。どうやら、興味本位で入ってきたのかもしれません。近所には、猫を飼っている方が結構いらっしゃいます。私も含めて、みなさん自由奔放に放し飼いが中心となっているので、いろいろなところで見かけていました。まさか、家の中に入ってくるとは思いませんでした。どうにか帰ってもらったので、安心しましたが、他の子が入っていないかを確認するために、カメラを設置してみることにしてみました。だいたい１日くらいを、猫ドア付近だけ映るくらいにしてセットしてみました。帰宅ののち、確認をしてみましたが、これが面白いようにたくさん映っていました。うちの子は、私がいない間は家に帰って留守番をしているようにも見えます。が、他の方が飼っている子が続々集まってきて、出入りしていました。中には、うちの子のための爪とぎとトイレを使っている子もいました。ちゃんとしつけできてるんだな、と感心する反面、なんとかならないのかと思いました。そのうち、キャットフードも食べられてしまうかもしれません。なにより、猫だらけになっているので、部屋の臭いが強くなっていることに気が付きました。これには、さすがになんとかしないといけない気がします。不動産担保ローンを利用することで、銀行からの融資とは別の方法での資金調達ができます。ただし、不動産担保ローンについては不動産担保ローンの審査があり、その審査によっては借入金額の上限や借りられない事態もあるので、しっかりと確認をいたしましょう。,1,,おならの臭いにさようなら,http://onara.co.jp/,1,0,,
,20,冬の臭い,,live,冬の季節になると首回りが寒くなってくるのでストールを巻きたくなります。冬に首に巻くものはマフラーもありますが、ストールの方がオシャレ上級者の印象があります。シンプルな洋服でもストールを巻くだけで一瞬にして華やかな雰囲気がでてきますし巻くだけでオシャレ上級者といった印象を持ちます。しかしそれだけに巻き方を間違えてしまうと一瞬にしてオシャレからかけ離れてしまいます。巻くときの注意点ですが立体的に巻かず平面的だとせっかく巻いていてもさみしい印象をどうしても持ってしまいます。巻物はついついきれいに折りたたんでしまいがちですがこれだとしっかりと跡が残ってしまい巻くときにいくら頑張ってもきれいに巻くことができなくなります。無造作にくしゃくしゃっとした状態で巻くことがポイントです。あまりにも寒さが厳しくなってくるとオシャレは２の次で防寒対策を優先してしまいギュッと結び目を強く締めてしまいがちですが、これではオシャレとは言えません。オシャレは我慢することが大切なのでたとえ寒くても我慢をし冬は着こんでしまいがちなので鎖骨を少し見えるように巻くとオシャレに仕上がります。マフラーなどを巻くときに陥りやすいことですが、髪の毛はアップにした方が見栄えがいいですしストールを隠すことがなくすっきりとした印象がありオシャレに見えます。冬の季節は髪の毛が乾燥でボリュームが出にくいのでアップにした方が少し寒いですが、お洒落に見えます。彼氏に送るプレゼントはしっかりと選びたいですが、選んでいる時間はなかなかないです。かといって、彼氏に好みをそれとなく聞くのも、難しいです。ネットショップでなら、そんな心配もありません。発送日に気を付けていれば、時間がなくても大丈夫ですよ。防寒グッズに目を向けがちですが、お洒落よりも大切なことは清潔感！どんなにお洒落でも少し肌を魅せただけで臭ったり、ムダ毛が生えていたらそれだけで幻滅しちゃいます。,1,,おなら臭いにお悩みなら,http://onara.co.jp/,1,0,,
,19,子供の頃のおなら,,cosmetic,子供のころから、「ごちそうを食べるとすぐお腹をこわすわね」とよく母に言われていました。特に焼肉や揚げ物などの脂っこいもの、冷たいものを食べたときにはほぼお腹をこわしていました。それは大人になった今でもあまり変わっておらず、やはり胃腸も強くありません。高校生くらいの頃から、精神的なものでトイレにこもることが多くなりました。特にお腹をこわすようなものを食べたわけでもないのに「授業中にお腹が痛くなったらどうしよう」「おならが出たらどうしよう」と考えると、どうしてかお腹が痛くなってくるのです。結局、休み時間はほぼトイレにこもりっきり。デジタル腕時計は常に身につけていて、チャイムのなる秒数も覚えていたため、残り数秒までカウントしながらトイレにいることもしょっちゅうでした。授業中にも何度もトイレに行きました。好きな人もいたのに、授業中に手を挙げてトイレに行く許可を取るときの恥ずかしさ、情けなさといったら。,1,,おならの臭いにさようなら,http://onara.co.jp/,1,0,,
,18,キャバドレス,,collect,キャバドレスに必須なヌーブラを激安販売しているサイトです。自宅の隣にドレス問屋があって、私が趣味でやっている社交ダンスのドレスはそこで調達しました。私の場合、普通の社交ダンスではなく、エア社交ダンスという全く新しい分野なので、インパクトを重視しています。印象強いドレスを着て見せることでエア社交ダンスの知名度を向上させようというわけですね。あの有名な狩野英孝も、目立つ白のスーツを着たから成功したといいますし。コスプレの人気商品です。お姉ちゃんが最近化粧を変えたのか、ちょっと素敵なんですわ。なにが違うのか？化粧筆を新しくしたのか、すごいメイクテクニックを習得したのかと色々想像しましたが、どうもカラーコンタクトレンズが雰囲気を変えた原因みたい。俺だって、俺だってぇ～～！と、気が付いたら行動は早かったですね。即通販サイトでカラコンをポチって、今は到着待ちです。,1,,仙台のキャバクラ,http://xn--ncke2h5c6a5349avph.jp/,1,0,,
,129,今の時代のいいところ,,kekkon,キャバドレスを着て街を歩いてみると面白いですよ。視線が突き刺さる感じがたまらないので、毎月新しいキャバ服を買っています。何気に同好の士ってやつもいまして、あれは新宿の街を歩いているときに見かけたんだったかな？彼は普通のサラリーマンだったんだけど、女装癖があったらしく、ついキャバドレスに手を出してしまったのだとか。私も公務員やってて暇だからこの世界に入ったんだけど、とっても面白い世界ですよ。,1,,仙台のキャバクラ求人,http://xn--ncke2h5c6a5349avph.jp/,1,0,,
,118,キャバ嬢になりたい夢,,fashion,キャバクラないしはホステスになりたいという女性は、増えている。女子高生のなりたい職業ランキングには、いつの間にか上位の常連となってしまった。毎夜毎夜お酒をたしなみ、男たちの愚痴や悩みを聞いたり、男を虜にしたりというのが、イメージとなっているのかもしれない。残念ながら、キャバクラやホステスの実態は、それだけではない。そのイメージは、しょせんうわべだけだ。というのも、こういった職業に、いきなり慣れるものではない。といっても、職業訓練校に通わなければならないということではないが。まず、お酒はどれくらい飲めるのかが大事になってくるだろう。お酒が飲めないのでは、夜の世界ではお話にならない。併せてタバコも吸えなければならない。そして、しっかり人の話を聞けるか、人の名前を覚えられるのかなども重要になってくる。夜の客というのは、自身の自慢をしたがったり、境遇の悩みや愚痴を話したかったりと、多種多様である。これらの客に平等に付き合えるのか、それもまた重要になってくるだろう。ただ、これだけではまだまだ前提のようなものである。人気となるには、会話の駆け引きなどもできるようにならなければならない。男を何人虜にするか、何人離れさせないかで、人気というのが決まってくる。ただニコニコしてお酒を飲んでいるだけでは、商売にはならないのだ。中には道半ばにして、挫折してしまうこともあるだろう。もしも挫折したのなら、または自信がないのなら、というかまずはまっとうな道を進んだほうがいいだろう。,1,,仙台のキャバクラ,http://xn--ncke2h5c6a5349avph.jp/,1,0,,
,143,キャバクラで働いて嫌だったこと,,biyou,キャバクラは、一見華やかな世界ですがやはり水商売と言われるものですので、厳しい現実もそこには存在します。 お店の経営がうまくいっている時はいいのですが、当然経営不振が続くと潰れてしまいます。 キャバクラ嬢という仕事は、たまにごく僅かにいる良心的な経営者のみ、会社員扱いとしてしっかりとした給料支払いシステムを採用しているお店もあります。 だけど、手払いで渡すお店も多いです。 私がいたお店は、何日締めの何日払いと決まっていて、その給料日に茶封筒で手渡しというスタイルでお給料が渡されていました。 なんと、潰れてしまった月のお給料はもらうことができませんでした。 その額数十万円、一ヶ月の間ただ働きになってしまったのです。 これはかなりへこみましたし、愕然としました。 それ以来、昼間の仕事で働くようになりましたし。 法律違反ではあるのですが、そこはお水の世界なのでしっかりしていないところはとことんしっかりしていません。 色々な意味で仕方がないです。 あとは、お客様で結婚されていて、どう見ても普通のサラリーマンでお父さんなのに、羽目を外して騒いだり、キャバ嬢にデレデレしている様を目撃したり、キャバ嬢と不倫したり現実はこんなものなのかと、冷めた視線も持つようになってしまいました。 別に皆がそうだと思ったわけではないですがある意味、男の人の現実がわかって、よかったのかもしれません。,1,,仙台のキャバクラ求人,http://xn--ncke2h5c6a5349avph.jp/,1,0,,
,144,キャバクラで働いていた時に驚いたこと,,zeiri,キャバクラで私が働いていた時に、未知の世界に飛び込んでいったわけですから驚くようなことは結構ありました。でも、退屈で飽きませんでしたよ。まず、枕営業をするキャバクラ嬢というのは実在しました。私はそんなことをするのはとてもじゃないけど出来ないし気持ち悪くて無理だったので、しようとも思いませんでした。お話をするのは別に減るもんじゃないから構わないと思ってキャバクラを選んだわけです。ここの、どこまでお客様に対して自分が許容できるかというラインで、水商売に従事する女の子は働く場所を決めていると思います。人それぞれ、かなりそのラインが違うということです。枕営業をしてまで美味しいと思えるような指名料では、決してないのですが。お客と枕営業の嬢が、直接金銭のやり取りをしているのかもしれませんし、そこまでは私にはわかりません。なかったらしないのでは、と予想はつきまけどね。本人たちが隠していても、ボーイや同じ店の女の子が目撃したり、そういうことをしているんだろうなという会話を聞くと一気にバレます。醸し出す空気もなんとなく違います。私の周りで見た感じでは、年齢が25歳より上の嬢のほうが多かったです。現実を知っている分、ある意味達観しているのかなと思ってしまいました。,1,,仙台のキャバクラ,http://xn--ncke2h5c6a5349avph.jp/,1,0,,
,99,キャバクラで働いて、プラスになったこと,,,キャバクラで働いて、勉強になったこともあります。世間一般ではキャバ嬢なんて、と思われていると思いますし、確かにしなくても済むならしないほうがいい仕事だとは私も思います。重々承知です。でも、キャバクラで働いたことで身についたのは対人関係のスキルだと思います。 空気が読めるようになったし、男の人のあしらい方なんかも、今結婚している旦那相手にそこそこ訳に立っているような気がします。こういう時はこう言えばいいとか、計算しているわけではないですが喧嘩した時とかご機嫌の取り方とかは、勉強になりました。また、大事な友人もできました。同じキャバクラで働いていた女の子なのですが、今は自分で勉強をして、飲食店の経営者になっています。キャバクラで働くのは、若い女の子が資金を貯めるのには確かに持って来いです。 だらしない女の子も居れば、物凄くしっかりした逞しい女の子もいました。あとはやっぱり肝が座ったことでしょうか。そんなに声を大きくして言えることではありませんが、本心の心の底ではあまり本気で驚いたり怯えたりはしなくなりました。自分さえ落ち着いてしっかりやれば、大丈夫だと自分を信じられます。それから、お酒に少し詳しくなったことと、お化粧がうまくなったことですね。仕事の調子が良い時は、自分がお姫様のようになれるので、楽しかったです。,1,,仙台のキャバクラ求人,http://xn--ncke2h5c6a5349avph.jp/,1,0,,
,100,キャバクラの衣装,,,キャバクラで働いていた頃、衣装は本当に大切でした。ドレス次第で可愛く見えると思っているので。その頃は、ロングドレスが流行りだした頃だったので、ミニスカートタイプや、昔ながらのスーツスタイルの方もけっこういたと思います。キャバドレスって、今は通販で安くてカワイイものがたくさん買えるんですね。結婚式とか、パーティーなんかでも使えそうで、羨ましいと思っています。プロポリスの効果によって見違えるほど綺麗になることができました。あまり期待せずに、飲んでいただけなのに、ガサガサの肌が日に日につやつやしてきたんですうよ。以前は肌はガサガサするたびに塗り薬を塗っていたのですが、今となっては必要無いものになってしまいそうですね。,1,,仙台のキャバクラ,http://xn--ncke2h5c6a5349avph.jp/,1,0,,
,107,キャバクラで活躍するには,dress,,キャバクラというと1つの接客業であり、男性のお客さんと一緒にお酒などを飲みながら話していくようなお仕事になってきます。一般的にその給料が高い事もありお金が必要な女性の方が働いている印象ではありますが、キャバクラで多くの額を稼ぐためにはそれなりに活躍していく必要があります。出来高制の所も多く、活躍しないと多くの額を手に入れる事が出来ないと言う事です。そこでどうやって活躍していけばいいかですが、とにかくお客さんに気にいられて多くの人から指名を受ける必要がありますので、どれだけお客さんが美味しくお酒を飲める環境を整えてあげるのかが重要です。そのためにはやはりコミュニケーション能力が必要です。相手の話をうまく聞きいれてお客さんに楽しさをあたえる必要があります。お客さんも癒しを求めたり、女の子と楽しく話したいから来ている人が多いですのでそれに答えてあげるというのが活躍のためには必要になります。お酒に関してもお客さんのペースで自分も飲むというのが必要になります。また、身だしなみも大事になってきます。自分がお客さんに気にいられるために常に可愛くいるというのも大事になってきます。もちろんそのためには美容などに励む必要がありますし、自分なりに見た目の面でも努力していく必要があります。以上のようにキャバクラで活躍していくためにはお客さんを楽しませるのと自分の身だしなみに関しても努力していく事が必ず必要になってきます。,1,,仙台のキャバクラ求人,http://xn--ncke2h5c6a5349avph.jp/,1,0,,
,108,コスプレday,kosupure,,コスプレでもナースは人気商品です。元々目が良い方だったけれど、度ありのカラーコンタクトを使ってみればさらに視力がアップ！？これであなたも千里眼の持ち主だ！と、上手くいかないのが現実で、どうして双眼鏡の役目を果たすカラーコンタクトって登場しないんでしょうか？もしそんなコンタクトレンズがあったらかっこいいですよね。モンゴル人みたいに、あと3日歩いた先に水場があるぜ。とか涼しげな顔で言ってみたい台詞だ。コスプレで女医気分を味わえます。目の色を変えるだけで周囲の注目をここまで集められるなんて、カラコンの威力はさすがです。少し派手じゃないかとも思いましたが、初心者向けのブラウン系カラコンは使いやすいわ。にしてもこの注目っぷりは芸能人みたいですね。サイレンもなっているし、パトカーが集まってくるなんて。これはカラコンを付けた僕が眩しすぎるからなのか、それとも僕がマフラー以外何もつけていないからなのか。,1,,仙台のキャバクラ,http://xn--ncke2h5c6a5349avph.jp/,1,0,,
,109,かわいいドレス,cute,,姉はキャバドレスの卸しをやっていまして、たまに売れ残ったものや事故品を持って帰ります。これを改造して遊ぶのが姉の趣味なのですが、キャバドレスって挑戦的なデザインが多いですよね。私もスタイルがもう少しよければ着られるのですが、柔道で鍛えたこの体ではキャバドレスは似合わない。似合うとすればやはり鎖帷子などの鎧ですね。本当はドレスが良く似合うと彼氏に言ってもらいたいのですが、私の体型だとそれは白々しいかも。卒業の時に買った振袖を着てみたら、なんだか力士みたいな恰好になってしまった。当時は体重も４０キロ台だったし、非常にスマートでしたから振袖が本当に良く似合った。しかし着物のいいところは、帯で調整するから体型が著しく変化したとしても何とか着られるんですよね。とはいえ、このズンドウ体型のまま外に出るのは非常に恥ずかしい。昔のような体型に戻すべく、これからトレーニングメニューを考えますよ。また着物が着たいですからね。,1,,仙台のキャバクラ求人,http://xn--ncke2h5c6a5349avph.jp/,1,0,,
