Post.id,Post.blog_id,Post.title,Post.pagename,Post.menu,Post.content,Post.public,Keyword.id,Keyword.keyword,Keyword.url,Keyword.visible,Arbitrary.keyword
,211,一国一城の主,,,一国一城の主ともなれば店舗デザインにも興味が湧いてきますよね。売れているライバル店を見ればわかりますがどこもみな店舗デザインが秀逸！まずパッと見が良くないとお客さんは入って来ないというオレデータがあります。一時期ラーメン屋をやっていましたがオシャレにしすぎた結果敷居が高くなりすぎて潰れました。これも店舗デザインを軽視した結果ですかね。千葉のマンスリーマンションで友達が暮らしているんだけど話を聞いているとうらやましくなるね。引っ越してきた時は会社の都合で面倒くさい目に遭ったと不満ばっかり言ってましたが越してきてすぐに居心地の良さに気付いたようです。でもマンスリーマンションってあまり長期間住み続けるようなところじゃないからあと半年くらいで出る予定みたい。,1,,屋根のリフォームはこちらへ,http://xn--jckte8ayb1f6082a2pr.net/,1,0
,70,貯金を使ってリフォーム,,home,金を使わないまま４０歳になったら貯金がすごい貯まっていた。まあ２億円くらいだけどケチケチ生活していればこれくら余裕ですね。いくらか世の中に還元しなくてはいけないと思い横須賀に新築一戸建てを建てた。住む予定もないから誰かに貸すか犬小屋にする予定です。お金は使わないと生きてこないですしね。どんどん家でもマンションでも買っちゃいましょう。究極の間接照明はアジアン照明にヒントがあるのでは？ベトナムやタイ料理のお店に行くとアジアン照明が置かれていますがあの独特な光のコントラストには癒されますよね。僕のマンションにもラタン素材のアジアン照明があって明かりをこれに切り換えると部屋の雰囲気が一瞬で変わります。まあ一応日本の行燈だってアジアン照明と言えば間違いではないのですがね…。,1,,屋根リフォームはここです,http://xn--jckte8ayb1f6082a2pr.net/,1,0
,69,どうしても屋根リフォームしたぁい！,,life,結婚４年目の姉は専業主婦の生活に飽きてきたようです。ある程度手抜きしても家事は何とかなるといい看護師の求人をネットで調べているようですね。確か看護師の専門学校を出てすぐに就職。結婚相手は医者ではなく医療機器メーカーの男性だったかな？看護師の仕事も本当は止めたくなかったらしく早く病院で働きたいと張り切ってました。会社の給料が安すぎて困っている…。バレるとめんどうだけどアルバイトを探そうかな？以前勤めていた会社が倒産したときだって実はみんないくつも副業してたりで社長もコンビニのバイトをしてたくらいです。まあ本業よりもバイトの方が楽しくなっちゃったらしく仕事がおろそかになって倒産したそうなんですがね。楽しいアルバイトもほどほどが大事ですな。,1,,屋根リフォームはお任せください,http://xn--jckte8ayb1f6082a2pr.net/,1,0
,67,工事の状況,,work,工事をしているところには必ず看板がありますよね。看板を見ると工事をやる期間や会社名などがきちんと書かれている時があることでしょう。書いていないときは「お願い」と書いてある看板が置いてあるのを見かけます。たまに看板がなく人形が腕を降っているだけというのも前に見かけたことがあります。それを見かけ思ったのが「日本って進化してるなぁ」としみじみ感じました。ある遊園地では工事中のアトラクションがあったらそのパークのキャラクターが工事の格好をしている看板があったり少し変わった看板でアニメキャラぽいような感じのものもあるようです。今まで生きてきて思ったのが工事の看板はやるものより変えるのかなと思いました。例えば①大きな建築をする場合は壁に貼れるような大きい看板となります。看板には工事を行う期間連絡先会社名依頼者など細かい情報が書き込まれています。②小さい工事なら工事服をきたおじさんの看板で「工事中」とあるだけでしょう。 というように看板は何かをやっているというマークになるので便利ですね。,1,,屋根のリフォームはこちらへ,http://xn--jckte8ayb1f6082a2pr.net/,1,0
,117,マンスリーマンション,,fudousan,震災があった仙台のマンスリーマンションで兄が暮らしていたけれど特に大した被害はなかったと言ってました。周りに住んでいる人たちは大騒ぎしていたそうだけど兄のマンスリーマンションはびくともせず無傷。震災があってから連絡を取ったきりまだ会ってはいませんが向こうから電話があってからずっとつながらないんですよね。まあ元気ならそれでよし。果たして北九州のマンスリーマンションは他と何かが違うのだろうか…。東京や千葉のマンスリーマンションに住んでいたことがある自分としては九州のマンスリーマンションのレベルが気にかかっていました。あ住んでみても特に違いはなく日当たりがちょっといいくらいかな？,1,,屋根リフォームはここです,http://xn--jckte8ayb1f6082a2pr.net/,1,0
,116,オシャレな家を目指す！,,fudousan,世渡り上手を目指す僕は商売もマンション経営が一番であることを知っている！なんせ人に部屋貸しているだけで金が入ってくるなんてこりゃあ笑いが止まりませんぜ。部屋の管理だとか面倒くさいことはマンション経営の管理業者に丸投げしてしまえばラクチンだしまずはマンションを購入するだけの初期投資の金を集めるだけだね。大阪の大学に通うことが決まってから大阪の賃貸を探してみましたがけっこう駅から近いところでも安い物件がゴロゴロ。住めば都と言いますし安くて良い賃貸物件を見つけたいですよね。部屋の広さに立地条件や家賃。このサイトで検索すればあなたの希望通りの住まいに巡り合えるはず。,1,,屋根リフォームはお任せください,http://xn--jckte8ayb1f6082a2pr.net/,1,0
,23,マンション借りるために不動産巡り！,,live,生活音がうるさいと聞いて福岡のマンスリーマンションを利用すると聞いたときは憂鬱でした。でも思ったほど音はうるさくないし神経質な人でもないと気にならないレベルですよ。話通りちゃんと生活家電は使える状態で置いてあったし単なる風評だったみたい。一か月単位での契約だから老後の旅行で長期滞在するならこういうマンスリーマンションもいいかもしれないね。使い勝手がどんなものかと千葉のマンスリーマンションに引っ越すまでは不安もありました。そもそも会社の都合で転勤なんてその時点でいい気分じゃないんですけどね。でもマンスリーマンションに入居してからは案外悪いものでもないと実感。たまたま隣の部屋に住んでいた人がいい人だったということもあるが生活家電が充実していたのが大きいですね。,1,,屋根のリフォームはこちらへ,http://xn--jckte8ayb1f6082a2pr.net/,1,0
,22,テーマパークの屋根,,cosmetic,先日那須ロコマーケットへ行って来ました。食のテーマパークらしいです。食のテーマパークってなんだ？と思いながらまぁ暇だったし行ってみました。家族を連れていくには良い場所ですね。ただ若いカップルがデートというとちょっとつまらないかな。だって食べ歩くで終わるというか。観光センターみたいな感じに思うでしょう。だったらもっと繁華街でお茶でもしておしゃべりをする方が楽しいでしょう。まぁとにかく那須ロコマーケットっていろいろと噂はあるけど別に騒ぐほどのことはないとおもいますので安心して行ってみてください。いろいろ騒ぎになったみたいだけどそんなの気にしなかったら那須ロコマーケットは魅力的だよ大宮に旅行に来てからはしばらく大宮のマンスリーマンションを拠点に名所を巡っていましたね。とっても雰囲気の良い大宮の街は一生暮らしてもいいくらいに気に入っています。マンスリーマンションにまだしばらく住んでいるつもりですがこっちで仕事見つけて暮らすのも悪くないかもね。 バルコニーをウッドデッキで作るならここへ依頼ください！,1,,屋根リフォームはここです,http://xn--jckte8ayb1f6082a2pr.net/,1,0
,21,マンスリーマンションをレンタルするときみるところ,,collect,中学生になってから福岡のマンスリーマンションに住むようになった。隣に住んでいたやつも同い年くらいで結局そのマンスリーマンションには中学生しか住んでいないとのこと。だったらエアガンでサバゲーやろうぜと中学生らしい発想を実現。壁も床もBB弾だらけになってあちこち小さい穴が…。大家さんは笑って許してくれたがもうこんなことはしないよ。解体工事だけで結構な額かかるのね～。ただぶっ壊すだけでもいい歳した大人が何人も必要だしその人件費と解体にかかる期間そして重機のガソリン代等々計算すればお金かかるのも当然か。壁なんかはハンマーでたたき壊せばいいが鉄筋の基礎は素人では破壊不能。解体工事では大量のゴミも出るしこの処理も勘定に入れるとやはりプロにお願いするしかなくなる。,1,,屋根リフォームはお任せください,http://xn--jckte8ayb1f6082a2pr.net/,1,0
,127,電話工事も依頼,fudousan,,電話工事を大阪で依頼するのはここが一番でしょう隣のビルが古くなって壊されていました。一応私が立てたビルよりも比較的新しいものだったのですが管理がまずかったんでしょうね。そこへ来ると私のビルは千葉県の大規模修繕に工事をお願いしていました。だから25年ほど経っても新品みたいなクォリティを保っている。大規模修繕にも結構な費用が掛かったがそれでも新しく立て直すのに比べれば安いものです。電話工事で番号など移設するプロはココですもう少しお金があったら横浜市に大規模修繕をお願いするしもっとあればマンションを新築にしたいね。タナボタで得たお金で買ったマンションでしたが30年も経過するとさすがにあちこちボロボロですよ。マナーの悪い入居者に部屋をめちゃくちゃにされたこともあるし…。あの時マンション建てて会社を辞めない方が良かったな。最近では入居率も下がったし今のマンションが潰れたらシャレにならんわ。,1,,屋根リフォームはここです,http://xn--jckte8ayb1f6082a2pr.net/,1,0
,163,ＤＩＹでお部屋のオシャレ,,,今話題のＤＩＹを自分でもやって部屋をオシャレにしたいと思っています。私は日曜大工はしたことがないのですがいつもの部屋になんだか飽き飽きしてます。以前は好きなアイドルのポスターを張ったりなどをしてましたらなんだか色あせていく様子を見ているとやるせない気分になったからです。もともと部屋のインテリアには興味がなかったので収納家具とベッドと棚がいくつかあるくらいです。アイドルグッズはクローゼットの中に収納しています。初めてのＤＩＹということなのでお部屋を素敵なもので飾ってみようと思います。とはいえいきなりのこぎりや釘打ちなんてのは多分できないと思います。なのでまずは人のやっているのを真似してみようと思っています。まずは簡単なものを作ってそれを好きな色に塗ってみるだけでもとっても達成感があると思います。幸い近くにＤＩＹの専門店が出来たのでそこで材料を買い集めて塗料を買ってとしていきます。家には再利用できそうなものがなかったのでＤＩＹとはいっても全て新しく買う必要があります。まずは簡単なものから作って行って次第に難しそうなやつも作って行こうと思っています。とってもオシャレな部屋になったらみんなに自慢しようと思います。そしてオシャレになった部屋に素敵な彼氏を連れ込むのが私のしばらくの目標です。素敵な彼氏を作るためにもまずはオシャレな部屋を作ろうと思っています。,1,,洋服の買取はここ,http://www.g-heart.com/,1,0
,204,ゴミが多い？,,,仕事の都合で大阪府や奈良県兵庫県に京都府と西のほうを巡っていますが毎日のように廃品回収の業者を見かけている気がします。偶然業者が多い時間帯に通っていて見かけるのが多いからなのかそれとも廃品が多いからなのかはいまいちわかりません。取引先の方から依然聞いたことですが勢いで買ってあとで後悔するというのが多かったようです。箪笥や食器棚椅子にテーブルが相当勉強されてセットで安くなっていたからつい買ってしまったけど必要なのは椅子だけだったから困り果てたとのことです。結局家具を一新したので解決したようですが以前から使っていた家具の処遇を悩んでいました。業者に出すとせっかく安かった分が帳消しになってしまうということです。家具は結局実家に引き取ってもらい実家からさらに親戚の家に運ばれて最終的にはインターネットオークションに出されていたそうです。ただここまで面倒なことになるなら自分でインターネットオークションに出すかもう最初から業者に出してしまったほうがよかったそうです。この取引先の方は極めてまれなケースでしたがほかの取引先の方や知り合いも似たり寄ったりで勢いで買った鍋がIHクッキングヒーター未対応だったり鍋3点セットを買ったら戸棚に入りきらなかったりのほかに乗馬マシンがブームだったときに買ったはいいけど数回使ったら飽きたなどもうなんでもありでした。こういったケースが多いから廃品回収業者をたくさん見かけているのかもしれません。,1,,洋服の買取はこちらへどうぞ,http://www.g-heart.com/,1,0
,213,キレイにいるためにも,,,通常の数倍の効果があるとかインチキな謳い文句を載せた商品って本当に許せない。僕の会社ではヒアルロン酸やビタミンのサプリメントを扱っている会社で世界平和のためにはビタミンが必要だという社長の価値観に痛く感銘を受け入社することになった。たまにリサイクルトナーの回収に来るお兄さんにもビタミンや乳酸菌とってますか！？と聞くと苦笑いするんですよね。それは本気で健康のことを考えていない証拠！恥ずかしがっていては健康な体を維持することなんてできるはずがない。私は近所にある大きめの公園で声を上げながらスキップする独自の健康ウォーキング術を開発実行しているから人間ドッグも余裕で問題なし。ただし脳に深刻なダメージが見受けられると言われた程度で頭以外は何の問題もないのです。子供の頃に階段を後ろ歩きして遊んでいたらそのまま転落して脳を損傷した時から今の性格になっちゃったんだよね。引っ込み思案であった性格が頭をぶつけてからものすごく積極的になったしむしろこっちが本来の時分だとさえ思ってます。頭と首を痛めた時は三軒茶屋の交通事故治療院で見てもらったもののたしか手遅れだとかそんなコメントを聞いた。家族からはこの性格をうっとおしく思われているがこれだけ社交的な性格を元に戻すなんてもったいないのではないか。人間は外見も大事だがそれよりも僅差で内面の方が大事だと思っている。だから美容整形で顔を整形手術してもらった妹には内心憎々しく思っているのだが多分本心を伝えることは一生ないだろう。外見にこだわるのは中身が不十分な証拠だと東京の通信制高校の先生も言っていた。,1,,洋服買取なら,http://www.g-heart.com/,1,0
,83,洋服も修理して,,recycle,洋服やものはいずれ壊れるものです。修理と言っても金具やファスナーを直すだけではありません。革も全体的に直したり一部を直したりすることができます。例えば大事なカバンにコーヒーがかかりました。革がベチョベチョで嫌。そこで革ごと交換するという手があります。ちょっとお金がかかりますが綺麗になるし前とは違う鞄ができるかもしれません。修理に持ってくるのは壊れた時だけではなく他のデザインに変えたい使いがってをよくしたいなどもございます。ベルトとか形を買えて繰り返し使うのも良いでしょう。高級バックだけでなくても普通のバックも見てくれるので心配はいりません。バックから財布財布から定期とか色々作り変える方法があるので古くなったから捨てるのではなく修理して違うものに変えて見るということも考えてみてください。最近家にでるのが億劫すぎるためにアクセサリーはすべてアクセサリーの通販サイトで購入しています。実際に触れないのが少し嫌ですがそういうのは一度購入してみたらわかりますから。,1,,洋服の買取はここ,http://www.g-heart.com/,1,0
,82,携帯のこと,,buy,知り合いにいうとすごく驚かれるんですが自分が携帯電話を持つようになったのってごく最近なんですよね。機械の操作ってのはそれほど苦手ではないのですぐに慣れましたがメールを打つのがなかなかできなくていつも時間がかかっています。最近ではスマートフォンがかなり普及してきて今後は近いうちに台数が逆転するんだとか。それ以前から携帯電話を二台持って会社用と個人用とで分けている人がいましたが今はガラケーとスマートフォンの二台を持っている人が多いようです。やっぱり通話ではガラケーアプリを使うのならばスマートフォンなんでしょうね。しかしただでさえ機械になれないお年寄りにスマートフォンが使いこなせるのでしょうか。自分はつい最近使い始めたので操作がわからないという気持ちはよくわかります。実際にスマートフォンを触ってみたことはないのでもしかするとガラケーよりも慣れれば使いやすいのかもしれません。ネット上でもガラケーはゴミスマートフォンを持っていないやつは遅れている などとずいぶんな言い方をする人がいますがそれほど革新的な製品なんでしょうね。ポスレジで経営を風通し良くカンタンに！多くのレジスターに導入可能なこの経営管理ソフトで飲食店の経営はもっと簡単になるかもしれません！売上も発注も従業員も全部このソフトで管理が可能なんです。ただのパソコンをポスレジに変えてくれるお利口ソフトがこちら！コチラを使って末永い経営を目指しませんか？会社の組織力を強化したいならコーチングについて知ってみませんか？業界内では全く相手にされない私の会社でしたがコーチングを依頼してからというもの少しずつですが業績が上がってきました。何と言っても社員一人一人の目の色が変わりましたね。以前は焦点の合わない目でフラフラしていた社員も今では水を得た魚！試してみる価値があると思いませんか？コーチング。レコメンド機能の導入をしようあなたの不気味な店舗デザインを一新させて集客パフォーマンスを向上させてみませんか？耐震耐火や耐久性をアップさせる店舗リノベーションでお店の性能を底上げすればスタッフのモチベーションも上がりますし何より経営者としては財産の保守は義務のようなもの。今こそ設備投資による空気の入れ替え時期ではないでしょうか。携帯がデータを残して昇天しちゃったときは白ロムを利用しよう！機種変より安いし今までのデータがそのまま使えるし気分によって替えることだって思いのまま！,1,,洋服の買取はこちらへどうぞ,http://www.g-heart.com/,1,0
,81,出不精だから,,repair,自分は昔から引きこもりである。もちろんそのまんまの意味ではないが出不精といったらいいのか。とにかく外に出るのが面倒で仕方がない。いちいち外出着に着替えたりヒゲを剃ったりするのがものすごく面倒に感じる。外で買い物をするのが非効率的だと常日頃思っている。靴に関しては実際に履いてみないと微妙な足の違いが分からないのでこれは通販にはあまり向かないといわれている。しかし身に着けるようなものでない石鹸や花であれば通販でも構わないと思う。店舗を持たなくてもいいのが通販のメリットでありその家賃分を価格に反映させることができる。実物を実際に目で見なくても構わないような商品はできるだけ通販で購入するようにしている。通販業者によっては購入金額によって送料が安くなったり場合によっては送料無料というところもある。都会であれば近所に店が沢山あるので買うところには困らないが車で1時間ほどかかるような田舎に住んでいる人間からすれば通販はものすごく便利だろう。この通販サービスによって地方と都会との地域格差が縮小できるのではないだろうか。現にそれを感じている地方在住の人間も少なくはないはずである。ネット上では家賃の高い都会に住むくらいなら土地の安い田舎に住んでネット通販でモノを購入するのが一番賢い生き方だと豪語する者もいる。通信販売が便利になることでこれからの商売のあり方が根本から変わっていくのかもしれない。プチ整形というと二重まぶたがメインではありますがその他にもヒアルロン酸の注射とかがあります。キャンディポップが安かったです。人類が夢にまで見た究極のエネルギー核融合そんな恐るべき太陽から大切なお肌を守るにはミネラルファンデーションしかありません。強烈な日差しで黒焦げになるまえにしっかり対策しましょうメガネが顔面の一部になっている人もコンタクトレンズに変えたら世界が変わるかもしれません。メガネの必要なかったあの頃に戻るチャンスです。母がイチオシしてる利尻ヘアカラートリートメントは自宅で白髪が染められるんだって。使い捨てからハードにカラコンまでコンタクトレンズを通販するなら品揃え抜群のこちらでどうぞ！ケア用品も売ってるしまとめて買えば送料無料にもなるのでいろんなコンタクト用品が欲しい人にピッタリのサイトです。,1,,洋服買取なら,http://www.g-heart.com/,1,0
