Post.id,Post.blog_id,Post.title,Post.pagename,Post.menu,Post.content,Post.public,Keyword.id,Keyword.keyword,Keyword.url,Keyword.visible,Arbitrary.keyword
,124,弁護士に詐欺を相談する,tamaatari,,今まで生きてきて何かトラブルに遭遇したことってありますか？ちょっと大きな事故に遭ったり置き引きをされたり人によっては泥棒に入られたなんて人もいるかもしれません。殺人などはそう滅多にないでしょうが詐欺の被害にあった人ならば結構いるかもしれないです。詐欺師というのは騙しのプロなので自分は大丈夫などとタカをくくっている人はあっさりと騙されてしまうことがあります。そんな時に弁護士に相談する機会があるのですがだまされたとなれば恥ずかしくてなかなか相談できないというのが人の心というものだと思います。多いのが競馬予想やパチンコの必勝法を教えるという詐欺。冷静に考えれば絶対にギャンブルで勝てるなどほぼありえないと思いますがその時の気分によってはあっさりと引っかかってしまうのかもしれません。自分はあまり外出するタイプではないのですがネットをやっていてワンクリック詐欺などの悪質サイトにだまされ高額の請求をされるということも多いです。家の中にいてもこういうトラブルに巻き込まれるというのは恐ろしいですよね。,1,,中古パチスロ,http://patio.ocnk.net/,1,0
,122,暑い夏で結婚式を！,pachisulot,,主に業務用品を扱っているスーパーでアルバイトしてたんですがそこに競馬の予想がすごくうまいおじさんがいて誇張とか抜きでコンスタントに勝ってましたね。自分は競馬はもちろんギャンブル全般がよくわからないのでどれくらいすごいのかはわかりませんでした。賭博にはほぼ無縁の家庭で母方の爺さんはたまにパチンコとか競馬に行ってたそうですが勝って帰ってくるところを見たことがないのでやっぱりうまい儲け話なんて存在しないんでしょう。ただ世の中にはそんなうまい話に騙される人って結構いるので弁護士の人も仕事にありつけるんだと。弁護士っていうと犯罪に巻き込まれたりしたときにお世話になる印象が強いですが身近なところだとインチキ商品をつかまされたとか詐欺の被害に遭った時にお世話になるのが多いはず。ドラマみたいに冤罪から身を守るために弁護士を雇うなんてドラマの中だけで十分です。他には軽い気持ちで結婚したはいいけどすぐに仲が悪くなって離婚というときにも弁護士が活躍するみたい。大抵芸能人がお金持ちと結婚するとどうせすぐ離婚するんだろうななんて考えてしまうのは自分の性格が最悪だからかな。ダルなんとかっていう野球選手はけっこうかわいそうで離婚することになって相手から凄まじい額の生活費を要求されたとか。お金持ちが離婚するとそういう時に大変なんでしょうね。,1,,パチスロ実機,http://patio.ocnk.net/,1,0
,119,疲れた時？プロポリスですよ…,pat1,,小学生の時すごく頭の良い友達がいて将来は弁護士になるとか言っていた。今は何をやっているのかは不明だが弁護士あるいは好きな仕事についているとうれしい。弁護士というとせいぜいテレビドラマくらいでしか見たことがないわけだが殺人や強盗などの犯罪者を弁護するだけが彼らの仕事ではない。比較的我々の生活に関連性のあるトラブルといえば業者間との取引だろうか。インチキなことを並べ立てて大して効果もない健康食品を売りつけたり絶対に儲かる投資話を持ち掛け大金を振り込んだまま何の音さたもない…など聞いているだけで腹が立ってくるような事件が絶えない。人をだまして手に入れた金で食う飯はどんな味がするのか聞いてみたいものだ。このような詐欺の被害で騙されるのはやはりお年寄りが多いようだ。思考能力が低下しているのかはっきりしたことはわからないが昔からいつも泣きを見るのは弱者である。自分の知り合いでもパチンコや競馬予想の詐欺にあった人がいる。相当恥ずかしいことだったようでなかなか話せなかったらしいが年月がたちようやく話せるようになったとかトータルでは勝っているなどうそぶいていたがやはり計算すると負けの方が多い。ギャンブルなど胴元が儲からなければ成立しないので当たり前といえばそれまでだ。弁護士に相談するのもお金がかかったりするしだました人間がどこにいるのかもう分からない。高い勉強料だと思ってあきらめるという話をしていた。自分は自分だけは大丈夫などと思っているのが一番危ないのかもしれない。しかし詐欺に立ち向かってくれるのは弁護士や警察だけではないそうだ。近年では探偵も詐欺対策に力を入れているらしい。弁護士も詐欺に立ち向かおうという活動をしている人たちは少なくないし無料で法律相談を行っているところもあるという。普通の人が弁護士に頼む場合圧倒的に民事のことが多いそうだが民事に強い庶民派弁護士はやはり頼もしい感じがする。知り合いの話だが会社の顧問弁護士事務所に経営のことなどを相談したところ借金関係だけでなくなんと税務処理までやってくれたという。その弁護士は税理士の資格も持っていたのだ。弁護士資格だけでなく税理士資格もある士業家がいる事務所ってなんて心強いんだろう。税理士や会計士などの士業と呼ばれるものはどれか一つの資格を取れば他の資格取得にショートカットが使える場合があるらしい。いちいち専門学校に通うというようなことをしなくてもいいのだ。しかしその方が顧客となる自分たちにとっても良いのではないかと思う。自分ももし士業家の世話になるときがきたらいろんな職種を兼業できる士業家を雇いたい。,1,,新台パチスロや中古パチンコ、中古パチスロ実機販売のパティオ,http://patio.ocnk.net/,1,0
,150,誰か弁護してくれ、俺の怠慢を,,zeiri,数か月後の初夏の時期札幌の結婚式場にて彼と結婚式を行います。友達もたくさん呼んだし親戚のおじさんオバサンも必ず来てくれると言っていた。札幌には結婚式場がいくつかあって迷っちゃったけれど口コミや評判を参考にしつつ最後は二人の直感で決めました。結婚相手も直感で決めたし最後に物を言うのは感情ですよね〜。夫婦そろってパチンカスだったから東京で格安結婚式をやったよ。結婚式って500万とか掛かるなんて知らなかったし親からもらった結婚資金はみんなパチで溶かしちゃったの〜。でも結婚式をやらないことには両親に顔向けできないし東京で格安結婚式ができると知った時は天の助けだと思いました。じゃあ景気づけにパチンコにでも行くか！,1,,,,1,0
,146,詐欺に合わないためには,,fashion,疲れのたまった週末はエステサロンに行くと決めています。頑張った自分へのなんとかってやつですね。エステって昔はお金持ちのマダムしか入れないところだと聞いてましたが探せば安いところもいっぱいある。割引キャンペーンで行ってみたエステサロンのサービスが良くってそれからずっとそこしか行ってませんね。ポイントカードもあるしこういう特典があると他を使えなくなるわ。彼氏にフラれて半ば自暴自棄になっていたのですがエステに行ったらそんなことどうでもよくなりました。体がリフレッシュすると自然に心も入れ替わったようになるんですね。気が昂ぶっちゃってそのままパチンコで一勝負しちゃいましたよ。エステで開運マッサージを受けたせいか玉が出るわ出るわで13万は勝ちました。運の流れが悪いと感じたらエステでリズムを変えてみましょう！,1,,パチスロ実機,http://patio.ocnk.net/,1,0
,43,ダーツ初心者だけど…,,zeiri,ちょっと意外だったんですがパソコンでネットができるようになると母親が株をやり始めたんですよね。大損して借金ってことにはならないように細心の注意を払っていたみたいですが儲けることは最初から眼中になかったんだとか聞きました。じゃあ何のためにやっていたかというと株主優待というのがあってそこで商品券やそこの会社の商品例えば精肉関連の会社だったらハムやソーセージが送られてきたりビール会社ならビール券なんていう風に株の副産物の方に興味があったわけです。最近はリスクが高いのでほとんどやっていないみたいですがやるとしてもお金儲けとしてはやらないでしょうね。株以外だとFXっていう外国の通貨を買って価値の変動で儲けたり損をしたりするのがありますよね。ルールがすごく単純そうなのでやってみようかとも思いましたが単純なものって奥が深かったりして手におえそうにありません。もっと儲かると思っているとすぐに暴落して大損したり買い方によっては借金を抱えることもあるので小遣い稼ぎにしてはリスクが高いように思えますね。本気で仕事にしようとしたら四六時中変動を画面でチェックし続けていないといけないので部屋にこもりがちになるとか。やっていることはギャンブルと同じなのでそれなりに儲かったとしても次に負けることを考えるとやっぱり真面目に働いたほうがいいのではないかという結論に到達しそうです。,1,,新台パチスロや中古パチンコ、中古パチスロ実機販売のパティオ,http://patio.ocnk.net/,1,0
,35,株と株主優待券,,credit,何冊もの占いや開運本を読みそして実践を重ねてきた私はまさに動く招き猫。アルバイトに行けばお客さんがどんどん入ってくるし宝くじは買わずとも道端で拾ったものが当たってしまう…。ギャンブルはいう間でもなく出入り禁止喰らっているほどだしパチスロは全国規模で入店禁止ですよ。開運って幸福のためにあるものだと思っていたのですが運がいいだけでは幸せになれないんですね。再婚を求めて母が東京の婚活パーティーに参加しています。参加費用がどれくらいなのか不明ですが母にとっても私にとっても再婚相手が見つかるといいなぁなんて。まあ自分はもう一人暮らししているし結婚相手が誰なのかポジティブに割とどうでもいい。しかし私も来年で30だしいい加減結婚相手の5，6人は見つけておいた方がいいでしょうね。,1,,中古パチスロ,http://patio.ocnk.net/,1,0
,167,お酒が大好きだから！,,,近頃は懐具合もあってお墓にお金を掛ける人が減っています。そんな時代だからこそあまのじゃくな私はでっかいお墓を建てようと貯金してるんです。基本的に一日一食にして酒もたばこもギャンブルもやりません。そんな節約生活を１０年続けて１０００万円貯まりました。でもまだ足りない。私が建てたいお墓っていうのはいわゆる前方後円墳なんですね。あれくらい大きなお墓を建てたら絶対有名になれるじゃないですか。夢があっていいと思うしド田舎のクソ安い土地を買収すればいいから土地はさほどお金もかからない。だから問題は墓石だとかの工事費ですね。総額で８００億円くらいかかるというので先はまだまだ遠いです。それなら一般的なお墓の価格は？と聞かれるとけっこう返答が難しくて場所によって大分違ってくるんですよ。言ってしまえば墓石自体はそれほど価格差はありません。相場が難しいのは永代使用料でついでに言えば管理費などもそうです。都内のように土地が高いところは一般的に永代使用料も高額。大抵は土地のレンタル代である永代使用料よりも上物の墓石の方が高いもの。しかし東京の青山霊園のように永代使用料だけで数百万クラスのところもざらにあります。ある程度区画面積が広ければ高いのは仕方ないのですが１uにも満たない土地で何十万もの永代使用料がかかるところがゴロゴロ。だから都内で土地や墓地を沢山持っているお寺さんはものすごい力を持っています。個人的にうらやましいと思うのはそのお寺さん直属の石材店さんですね。お寺とのコネクションが強ければうちにお墓を建てたいのならどこそこの石材店しか認めませんというところも結構多い。しかし都内のお墓とはいってもそれほど大した面積はない。もっとすごい石材店といえば区画数が数万を超えるような大規模霊園から仕事を貰っている石材店だろう。大抵は一社独占ではなく４〜５の石材店が大型霊園と契約を結んでいることがほとんど。管理費が払えなくなったりお墓を持つ一族が全滅したりするとお墓が撤去されてしまう。つまり空きができるというわけですね。そこに新しくお墓を建てるので大抵石材店には仕事が生まれてくる。自分も石材店の家に生まれればよかったと本気で考えた事もありますよ。しかしそれも時代の流れというものがあって自然葬がとっても人気なんです。水葬や樹木葬って聞いたことありませんか？海に遺灰を撒いたり樹木の下に骨壺を埋めるようなものです。これなら高価な墓石を買う必要はないし墓を掃除したり修繕したりといった管理も必要なし。今は仕事が忙しくてお墓参りなど行っている暇がない家も多いですからね。ある意味ではお墓も時代の流れにシフトしつつあるのではないかと思います。,1,,パチスロ実機,http://patio.ocnk.net/,1,0
,173,結婚したらお墓を,,,最近は当たる占い師ってほとんどいないもんですね。僕が小さい頃は街角の占い師でもかなりの的中率があったのですが今の占い師ときたら中途半端な連中ばかり。当たる占い師だったら僕のおばあちゃんが地元でも有名なシャーマンですね。怪しげなハーブを焚いて紙降ろしをするといろんな人間の未来が断片的に見えてくるんだとか。しかも的中率は90％以上！世の中すべて運ではない努力も大切だ！そんなたわごとを抜かしていた青い私ですがやっぱ運ですね。開運セミナーで運気の流れをコントロールできるようになってからは全てが上手くいっています。逆に運がよすぎて怖いくらいですよ。宝くじやギャンブルで勝利するのは序の口。モデル女性と結婚して会社では社長に昇進。経営も順風満帆でこれが運によるものでないと誰が言えようか。,1,,新台パチスロや中古パチンコ、中古パチスロ実機販売のパティオ,http://patio.ocnk.net/,1,0
,104,ボイトレして吃りを治す,,,ポスレジを使いこなす店員さんを見ていたらつい時間が経ってしまいました。まさかポスレジさばきに見とれて胸キュンしちゃったなんて絶対言えないしな。恥ずかしさにパニック状態だった私はつい店員さんに見とれていたと告白！今台所で味噌汁を作ってくれている女性がその時の店員さんつまり僕の嫁さんなの。ポスレジにドラマありですな。裕福な友達って父親が医者だとか弁護士であるほかマンション経営をしているパパさんがいたね。いつ行っても平日にお父様がいるので変だな〜と思っていたのですがあれはニートじゃなくてほんまもんの金持ちだったんだね。あくせく働かずにマンション経営をしつつ趣味に生きるとか完璧な人生じゃん。僕の目指している人生のモデルはそういうマンション経営で暮らす富豪です。子どもがやんちゃざかりでこのあいだもカーテンをターザンロープにして壊してしまいました。バレたら怒られると思ったのか庭に掘った穴にカーテンを埋めてしまい捨てるハメに。子供にはゲンコツをお見舞いしましたがまた同じデザインのカーテンを買うのもつまらないんですよね。安物のカーテンにするか防音機能のあるカーテンにするかで悩んでます。芸能人が持っているかっこいいタンスや鏡を買ってみたのだが何かパッとしないんだよね。インテリアコーディネイターの彼女に診断してもらうとカーテンの色やデザインが悪いとのこと。家具にこだわる人はいてもカーテンにこだわっている人ってあんまりいないからね。友達が来た時にカーテンのうんちくを話せたらちょっとかっこいいかも。,1,,雛人形,http://www.marugin.com/,1,0
,99,歯科医師になりたい,,,ようやく自分にも孫ができまして子どもの頃に習わせるものとしてはピアノが良いですよね。脳の発達にも影響するそうですし。丁度娘が昔使っていたグランドピアノがあるのでこれをあげようかとも思ったのですが長年ピアノ調律していなくて音がおかしい。プロではないので何となく音が違う程度の間隔ですがちゃんと調律されたピアノでないと意味がないですしね。兄と弟兄弟三人そろってサポート校に通っています。全員見事に高校受験を寝過ごしてこうなってしまったのですが通信制高校は気楽でいいですよ。普通の高校に行きたいと思ったこともありますが今となってはどうでもいいことです。僕の頭の中には東大に合格して楽しいキャンパスライフを堪能する自分の姿しか描かれていませんしね。,1,,五月人形,http://www.marugin.com/,1,0
,109,美しい女声になるためにアレンジメントを,dolls-arenji,,家裁の人というマンガがあります。昔片岡鶴太郎さんが主人公で裁判官役をしていたのを覚えています裁判官が見事な裁きで事件を解決するのですがその中に離婚の話題もありました。離婚になると子供をどうするのかが最も問題になります。子供はかすがいともいいますが離婚になるとどちらが責任を取って扶養するのか問題になるんです。取り合いになるケースもあればどちらも押し付け合いを行う場合もあるんです。面会する権利はありますが子供が嫌がっていたりすると強制的に合わせる様な法律の実行は難しいですね。親権をどのようにするのかなどについても離婚をするの際には大事な要素ですよね。離婚になると実は子どもとの面会交流はできることをa離婚相談でようやく知るケースもあります。びっくりですよね。,1,,雛人形、五月人形のまるぎん,http://www.marugin.com/,1,0
,128,資格を取る夢,hina,,最適化についてここまで細かく書かれた文章はない会社のウェブサイトを持っていてもそこまでやって来てくれないと論外ですよね。できれば最適化を図ってサイト流入者数を増やしたいところ。サイト管理者であれば多少seoの知識はあると思いますがリンクを貼ったりするところまでは時間が足りない。上位化を本気で狙うつもりならかなりＳＥＯにお金をかけないといけませんね。那須ロコマーケットは海外のフードコートみたいだと思いました。日本ではファストフードが多く入っているけど海外ではファストフードだけでなく地元のローフードのお店もフードコートに入っているから。あの雰囲気が私は好きです。那須ロコマーケットへ行ってみた感想のブログらしい那須ロコマーケットは那須の物産展だと思っていたら違うみたいですね。フードだけではなく他の要素もあるらしく子どもと行っても楽しめるらしいです。夏は暑いけど冬はとても寒くなるので秋のうちに行っておきたスポットのひとつです。,1,,雛人形,http://www.marugin.com/,1,0
,117,二次会代行って便利ね！,,biyou,子どものときは体が弱かったので頻繁に薬を貰いに行っていました。そこで薬局で働く人に興味を持ち高校卒業するくらいには完全に薬剤師に向かっていましたね。国家資格試験をパスしないといけないのは面倒でしたが薬剤師の求人を見る感じだと待遇も良いし最高の職場ですよ。経験者優遇のところが多いですがまあそこは適当にでっち上げれば楽勝でしょ。,1,,五月人形,http://www.marugin.com/,1,0
,149,タイヤでバッグをつくります,,recycle,子どもの頃親が結婚式に行ってくると聞くと引き菓子を楽しみにして待っていました。今となっては参加した結婚式の帰りに引き菓子を食べてしまうのですが何度食べてもいいものですよね。ただのお菓子とは違うスペシャルな思いが込められているのが一番の魅力。いつかは貰うだけでなくこちらが来賓者たちに配る身分になりたいものです。友人の結婚式が近いので東京のブライダルエステとやらに行ってきました。しかし調べてみるとブライダルエステって結婚する新郎新婦が使うものみたいですね。ということは単なる参加者がエステに行くのはちょっと場違いだったかしら？なんて話をすると美容意識が高いことは良いことだしそれだけ結婚式に対する情熱が伝わってきて新郎新婦も喜ぶとのこと。心配して損しちゃいました。,1,,,,1,0
,15,老後の余った時間をフラワーアレンジメントの教室に,,cosmetic,生まれつき知的障害がある僕でも神奈川のプロ家庭教師に勉強を教わったことで早稲田慶応クラスなら何とか合格できました。理解力がほとんどなかったので得意な暗記能力を活かし全部の参考書や教科書を丸暗記。受験とはいえ基本的に暗記した内容の応用ですからね。知識があっただけでもギリギリ合格できました。家庭教師の方からも100点満点で合格する必要はないと言われていたことを思い出します。子どもに家庭教師を付けているのですがプロの家庭教師はやっぱり違いますね。なかなか学生アルバイトの家庭教師だと成果が出にくかったのですがプロの家庭教師に任せてからは劇的な成長があったようです。成績が上がると本人も自信がついてくるようでそれがさらなる成績向上に結び付いているんでしょうね。どうせお金を出して家庭教師を雇うのであればプロにしておきましょう。,1,,雛人形,http://www.marugin.com/,1,0
,18,離婚に際して親権を争う場合,,collect,祖父母が立派な入れ歯を持っていて子ども心ながらにかっこいいなと。人体の一部を人工物にしたいわゆるサイボーグってやつですね。入れ歯のカッコ良さが分からない人もいないでしょうが僕が歯科技工士の資格を取った理由はまさにそれ。入れ歯サイボーグもカッコイイが僕は改造手術をするマッドサイエンティストの方がもっとカッコいいと思っていました。,1,,五月人形,http://www.marugin.com/,1,0
