Post.id,Post.blog_id,Post.title,Post.pagename,Post.menu,Post.content,Post.public,Keyword.id,Keyword.keyword,Keyword.url,Keyword.visible,Arbitrary.keyword
,122,お祭りで買ったもの,repair,,各地方によってお祭りが開催される季節って違いますが大抵は初夏から秋ごろにかけてが一般的ですよね。お祭りになるとお小遣いを500円貰って遊びに行ってました。でも自分はお祭りの夜店で何かを買ったことってほとんどないんですよ。ではどうしてお祭りに行ってたかというとお祭りという特殊な空間の空気を感じ取りそこで凝縮されたスピリチュアルなエネルギーを体内に取り込むことによって健康な体を保つわけです。というのは三分の一くらいが嘘で本当はお小遣い稼ぎなんですよ。夜店ってのは基本小銭での支払いが多いのでよく見ると100円玉とかが転がっていることが多くてそれを目ざとく見つけて回収するというのがお祭りの醍醐味でしたね。友達の中では1000円近く回収した猛者もいて自分はせいぜい300円くらいが限界でした。でも小学生の300円ってかなり貴重ですから神の与えた神聖なる報酬としてありがたく頂戴していたというわけです。他にも自販機を見つけてはつり銭をチェックしたり小銭が下に落ちていないかを確認する作業は常識でした。あの頃みたいなお金に対する異常なまでの執着心が今の自分には必要なのではないかと思いますね。,1,,洋服の買取はここ,http://www.g-heart.com/,1,0
,123,ロレックスもリサイクル,recycle,,ロレックスは腕時計の中でも高級品に入るブランドです。ロレックスは全て手作りで作られているので少々高いと思われる部分があるかもしれません。しかも機械式！修理のほうも普通の時計より高めになるような傾向があるようです。安くすむ場合があるかもしれません。最近の時計は機械式が少ないので修理できる場所が少ないとは言いませんが減ってきてはいます。試しに持っていき修理不可ならば近くにある時計屋さん(昔ぽい人がやってる)に行くと修理できるかもしれません。機械式の時計は最近の時計とは違うので最低限5年に1度は修理に出すと故障の心配はないはずです！色々検索した結果修理費が最高4万/最低3.5万円かかると出てきました。ベリーダンスの衣装がパーティでも利用できてお得です。,1,,洋服の買取はこちらへどうぞ,http://www.g-heart.com/,1,0
,129,雑誌の情報,,recycle,雑誌で脱毛を大特集していたので興味を持ちました。レーザー脱毛がなういと母親から聞きさっそく医療レーザー脱毛を行っている美容外科に電話しましたね。やることはとにかく早いに越したことないですもん。予想していたレーザーとはちょっと違いましたが別に痛くはないしねっ転がっていたら終わっていたというのが正直な感想ですね。仲の良かった同期の同僚が福岡のマンスリーマンションに引っ越しました。もう数か月経っているので向こうの生活にもかなり慣れてきたはず。最初引っ越さなきゃならなくなったときは面倒くさいとぶーぶー文句たれてましたが今ではもう戻りたくないとか。マンスリーマンションの居心地なのか引っ越した先でなにかロマンスがあったのかは謎ですがちょっとうらやましい。若い人を中心にレストランウェディングを選ぶカップルが多くなっています。普通の結婚式場で行うものとは違い本当に親しい間柄だけ集まってやるので気を使いすぎることもありません。レストランウェディングですので当然出てくる料理もよいものばかり。食事と会話を楽しめる結婚スタイルは格式ばった結婚式を嫌う若者にピッタリなのかもしれませんね。小さくてもいいからお店を開きたい。それだったら中古のレジスターなんてどうでしょうか？飲食店でも小売店でもレジスターがないと商売になりませんからね。停電したときなんて電卓で計算しているお店もありましたがそれだけレジスターってお店にとって重要な心臓部分になっているのかも。お店の道具選びはまずレジスターから！,1,,洋服買取なら,http://www.g-heart.com/,1,0
,118,中古のバッグ,,recycle,雑誌でもインターネットでもアクセサリーの通販は使ったことがあります。幸運のネックレスとか女の子にモテモテになる香水とか…。そりゃもう片っ端から買いましたよ。でも社会人になってからは幸運のアクセサリーよりも呪いのアクセサリーの方が欲しいですね。人間って基本的にネガティブだからそういう方向性のアクセサリーの方が売れるのでは？彼女はKK団のかぶるようなトンガリ帽子をかぶっていて誕生日プレゼントには不思議なアクセサリーやシカのつのを貰ったことがある。こういうちょっと普通とは入ってくる電波が違うところに魅力を感じるんだよねぇ。今月の頭らへん僕の誕生日だったがやはり変わったプレゼントをもらった。いわゆる干し首っての？カチコチの干し柿みたいなものだがこいつがまた夜中にしゃべりだしてうるせーんだ！,1,,洋服の買取はこちらへどうぞ,http://www.g-heart.com/,1,0
,180,痛くない歯科,,,私が気に入っていた胸毛ですが彼女から見苦しいといわれ泣く泣く医療レーザー脱毛を受けに行きました。このレーザー脱毛だったら次から生えてくるムダ毛を薄くする効果があるんです。特に彼女がこの医療レーザー脱毛を勧めてきたのには理由があります。いったいどれほどの永久脱毛効果があるのかという実験がしたかったんですね。別にムダ毛を処理するだけなんだし大したリスクもないと思うのですがモルモットにされた気分です。豊胸手術のやり方を聞いたときはちょっと怖かったけれど胸が大きくなるのであればやってみる価値はありそう。彼氏はことあるごとに女性は胸が大きい方が良いとつぶやいています。どうして巨乳が好きなのかというのはもう本能みたいなものだから説明できないそうで私もできるだけ彼の要望に応えたいと思っています。豊胸手術をするにはまだ貯金が足りないのでいつか胸の大きさが３倍になることを夢見て節約生活を続けている最中。,1,,京都のインプラントはここが人気,http://www.obata.or.jp/,1,0
,181,歯科医を目指していた時期もありました…。,,,若い頃は徹夜しても眠いくらいで何ともなかったのだが一晩寝ても疲れが取れにくくなったね。 この辺りからそろそろ自分も歳かな？なんて思い始めて積極的に運動をしたくなくなる。 かなり昔になるけれど高校のクラスメイトのうち4人くらいが歯科技工士の学校に入学した。 歯医者になるのはかなり難しいが歯科衛生士や歯科技工士であれば歯科医になるよりはハードルが低い。 そのうち歯科衛生士というものは女性向けの仕事だったので男性が歯科業界で働くなら歯科技工士というパターンが多いそうだ。 表向きには今後確実に老人の数が増えていくので歯科技工士としての技術を世の中に貢献したいという理由で始めた。 だが現実はというとそいつら4人はみんなプラモデルやガレージキットを作るのが好きなだけだった。 歯科技工士の専門学校では人口歯として使われるインプラントや入れ歯を製造する技術と知識を勉強する。 当然歯の形なんて人によって微妙にことなるので微調整には人間の手で上手く研磨するなりしなければならない。 この作業がフィギュアの原型師やプロモデラーと似ているので歯科技工士の趣味は模型作りが多いという話はあながちウソでもないはず。 プラモデルくらいは自分も作るがどちらかというとゲームやインターネットが好きだったので自分はＩＴ専門学校に行った。 大学でも勉強できたとは思うが早い段階でシステムエンジニアやプログラマーとして働きたいという気持ちが強かったんだな。 一生プログラマーというのも難しいのでいつかはプログラミングやシステムエンジニアとしての知識を生かした営業をやると思う。 中には本当にプログラミングが好きで安月給でもずっとプログラマーをやっている人もいるらしいけどね。 体力精神的に死ぬまでシステムエンジニアやプログラマーを続けるのはかなりしんどいのかも。 なにせプログラミングの技術は新しい言語も出てくるしその都度知識や技術も更新していかなければならない。 好きだったらそういうプログラミング言語の知識吸収も苦ではないだろうが40超えたSEを見ないしやっぱり厳しいんだろうね。 仕事というと妹は看護師の母を見ていたせいかなるとしたら看護師っぽい仕事がいいが絶対看護師にはなりたくないと言っていた。 そこで関西にある作業療法士と言語聴覚士の専門学校で資格取得と就職のために上京。 作業療法士と言語聴覚士が病院や施設でどんな仕事をしているのか聞いてみたが何だか難しい話で自分には分からなかった。 健康な人が普通に行える動作もケガや老化によって体が弱った人には難しい。 食事や歩行といったごく当たり前のことですら難しいわけでちょっとコンビニまで雑誌とお茶を買いに行くのもままならない。 結果引きこもりがちになり身体の弱体化が進行して最悪寝たきりになることもあるようだ。 やや極端な例だけど作業療法士はそうならないために体の機能を改善させるサポートが仕事なんだと。 言語聴覚士は名前で大体わかるように相手に言葉で伝えたり逆に耳で聞きとる能力の確保。 ちょっと意外だったのが食べ物を飲み込む能力をつけるのも言語聴覚士の仕事内容だということですね。 人と関わるのがあまり得意でないからシステムエンジニアだとかのコンピュータ方面に進みましたがどこに行っても人と接するのは避けられないんだよな。,1,,京都でインプラントといえば,http://www.obata.or.jp/,1,0
,177,歯科衛生士になりましょう,,,若い女性から年配の男性まで大人気のチーズケーキを買い占めてやった。大食いな僕は人生一度でいいからチーズケーキをキロ単位で食べたいと思ってました。それがそのドリームが叶ってしまったんですよ！手づかみでケーキをほおばるのが一番おいしい食べ方。行儀は悪いですが僕の場合おいしいものを食べる時は人間をやめて動物になるのが礼儀だと思ってますんで。いきなりですが家庭教師でバイトをしたことがある人は普通に頭が良いと思う。それを言うと頭はよくないけど楽しいという人がなかにはいる。頭が良くない人はあまり勉強が楽しいとは思う人がいないと思う。家庭教師は基本的には若い人が多いイメージを持っている。それも話を聞いているとアルバイトとして働いている人が意外と多い。学生なのにしっかりそれぞれの範囲を説明が出来るのはすごいと思う。授業を行なっている学生の成績を上げなければいけないプレッシャーは相当あるのだろう。そんなところで働くのはなかなかの覚悟が必要になるので大変だろう。しかし子どもの方からすれば家庭教師の人と合う合わないで授業のやる気にも影響してくるのではないだろうか。だから親は子どもがどんな人と合うのかをしっかり把握しなければ家庭教師をやっていても先生と合わずに勉強をしていても学んでいなければ意味がなく無駄になってしまう。そうするとお金を無駄に出費してしまったりして家庭の環境が悪くなってしまう問題が起こってしまう可能性があると思います。なので家庭教師をやろうとする時には親でしっかりと話し合いをしてから決めるべきだと思います。,1,,京都のインプラントはこちら,http://www.obata.or.jp/,1,0
,10,インプラントってネジいれるやつ？,,datsumou,重度のガミースマイルで口を閉じていても歯茎が見えてしまいます。家族や友人からは大したことないから気にするなと言われていますが内心結構気になってるんですよね。白金高輪の歯科医院では私みたいなガミースマイルの治療をやっているというし今月末にでも相談に行きます。インプラントにするくらいしか思いつきませんが歯茎を削ってガミースマイルを治す方法もある様なので期待しています。酷い出っ歯であだ名はやはりデッパとかさんまでした。僕個人としてはコレをネタにひとつ笑いが取れるからいいのですが彼女がどうしても治して欲しいっていうんですね。港区の審美歯科で出っ歯治療を行っているところがあるとのことでとりあえずカウンセリングだけ受けに行きます。出っ歯が治ったら僕のあだ名がどうなってしまうのか気になりますが彼女が喜んでくれるなら審美治療も悪くないかな。,1,,京都のインプラントはここが人気,http://www.obata.or.jp/,1,0
,6,ホワイトニングでお口真っ白,,shibou,初めて歯が抜けた時ってすごくびっくりしましたね。いきなり歯が抜けたってことはないですがぐらぐらしてきてすごく気持ちが悪かったことを覚えています。思い出すとちょっと気分が悪くなりますがもう歯が抜けるのを経験したくはないですね。割と歯並びは良い方だったので特に歯の審美治療で矯正手術をすることもなかったのですが乱杭歯の友達は大変そうでした。ありえないところから上の前歯が生えていて手術も少々難航したそうですが腕が良かったのかきれいな歯並びになっていました。日本よりもヨーロッパでは歯の矯正が盛んですから虫歯や歯医者と聞くとフィンランドなどの北欧をイメージしますよね。向こうで歯の矯正治療をしない人というのはかなり珍しく歯の矯正すらするお金のない家の子だったと思われるそうです。たしかに歯並びがものすごく悪いとどんなに顔が良くて優秀でも一発でちょっとアレな人扱いされがちですから歯が他人に与える影響ってものすごいです。虫歯を直すのが歯医者の主な役割ですけどいまはそれよりもホワイトニングやインプラント治療のほうにウェイトが行ってそうだな。年寄りの数がドンドン増えていくのだし入れ歯やインプラントはもっと増えるはず。,1,,京都でインプラントといえば,http://www.obata.or.jp/,1,0
,12,歯医者探しは口コミが重要,,supli,小学生の頃は親に強制されて歯科検診を毎年受けていましたが高校生あたりになると自分で勝手に行くのが普通ですよね。好き好んでいくようなところでもないのでそれっきり行ってない人も多いはずです。女の子が大好きな友達はお気に入りの歯科衛生士がいる歯科医院に通っているらしくて毎年3回は定期検診に行くみたい。そういう理由であっても歯医者さんに診てもらうのは悪いことじゃないよね。大人になると虫歯だけじゃなくて歯周病も怖いから歯を磨く習慣があまりない人は危機感を持った方がいいですね。人前に出て何かをするいわゆる芸能人は歯医者さんの中でも審美歯科という見た目を重視する歯科医院に通っているみたい。主にホワイトニングで白くて健康的な歯を手に入れたり抜けてしまった歯をインプラントで植えるとか…。もうここまでくると一種の整形手術みたいなものですが審美歯科の趣旨を考えるとそれもあながち間違いでもないのかな。オシャレに着飾ったところで歯並びが悪かったり笑った時に見えた歯が茶色かったりするとそのギャップに幻滅しますよね。意識の高い人は虫歯だけでなく審美歯科に通っているのが今の常識です。,1,,京都のインプラントはこちら,http://www.obata.or.jp/,1,0
,144,歯医者さんと結婚,,biyou,上手くいけば歯科医と結婚することも夢ではない…。学校の先輩からそんなことを聞き進路はもちろん歯科衛生士の専門学校です。まあ現実はそううまくいかない様子で専門学校では実習もあるし勉強についていくのは大変。片手間にバイトしながら国家資格くらい取れるかな？なんてタカくくっていたらどんどん授業は先に行くし現在大ピンチ。でも玉の輿の為を思えば歯科衛生士の勉強も楽しいかな？ 口をあけている人ってどこかユーモラスですよね。大口を開ける人を見るとうれしくなっちゃうお口フェチな私は歯科学校で歯科衛生士の勉強中。歯の模型をいじったり歯科衛生士の実習は口の中や歯を観察できるいい機会。初対面の人にいきなり口の中を見せてと言って見せてくれる人なんて滅多にいないもんね。人の口の中を探検できるのは歯医者さんと歯科衛生士の特権だ。  食事の度に奥歯がいたいのだがそろそろ白金高輪の歯科医院に行って歯の具合を見てもらったほうがいいかもな。半年くらい前に歯医者に行ったときは奥歯の方が手遅れで引っこ抜くことになったし。でも白金の歯医者さんはインプラント治療でも知られている歯科医だから治療が面倒だったら歯を抜いてきれいなインプラントに差し替えるのもありだね。,1,,京都のインプラントはここが人気,http://www.obata.or.jp/,1,0
,145,歯科衛生士として,,biyou,働いていた会社の経営が危なくなったと聞かされ夜間の歯科衛生士専門学校で勉強していました。それから会社の経営は持ち直したものの私の歯科衛生士にかけるパッションを消すことは不可能でした。給料の高い安いを問わず適当に近所の歯科医院に転職。自分くらいの年齢で歯科衛生士に転向する人も珍しくはないようでまさに理想的な転職だったなぁ。自分の顎の骨にネジみたいなもんを埋め込むとかちょっと恐いね。歯科技工士のお仕事をしている人はこういうインプラントの歯も作っているのだろうが自分の口に埋め込みたいと思うのかな？でもフランケンシュタインも頭にネジを埋め込んでいるしそういうオシャレがあってもいいかもしれないね。インプラントはまだ高価だから入れ歯を使う人にとっても歯科技工士は必要な人材ですね。,1,,京都でインプラントといえば,http://www.obata.or.jp/,1,0
,135,全ては歯から,,,父はけっこうメタボな人でいびきがうるさかった。それがここ最近イビキがおかしいんだな。途中で止まっているようなイビキで何だか苦しそう。本人も寝不足を感じているみたいで睡眠時無呼吸症候群を疑いましたね。歯科医院で早速その健診を受けてみたら透明なマウスピースを貰ってきた。こいつをつけて寝るだけで改善できるんだって。今まで入れ歯を使っていた祖父がせんべいをバリバリ食べていた。そんなスピーディーにせんべいをかじって平気なのかと聞くと白金高輪の歯科医院でインプラントにしてもらったらしい。インプラントが何なのかその時は分からずにごまかしたが入れ歯の未来的なモノらしい。私も事故で右側の歯が全部無くなっているからお金があればインプラントもいいかな。歯が抜け落ちる夢を見て不吉を感じ桜区の歯科医院を訪れた。先生にレントゲンを撮ってもらったりして検査したが意外なことに虫歯は見つからなかった。妙に不安だったので他の歯医者も当たってみたがやはり異常なし。普通どこかの歯科医院で虫歯が一つくらい見つかってもいいくらいなんですけどね。そこでよく考えなおしてみたら私の歯って全部インプラントなんですよ。歳の割に老けて見えると言われるので思い切ってフェイスリフトをやってみましたよ。私の場合切らないフェイスリフトという手術をやってもらいました。これは針と糸を使った方法で日帰りで終わる簡単な手術でした。昔のフェイスリフトだと美容整形の中でも大がかりなモノでしたからね。言葉で説明すると痛そうなものであれには勇気がいりますよ。,1,,京都のインプラントはこちら,http://www.obata.or.jp/,1,0
,136,サウナ,,,普段の家のお風呂に飽きたというときには近場の銭湯に通ってみるといつもよりも疲れが取れる気がする。特に家には絶対にないであろうサウナがあるのが非常にいい。最近ではミストサウナというものが誕生し一般家庭でもサウナに入れるらしいが銭湯でもできることを家でやる必要はない。サウナに入る前にはまずは体調のチェックが必要だ。食後なのか飲酒後なのかそういった些細なことでもサウナの効果は落ちてしまうのだ。またサウナに入る前は体を拭きとっておいたほうがいい。いつもサウナは銭湯での締めとして入っているのでしっかりと体を拭いてからサウナに入っている。サウナ室はあまり広いとは言えない場所なので混んでいるときはあまり自由な姿勢では入れない。それでもサウナは気持ちがいいが。サウナに入ってからはすぐにベンチに座りしずかにゆっくりとサウナを楽しむ。汗が滝のように出るのでタオルで拭きながらしばらくサウナを浴びる。だいたい10分くらいしたらゆっくりと立ち上がってサウナ室を後にするのだ。サウナは入り続けていればいいというわけではないし効果も人によって個人差が出てくる。自分にあった時間が10分なので人によっては短かったり長かったりするだろう。サウナ室から出たらまずは常温で体をゆっくりと休める。いきなり水をかぶるのは心臓まひや心筋梗塞になってしまうので控えよう。もしも水を浴びたいなら手や足などのなるべく心臓から遠い個所からすこしずつ冷やしていく。これだけで明日も頑張れるのだ。,1,,京都のインプラントはここが人気,http://www.obata.or.jp/,1,0
,55,防水できる建築士,,poster,何度建築業者に頼んでも雨漏りしてくるから防水技術に定評のある改修工事業者にお願いすることにした。本当は雨漏りする前に改修工事をするのが一番らしいがそんなお金ホイホイ出てくるわけないですからね。改修工事をやり始めてからけっこう歴史もある会社らしいのでうまいこと防水工事もやってくれるものだろうと期待してますよ。小金をためて売りアパートを購入してみたいとは思わない？持家もいいがそれ以上にアパートを一部屋持っているといろいろな状況で役に立ちますよ。人に貸してお金を設けるのもいいし誰も住んでいないのなら物置場として利用してもいい。僕のおじは安いボロアパートを購入してトランクルームにしていますがそれで働かずして年収1000万！そのお金でもっともっとアパートを買うと言っていました。,1,,神奈川の一級建築士です,http://www.takizawasekkei.com/,1,0
