Post.id,Post.blog_id,Post.title,Post.pagename,Post.menu,Post.content,Post.public,Keyword.id,Keyword.keyword,Keyword.url,Keyword.visible,Arbitrary.keyword
,124,プロデューサー巻きで生き字引き？,cosmetic,,ちょっと前まではダサいの象徴とすら言えるシロモノでとても実行できたもんではなかったプロデューサー巻き。プロデューサー巻きとはカーディガンを着ずに肩に羽織る着こなし方です。しかし気付けばあっというまにおしゃれ界を席巻したプロデューサー巻き。ちょっと前までアパレルショップのマネキンやスタッフ全員がプロデューサー巻きをしている言っても過言ではないくらいでした。やってみると意外と便利で着こなしのアクセントになったりします。寒ければ実際に羽織として着たらいいし暑ければプロデューサー巻きにしたらいいし。カーディガンだけでなくシャツもプロデューサー巻きにできるので着こなしの幅が広がった気がします。いやあやってみると便利ですね。プロデューサー巻きを普段しない人は是非おすすめしたいと思います。ひごろから地味な色の洋服しか着ないなら鮮やかな色のカーディガンやシャツをプロデューサー巻きにしてみるのはどうでしょうか。一挙に今っぽくなるので面白いですよ。しかし今流行しているプロデューサー巻きもまたいつかすたれていくわけです。ああこんなに便利なことを知ってしまってすたれたときにプロデューサー巻きを手放せるのだろうか。それともすたれたあとにまた数十年経ってプロデューサー巻きの流行を経験することになるのでしょうか。そんなことになったらまるで生き字引きですよね。まあ流行って廃れるのが流行です。あまり深く考えずに今を楽しむことにします。,1,,仙台のキャバクラファッション,http://xn--ncke2h5c6a5349avph.jp/,1,0
,125,お金を掛けずにオシャレを楽しむ,collect,,私は昔からファッションが大好きです。服に靴バッグなどブランド品も大好きです。しかし結婚して専業主婦になり独身の頃のようにファッションや趣味にお金を掛ける事ができなくなってしまいました。結婚前はキャバクラで勤務していた事もありそれまで欲しい物はどんどん買ってきた私。そんな金銭感覚の私にとってこれは大きなストレスでした。結婚して主婦になったからといってファッションへの興味が無くなる事はなく欲求ばかりが膨らみました。そんな時あるブログをたまたま見つけました。プチプラの洋服や小物でオシャレにコーディネートをしている方のブログでした。その方は年齢も私と近いようでコーディネートも私好みのシンプルでキレイ目なものでした。一目見てすぐに「素敵！」と感じました。コーディネートと一緒に紹介されている洋服のブランドを読むと有名なファストファッションのブランドや手頃な価格帯のブランドがほとんどです。私にとって目から鱗でした。私の愛読している雑誌では何万円もする洋服が多く掲載されています。そんな高価な物は今の私には高嶺の花です。でもこれなら私の好きなファッションをもっと楽しめると思いました。お金を掛けなくてもこんなに上品で素敵なコーディネートができるのかと。主婦だからといってオシャレを我慢しなくても良いのだととても嬉しくなりました。そして早速ずっと欲しかったスカートを購入しました。最初に欲しかった商品よりも安価な物です。これからいかにお金を掛けずにファッションを楽しむか何だか無性にワクワクしています。,1,,仙台のキャバクラはここから,http://xn--ncke2h5c6a5349avph.jp/,1,0
,74,ファッションは自分を表現する手段です。,,fashion,ファッションでオシャレをすると気分がいいものです。メイクもバッチリ決めて気に入った服を着ていると気持ちが高まります。女性がファッションにお金をかける理由はそんなところにあると思います。決して安くはない服を頑張って買っているのは自分が納得できる服を着ていたいと思う気持ちと自分がどんな風に周りから見られたいのかを意識する気持ちの両方にあります。ブランドのファッションにこだわるのも自分がそのブランドの服を身に着けていて気持ちが高揚するからという理由プラス周りからブランドのファッションを身に着けている自分を見てもらいたいと感じるから高価なファッションに身を包むのでしょう。もしも世の中に自分とその家族くらいしか人がいなくなったと仮定したらきっと服にお金をかけるなんてことはしなくなるでしょう。服にお金をかけなくなるだけではなくアクセサリーやバッグや靴などにもお金をかける意味が見いだせなくなるはずです。人に自分が見られていることを意識し始めると人は自分のイメージをファッションや持ち物で表現しだします。もちろんいいことですからなりたい自分に少しでも近づくようにファッションやおしゃれに気を使っていいのです。私もファッションでオシャレを楽しむことは好きな方です。ただしあまり背伸びしたファッションはしないように心がけています。やはりファッションでオシャレを楽しむのは普段着なれている服でしていたいと思うのです。,1,,仙台キャバクラの人気,http://xn--ncke2h5c6a5349avph.jp/,1,0
,3,系ファッションって？,,fashion,自分のファッションがいったい何系に当たるのか悩むことがあります。雑誌を買う時服やでコーナーを探す時○○系と分かっていれば迷わないのですが。私が好んで着る服は無地が多く柄があってもトライプといったシンプルなものです。かわいらしい花柄や光沢感のある素材華やかなビジューの付いた服も素敵だとは思います。しかし私がそういった服を着ない理由は私のファッションが服でなく小物が主役であるところにあります。靴やバッグにアクセサリー時にはメイクやヘアスタイルをコーディネートの主役に置くこともあります。“小物系”ファッションとでも言うのでしょうか。そういったこだわりの小物の魅力を際立たせるために服はシンプルにすることが多いです。ハリウッド女優のような真紅のハイヒール使い込んだヴィンテージ感たっぷりの革バッグルース選びやデザインまで自分でしたアクセサリーなどなど。これらは多くの服とは違い一時のトレンドに左右されることなく歳を重ねてもずっと使えるこだわりの小物です。小物を主役にする引き算のファッションをしていく中でシンプルな服にこそ美しさが求められることが分かりました。ごまかしのきかないファッション名だけに時には身につける人の内面の様子まで出てしまいます。身に付けるもので飾り立てるのではなく内面からの美しさも磨かなければと感じています。話は逸れましたがどんな系のファッションでも中身の美しさが大切だということですね。,1,,仙台のキャバクラドレス,http://xn--ncke2h5c6a5349avph.jp/,1,0
,99,日本に住んでいると服が増えます。,,,日本は春夏秋冬という四つの季節が順々に巡ってきます。季節が移り変わるたびに人はその季節のイメージカラーで装ったりそれぞれに趣があるファッションに身を包んだりして思い思いに装うことを楽しみます。日本に住んでいるといろいろな種類のファッションが楽しめます。ただし気を付けないとファッションに多額のお金をかけてしまうことにもなりかねませんからそこは自分のクローゼットの中身をよく知っておくことが大切です。四季がある国に住んでいるととにかく服が知らず知らずのうちに増えていき気が付くと箪笥やクローゼットの中がいっぱいでどうしましょう…ということになりかねません。無駄に服を買っているつもりはないにしてもバーゲンセールが開催されていればクローゼットの中に余裕がなくても買いに走るのが女性です。もう服はいらないと私も何度となく今まで思ってきましたが結局お気に入りのお店のバーゲンセールが開催されれば我慢できずに衝動買いしてしまうのです。そしてたくさんの服をまとめ買いしてしまってからまた買ってしまった…と後悔するのですがこんな風に毎年服を買い込んでいればまだ1度しか袖を通していない服も出てくるのです。こんな無駄なことはありません。第一せっかく選んで着るために購入した服が可哀そうです。しかし何とか着たいと思って分かりやすい場所へ出しておくのですがそういう服はなぜかまた着ないままどこかクローゼットの奥の方へしまわれてしまうのです。,1,,仙台のキャバクラファッション,http://xn--ncke2h5c6a5349avph.jp/,1,0
