Post.id,Post.blog_id,Post.title,Post.pagename,Post.menu,Post.content,Post.public,Keyword.id,Keyword.keyword,Keyword.url,Keyword.visible,Arbitrary.keyword
,208,賃貸マンションのインテリア,,,家族と一緒に都内の賃貸マンションに住んでいます。分譲のマンションは自分の所有なので好きなように部屋をいじれるしペットもたいてい飼える点では羨ましい。でもマンションも流行の形があります。20年も経つとさすがに古びてくるし最新鋭のマンションに比べてどこか流行遅れに見えてきます。その点では飽きたら引っ越せる賃貸マンションも悪くはありません。一生家賃を払い続けなければならない事を考えると多少型落ちになったとしても分割払いが終われば自分の物になる分譲マンションの方がやっぱりいいのかもしれませんが。さて表題に掲げた通り賃貸マンションのインテリアについてですが…引越しをする時の事を考えると原状復帰が出来る範囲でお部屋を使わなければなりません。多くの物件の契約書に共通していると思うのですが壁紙の月日による黄ばみやカレンダーなどの跡畳の日焼けなどは借主側の負担になりません。つまり原状復帰の義務がないもの。たいていの場合傷を付けてしまうと壁紙や床の張り替えが必要となるので費用が発生してしまいます。だから賃貸の場合インテリアにも気を遣います。壁に釘を打つのがダメ。フローリングに椅子の擦れなどが付いて傷が目立ってはダメ。だけど壁が寂しいので絵を飾りたい。傷が付くと分かっていてもソファーや椅子を置きたい。そこで我が家が使っているのは壁に最小限の負担（穴が開いても目立たない）で済む絵画用のフックとソファーや椅子の脚用のパッチシールとカバー。百均で売っている物もあるし活用しています。ちょっと工夫すれば賃貸だって思い通りのインテリアを楽しめます。,1,,相模原の一戸建てはこちら,http://www.ujh.co.jp/,1,0
,210,オール電化で快適リフォーム,,,我が家は築30年の家でそろそろ水回りが痛みリフォームしたいなあと思っていました。そんな中新聞の折り込みチラシでオール電化水回りキャンペーンというのをしている工務店があり見積もりをしてもらいました。他にも何社か見積もりをお願いしたのですが内容と値段が一番良かったところにお願いすることにしました。オール電化にするのでエコキューとを据え付けお風呂も電気でわかすことになりますし台所はＩＨにしました。この際なんでお風呂も台所もシステムバスシステムキッチンに総入れ替えしトイレもお掃除の便利なものに交換しました。一緒にトイレ洗面台所のクロス床張りも新しくしまるでそこだけ新築のようになりました。とても信頼できる工務店だったので工事内容も詳しく説明してくれ納得しながら進めることが出来ました。この先も長年暮らさなければならない我が家なんで年をとっても少しでも快適に暮らせるよう段差もなくし手すりをいろんなところにつけてもらいました。こういった部分は工務店さんの御配慮でいろいろアドバイス下さるので助かりました。リフォームって案外高い買い物ですし納得のいく工事をしてもらわないと困ります。今回のオール電化工事は本当に大満足の仕上がりでした。今度家のどこかに修理個所ができたら是非こちらの工務店にお願いしようと思います。リフォーム後もちょっとしたことですぐに来てくれますし本当にいい工務店にリフォームしてもらいました。,1,,相模原の不動産もお任せ,http://www.ujh.co.jp/,1,0
,70,やっぱり賃貸を考えます,,home,やっぱり自分が住む場所があると安心しますよね。住所をあれこれ変えなくていいのって本当に便利です。定住する場所があるのとないのとでは本当に大違いです。しかしながら今は独り身ですし今後どんな生活を送るのかが分からない以上賃貸に住み続けることを考えてしまいます。誰かと一緒になってその土地で暮らすというイメージがわかない以上家を買うって選択肢は多分生まれないでしょうね。今は資産と負債の面から言って家を買うのだけは負債に該当しちゃいますし。安心が欲しいとは思っちゃいますけどなかなか仕事も流動的だし今はとにかく安定したものがない時代なので半分あきらめていますね。もう少し今の投資とかの額が大きくなってきてくれるとやりたいこともできるようなってくるかなって思ったりします。賃貸といっても不動産を自分でもってそこに自分も住むといったやり方も一つの手ですよね。ただし住宅は余っている状態なので不動さん選びは気を付けないといけないなって思いますけど。でも夢はあれこれ考えなくていい自分だけのお城みたいな部屋が欲しいってことですね。そのとき一人でいるかどうか分かりませんが賃貸からおさらばしたいって気持ちもなきにしもあらずです。ただ物件って経年劣化とかしますしちゃんと管理ができるのかな〜とか思うとやっぱり賃貸でいっかなぁと思ったりもしてしまいます。どっちにも良さと悪さがあるよなって感じです。,1,,町田で一戸建てをお探しなら,http://www.ujh.co.jp/,1,0
,69,一人暮らしにぴったりの賃貸アパート,,life,一人暮らしをしている人はたくさんいると思いますが大学などのために遠方から都市部に来ている人や仕事のためにそうしている人もいます。事情はどうあれ一人暮らしというのは気楽さがなにより良いのであり自分だけの空間を楽しめるという利点があります。一般的にワンルームマンションというのはひとり暮らしの人が生活しやすいようにコンパクトに設計されています。ユニットバスやキッチンの下に入る1ドアの冷蔵庫などはまさにそうです。間取りは6畳くらいのところが多くなっています。アパートによってはインターネットがフリーで自由に使えるサービスをしているところもあります。このような賃貸のアパートは便利とはいえ少し狭いと感じることが多いですし机やテレビなどを置いてしまうと寝るためのふとんを敷くのがやっとというくらいです。必要なもの以外は持ち込めないと感じる空間しかないのです。またユニットバスはトイレとバスが一緒になっていますのでどうも好きになれないという人もいます。さらにワンルームマンションは構造が簡単で隣りの部屋の音や声が聞こえやすいというのも気になるものです。それでひとり暮らしで快適な空間をつくりたいならば1LDKの間取りが理想です。リビングがあることで寝る部屋とくつろげる空間を得て楽しむことができるのです。大きめのテレビを置くことも可能ですしこうした間取りのある賃貸は外観もよくとても良いものです。ひとり暮らしを楽しむために少し大きめの間取りの賃貸アパートに住みたいものです。,1,,町田の不動産会社はこちら,http://www.ujh.co.jp/,1,0
,67,どんな住まいでも自分らしくアレンジしたい,,work,一生のうちでいろいろな住み方を経験すると思います。賃貸であっても一戸建てであっても分譲マンションであっても自分の住む所は快適に過ごしたいと誰もが思うのではないでしょうか。私自身も子供の頃は県営の住宅から中古住宅に移り住み新築と経験しました。子供の頃は自分ではインテリアなど何もできませんでしたが大学生になって寮に住んでインテリアをある程度自分なりにコーディネートしてみて初めて自分らしくアレンジしたのを覚えています。それ以来一人暮らしも長いですが賃貸マンションでもできる範囲でいろんな工夫をするようにしています。例えばカーテンも天井が少しでも高く見えるように縦のラインが強調されるようにストライプのものを選んだりカラーコーディネートもブルーやグリーンなど寒色系で自然を感じるものをチョイスして統一感を持たせています。照明器具も手作りのものを使ってかなりこだわったインテリアになっています。ただ賃貸なので壁紙や床材などは既存のものを使っているのでこのあたりも自分のお気に入りのものを選べることができればいいと思いました。最近ではそういった要望を賃貸マンションでも実現できるタイプの物件もあるそうでこだわりのある人なら大きなセールスポイントになると思います。広くても狭くても新築でも中古でもどんな住まいでも制限がある中で創意工夫することによって自分らしくアレンジできれば満足度も上がって暮らしが豊かになるように感じます。,1,,相模原の一戸建てはこちら,http://www.ujh.co.jp/,1,0
,130,初めての自分の部屋,,fudousan,私が小学校に上がったころ初めて引越しをしました。引越しの理由は私が学校に上がったことで自分の部屋があってもいいのではないかといった親の思いからでした。引越しをした先のアパートでは自分の４畳半の部屋がありました。私は始めての自分の部屋がすごく嬉しくてどうやってすごそうかいろいろ想像しました。自分の部屋には勉強机とベッドが理想でしたがベッドは残念ながらスペースがなくおくことができませんでした。勉強机は日当たりのいい窓際に置くことにし父親が手作りで作ってくれました。引き出しつきの手作りの勉強机です。私の部屋のほかには両親の寝室とお茶の間台所がありました。私のお部屋以外は全部６畳のお部屋で台所はフローリングになっていました。後の部屋は全部畳でお茶の間には１畳くらいの小さなサンルームもついていました。洗面所は少し小さなものでしたが当時の私にはこれが当たり前のように思っていました。いつからか台所で歯を磨いたりするようになったのですが小さな頃は小さな洗面所がすごく気に入っていました。私が今まで生きてきて一番長く住んでいた場所です。今は念願の一軒家に住んでいますがきっと今住んでいるところが最後の引越し先になるのかなと思っています。アパート暮らしをしていたときよりは広々として過ごせているようにもかんじます。一軒家の方が広びろとしてすごせているのがきっともうアパート暮らしはできないかもしれないと思っていますがすごくいい思い出に残っている部分もあります。,1,,相模原の不動産もお任せ,http://www.ujh.co.jp/,1,0
,129,今の住まいとの出会いは,,fudousan,私は今とある賃貸アパートに住んでいます。築二重数年なので決してきれいとは言えませんし1Kの24平米と決して広くはありません。しかし私はこの物件を見つけた時すぐに下見をしてすぐに契約しました。ビビッときた理由がいくつかあったのです。まずは最寄り駅から徒歩4分で敷金礼金がいらない事でした。事前金が節約出来るというのはとてもありがたい事でかつ駅から近い物件を探していたのでこの条件は必須ではありませんがありがたい条件だったのです。しかも共益費駐車場込みで家賃が5万円だったというのも満足です。必須条件だったユニットバス以外の物件というのもクリアし何よりびびっと来たのは窓が二つもあったという事です。私が今まで見てきた1Kは窓はベランダに通じるところ1つのみというものがほとんどだったのに対しこの物件は二つあり日当たりも良好ですし風通しもとてもよかったのです。窓が二つというのも必須条件ではなかったのですがひとつより二つのほうがいいに決まっていると私の心を揺り動かした条件だったのです。それが私を後押しして私の住まいはここだと思わせてくれて契約に結びついたのです。実際住んでみて窓二つ開けてさらに換気扇を回すと予想通り風通しがよくとても気持ちが良いのです。住み始めて一年ちょっとになりますがとても満足しています。贅沢を言うと収納がもう少し欲しかったなとは思いますが。,1,,町田で一戸建てをお探しなら,http://www.ujh.co.jp/,1,0
,127,インターネットで家具選び,fudousan,,ベッドやシェルフといった組み立ての必要な家具をインターネットで買うことも増えてきました。車がない一人暮らしの学生やご高齢の方街から離れたところのお宅などインターネットで家具を購入できると助かることも多いです。今まで家具屋等で実際に目にして触れてから買っていた家具をパソコンやスマホの画面を通して買うことにはメリットがあります。実店舗へ出向く必要がないこと低価格であること複数の商品を同時に比べられることです。それに加え組み立ての簡易さもその流れを後押ししていると思います。搬入路の狭いマンションや力の弱い高齢者の住まいでも簡単に組み立てられる商品をよく見かけます。六角レンチやドライバー等組み立てに必要な工具も簡易的なものが添付されていたりもします。またエコ活動の推進によってネジが不要だったり軽くて強靭な新素材が使われていたり組み立ての作業自体もしやすくなっています。プロの配達員さんが自宅まで運んでくれるのもインターネット購入では当たり前ですがありがたいサービスだと思います。それでも個人での組み立てに不安がある人は専門業者に依頼できるサービスもあります。こだわりたい家具は実際にお店に足を運んで目で確かめて買うのも良いですしちょとした棚や台なら安さと手軽さ重視で買うのも良いです。それぞれ自分に合った購入方法と組み立て方法を選べるのは消費者にはありがたいです。,1,,町田の不動産会社はこちら,http://www.ujh.co.jp/,1,0
,128,我慢しないでトイレのリフォーム,home,,トイレのリフォームにかかる費用を知って驚きました。アラサーの私でも1回のボーナスの数分の1で出来てしまうのですね。実は実家のトイレがリフォームされたのですが父曰く「これまで長年旧式のトイレで我慢し続けていたのがアホみたいに思えてきた」ということで。まあそうでしょう。父は還暦間近ということもあって結構良い金額のお給料をもらっていますし。けれどもやっぱり「リフォーム」という言葉のイメージからでしょうか。トイレの入れ替えだけでも結構なお金がかかるというイメージがあるのです。私もまとまったお金が必要だと思っていましたし父や母もトイレだけでも少なくとも百万円はかかると思っていたそうです。けれども兄の新築に際して見積もりを見て便器単体での金額に驚き先にトイレのリフォームを決意したそうです。定年後に実家をリフォームする予定だったのでトイレもその時でいいやと思っていたのですがしかし便器の金額を知ってしまったからには今すぐにでも新式のトイレに取り替えたくなり先にトイレ空間のみリフォームしたそうです。ちなみに「定年後に実家をリフォーム」と言っても大改造するわけではなくもう少し小さいサイズへの設備の入れ替えと壁紙の貼り替え程度を検討していたそうで間取りはいじらない予定だそうです。ですからこそトイレのみ先にリフォームをしたのです。最後になりましたがトイレのリフォームは便器の入れ替えと壁紙と床材の貼り替えで十数万円程度だったそうです。,1,,相模原の不動産もお任せ,http://www.ujh.co.jp/,1,0
,103,リフォームして家がより便利になった話,,,家では何年か前にリフォームをしました。ちょうどわたしがイタリアへ留学している頃でわたしの部屋に家具などの大きな荷物を全部放り込んで作業をしたようです。黄ばんでいた壁紙も全面的に取り換えましたし水周りもきれいにリフォームしたのです。それで家はさらに便利になったように思います。まず台所ですがきれいな木目調のキッチンにしてビルトインの浄水器もつけました。二人分の一日のお皿を一度に洗えるような十分に大きいディッシュウォッシャーもつけました。この台所は毎日使うものですからやはり使い勝手にこだわりを持ったのです。ディッシュウォッシャーも毎日使っています。水周りでもうひとつ便利になったのは洗面所と浴室です。洗面所は大理石調の美しい台にしました。流しに向けて微妙に台が斜めになっており水を流しに追いやることが可能です。とてもきれいなので使った後はきちんとぞうきんで台を拭いてあげます。また浴室はカビないように壁や床の表面にザラザラの突起がついているモデルにしました。こうすると水はけがよくなるというのです。家は浴室に窓がないのが残念なのですがお風呂から出た後は水滴がこびりつかないようにぞうきんで拭きます。このようにいろいろなところをリフォームしました。新しいモデルやシステムにするということは本当に便利です。何十年も前に建てたような家ならば設備も古くなっていますがそれらが復活します。,1,,町田で一戸建てをお探しなら,http://www.ujh.co.jp/,1,0
,24,クレジットカードを持つメリット,,zeiri,おそらく最近は買い物の際にクレジットカードで支払いをするという方も多いと思います。それはどうしてかというと最近はクレジットカードがないと何かと不便だからです。特に私がそのように思うのは最近は買い物というのは生鮮食品や日用雑貨品以外は何でもインターネット通販を利用して買い物をするという方が多いというのがあります。それは私も同じで私もここ数年は買い物をしようと思った時は大抵インターネット通販を利用しています。ですからその際の決済手段としてクレジットカードを選択した方が商品が万が一届かないというトラブルが起きた場合でも対応できる事が多いというのもあって今ではクレジットカードなしでは買い物もできないという感じです。しかもそうやって頻繁にクレジットカードを使って買い物をした結果それまで全く気づかなかったある事に気づきました。それはクレジットカードを使って買い物をすると買い物金額に応じてポイントのキャッシュバックがあるという事でした。しかもそのポイントというのがクレジットカードによっては買い物の決済に使える物もあります。ですから実質お金を一部返金してもらっているようなものなので普通に現金で買い物をしたら損だと思うようになりました。なので今ではインターネット通販以外の実店舗での買い物でも私はクレジットカードを使って買い物をしようと思うようになりました。ですから最近はどこでも買い物をする際にはクレジットカード決済ができないか確認してから買い物しています。,1,,即日融資はこちらで,http://xn--nckgu1cyjxdw750al34a.co/,1,0
,25,ネット銀行に預金をする人の気持ち,,tanpo,今は大手金融機関の普通預金の金利が非常に低いのでネット銀行の定期預金にお金を預けて運用している人も多いと思います。しかしその比較的金利の良いネット銀行の一年定期の利回りでも各種税引き前の年利で0.5％よりも低いことがこの国の実情です。日本では長い間金利が安い状態が続いているので個人が金融機関にお金を預けてもほとんど金利がつきません。しかし仕方がないのである程度リスクをとって株式投資やＦＸを始めようと思っても思っても一度も投資をしたことがない人がいきなり投資を始めてうまくいくことは稀です。そのため投資初心者はどのような投資をすれば確実に金融資産が増えていくことが書かれた書籍を書店で血眼になって探すかもしれません。しかし出版されているこのような類の書籍の中には使い方によっては投資のヒントになるようなことが書かれた良書も数多く出版されています。このような書籍は投資初心者が書籍を参考にしながら試行錯誤を繰り返して自分の投資スタイルを確立するのには役に立つかもしれません。しかし金融資産を増やそうと思いそのような書籍を求める人は数学のように手順を一つ一つ踏めば誰もが確実に儲かる方法が書かれている書籍を探し出そうとします。しかしそのような夢のような書籍は現在のところ存在しないので結局は投資は危険なものと思い込み最後はほぼノーリスクで年利0.5％以下低金利のネット銀行に預金をしてしまうことになっているのが現状だと思います。,1,,即日融資はお任せ,http://xn--nckgu1cyjxdw750al34a.co/,1,0
,26,クレジットカードを上手く利用する,,credit,最近ではお金を支払う際に現金以外にもクレジットカードの支払いが多くなりました。しかしクレジットカードはとても便利なものですが利用の仕方を間違えるととても大変なことになります。例えば女性の多くの方に見られるのが初めてクレジットカードを持った時に預金口座がないのにも関わらずブランドものなどを買ってしまい最終的には引き落とし日にお金が足りなくなってしまいクレカ破産が起きてしまいます。そのためクレジットカードの利用には注意が必要です。まず大事なこととしていらない物は買わない事です。もし手もちの現金が足りなかった時に高価な物は買う事ができません。しかしカードがあるだけで買うという選択肢ができてしまいます。そのためしっかりとこのブランド品であったりの高価な物は本当に自分にとって必要なものなのかという確認をする必要があります。次に自分の中でしっかりとルールを作る事です。例えばカードを利用する時はインターネットショッピングの時だけであったり自分の預金口座以上のお金のものは買わないなどの自分にルールを作る事によりクレカ破産になることがありません。このようにして自分自信のルールを作るようにすることをお勧めします。クレジットカードはとても便利なもので今の生活には欠かせないものですが使わせるようなたくさんの誘惑があるためしっかりと自分で制御をしなくてはいけません。上手に利用するようにしましょう。,1,,即日融資を選べます,http://xn--nckgu1cyjxdw750al34a.co/,1,0
