Post.id,Post.blog_id,Post.title,Post.pagename,Post.menu,Post.content,Post.public,Keyword.id,Keyword.keyword,Keyword.url,Keyword.visible,Arbitrary.keyword
,147,出来るだけ気楽にやることが貯金ができるコツ,credit,,貯金しよう！と思えば思うほど上手くいかない気がします。やる気が空回りしてしまったり頑張りすぎるせいで結局挫折してしまったり思ったように貯金できないといった経験はないでしょうか。貯金はお金を貯めていくことではありますが収入という大きな枠がありその中でお金が減るということがなくなっていってこれまでよりお金が貯まれば達成するわけです。つまり貯金というより「節約」こそが肝であり支出を少しでも抑えることができれば自然と貯金が出来る流れにもっていくことができて毎日貯金が可能な環境への近道でしょう。目標をもつということは大事です。５０万円貯めたい。１００万円貯めたいと決めて目標に向けて節約をするというのも大事ですがもう一度目標内容を見直してみましょう。設定期間に無理がないでしょうか。金額に無理がないでしょうか。同じ収入であっても人によって支出は全然違います。例えばランチに毎日１０００円かける人がいれば５００円で済ませている人もいます。これだけで毎日５００円の差が生まれますから平日計算でも月々１万円ぐらい差が生まれます。年間では約１０万円。とこれを聞いた毎日１０００円ランチを食べている人が明日から５００円減らす努力をしようとしてしまうから無理があるのです。１００円でいいのです。いや５０円でも１０円でも安いランチに切り替えるだけで毎日の支出が変わるのです。そしてそういう変化を夕飯であったりおやつであったり趣味のものであったりとすべての支出に適用していけばきっと節約の総額が凄いことになることでしょう。極端な変化はストレスが溜まってしまったり挫折率が上がってしまったりと厳しいものです。少しずつ少しずつ緩やかにマイペースに貯金していきましょう。,1,,即日融資について,http://xn--nckgu1cyjxdw750al34a.co/,1,0
,133,お金の扱い方の得意不得意,money,,お金の使い方扱い方というのは人の数だけあるのではないかと思います。あればあるだけ使って貯金が全然ない人やとにかく稼ぐのがうまい人節約が上手な人などいろんなパターンがあると思います。私の場合はどちらかというと節約上手のタイプになると思いますがお金を稼ぐという面ではどうも才能がないかもしれません。節約は自分でもうまいと思うのでクレジットカードなどもうまく使いこなせて特典やサービスをうまく利用しています。貯金も収入の割にはかなりの率でできていると思いますがどうも収入が少なすぎてそれほど貯まっていないという現状があります。おそらく通常の人なら貯金などとてもできない金額でやりくりができていると思うので今考え直すのはやはりお金を稼ぎ収入を増やすというところにポイントを置いたほうがいいと思っています。今の本業の収入を増やすというのは一番早い方法ですが実はそれが一番難しいような気がします。少しずつ副業としての取り組みもしていますが小遣い程度の金額なのでこれをもう少し増やして第二の収入源として確保できればと思っています。そして投資や起業についてもできれば取り組みたいともいます。片手間にはなかなかできるものではないですが何とかできないか方法を考えているところです。しかしなかなか投資や企業についても確実な方法のものはなくやはり試行錯誤しながら勉強して自分なりのものを確立していくしかないのかもしれません。,1,,即日融資はこちらで,http://xn--nckgu1cyjxdw750al34a.co/,1,0
,190,結婚をしてからの家庭の貯金,,,結婚をして子供が生まれるとこれからたくさんのお金がかかるので独身時代と違い毎月貯金をする人が増えてきます。独身時代はもらった給料を飲み会に使ったり美味しいものを食べに行ったりします。そして休みの日には恋人とデートをしたりデートのための流行りの服を購入します。しかし結婚をするとお小遣いにかわり毎月決まった額しか使うことができません。そして週に何回も外食をしていたが週に一回以下にしてそれ以外はスーパーで安いものを購入し作って食べるようにします。子供が生まれると子供を連れておしゃれなお店やタバコの煙がある居酒屋などにはいけなくなります。外食といえば休みの日の昼食にファミリーレストランやショッピングセンターのフードコートなどが多くなります。そのような節約生活をすれば毎月きちんとした額を貯金することが出来ます。特に女性よりも男性の方が給料を使い切っていた人の方が多いです。そのため結婚をすると男性よりも女性の方が家庭のお金を管理している人が多いです。最近は夫婦共働きの家が多いですが女性が食事の買い物をしたりすることが多いので女性がお金を管理した方が便利です。しかし毎月最低限のケチな生活をしていると楽しくないのでたまには高いお肉を購入したり好きな洋服を買ったり友達と飲み会に行ったりした方がいいです。そして年に何回かは子供を連れて泊りがけで旅行に行ったりした方がまた頑張って働こうという気分になれます。,1,,即日融資はお任せ,http://xn--nckgu1cyjxdw750al34a.co/,1,0
,191,40才からは介護保険料を支払います。,,,40才からは介護保険料を支払います。これは各自治体で違いますから全国一律の値段じゃないです。国民健康保険量の中に合算して一緒に徴収されます。私は今のところは毎月６０００円強くらいです。会社に勤めているときには会社が半分持ってくれても健康保険料だけでもっと多い９８００円ひかれていましたけど…そこに加えて介護保険料がのしかかってくるわけです。駆け出しの頃は４０００円引かれる事になっていたから毎月別に４０００円ひかれていました。でも今はどこでどう変わったのか負担額がどんどん減りずいぶん楽になりました。国民健康保険料は全額支払いだけどこっちの方がずいぶん安いです。しかし全然病気にならない人が毎月毎月それを支払うのは結構大きいしバカバカしいですよ。とにかく蓄えといてほしいですよ。国には…何のために健康でいるのかわかりませんからね。人のためばっかりに働いているわけじゃないので…年金も一応みんな貯めていますがそれをあってもあてにばっかりしないで死ぬまで働くんだ！と思っていればかなり違いますよ。もらう時期が来たらそれはこちらから言わないと支払われないですよ。黙って待ってたらああいうのは支払われないですからね。国はもう勝手に行方不明になって死亡する認知症患者も含め死亡届も出さない転居届けも出さないそういう人がいっぱいいるからきれいに事務処理されてなくて向こうからの申請の受付分だけ年金支払いに応じることになってるんでしょう。だから待ってる分は損をしますからね。,1,,即日融資を選べます,http://xn--nckgu1cyjxdw750al34a.co/,1,0
,192,クレジットカードを利用することが節約になります。,,,やってみた人はわかると思いますが節約をすることは簡単そうでなかなか難しいものです。特に節約をする場合にはやり始めて最初のころはモチベーションもありますから成果が上がるのですが長い間続けようとするといわゆる節約疲れのような状態になることがよくあります。そのなると節約のペースがゆっくりとなりだんだん元の黙阿弥になってしまうということも稀ではありません。節約を長続きさせるには頑張りすぎないということが重要でそれを最も簡単に実行する方法はあまり意識せずに節約をしているという状態にすることです。それについて効果的な方法はクレジットカードを利用することです。クレジットカードを使えば一括払いを選択すればポイント還元という形で節約ができます。特に意識しないでいつもの買い物にクレジットカードで支払いをすれば知らないうちにポイントがたまっていきます。クレジットカードで節約を具体的な方法は二つです。一つ目はなるべくポイント還元率の高いクレジットカードを作るということです。その際には年会費やよく利用する店舗などを考えて効率が良いようにクレジットカードを選ぶことが大切です。ポイント還元率の良いクレジットカードを持てばあとはいかに使っていくかということだけになります。二つ目はなるべくクレジットカードを使うということです。余計なものを購入するということではなくいつもの買い物にクレジットカードで購入するということです。幸いにクレジットカードで決済可能な店舗やサービスは増える一方といえるのですから。,1,,即日融資について,http://xn--nckgu1cyjxdw750al34a.co/,1,0
,119,貯金をするには少しずつが大事です,,,クレジットカードや投資はたまた貯金など様々な方法でお金の使い方はありますね私も日頃から貯金なんてことをしているのですがこれはも昔からやっていることです。残念ながら数年貯まった貯金も必要になり空けてしまいましたがそのときに貯まっていた金額は50万ほどありました。かれこれ3年ほど毎日5百円貯金をやっておりましたがもちろん時には出来ないときもありましたがよくここまで貯めれてもんだと関心さえしてしまいました。それからまた貯金をしているのですがまず貯金と言っても中々出来ることではありませんよねしかも毎日5百円貯金となると月に1万5千円にもなるのですからそれを考えると生活がギリギリの方には到底出来たことではありません。幸い私は残せるお金があるからそういった行動が出来てしまうのですがまず無駄なことを省くことが大事できっと多めに持っているであろうお金を私の場合は貯金箱に入れてしまいます。どうしても必要なときはやりませんが今日はこれを買おうと思ったものを今一つ見定めて本当に必要なのかを考えます。せこいと思われるかもしれませんがそれが貯金への繋がりになり塵も積もればとなるんです。他にも貯金で必要不可欠な行動派定番として光熱費をどれだけ抑えられるかなどがあります。また年齢によって収入の差もあるので貯金の金額や回数なども決まってくると思いますが少しずつの行動が貯金にはとても大事なことなんだと思います。,1,,即日融資はこちらで,http://xn--nckgu1cyjxdw750al34a.co/,1,0
,120,自分に対する投資,,,やはり貯金はいつも十分であってほしいと思うものです。お金が無くなったら大変。将来のための安心が欲しい。僕も通帳にたまった金額を見て安心するタイプの人間でした。ただしお金は何のためにあるのでしょう。それは自分が幸せになるためにあるものです。自分に十分に投資しましょう。自分の服装にお金をかけましょう。高い靴を選んでみましょう。素敵なデザインの眼鏡を買いましょう。高い美容室に行ってみましょう。海外旅行に行きましょう。楽しい映画を見ましょう。とびきり高い夕食を食べましょう。素敵なパートナーのためにプレゼントを買いましょう。友人にご馳走してみましょう。自分自身を満足させるために十分にお金を使いましょう。またこんな使い方もオツなものです。人気の少ない神社におさい銭をしてみましょう。コンビニの募金箱にお金を入れてみましょう。お金を使えば自分や周りの人たちが幸せになるだけでなくお金を利用された側もとても助かります。自分がお金を使って魅力的になった分自分に色々なものがきっと帰ってきます。それは例えば仕事だったり周りの人の好意だったりお金だったりします。使うお金の量や誰にもしくは何にお金を使うかは他人と比較せずに自分の満足度を大切にしましょう。試行錯誤の上自分の満足度を積み重ね上げていくのです。そこまで行くとお金に振り回される人生ではなく自分がお金を自由に利用できる人生になるのです。,1,,即日融資はお任せ,http://xn--nckgu1cyjxdw750al34a.co/,1,0
,161,洋服を購入する時は自分が気にいったものを選ぶ事が大切,,,ファッションの1つとして多くの方が洋服を購入して自分をコーディネートしていきます。そこで洋服を購入する時には一生懸命ファッション雑誌を見て流行の洋服を取り入れていったり友達や店員などに聞いて自分が似合う服を選んでもらったりしている人も多くいます。しかし一番大切なのは流行や他の人の意見よりも自分の意見を重要視するという事です。ファッションは自己満足が大切になってきます。仮に流行のファッションを取り入れたり他の人の意見を聞いて似合っていても自分が決めていないとなんだか満足感からすると少し物足りなさがでてくる場合もあります。別にファッションショーにでるわけではないです。普段着る洋服選びは自己満足がある程度必要になってきます。自分で気にいった洋服を選び満足する事が一番大切です。他の人から見て似合っているか似合っていないかというよりも自分自身で今自分が着ている洋服を気にいっているのか気にいっていないのかが重要になってくるというわけです。たしかに他の人の意見を聞いたりファッションについて勉強をしていくのも1つの参考としては重要になってきます。ただ最終的には自分自身が似合うと思うファッションをしていきます。すべて他の人が決めた洋服ですと自分自身が決めたわけではないですので違和感がでるのです。普段のファッションというのは自分らしさをだすというのが大切ですしそれが楽しさでもあります。,1,,仙台のキャバクラドレス,http://xn--ncke2h5c6a5349avph.jp/,1,0
,182,主婦の強い味方おしゃれなトレンカ,,,いまやレギンスと合わせてすっかり定番のアイテムになったトレンカ。特に小さい子供のいる主婦のあいだではすぐに裸足になれるのでお掃除のときやちょっとした水遊びをさせたいというときに便利という声も多く幼稚園や小学校のお子さんをもつお母さんでトレンカを履いている人も多いのではないでしょうか。さてトレンカといえば以前は黒一色と見ようによってはちょっと野球部の人が履くようなものに見えなくもなかったのですがいまやトレンカは豊富なカラーバリエーションに加え機能性も上がってきています。ブルー系にピンク系にグリーン系と淡い色からビビットな色までかわいいトレンカがいっぱい。カラーパンツとコーディネートすれば地味に終わりがちな普段着のアクセントにもなります。またデニムのような見た目やかわいい柄の入ったトレンカも増えそれだけでおしゃれなボトムスにもなります。さらに汗をかくと涼しく感じられる機能を持った夏の暑い時にも履きやすい涼感トレンカや適度な圧力を脚にかけてむくみを防止してくれる着圧トレンカもあります。UV加工で日焼け止めの機能もついていたりお洗濯しても乾きやすいものなどピッチリとしたものを履きたくない夏にも履きやすくて便利なトレンカがいっぱいあります。秋〜冬はあたたかくてムレにくいタイツのようなトレンカも多く出ています。いまはトレンカと合わせてコーディネートできるソックスも売っているのでかわいくて種類が豊富なトレンカと合わせて足元もどんどんかわいくできます。まだトレンカ買ったことないという人はぜひ一本お試しに買ってみてはどうでしょうか。,1,,仙台のキャバクラファッション,http://xn--ncke2h5c6a5349avph.jp/,1,0
,18,黒色の服は便利ですが夏は明るい色の服が活躍します。,,live,服の中で誰でも1枚は黒色の服を持っているのではないでしょうか。黒色の服はちょっと重い感じがしますが多くの人に受け入れられやすい色だと思います。私も黒色の服をたくさん持っています。黒い色の服で全身を固めるファッションが私の若いころに流行ったなごりと色白の私に黒色の服は意外と似合うのでつい購入する頻度が上がるのです。それに黒色の服装は意外と役に立つことが多くてまず汚れても目立たないということが挙げられます。小さな子供にまだ手がかかる今の私には黒い服が役立ちます。服に付いた汚れが目立たないということは少しくらい汚れたって洗濯をしてキレイに汚れが落ちなくてもまた次も着られるということです。白い服ではこんなことはできません。シミが付いた白い服はもう着られませんから（私の場合です）それを思えば黒い服は気軽に着られて便利です。また黒色のファッションは夏場には少々重く見えますが秋や冬になるとかっこよく決まります。夏場にはパステル系の軽く涼しげに見えるカラーのファッションが映えますがちょっと秋の気配がするようになるとこげ茶色や黒色の服が毎年大活躍します。その季節によって素敵に見える服の色が違うことを覚えておくと楽です。夏に女性服売り場に行けば夏物の服の多くが白っぽいことでおのずと購入する服も明るい感じの色になりますがそれが正解だと思います。汚れが気になるときにはジーパンなど下を汚れが目立ちにくい服にすれば大丈夫です。,1,,仙台のキャバクラはここから,http://xn--ncke2h5c6a5349avph.jp/,1,0
,17,周りから見ても似合っていると思われるためにはファッションセンスをみがく事,,cosmetic,一般の人の中にも常に似合っている洋服を着ている人もいればあまり似合っていない洋服を着ている人もいます。その1つの原因になっているのがファションセンスの違いです。ただどちらも自分では着ている服が似合っていると思っていますので普段のファッションでは問題ないです。しかし自分だけが満足するのではなくて周りから見ても似合っていると思われるためにはファッションセンスをみがく事が必要になってきます。ファッションセンスは元からの素質もありますけどファッションセンスを自分で勉強する事によってある程度はみがく事ができます。そこでまずはファッション雑誌などを見て流行のファッションを常に把握したりインターネットなどでどのようなファッションにすれば似合うのかという知識を身につけていきます。また周りからファッションセンスが良いと言われている人の話を聞いたりするのも1つの知識を高めるためには必要になります。このようにファッションの知識を身につける事が自分のファッションセンスをみがくためには大事になってきます。さまざまな知識をうまく取り入れながら自分の中でアイデアを出していくと次第にファッションセンスが良くなってきます。またファッションについて強い興味を持つ事も大事になってきます。興味を持つ事によって洋服が好きになりファッションについても積極的に自分の中に取り入れようとしますのでセンスがみがかれます。,1,,仙台キャバクラの人気,http://xn--ncke2h5c6a5349avph.jp/,1,0
,16,自分の個性を出すためのファッション,,collect,私はファッションはその人の個性を表すものだと思っています。どんなにかわいいと言われている服でも人と同じものだったら個性とは言えませんし重ね着をしたとしても自分らしさが出せなければ地味な存在になってしまいます。自分らしい服装を心がけてこそファッションの楽しみは生まれると思っています。私自身はファッションに自信がありません。どんな服を着ても自分に似合わないと思ってしまうしかわいい服なども普段は積極的に着ようとは思わずどちらかというとクール系カジュアル系の服を好んで着ます。周囲の人からはその方が似合っていると思われていると自分で感じているから自然とそうなってしまうのでしょう。私としては本当はかわいい服も着てみたいしもっと女性らしいきれいめのファッションにも挑戦したいと思っています。でもそれは自信が持てずどういった着こなしをしたらいいのかわからないということもありなかなか手を出せません。どんなに男性っぽくなろうが私はカジュアルな服装をしたいと思っています。その方が自分の個性を出せると思っているのです。自分らしさは性格だけでなく絶対にファッションにも出ます。たまには女性らしい格好をしたいと思っている私ですがやはりそれは自分らしさというのを失ってしまうのだとなんとなく自分の中で感じてしまいます。本当の自分をさらけ出せる格好はやはりカジュアル系なのだと私は今まで生きてきて感じました。私の個性はカジュアル系を着てこそ出せるものなのです。,1,,仙台のキャバクラドレス,http://xn--ncke2h5c6a5349avph.jp/,1,0
