Post.id,Post.genre_id,Post.title,Post.pagename,Post.menu,Post.content,Post.public,Keyword.id,Keyword.keyword,Keyword.url,Keyword.visible,Arbitrary.keyword
,32,資格取得のために必要な問題集はかき集めたほうが良い,,office,資格取得のための勉強をしているとき自分がどれくらい知識を増やせているのかはとても気になります。いくら毎日一生懸命勉強していたとしても勉強した知識がしっかり身についているかどうかは案外自分ではよくわからないものです。ではどうしたら習熟度を確認できるのでしょうか？それはこまめに自分自身をテストすることでだいたいの習熟度を確認できます。ですから自分の習熟度を知るために問題集はどんなものでもたくさんあるに越したことはありません。それはたとえ古い問題集であってもきちんと正しい答えの書かれている問題集ならば活用できるということです。そんな資格取得のために必要な問題集はブックオフなどの古書店で安く取り扱っている場合がありますしかき集めればいくらでも手に入ります。そして手に入れた問題集を日々少しずつこなしていけば自分がしっかりと理解している部分と理解していない部分をはっきりと浮き彫りにすることができ理解していない部分を重点的に勉強していけば習熟度をどんどん高めていくことができます。資格取得のための勉強はただ単に知識を詰め込めば良いというわけではありません。詰め込んだ知識がしっかりと身についているのかを短いスパンで自分をテストしていかないと覚えた気になっていたのに実際の試験では思い出せないということになってしまいます。ですので勉強を着実に力とするためには日々問題集に取り組むことがとても大事です。,1,,滋賀のアルバイトはこちら,http://2010-shiga-kyujin.com/,1,0
,12,陶芸教室を開くために日々の勉強中です。,,poster,私は２年前から陶芸学校の専門コースに通っています。 きっかけは７年前に自宅近くにある陶芸教室の１日体験に参加してマグカップを作成し物作りの楽しさに目覚めたからです。 当初は土をうまく操ることが出来ず思い通りの形にならなかったり焼き上がりや絵付けが想像と違っていたりなども多々ありましたが次第に手の使い方に慣れてくると形やデザインを自分で考える創造力も生まれて楽しくなり将来は自分の陶芸教室を開きたいと思えるようにもなり本格的に学校に通って基礎から勉強を始めました。 現在は備前焼や伊万里焼などを習いながら今まで独学で行っていたやり方を見直したり人に教える時の教え方などを勉強しています。土をいじりながら何を作ろうか創造力を働かせるのはストレス解消にもなりますしろくろを操る時は一瞬の気の緩みや気持ちが落ち着かない時は形が決まらず失敗することもあるので常に無心で集中しながら行うことでリラックスできます。 自分で作った食器類を使って料理を盛り付けると普段の料理が更に美味しく見えるので次の作品への創作意欲が上がり今では我が家には色々な焼き方の手作りの食器やグラスがたくさんあります。 時には卒業生の展作品覧会などに出掛けて次に作る作品の参考にしたりなどもしますが今では会社で退職する上司や同僚に食器や花瓶などをプレゼントすると大変喜ばれます。 陶芸は作る楽しさ使う楽しさプレゼントして喜ばれる楽しさなど色々な楽しさがあり幾つになっても長く続けられる習い事だと思います。 ,1,,滋賀でアルバイトをお探しなら,http://2010-shiga-kyujin.com/,1,0
,12,そろばんを習っていました,,money,わたしが子供の頃唯一習い事をしたのはそろばんでした。きっかけは姉が習っていた事もともと算数が得意だった事です。習いだしたのは小学校２年生の時で教室は大きな家の一室で先生はおじいさんでした。最初はそろばんの扱いに苦労しましたが慣れてくるとなかなか思いしろく計算にも強くなっているのが解りました。半年に一度昇進試験があるのですが順調に８級７級とステップアップしました。そろばんを習い始めて３年ほど経ったころ先生から市のそろばん大会に出てみないかと打診がありました。大会は日曜日に行われるため休みがつぶれるのが嫌でしたが自分がどれくらい出来るのか試してみたい気持ちもありそろばん大会に出てみました。場所は市役所の一室で行われ参加者が５０人くらいだったと思います。みんな頭のよさそうな子が多く自分がひどく場違いだったことを覚えています。いざ始まるとシーンと静かな部屋にぱちぱちとそろばんをはじく音が聞こえてきました。わたしも何とか集中して一生懸命問題を解いていきました。結果は午後に発表されるとの事で家が近所だったこともあり一度帰宅してから両親と発表を聞きに行きました。結果はなんと２位でした。（優勝準優勝１位がいたので実質は４位です。）市の大会で２位という好成績を残せたことで両親はとても喜んでくれました。（その日の夜は外食に連れて行ってくれました。）そろばんは小学校卒業を機にやめてしましましが今でも暗算や計算が得意なのはそろばんのおかげだと思っています。,1,,滋賀のアルバイトはこちら,http://2010-shiga-kyujin.com/,1,0
,12,社会人の資格の勉強は環境づくりから,,biz,社会人ともなると勉強時間をいかに確保するかが問題となります。休日にまとめて勉強しようなどと考えてもいざ休日になるとぐだぐだと過ごして一日が終わるなんて人も多いのではないでしょうか。そんな方にお勧めしたいのが早朝出勤勉強です。始業２時間前には出社し勉強する。これを毎日続ける。早朝出勤のメリットはなんといっても朝一番のさえているときに勉強できることです。仕事が終わってから勉強すると予定を立てても一日仕事すればくたくたになるのは誰も同じです。ほとんどの人が仕事が終わってから勉強するのは難しいのではないでしょうか。早朝勉強ならスッキリとした疲れていない頭で勉強することができるので勉強の効率が上がります。デメリットとしては朝の早起きがつらいこと。でも資格をとりたいのであればそれくらいの我慢は仕方のないこと。早起きが苦手な方でも１カ月も続ければ慣れてきて次第にラクになってくると思います。早起きのつらさよりも朝の時間を有意義に使えていることに充実感を感じてくるようになるかもしれません。デメリットとしては早朝に会社で勉強している場合電話が鳴って勉強が中断されることです。私の場合電話がなってもひたすら無視しています。それとたまに早く出社する人がいて勉強できなくなってしまうことです。そんな環境の場合は自宅で勉強するか会社近くのカフェで勉強するのがよいかもしれません。習慣化するまでは大変ですが一度習慣化してしまえば楽になってしまいますので是非一度お試しください。,1,,滋賀でアルバイトをお探しなら,http://2010-shiga-kyujin.com/,1,0
,12,『下手でいい、下手がいい』絵手紙教室の魅力,,,近所にカルチャースクールができたので以前から興味があった絵手紙を習い始めました。もともと絵を描くのは好きなので簡単にできるものだと思っていたのですが意外や意外かなり奥が深いものでした。簡単に言うと絵手紙とはまず墨で絵の輪郭を書いて顔彩という絵の具で塗りそこに言葉を書いたものです。まずはお道具を揃えなければなりません。子供が使った習字セットを持って行った私は初日にとんでもない間違いに気付きました。先生が見せてくださったお道具は墨は青墨絵の具は顔彩パレットは陶器の梅皿ハガキは画仙紙とそれぞれ絵手紙の趣きを演出するそれ専用のものなのです。筆も顔彩を塗るには穂先が短めのものを使用します。一通りのお道具を購入すると１万円以上ですが一度用意すればずっと使えるのですから初期費用だけで気軽にできる習い事だと思います。最初のうちは筆で半紙に線を描く練習をしますがこれがかなり難しくなかなか真っ直ぐ線が描けません。それもそのはず筆の持ち方が普通じゃないです。上部をつまんでゆっくり動かします。墨をたっぷりつけているので線は太くなったり細くなったり途切れたり滲んだり。でもそのにじみがステキな絵手紙の魅力となり相手に伝わるのだそうです。１つの絵手紙を完成させるのに時間はかかりますが『下手でいい下手がいい』という言葉に励まされて毎回楽しくレッスンしています。描く前に誰に送るか決めてから描く絵手紙です。絵手紙仲間との品評会も楽しく良い習い事を始めたと満足しています。,1,,滋賀のアルバイトはこちら,http://2010-shiga-kyujin.com/,1,0
,12,茶道教室での交流,,,以前茶道教室に通った事があります。始めてみようと思ったきっかけは折角日本人に生まれたのだし日本特有の文化を体験してみたいという動機です。この教室には韓国人の女性も来ていて日本文化に尽いての話も色々出来たので印象に残っています。茶道は表千家と裏千家が有名ですが他にもあるらしいです。私は表千家を学ぶ事になりました。暫くして祖母が「貴女表千家習ってたの？私はてっきり裏千家だと思っていましたよ。」と自身が娘時代に裏千家を習った時の事を話してくれました。裏千家は表千家と比べて大雑把なのだとか。「表千家は細かい筈よ。」と私に先輩の立場として表千家は大変であるという様な事を言ったのですが私自身は全く難しいとは思いませんでした。何故なら教室の生徒さん達が皆マイペースな人達が多く私語も多かった事が理由であると思います。自分の番が回って来るまで他の生徒さんと雑談をしていました。私はその韓国人女性と日本語で会話していたのですが韓国では正座する習慣が一般的ではないそうです。ですので皆正座している中足を崩して片足を立てている状態でした。よく韓国ドラマ等でチョゴリの民族衣装を着た女性が床に座っているポーズと同じです。お菓子がいつも和菓子だったのでその食べ方等も学びました。まるでマナー教室みたいなものですね。懐紙という薄い紙で和菓子を取ったり其の懐紙にも模様付きと無地の物があったりして選ぶのが好きでした。またいつか始めたいです。,1,,滋賀でアルバイトをお探しなら,http://2010-shiga-kyujin.com/,1,0
,32,通信制の大学で勉強しようか迷っています,office,,最近子どもが少なくなって来たからか通信制の大学増えましたよね。私学なんかは通信もやっていますってとこ多くなってきたような感じがします。その代わり二部制が少なくなって夜間は無しみたいな感じですね。それで私も通信制の大学で勉強しようかなって迷っています。市民講座とか講習とかでも学べるけど大学の方が勉強密度は高いしトータルで学べるから沢山勉強できそうで最終的には講座に参加するより大学で学んだ方が安いんじゃないかなって。でも通信はやっぱり卒業が大変みたいですね。基本的に社会人向けのものだから求めるもののレベルが高いみたいなんです。高校卒業したばっかりの子は多少文章おかしかったりレポート書けなくても出席さえすれば許されるらしいけど通信ではそれは許されないみたいで。結構厳しいみたいなのに通信制ってバカにされることも多いみたいですよね。でも社会人にとっては学歴とかはもうあまり関係ないから気にする事はないかな。ちゃんと卒業できたら逆にプラスになりそうではあります勉強以外の面でも。卒業率を数字で表すと半分とかそれ以下とかそういうこともザラみたいで。かなり厳しいんでしょうね仕事と勉強の両立は。ただね通信制だと学費がとっても安いし休学料もとっても安いから長い目で見れば卒業できるんじゃないかなーって思いますよ。生涯学習講座じゃないけど生涯勉強！ってことで願書出してみようかなー。幸い私は時間が融通効くお仕事だからなんとなく出来そうかなとも思います。そういえば政府も主婦の再勉強を支援していくみたいですね今後。やっぱり何歳になっても勉強できる環境がこの国にあったら凄い幸せなことだと思いますね。そんな感じで今度説明会に行ってみたいと思います。,1,,滋賀のアルバイトはこちら,http://2010-shiga-kyujin.com/,1,0
,32,英会話教室の思い出,job,,私は以前英会話を習っていました。だいぶ前に辞めたのですが今でもその英会話スクールの前を通ると当時のことを思い出します。習い始めのころ同い年の子たちとグループレッスンをしていたのですが私以外の子たちはみんな私立で学校の授業で普通に英語を習っていました。私は公立の学校だったので英語の授業はありませんでした。時間が経つに連れ理解力に差が出てきました。英語に触れるのは私は週に一回他の子たちは週に四回でした。差が出ないほうが不思議です。私はいつからか「バカだ」とからかわれるようになりました。それが嫌で辞めたくて仕方なかったのですが先生と相談した結果個人でレッスンを受けるようになりました。それからは楽しく学ぶことができました。分からないことがあっても気軽に聞けるし私の理解力に合わせて教えてくれるので無駄に焦ることもありませんでした。こんなことならもっと早くから個人レッスンにしてほしかったなと思ってしまいます。自分に合わせて学んでいったせいか私はグングン成長していきました。中学に入ってからは英語の授業は予習しなくても余裕で分かるくらいになりました。もちろんちゃんと予習しましたが。ですがかなりの部分が分かっているので短時間で済みました。嫌な事もたくさんあったけれど振り返ってみると楽しかったことのほうが多かった気がします。英語は未だに大好きな教科ですしこれからは小説も原語のまま読めるように頑張りたいです。,1,,滋賀でアルバイトをお探しなら,http://2010-shiga-kyujin.com/,1,0
,22,初めての京都旅行,,traveler,先月初めて京都へひとり旅に行きました。実は京都へ行くのは初めての経験で古い街並みなどを散策するのが好きなので以前からずっと行きたいと思っていました。今回は1泊2日の旅でしたが見てまわれなかったところもたくさんあるのでまた冬頃に行けたらいいなと思っています。京都には高速バスを使用していきました。高速バスは費用が安く抑えられるのでよく利用するのですが電車での旅も好きです。次回は電車もいいなと考えています。京都についたのはお昼を過ぎたころでした。取りあえずカフェで軽くお昼を済ませてどこへ行こうか考えていました。世界遺産は観たいと思っていたので近くの寺院からまわることにしました。バスに乗って西本願寺や東本願寺に行きました。その後は二条城へ行こうと思っていたのですがあいにく休みで散策することができませんでした。仕方がないので清水寺に行くことにしました。清水寺に行くまで民芸屋さんや和雑貨屋さんなどがあり古い街並みが連なっていました。風情ある街並みを歩いているだけでわくわく楽しい気分になります。清水寺ではお守りを買って帰りました。次の日は平安神宮や美術館南禅寺などを散策しました。金閣寺や銀閣寺なども見てまわりたかったのですが時間がなくて今回は断念しました。友達や家族のお土産選びなども旅の醍醐味です。友達にはあぶらとり紙家族には京都の漬物にしました。京都はとにかく外人さんを多く見かけて地元とは大違いでした。さすが古都であり歴史ある都市です。また落ち着いた時に行こうと思います。,1,,ハワイでの結婚式はこちら,http://www.hawaiianbridal.com/,1,0
,22,旅は心の成長の時間,,ryokana ,旅行ーそれは毎日の慌ただしさから解放される時間です。日ごろの悩みや大変なことから少しだけ逃げて自分の心にお休みをあげることはとても大切です。私も旅に出る度に色んな事を考えさせられます。私のした旅の中で印象が深いのはニュージーランドへの４週間の旅行です。海外に旅行するのは初めてで何もかも新鮮でした。スーパーに行っても日本の数倍もあるカートや品物何もかもが大きく見えて自分が小さな存在に思えました。外国人として暮らすという事の苦労も少しですが感じる事がありました。日本では自分の住民票とか戸籍などがきちんとあって日本国民として守られています。でも一歩外国に行くとパスポート意外自分の身分を証明できる事はないので何か問題が発生した時にはとても不利です。自分の国内での状況がいかに恵まれているかが分かり感謝が深まりました。ニュージーランドでのステイも終わりにさしかかっているという時に知り合いの車が突っ込んできた他の車から激突されてぺしゃんこになったのも見ました。私と知り合いが買い物するために駐車場に駐車している数十分の間の出来事でした。買い物から帰ってきたらなんと車の上に事故車両が乗っかっていたのです。もし車に残っていたら命を落としていたことでしょう。命は本当に履かなくいつなくなるか分からないのだと思いました。命を大切に生きていこうと決意して日本に帰国しました。毎回の旅行でちょっとだけ成長出来る気がします。また計画したいです。,1,,ハワイの挙式のことなら,http://www.hawaiianbridal.com/,1,0
,22,海外旅行へ行ったときは警戒心を怠らない,,buildinga,海外旅行へ行ったときは気をつけなければならないことがたくさんあります。まずなるべく治安の良い国に行くのは当然のことですが例え治安が良いとされている国でも日本のように安心して行動できると思い込んでいてはとても危険です。例えば私の友人がヨーロッパへ旅行へ行ったとき見知らぬ男性の若者から人形のような物を渡されそうになったそうです。その身振り手振りはどうやらプレゼントするという意味だったためその友人は人形をもらいかけましたが何となく嫌な予感がして断りました。するとその光景を観ていた現地に住む日本人の人がやってきてそれは人形を最初は無料で渡し後からお金を請求する詐欺みたいなものだから絶対にプレゼントをもらってはいけないと忠告されたそうです。日本では見知らぬ人からいきなりプレゼントされることなどほぼなくまったく予想できないことですからそのとき第六感によってプレゼントをもらわなかった友人は正しい行動をとったということになります。またぶつかった瞬間にバッグや財布を盗もうとするスリだったりタクシーの運転手が日本人と見るなり法外なお金をふっかけてきたりなど海外では日本であまり起こらないような犯罪にいつの間にか巻き込まれてしまうことがあります。ですので海外へ旅行に行ったときはそういった悪質な犯罪に巻き込まれてしまわないよう十分過ぎるくらい警戒して行動することがとても大事です。,1,,ハワイの結婚式はお任せ,http://www.hawaiianbridal.com/,1,0
,7,日本は男女平等の国,,bridal,女性です。海外でびっくりしたことはいろいろありますが意外だった出来事を紹介します。ロシアに行ったときのことです。ロシアでサッカーといえば昨シーズンまで本田選手がチェスカモスクワに所属していてロシアリーグが身近な存在でしたが他のヨーロッパの国同様にロシアでも一番人気のあるスポーツはサッカーです。そこでサッカーのロシア国内リーグを見に行くことにしました。モスクワ市内にあるディナモモスクワという本田選手のチェスカと並ぶ古豪の本拠地で観戦しました。同じツアーで一緒になった男性と訪れたのですがスタジアムに入ってびっくり。女性サポーターが一人もいないんです。まあ平日の昼間で観客も少なかったのですがそれにしても女性が私だけとは！なんか居づらい思いをして観戦しました。ホテルに戻ってガイドのロシア人女性にロシアではサッカーは人気スポーツではないのかと尋ねるとサッカーはロシアで一番人気のスポーツ。でもあれは男が見るものよとの返事。日本では女性のサポーターも普通にいるし欧米は男女平等みたいな印象があったので意外でした。日本は本当は男女の区別をそんなにしない国なのではないかと感じました。今は聞きませんが昔は男女混浴とかあったようですし明治の外国人の日記には混浴なんて考えられない！でも混浴風呂で裸の日本女性に「オハヨー」とふつうに声かけられて考えが変わったという記述が残っているようですし。日本は「和」の国なんですね。,1,,ハワイでの結婚式はこちら,http://www.hawaiianbridal.com/,1,0
