Post.id,Post.genre_id,Post.title,Post.pagename,Post.menu,Post.content,Post.public,Keyword.id,Keyword.keyword,Keyword.url,Keyword.visible,Arbitrary.keyword
,24,ファッション用のカラコン,,collect,非視力補正用色つきカラーコンタクトレンズ(ファッション用カラーコンタクトレンズ)は視力の矯正などを目的とするものではなくファッションのために虹彩部分の外観上の色を変化させることを目当てにしたコンタクトレンズである。ほかの視力矯正用のコンタクトレンズも完璧に透明なものはあまりなく取扱いの際にコンタクトレンズ自体を見えやすくするために薄く色づけされたものが多い。その場合添付文書の品名表示には「色つきソフトコンタクトレンズ」などとなっているがこれらは取扱いのための色づけであって目の色を変えるためのものではないのでたいていはカラーコンタクトレンズとして含まれない。カラーコンタクトレンズという場合にはケアのために色づけされたレンズは含まず外見上の色を変えることを目的としたものに濃く色づけされたレンズを示す。「カラコン」等と日本では一般的に略される。カラーコンタクトレンズはファッショ目的であるので以前日本では医療機器には該当しなかった。,1,,デカ目カラコンならこちら,http://www.girlscolor.com/shop/list.php?ca_id=g0,1,0
,24,コンタクトの正しい使い方,,,コンタクトの正しい扱い方について。コンタクトレンズは角膜に直接触れて装着することから眼鏡よりもよく見える。しかし角膜に接触することでレンズに汚れがついてしまうのでケアが必要である。ケアをするのは少々手間がかかるがしっかりとケアをしなかったりまたコンタクトレンズをつけたまま寝てしまうと眼病の原因になってしまう。だからしっかりとケアすることが重要だ。まずはコンタクトレンズの装着時間を守ることだ。そしてレンズを丁寧にこすって洗浄しコンタクト洗浄液にしっかりとつけておくべきだ。そのようにして毎日大切に使っていきたい。コンタクトを洗浄するときに手でレンズをこする回数は30回以上が良いと言われている。こするときに強すぎてはいけない。やさしくていねいにこすってあげればレンズが傷つかなくて済む。手入れするには手間がかかって面倒だが目を傷つけないためにそれは必要なことだ。取扱説明書をちゃんと読み使用期限を守り洗浄などのケアをしっかりと行っていきたい。,1,,デカ目カラコンならこちら,http://www.girlscolor.com/shop/list.php?ca_id=g0,1,0
,20,TOEIC試験を目標に英語を勉強する,,,海外のWebサイトを見ることが多く自分の語学力の低さを感じているので英語の勉強をしています。ただたんに英語の勉強をしていてもモチベーションが下がってしまいますのでそこで英語の資格TOEIC試験で高得点を取るという目標を掲げながら勉強をしているんです。恥ずかしながらTOEICの点数はまだ700点に届かない程度なので今年は700点を超えて更には800点代になるのが目標です。こういう明確な数値で表せる目標というのはモチベーションを出すのに便利だなと感じています。実際に試験を受けてみるとリスニングが特に弱いようなのでいまは海外ドラマを見る勉強法をしています。インターネットで調べてみると英語の勉強には海外ドラマが良いという記事が多かったのがこの勉強法を選んだ理由です。まずは英語を英語として頭の中にたたき込むんです。わたしたちは日本人ですから自然と英語を日本語に翻訳しながら聞いてしまっています。それを辞めて英語のニュアンスそのままに聞く練習です。こうすれば日本語に訳すタイムラグがなくなるのでスムースに聞くことができるようになるんだそうです。そしてその次に英語字幕をつけて見て意味のわからなかった単語を英英辞典で調べるんです。そうすると飛躍的にボキャブラリーが増えていくんだそうです。この勉強法を試しだしてまだまだ日が浅いですが確実にリスニング能力が高くなってきているように思います。もっとがんばって今年は必ずTOEIC800点代を取りたいですね。,1,,キャスティングはこちらへ,http://www.e-spirit.jp/,1,0
,20,カルチャースクールの様々な講座と開講時間,,,地元にある総合カルチャースクールでは様々な習い事の講座が開かれています。扱われている内容によって開講時間には違いがありそれぞれの受講者層が伺えます。例えば主婦に人気の高い講座は平日の日中に開講されていることが多いです。それに対しビジネスマンも参加しやすい講座は夜間に開講されています。幅広い客層を獲得している講座に関しては日中と夜間に分けて開講されることが多いようです。もちろんそれぞれの講座の内容にも偏りがあると思います。平日の日中に開かれている講座は主婦や高齢者に人気の高い内容です。ヨガや手芸書道などの講座などがその一例です。反対に夜間に開講されている講座には英会話やビジネスで使えるパソコン講座などがあります。カルチャースクールのような習い事の場所というのはそもそも受講生がいなくては存続しません。それぞれの講座の内容と客層を一致させそれぞれの受講生が通いやすい時間に講座を開く必要があります。主婦や高齢者は日中に自由になる時間が多いのでこのあたりを客層にしている講座は平日の日中の講座が多いわけです。社会人をターゲットにしている講座は仕事の後に気軽に通えるように平日の夜間に開講されるのです。社会人が習い事に求めるのは趣味の充実やキャリアアップです。それらの需要を満たす講座を多数開講していることが多いのでどちらかというと夜間の講座の方が充実していると言えるかもしれません。特に習い事に通える時間が限られているわけではないなら夜間の講座を利用した方がバリエーションも豊富なのではないでしょうか。,1,,キャスティングのことなら,http://www.e-spirit.jp/,1,0
,12,資格取得は自分の努力次第！,,poster,やっぱり手に職があったらいいなあとは常々思います。国文学科の大学を出て教員資格は取ったものの教員にはならずに一般企業に就職妊娠出産で会社を退職して専業主婦をしています。こんなとき手に職があったら復帰も見通しが立ちやすいし自宅で開業できるような資格を持っていたら定年も気にせず働けるのになあなんて。一般企業で働いていたとき社会保険労務士の資格にチャレンジしよう！と資格取得の学校に通ったことがありました。上司も背中を押してくれて３年くらい頑張ってみよう！と。ところが仕事が激務になって学校に通っていることを知っているはずの上司もガンガン残業を振ってくる。夕方１９時頃から開講の授業にはとても間に合わず土日のサテライト授業に頑張って出ていたものの結局気持ちが続かず通学を諦めてしまいました（＞＜）最近学生時代の友人が３年がかりで行政書士の資格に合格しました！彼女もかなり多忙のはずなのに頑張って学校に通ってついに合格。私は残業を言い訳にしていたけどやっぱり努力の問題だな〜と反省。今資格にチャレンジするならやっぱり通信講座になりますかね。士業の他にもネイリストやペットシッタートリマーといった自宅でお客様を迎えられる仕事に繋がる資格も魅力的です。私のように努力できない飽きっぽい性格には通学制の学校で仲間を作ったり先生がいたりというほうが続くんだろうなあと思うのですが託児施設付きの資格の学校なんてあったら主婦は助かると思うんだけどな〜。と妄想してしまうあたりがやっぱり努力が足りないんでしょうねえ。妄想してる暇に勉強始めればいいのにねえ。と思いつつ通信講座や資格取得のパンフレットを見るとついつい持って帰ってしまうのです。,1,,キャスティングならここ,http://www.e-spirit.jp/,1,0
,12,資格取得の勉強や習い事は1日でも長く続けることが大事,,money,「継続は力なり」というとても良い言葉がありますがこの言葉は資格取得や習い事をする上でとても大事なキーワードになる言葉です。どんなに頭が良くて聡明な人間でも1日ですべての知識を覚えられるわけではありません。ある程度の期間をかけ長い間勉強することによりやっと人に誇れるような知識を身に付けることができるのです。ですから資格取得や習い事ではとにかく続けて勉強することがとても大切です。人間の調子は日によって上下しますのでときには勉強に対してまったく乗り気ではない日があるかもしれません。それでもそういう日にパタリと勉強をやめてしまうのではなくたとえ5分でも良いから机に向かって勉強をするとやめないで継続させていくことができます。これらの継続を軽んじてしまうと資格の取得や習い事で大事な基礎の部分がいつまで経っても固まりませんので結局前に進みにくくなってしまいます。ですから基礎固めをするためにも継続して勉強をすることはとても大事です。例えば自動車運転免許において仮免試験で何回落ちても最終的には自動車に乗れるようになっている人がたくさんいるはずです。それは途中で諦めたりせず何度も長い間続けたから徐々に成果が出たのです。そしてそれは勉強以外の料理やお花や絵画などさまざまな習い事でも総じて共通することです。ですので資格取得の勉強や習い事は1日でも長く続けることが大事です。,1,,キャスティングはこちらへ,http://www.e-spirit.jp/,1,0
,12,習い事の有用性について,,biz,景気が上昇しているとは言われているがまだまだ身にもってその上昇を身に感じる事は中々無い。ガソリン代も頭打ちでやっと値上がりが終わったと言われている昨今である。ところが今塾業界特に個別指導塾の営業利益が上がっているらしい。近年塾の教室数はどんどん増加している。中でも個別指導塾は大手会社のフランチャイズ店舗を中心に軒並み増加傾向である。一体どうしたというのだろうか？本来塾というは有名大学やその高校中学への進学を目指す子ども達が通うものであった。ところが今日では学校の基本的内容が分からない子ども達が学校の授業について行くために通っている楊である。そしてその通塾先が個別指導塾なのである。どういうことかと言うと通常の塾は集団で授業を行う。その為分からなかった事があっても全体に合わせないといけない心理が働き先生に頻繁に質問したり自分が理解するまで授業を止めるということは出来ない。しかし個別指導ではこの問題が改善され正に「わかるまで」教えてくれるという訳だ。つまり学校の授業について行く為の手段としての塾のニーズが増加しその教室数が増加しているという訳だ。しかし実際は個別で生徒と対応する為講師は大学生を中心とするアルバイトがほとんどでありその授業内容やスキルについては疑問が付き纏うところである。しかも本来学校の授業というのは誰でも勉強すれば理解できるものばかりである。そう考えるとこういった塾のニーズが増加しているのは喜ばしい事とは言えないのかもしれない。スポーツ芸術学習とあらゆる分野の習い後があるがどの分野においても自分から能動的に学んだ上で習うというのが本来の形では無いかと私は考える。,1,,キャスティングのことなら,http://www.e-spirit.jp/,1,0
,32,水泳やっていました,poster,,習い事ランキングで上位に必ず入ってくる水泳。僕も小学生時代に地元のスイミングスクールに通い水泳を習っていました。それまでは泳ぎが苦手だったので何とかうまく泳げるようになってほしいと思った両親が通わせてくれたのです。最初水に入るのにはかなりの抵抗がありまして足先をつけるだけでドキドキでした。でも教室を担当してくれた男性コーチがとても優しく教えてくれたのですぐ水に入れてそれがとても嬉しかったのを覚えています。色々ある泳ぎのなかで一番苦労したのが意外にもクロールです。バタ足をしながら手で水をかき一定のタイミングで息継ぎを横向きでやるのが凄く苦手で何度も何度も練習しました。まずは息継ぎタイミングを掴むためビート版をしようしての息継ぎ練習からスタート。それが慣れてからバタ足を加えて最後には腕の動作も併せて練習と段階を踏んでの練習を繰り返し実践。効果はものすごく表れて一カ月後にはゆっくりでしたがクロールで自分だけで泳げるまでに。出来たときは本当にうれしかったです。それからは自分で自主練をやったりしてすっかりクロールが得意になりました。今でもそのスクールに通い泳いでいましてたまにコーチのお手伝いをしたりなんかもやっています。これから昔の僕みたいに泳ぎが苦手な子がいたら僕の体験談を話しながら上達するための手伝いをしていこうと思っています。そのときがくるのを今か今かと心待ちにしている状態です。,1,,キャスティングならここ,http://www.e-spirit.jp/,1,0
,32,通信制の大学について　,money,,通信制の大学で教員免許を取りました。大学を一度卒業しているので基礎資格はあるため教職に必要な単位を取ればいいのですがそれでも２年かかりました。通信制の大学は入試試験がありません。だから入るのは簡単なのですが単位を取るのはたいへんで途中でやめていく人も少なくないといいます。通信制ですから普通に通学する場合の授業がレポートにあたります。１科目ごとに８００字〜２０００字程度の論文を書かなければいけません。私の場合は２０科目ですみましたが通信制で大学卒業の資格を取ろうとする場合は最低４年在籍しさらに多くの単位を取得しなければいけません。その後指定された日に指定された会場で試験を受け合格すると単位獲得できるのです。このくり返しです。問題はレポート作成です。与えられた課題に対する文を合格できるようなレベルで書かなければなりません。作文がどれだけ大変かは想像できると思います。通信制大学は学費も安く入学試験も必要ありませんが入ってからが大変であることを覚悟するべきでしょう。ただ通学していれば適当にすごして卒業も可能ですが通信はそうはいかないので卒業終了できたら本当に充実感あふれる気分になると思います。自分のためにもなります。社会に通用する知識を得られることでしょう。本来大学の勉強というのはそういうものでなければいけないと思うのですが日本の大学制度のあり方も考えさせられました。,1,,キャスティングはこちらへ,http://www.e-spirit.jp/,1,0
,32,英検1級の勉強をしています,,office,私は50歳も見えてきたような年齢のおばさんですが実は英検1級の勉強をしております。独学です。お金がないばついちですからパソコンと昔から持っているテキストや問題集などで勉強しています。でも今はパソコンさえあれば英語の勉強は出来ますね。まずリーディングは教材に不自由しませんね。読みたい物を自由に読めます。更にスマホのニュースアプリなどでも英語の記事というのはいくらでも無料で読めます。リーディングの勉強には苦労しませんね。リスニングの勉強はラジオ英語講座を使っています。これはパソコンやスマホのラジオアプリなどで聞けるのでとても助かっています。昔はラジオの電波の届く所にラジオを置いて聞いていました。私の住んでいる住宅ではなかなかラジオがうまく聞こえない場所も多くラジオを聞くのには苦労したのが懐かしい思い出です。あとは英検1級に合格するには単語力がかなり高くないといけないのですがこれもパソコンを利用して勉強しています。無料で単語力を診断したり誰かと競ったりできるサイトが結構あるのでそれを利用させてもらっています。1日10分とかでも何もしないよりはかなりいいと思っています。そんな感じで勉強を続けています。仕事もしながらなのでなかなか順調に勉強が出来なかったりしますがなんとか勉強を続けています。50歳までに英検1級に絶対に合格したいと思っています。本当はもっとはやくに合格したかったのですが色々事情がありなかなか勉強が出来ませんでした。でも諦めないで頑張っています。,1,,キャスティングのことなら,http://www.e-spirit.jp/,1,0
,32,簿記2級資格試験に挑戦,,office,私が学生の頃簿記3級の資格を取りました。もう少しステップアップをと思い簿記2級の資格を取ることに挑戦しようと思いました。簿記3級の時は学校の授業で教えてもらい何度も模擬試験を行い先生や周りの協力があって資格試験に合格することができましたが今度は独学でやらなければならくてとても大変でした。まずどのテキストがいいのかネットで調べて書店に行き中を見て確認しました。私は理解力があまりないので絵などがついてわかりやすくまとめているのを選びました。とにかく最初は基礎知識だということでテキストを見て自分なりにノートにまとめました。そこから過去問を何度も繰返しやりました。最初は全然わからないことに苦しみ自信も全くなく全然覚えられない自分に腹も立ちました。ですがだんだんやっていくうちに分かってきて分かったことがとても嬉しくて今まで学生の頃勉強って分かっていくのが楽しかったなぁっていうのを思い出しました。そして簿記2級試験の日がやってきました。ものすごい緊張で自信もあまりありませんでした。周りの方たちの電卓を打つ音などが気になって少し集中もできなかった気がします。試験の出来は微妙で分からないところもあったし出来たという所もありました。後日届いた結果は見事合格でした！点数ギリギリでしたが今まで自分が頑張ってきたことが身になってすごく嬉しかったです。自分でも努力すれば出来るんだとより自信になりました。,1,,キャスティングならここ,http://www.e-spirit.jp/,1,0
,32,綺麗な字を書きたい！！,,,私が昔の自分に何か習う事を勧める事が出来るなら私は迷わず言うだろう。「習字を習え！！」と。私が綺麗な字を意識するようになったのは２０歳で入社した会社。生命保険会社だった。当時私と同い年の社員は私を含めて９人。その中で１人習字を習っていたと言う子がいた。彼女の字は本当に綺麗な字。会社の社長さん達をも相手に営業しなければなからない中彼女の字の綺麗さはとてつもない強みだと私はひしひし感じたものだった。とても羨ましく見よう見まねで彼女の字を真似た。周りに言われた一言は「もう少し綺麗にせめて丁寧に書きなさい」。えぇｯ！！？その時ばかりは素直に落ち込んだ。保険会社はそれはもう書類ばかり。その上会えなければ手紙をポストに投函は当たり前。ポスティングする時の自己紹介のチラシも手作りだった。字の汚さを自ら広めているようなものだ。そして今私がしている仕事はその保険会社以上に字を書かなければならない。誰かを相手に営業する訳ではないので字の汚さは差ほど気にはならないがそれでも綺麗な字を書く人はとても憧れる。今からでも遅くはないが兼業主婦の私は習字を習いに行くだけの時間の余裕が今はない。私には子供はいないので今はいいけれど子供が生まれたらこんな子供のような字を子供に見せるのか…と思うと子供には見せられないなとまで思ってしまった。やはり今からでも習いに行くべきだろうか,1,,キャスティングのことなら,http://www.e-spirit.jp/,1,0
