Post.id,Post.genre_id,Post.title,Post.pagename,Post.menu,Post.content,Post.public,Keyword.id,Keyword.keyword,Keyword.url,Keyword.visible,Arbitrary.keyword
,7,食べ尽くした韓国,,bridal,先日友人と韓国食い倒れの旅に行ってきました。以前からずっと行きたいと思っていましたがなかなかまとまった休みが取れずようやく３泊４日の旅をすることができました。おとなりの国なのでとても近くて最近では安い航空券も出ているのでとても助かります。近いというだけで旅の疲れが半減しますよね。私たちが行ったのは韓国の首都ソウルです。とても活気にあふれている町で日本とは違った文化を肌で感じました。今回の旅行の主な目的は「食い倒れ」なので事前に韓国のおいしいレストランをチェックしてから行きました。一緒に行った友人も食の好みが似ているので一緒にいてとても楽しめます。２人とも遠慮なく食べれるので最高のパートナーでした！初日の夜はまず韓国と言えば焼き肉でしょうということで評判の良かった焼き肉屋さんへと足を運びました。その焼き肉屋さんは日本人観光客も多いみたいで日本語のメニューも用意していてとても助かりました。韓国の焼き肉屋さんは無料でキムチやナムルなどの小皿がたくさん出てくるサービスをしているのでそれには私たちも大感激。お金を取られないのか心配しましたが大丈夫でした。焼き肉屋さんでは韓国特有の骨付きカルビやサイドメニューのチャプチェビビンバなどを堪能しました。やはり本場は違います！翌日からもショッピングをしたり韓国の海鮮料理を食べに行ったり屋台で売っているものを食べ歩いたりしてまさに食い倒れ旅行でした。,1,,usjツアーの相談窓口,http://www.knt.co.jp/usj/,1,0
,7,ママと娘の二人でめぐる世界文化遺産の旅『広島・厳島神社』,,est,この夏は9歳の娘と夏休みを満喫するため青春18きっぷで広島の世界文化遺産厳島神社を旅した。筆者が住む岡山から広島は日帰りコースながら青春18きっぷは普通快速列車のみ利用可能なので早朝出発で深夜帰宅となる予想で頑張ろうと思う。早朝6時に岡山の山陽本線熊山駅を出発し10時にＪＲ宮島口駅に到着。青春18きっぷで乗れるＪＲ西日本宮島フェリーは厳島神社に最も近寄ってくれるのでシャッターチャンスもたっぷり。海から見える初めての厳島神社は気高く荘厳。フェリーから降りて土産物屋が続く趣のある小路を歩くが観光客のめぐむ食べ物目当ての鹿があちこちに陣取り脇の下をつついたり土産を入れたビニール袋に鼻を突っ込んだりしている。海岸沿いを歩くと右手にかの有名な海の中に建つ赤い大鳥居が見える。基礎部分が相当太い。樹齢500年のクスノキで作られているらしいがこれだけの巨木はなかなかお目にかかれないだろう。高さは奈良の大仏くらいか。厳島神社は推古天皇の時代の創建だが平清盛の援助を得て今のような海上社殿となった。本殿入り口で大人300円小学生100円を払って中へ。朱塗りの柱が続く回廊をあるくと妙に足元がガタつくのに気付く。床板と床板の間に隙間があって歩きにくいのだがこれは台風や高潮で床板がはがれるのを防ぐための措置。なかなか工夫されている。本殿には平舞台（ひらぶたい）と高舞台（たかぶたい）や能舞台が作りつけられ平家一門の舞楽好きが垣間見れる。松明を灯した夜の舞台はどれだけ美しいだろうと想像する。これらの建物は陸上の建物と変わらない技法で建てられているので海底に浸かる部分は腐食する。定期的な点検で腐食を発見し根継ぎを行うのでこれに係る手間暇は膨大だろうと感じ入る。社殿中央ではおみくじができるので娘と引いてみた。小吉に中吉。当たっているような当たっていないような…。大国社と呼ばれる大国主命（おおくにぬしのみこと）を祀った拝殿近くでおみくじを結びついでに大国主命にも拝礼する。回廊の終点近くにある反橋（そりばし）と言う長さ約２４ｍの太鼓橋は修復中で入れなかったが反り角度が急すぎてどうやって登るのか娘と二人で腕組みして考えた。後日帰宅してから調べたところ中央に階段を設けて渡ったとあるのでなんだじゃあなにもこんなに丸々してなくても良いのではないか？と笑ってしまった。出口から出ても良かったのだがもう一度見て回ろうと言うことで本殿にＵターンしチケットを買った入り口から出て鹿に遊ばれながら神社を後にした。帰りがけには娘に名物「あなごめし」を誘ったのだが見事に蹴られ広島風お好み焼きにたどり着いた。なぜ「広島風」とつくのか関西が本場だからか…そんな議論を娘としながら分厚くてボリューム満点のお好み焼きをほおばった。,1,,usjツアーの会社,http://www.knt.co.jp/usj/,1,0
,7,生まれて初めての海外旅行,,gift,私が生まれて初めて日本を出たのは１８歳の春でした。同じクラスの子たちがわいわいと楽しそうに卒業旅行を計画しているときにいわゆる「ぼっち」の私はエジプトに行く計画を練りました。本当は一人旅がしたかったのですが両親に猛反対されツアーに１人参加という形になってしまいました。行ってみるとどういうわけか私以外はみんな新婚カップルばかりでした。カップルの真っただ中に一人ぼっち。これは一人旅よりずっと寂しいものです。はっきりいって最悪だと思いました。しかしツアーが始まってみるとそんな寂しさはどこかへ吹っ飛んでしまいました。エジプトという国そしてピラミッドは観光客の期待を決して裏切らないのです。どこまでも続くサハラ砂漠真っ青な空にそびえたつ途方もなく巨大なピラミッド。異国情緒あふれる市場スパイスの効いた料理ベリーダンス。旅行中の１週間はまるで現実感がなくおとぎの国へ入り込んだような気持で過ごしました。当時私はいろいろなことで悩んでいました。うまくいかなかった進学のこと家族のこと人間関係のこと将来の不安。旅行中にそういうことを全く思い出さなかったといえば嘘になります。けれどエジプトではそんな数々の悩みがとても些細なつまらないことに思われたのです。帰国後も私は何か嫌なことがあるとエジプトの広い空を思い浮かべました。こんなことは些末なことだと小さなことに囚われるのはやめようと思うことができたのです。私は旅行に出て世界が広いことを知りました。学校で教わるより本で読むよりテレビで見るよりずっとずっと広くそしてたくさんのいろんな人間がいることを知ることができました。,1,,usjツアーはお任せ,http://www.knt.co.jp/usj/,1,0
,32,セブ島の一流ホテルの隣室で鳴いたのは鶏だった！,,travel,１９７０年代にフィリピンセブ島に某会社のキャンペーンでセブ島に一ヶ月ほど滞在したことがありました。現在のセブ島は高い近代的なビルが立ち並んだ写真がパンフレットに掲載されていてまさに高級リゾート島という感じでここがあのセブ？という印象でしたが私が訪れたセブの町はまだまだ開発されていない素朴がそここに漂う町でした。そこで滞在中はとりあえずセブで一番ランクが上だというホテルに滞在したわけです。まあ一見は清潔で過不足もないホテルに見えました。それにそのホテルには階上に立派な回転するラウンジがありそれはホテルニューオータニの設計者だとオーナーは胸を張りました。私は大抵そこでディナーを食べていたのでよく立ち寄っていました。確かに一回転すると海も眺望できる素晴らしい眺めでした。シェルガスのタンクが風貌のよさを邪魔していたものの視界をさえぎるものもなく素朴な海が広がっていました。ところがシングルルームの自室から朝になると鳴き出す存在がありました。鶏です。隣の部屋から早朝に「コケコッコ！」と鶏が鳴くのです。私は飛び起きました。何事かと…。ボーイに尋ねると彼はにこやかに微笑みながら「あれは闘鶏用の鶏です。」と答えたのです。「闘鶏は明日なので…。」とも言い添えました。どうやらこの闘鶏で賭け事があるらしいのです。そのことに何の疑問もないようでした。また別のある日鏡台の引き出しを開けるとそこから飛び出したものがありました。何とネズミでした。私はびっくりして追いかけましたがどこかへ逃げられました。三週間位滞在してこの不潔な小動物の出現で私はチェックアウトを決心しました。支払いの折ネズミが出たんだし三週間も泊まったのだから少しまけるように要望しました。ところが駄目だの一点張り。私は腹をたてて「二度とあなたの所には泊まらない。」とたんかを切ってホテルを出て行ったのです。しかし暑いフィリピンスーツケースを引きずり探しましたが他にホテルらしきホテルもなくてまたすごすご戻るしかありませんでした。カウンターの男性はこのことを読んでいたのですね。けれどホテルのチャージを値切った私の方が非常識だったかしらと思ったりするものの普通はご迷惑をお掛けしました位の値引があってしかるべきだと思いますが？文化の違いというか…今ではこんなことないのだと思いますが昔のセブ島の一コマでした。,1,,usjツアーはこちら！,http://www.knt.co.jp/usj/,1,0
,32,海外の格安航空会社は、飛行機の座席争奪戦をする,travel,,同じ格安航空会社といっても日本の格安航空会社と海外のそれでは大きく異なるところがあります。いくつかそういった点はあるのですが特に気になるのが全席自由席であるということです。海外旅行に行くとき飛行機の座席の位置というのは結構気になるもの。頻繁にトイレに行く人は通路側がいいでしょうし窓の景色をじっくり眺めたい人は窓側がいいでしょう。機内食をいち早く選びたいのであれば前方が有利ですしトイレに行きたい人は後ろ側のほうがいいでしょう。大手航空会社であれば最近ではあらかじめ座席指定が出来るのが普通です。格安航空会社の中でも一部に座席指定ができる場合がありますが座席指定を有料としている格安航空会社もあります。そもそも飛行機というのは重量バランスが結構シビアでありあまりに一方に偏るような重量配分では困ってしまうわけです。それを防ぐため航空会社のほうで座席をうまいこと配分しているのです。しかし海外旅行で海外の格安航空会社を利用すると完全に自由席という場合があります。もちろん飛行機ですので全員確実に座れるようにはなっているのですが自分の希望の席に座れるかどうかは分かりません。搭乗開始直後なだれ込むように飛行機の中に入って座席取りが始まるのです。そういった航空会社でも座席指定をすることによりそういった人たちよりも早く悠然と入ることが出来ますが追加料金がかかるのであまり利用者は多くありません。,1,,フィリピン留学はここ,http://www.cebu21.jp/,1,0
