Post.id,Post.genre_id,Post.title,Post.pagename,Post.menu,Post.content,Post.public,Keyword.id,Keyword.keyword,Keyword.url,Keyword.visible,Arbitrary.keyword
,21,貯金をするなら小銭貯金から始めましょう。,,buy,お金を貯める方法でいつの間にか貯まって行く方法があります。それは小銭貯金です。1円と5円と10円と50円は一つの貯金箱に入れておきます。もう一つの貯金箱には100円と500円を入れます。毎日朝起きて会社に行く時に貯金箱に100円入れて会社に行きます。家に帰って来た時も貯金箱に100円を入れて毎日200円の貯金になります。買い物に行った時の100円以下のお金は貯金箱に入れます。財布の中には100円以上のお金しか入れないようにします。100円以下を貯金箱に入れるようになると買い物で無駄に使うことがなくなるはずです。会社に行く時だけと考えても毎月4000円から5000円くらいの金額になってきます。わからないままに減って行くお金のことを考えると小銭を貯めることでコンビニでの無駄使いがなくなってきます。小銭は年末に銀行でお札に両替してもらって毎年5万円から6万円のお金になります。今年は一度まとまったお金が必要だったので4万円のお金を100円貯金から出しました。それでも100円貯金を再開して今では1万5千円のお金が貯まっています。財布にあるお金は一瞬でなくなりますが財布から出しておけばなくなることはありません。財布の中から出してしまうことでお金でないお金となってしまい使わないということになります。使えないようにすればお金は貯まりますよ。,1,,車でお金を借りよう,http://www.naruto1010.com/,1,0
,21,投資の入り口には外貨預金が良いんじゃない？,,repair,友達が何故か投資をしたいというので最初は外貨預金でいけば？とお勧めしました。理由は色々とありますが大きなのはリスクの部分と把握のしやすさがあります。投資には色々と種類があります。聞いたことのある人は多いでしょうがそれぞれ特徴があって把握も難しいですしリスクの部分は考えておかないとなりません。一番リスクの低いのに銀行預金が挙げられますがそれだと増えるのも微々たるものなのでそれならちょっとリスクを考慮して外貨預金でと言う話です。危ないと言う人もいますがやり方によってかなりリスクを下げる事も出来るので安全な部類に入りますね。もう一つの把握のしさすさはどこでもその情報を得る事が出来るからです。投資は情報でかなり結果が左右されますが為替であれば一つ見ていればまぁいいでしょうしテレビでもなんでも情報を出しています。株式だったりすると把握しずらい面があったりしますね。他の投資もそれに近いです。昔に比べれば遥かに簡単ですがそれでもコツはあります。外貨系ではＦＸもありますがいきなり勧める気にもなれません。全くの初心者の人なら外貨預金から始めてドルとかユーロとかで投資に慣れるのが良いんじゃないでしょうか？。,1,,車で金融はこちら,http://www.naruto1010.com/,1,0
,32,IPO株もめちゃくちゃ気になりますけどね,,kinyuu,一度は狙ってみたいって思うのがIPO株なんですよね。今はIPO株も増えてきていますし大型がくるってかなり騒いでいる感じですよね。銀ダコとかも上場するって聞くとすごい勢いだなって思ったりしちゃいます。リクルートとかすかいらーくとか再上場になるわけですしね。こういった株が手に入ったら楽しいだろうなって思うことはあります。でもほとんど当たらないのがIPO株の特徴でもあるんですよね。個人投資家は当たらないんだろうな〜って思って応募する人がほとんどのような気がします。ネット証券では完全に抽選で行われていますけど多くの場合は大手がいっぱい権利を持っていることがほとんどです。だから大手証券に口座開設するくらいの勇気も必要ですよね。もちろんそうなると担当者さんとのおつきあいとか色々大変なんですけども。でもそんなことを言いつつ法人営業がメインだったりするので個人は後回しにされがちだと思います。だからとりあえずIPO株は上場してから後に見守るっていうのもアリかなって思ったりしますね。なんていうかそんなに心配せずにもしかしたら値上がるかもと思ってその株価推移をチェックすることから始めようかなって思います。抽選に当たるのは運に任せてできることをやるだけですよね。,1,,車でお金,http://www.naruto1010.com/,1,0
,32,副業もどんどんステップアップしたいです,,kinyuu,何かとお金が減ってしまう印象を受ける昨今。それゆえ副業にかなり力を入れています。絶対に本業の方には手を付けず副業のお金だけで投資をしているのですが今もっとも買いたいものがあるんですよね。だから副業の方もいままでやっていたものだけでなく新しいものに挑戦したいなって思っています。これまでお小遣いレベルの副業は結構やってきました。例えば一番やりやすいものっていうとポイントサイトですよね。ぽちっとクリックするだけで1円が貯まる仕組みなんだか嬉しくなってしまいます。CMを見てポイントを稼いだりゲーム感覚でできるのはいいな〜って思っていますが海外からだとできないものもあり自然と消滅していきました。次にアンケートモニターとかもやりましたね。モニター系は数も多いですしポイントサイトより単価が高いのですがそれだけでは微妙な感じかな〜って感じです。また高単価の案件はすぐになくなってしまったりして稼げないなって印象でやめました。今はそういったお小遣い系サイトは縮小させて記事作成とかもう少し単価の高い副業にシフトしています。できれば今後はアフィリエイトとかもう少し自分で稼げる量を増やしたいなって思っているところです。,1,,車で金融,http://www.naruto1010.com/,1,0
,32,お金持ち風水というのがあるらしい,credit,,いままで考えた事もないんですけど普通に金運を上げるためだけの風水っていうのは日本独特のものらしいです。占いとかスピリチュアルなものとして受け入れられているのは日本だけなんですって。やっぱりおかしな国ニッポンって感じですね。そういう国民性っていうのも愛すべきところだよなって思いますけどね。それよりも実際のお金持ち風水というのは一種の環境学だったりするそうです。だからあんちょこなものとは別物らしいです。あとビジネスパートナーとかを選ぶときに見るのは人相だったりするそうです。やっぱりその人の生き様というのは顔に表れるみたいですね。なんとなく風水とか人相学とか知らなくてもありますよね。その人の特性っていうものは顔に出るな〜っていうのは。とにかくお金持ちはその人の顔を見てちゃんとビジネスチャンスかどうかを見極めるそうです。相手を知るためにはその人の奥さんもしくはダンナさんがどういう人かを見るのも効果的なんだそうです。そうするとパートナーが幸せそうな人は総じて良いビジネスパートナーであることが多いそうです。確かにそういう裏表のない人が人生においても成功しそうだなって思いますね。人を思いやれる人にこそお金も集まってくるような気がします。,1,,車でお金を借りよう,http://www.naruto1010.com/,1,0
,32,貯まらない貯金,,,私はなかなか貯金をすることができません。日々の生活でも貯金をしようと節約術をいくつか試してはいるのですがそれが実行出来ないのではなく貯まった頃にいつも使ってしまうというのが現状です。以前お金をがんばって貯めていた時も貯まった頃に主人の仕事が変わり生活が苦しくなって貯金がなくなってしまったこともありますしその後も少し貯まっても子供が生まれて出産費用や子供の出産準備になくなってしまったりと使う目的がいつも出てきてしまいます。それが気のゆるみなのかどうしようもないことなのかが微妙なラインでお金を使わなければいけないという事実は変わらないので困ってしまいます。子供の学資保険や主人の生命保険など貯蓄型の保険にも一応は加入しているので万が一何かあったときには大丈夫だと思うのですがそれでも口座に貯金がないと不安な気持ちになってしまいます。自分にもっと貯めようという気合いが足りない気もするので気を引き締めてみるのですがあまりにケチケチした生活をしすぎるとストレスがたまって結果使いすぎてしまったりしてしまうこともあるので自分にストレスのない範囲で貯金をいかにがんばれるかということが私の中で永遠の課題になりつつあります。,1,,車で金融はこちら,http://www.naruto1010.com/,1,0
,18,光熱費の節約の仕方,,zeiri,節約ということでいえばまず光熱費からって人は多いですよね。電気代とかガス代水道代っていうのがどんどん下がれば目に見える形でお金が手元に残るので嬉しいです。目に見えることで他のことも節約しようっていう気持ちになったりします。まず電気代は季節によって変動しますが私は暖房費用を下げることに成功しました。それは湯たんぽの活用です。毛布にくるまりながら湯たんぽを入れていれば数時間は温かに過ごすことができます。特にやることがない休日などは家にいるときそうやって電気代を下げました。ヒーターとかを使わない分わりと大きな金額が節約できます。あと冷蔵庫とかは弱に設定しておきました。あんまりピンとこないかもしれませんがちょっとした節約ですね。それからガス代節約のためにはまず東京ガスなどの都市ガスを利用することですね。LPはどうしても高くついてしまいます。後は鍋に火をつける時は中程度で使うのを心がけるだけでだいぶガス代が減りますね。ガス代の大きいところといえばお風呂でしょうからこの時間を減らすというのが大きな節約につながると思います。電気も水道もお風呂時間を短くするだけで違うな〜って実感します。,1,,クレジットカードの現金化はこちら,http://nagomigift.com/,0,0
,18,NISAが上手く使えないんですよね〜,,tanpo,ニーサってみんなどうやって使っているのかなって思ったりします。たかだか100万円されど100万円の投資枠ですよね。すでに資産のある人たちからみればさしたる金額ではないのかもしれませんが個人的には100万円貯めるのは至難の業なのでなんていうか使い切れないって感じですね。前にとある投資家さんが外国株に投資してみるって話をしていました。ベトナムだったらベトナム国内の税金がかからないそうなんです。日本でかからなければ完全なる非課税だからって。そんなことを考えている人もいるんだな〜ってそのときはかなり感心してしまいます。でも普通の人間からするとニーサって塩漬け株にしてしまいがちといいますか。値上がりを狙っている人もいるのかもしれませんが普通の初心者なら高配当に流れてしまうような気もします。政府としてはそれでもいいのかもしれませんけどね。でも若年層が動かないから困っているって話も聞いたような気がします。税金税金って感じですからね。最長5年間でどれだけの利益を生み出すのかな〜って考えてしまいます。5年後に日本経済がどうなっているのか投資した人がどうなっているのかかなり気になるところですね。,1,,クレジットカードの現金化,http://nagomigift.com/,1,0
,18,上がっていれば下がっているものでもない,,credit,株のことなんてよくわからないなってしみじみ思います。今日は日経平均もかなり上がったから手持ちの株も上がっているのでは？って期待していたわけですよ。でも実際は全然上がってなかったりします。だから日経平均が上がっていても全体が上がっているとは限らないんだな〜ってことを実感することになりました。また業界とかによっても違うみたいですね。飲食業界は上がっていないけど銀行系は意外と上がっているのかなって感覚もありまして。まぁ手持ちの株なんて数も知れているので何の役にもたたないんですけど。もっとサンプルを集めないと実際のところはどうなのかっていうのが分からないなって感覚です。みんなどうやって情報収集しているのかな〜って思ったりしてしまいますね。それと東証一部の有名どころが上がっていないけど新しいところが上がっている可能性とかもありますよね。小型株よりも大型株のいくつかが値上がったから大きく上がったように見えているってケースもありますし。いろんな要因が関わっているんでしょうけどもう少しシンプルになってくれないかな〜なんて思うこともあります。個人的に銭の単位がイマイチよく分からないので元に戻してくれないかなって感じです。,1,,クレジットカードを現金化に,http://nagomigift.com/,1,0
,32,9月は盛り上がっていますよね〜,,kinyuu,やっぱり中間決算っていうものがあるので9月は投資市場も盛り上がっているなという印象です。しかも権利確定日にもらえる株主優待も多いですからね〜。9月3月って意味もなく盛り上がっている側面もあるのかなって思ったりしてしまいます。でも株主優待検索とかで優待の検索するのも本当に楽しいですね。普通に買うことはできませんが高島屋とかデパート系の優待とか一度でいいから手にしてみたいです。まずは100万円かなぁって考えてしまいますね。それから外食系とかも多いんですよね〜。いわゆるお食事券をもらえるところが多いので気になってしまいます。もちろん使えればいいんですけど使えなくても金券ですから売ることも可能ですしもらってみたいなって思います。でも優待のない株も配当金がありますからこっちもかなり楽しみですね。貸株とかに出しているものを戻しておかないといけないなって思ったりします。値上がりなんかしなくても残りの数年で配当金が出るなら結構いいかな〜って思っている株も多いです。目先の利益より将来の収益かなって感じです。この9月の盛り上がりで変な株を買わないようにしようとだけ思っています。流されては負けですよね。,1,,クレジットカードの現金化はこちら,http://nagomigift.com/,1,0
,32,貯金は習慣で。出来るようになれば簡単です。,,kinyuu,子供の頃はよく貯金しておかないとダメなんて言われていました。何となく大人は貯金しているんだろうななんて思っていましたが全くそんな事も無くやっている人はやっているしやっていない人は全くやっていないという状況でした。別にやったから凄い等と言う話では無いですが貯金が出来ないという人は困ります。大人でも結構貯金をやろうとして出来ない人は多く本人もなんで出来ないのか分からなかったりしますね。貯金はちょっとしたコツがあります。それは習慣にしているかどうかという部分です。お金って完全に習慣で使いますよね。勿論アレが欲しいと思い立って買い物する事もありますがそれは圧倒的に金額が少ないはずです。大富豪ならともかく一般人は誰でもそうでしょう。貯金を出来ない人もこの習慣を変える事が出来ないのでお金が一向に溜まりません。貯金が普通になってしまえば後は勝手に溜まって行きます。方法は色々とありますよね。つもり貯金とか罰金貯金なんてのは昔からありますし金融機関等を使ってある程度強制的に貯金していく方法もあります。変えるのは行動では無く心のほうだと強く認識しましょう。そこが変われば行動も変わります。出来るのとしないのは結構な差がありますから貯金はスキルみたいに考えても良いかも知れませんね。,1,,クレジットカードの現金化,http://nagomigift.com/,1,0
,32,自炊しつつも時には贅沢に,card,,オランダに来てからめっきり外でごはんを食べなくなりました。たまにテイクアウトくらいはしますけどかなり割高な印象です。自炊率が以前にもまして増えたような気がしますね。個人的にお料理上手だったらな〜って思うことばっかりです。そんなことを言ってるだけでは何も変わらないので料理もバリエーションをつけようと頑張っているところです。自炊で節約している分たまにはいいものを買ってもいいよねとばかりに調味料とかも買い込むようになりました。やっぱり日本人はグルメなんだよな〜って日本のドレッシングとかを食べながら思います。割高ですけど美味しいものを食べることで頑張れたりすることを考えれば安いものかなという印象です。それとオランダではお肉とかが安いので上手にお肉料理をしています。牛肉も日本では考えられない安さなのでたまに食卓に上ります。節約を心がけていますがたまに贅沢することで生産性も上がり結果としてお金も貯まっているように感じますね。ただうっかりすると買いすぎてしまう傾向にあるのでそこだけは気をつけようっていつも思っています。買い忘れと買いだめを防げばかなりの確率で食費は安くすみそうな感じです。,1,,クレジットカードを現金化に,http://nagomigift.com/,1,0
,32,投資のために役立つテレビ番組の話,yushi,,投資をするときにはいろんな経済情報が必要になってきます。その一つがテレビですよね。いわゆるNHKとかで取り上げられている企業の株は上がるとか言われたりしています。でももっとバラエティー色の強いものでも投資のための情報を提供してくれているものが沢山あります。個人的に好きなものとしてはまずがっちりマンデーです。これは加藤さんと進藤アナウンサーが司会を務めているのですが会社の社長さんが登場したりゲストと一緒に今注目の企業を見ていったりする番組です。企業がどんな工夫をしているかっていうのがすぐに分かるのでその会社に対して好意的な目を向けることができます。いままで知らなかった企業の裏側を知ることができるので日曜日に情報を仕入れられて嬉しくなったりもします。もう一つはだけど食堂です。こちらは経済系の番組ではなくグルメリポートの番組なのですが個人店とチェーン店のどちらもバランスよく取材しています。新商品をいち早く美味しそうに紹介してくれるので個人的にここで取り上げられた飲食店は注目しています。鈴木砂羽さんと柳原加奈子さんの掛け合いもテンポよくあまり考えなくても今の飲食業界のことを知ることができるので気に入っています。,1,,クレジットカードの現金化はこちら,http://nagomigift.com/,1,0
,32,収入の複線化が大事なんですよね,,,お金を稼ぐためというより何があっても困らないようにって思うとまず収入の複線化をすると良いって話があります。収入が一本だけだとそれが折れちゃうともうそこでストップってことですよね。だから収入はいろんなところから入ってくるようにするのがいいとのこと。なるほどな〜って思いました。できれば四本くらいあるといいみたいです。普通に働くだけでは夫婦になったとしても2本しかありませんからその上に副業をするなり不労所得を得るなりするべきなんだと思うんですよね。私は独り身なのでとりあえず副業のラインをもう一本増やそうかなってところなんですけども。そうやってお金の面で多角化をはかっておけば本当に嫌なことがあったとき仕事をやめることができるっていう決意をする事も出来るんですよね。真面目に仕事は我慢ってこともあるかもしれないけどそういうライフネットを持っていると自分の人生を選べるのかなって思ったりします。お金も大事だけど自分の好きな環境を作るためにやれることはやりたいなって思います。やっぱり収入の複線化を積極的にやっていきたいです。不労所得も増えていくといいなって思っています。他の投資方法も検討しようと思っているところです。,1,,クレジットカードの現金化,http://nagomigift.com/,1,0
,32,投資をやっていくと再びお金が欲しくなります,,,最初はお金が欲しいなって思って投資って始めたりしますよね。でも投資を続けていると今度は投資のためにお金が欲しくなったりします。だって投資にはいろんな手法があってそれを試すためにはまとまったお金が必要です。世の中ですごい投資家だと言われている人もそれなりの金額を元手にしています。個人的に投資はやりたいと思ったときにやったらいいと思うんですけどもしそれなりのリターンを希望するならばまとまったタネ銭があった方がいいだろうなってすごく思います。見切り発車で私は始めてしまったので特にそう思ってしまいます。今はIPO株も増えてきていますからそういった新しい株も買ってみたいし最低単元株で買うのではなく優待のこととかも考えてまとめてお金をつっこんでみたいなぁって思ったりとかしてしまいます。もちろん株が値上がりすれば売ってみるっていう売買経験を積んでみたいんですよね〜。また投信よりも積立金が大きいETFとかも魅力的です。外貨預金とかも元手が大きければ大きいほどいいですし常々投資に回せるお金を増やしたいです。配当金とかも再投資に回しつつやはり稼ぎ力をアップさせるのがポイントかなって思ったりもします。,1,,クレジットカードを現金化に,http://nagomigift.com/,1,0
