Post.id,Post.genre_id,Post.title,Post.pagename,Post.menu,Post.content,Post.public,Keyword.id,Keyword.keyword,Keyword.url,Keyword.visible,Arbitrary.keyword
,32,デリヘルでの素股、最高です。,,,僕は最近出張の度にデリヘルを利用しています。何なんでしょう。出張ってちょっと旅行気分になっちゃって家庭の事を忘れて羽を伸ばしちゃうんですよね。日頃は仕事も遅いし早くてもそんなときくらい早く帰ってこいと言われるし。ストレスたまりまくりなんですがそのストレスを出張で発散してしまってます。妻とはセックスの回数も減ってきて性欲がたまりまくっているのでここぞとばかりに風俗を利用します。ただ今まで風座奥経験があまり無く慣れているわけではないのでホテルの部屋に来てくれるデリヘルが便利でした。終わったあとの虚脱感の中ホテルに帰るという手間が無いので気に入ってます。プレイは素股が興奮しますね。初めて体験したときは本当に入っているのかと思いました。何度か利用していると素股にもうまい下手があるみたいで自分の好きなタイプの素股は自分のちんちんが見えず本当に入っている気がする騎乗位です。僕はちんちんの形が変みたいで女の子は大抵すごい気持ちいいって言ってくれます。最初は演技でしょ〜なんて思っていたのですが冷静に話を聞いてるとみんな同じように言うのでとてもうれしいです。これからも変な形のちんちんで素股で喜んでもらおうと思います。,1,,渋谷の風俗,http://fuzokudx.com/arealist/show/id/487,1,0
,32,夜のお仕事も大変です。,,,出張先では結構その地方の風俗店を利用しています。福島県栃木県新潟県埼玉県など。特に福島県や新潟県が良かったかな。何よりそこで働いている人の性格が良いから印象がいいのかもしれませんが。さてそおで働く人ってどういう生活をしているか分かりますか。また聞いたことありますか。自分の場合そのあたりの話しを聞くのも好きで以前は何人かの女性とプライベートでも会ったりしていました。ある女性の場合ですがお店に入るのが夕方5時で仕事終わりが夜中の2時ということ。これで一日8千円。時給に直すといくらでしょうか。時給900円というところでしょうか。安くありません？あの仕事の内容でこの金額ですから。ただ一人のお客さんを相手にした場合一人当たり1000円ということでした。聞くと平日はあまりお客さんは来ないためなかなか稼げないということでした。また別の女性は１ヶ月のうちほとんど毎日働き休むのは月１２日くらい。この休む日は生理がひどい時だけということ。そして自分も何回か会ったことがありますがそれは休みの日でまさしく生理がひどいとき。その時に会っていました。そんな生活を彼女達は送っています。みなさんではないでしょうが。,1,,,,1,0
,32,私もキャバで働きたいよ〜！,ikeikeshibuya,,最近雑誌とかテレビでキャバ嬢がめっちゃ人気あるよね！みんな可愛くてやばい〜！細いし憧れるよおあんな綺麗なドレス着たりかわいい髪型してみたいなあお姫様みたいでほんときらきらしてて女の子の夢って感じだよね夜の仕事ってなんか怖いというか危ないイメージとかあるけどうちの友達もやってる子多くて色んな人と関われるし色んな話ができてすごい自分の世界広がるし勉強になるんだって！おしゃれも出来るしかわいくなれるしそんないい事ばっかりでお給料もたくさんだなんてやばいよね！私もずっとお酒が飲めないしと思って迷ってたけどお酒が飲めなくても大丈夫なんだってそれ聞いてまじ安心したよ(>_<)私。缶ビール一本も飲みきれないくらいお酒弱いからね〜！笑だから飲み会とか女子会とか本当は行きたいのに行けなくて困るんだけど泣お酒がダメな分お客さんといっぱい話して話の引き出し増やして将来の旦那さんにもずっと一緒にいても飽きない子だなあって思われたいな♪あそれだけじゃなくてキャバ嬢なら気遣いも細かく出来なくちゃねっお酒の作り方とか座り方とか胸の盛り方とか？！友達に色々聞いて今から勉強がんばらないと！さっそく明日応募してみよう♪私も一流のキャバ嬢になってみせるぞ〜！,1,,渋谷の風俗店一覧｜フーゾクDX,http://fuzokudx.com/arealist/show/id/487,1,0
,32,キャバクラ１日体験,fankycity,,友人に誘われ私はキャバクラでアルバイトをすることになりました。接客業の苦手な私なのでしっかり出来るかすごく悩みましたが友人は「私がサポートするから」といい少し安心していました。友人の働くお店では高収入で学生OKお酒が飲めなくても大丈夫なお店だったのでその点でも安心して働くことが出来るかなと思っていました。でも実際に行ってみると友人とば別のテーブルにつかされ先輩キャバ嬢の人のサポートでまわることになったのですがお客さんがお酒を進めると飲まないといけなくなり先輩キャバ嬢の人は「ここはお酒が飲めなくてもOKだけどお客さんが進めたら飲まないといけない」と言いアルバイト後半はすごくふらふらになっていました。仕事が終わりお給料をいただいたのですが衣装代やヘアメイク代なども差し引かれて手取り金額が思ったより少なかったように思いました。個人的には残念な感じでしたが「これから仕事をしていけば伸びていく可能性もある」と言われました。でも学業をおろそかにしたくなかったので今回はお断りしてまた人手が足りない時にヘルプで出るような形になりました。キャバ嬢はノルマでバイトをしているところもあるようですがそういったところだと私には合わないかもと今回は思いました。,1,,渋谷の風俗,http://fuzokudx.com/arealist/show/id/487,1,0
,32,デリヘルといってもさらに変化をつけたデリヘル,,office,もはや風俗利用者で「デリヘル」というとスタンダードなサービスで利用者も多いと思います。ただデリヘルは素晴らしいサービスといっても同じことの繰り返しは誰でも飽きるものです。そこで変化をつけるために特殊なサービスを展開しているデリヘルを利用してみてはどうでしょうか。デリヘルに興味があってどんなデリヘルがあるのか気になっているという人にもいろいろとおすすめしていきます。まずは選ぶ女性の年齢層で変化をつけるのはどうでしょう。いつも若い子ばかり狙っている人なら年上のお姉さんや人妻という女性を狙うといいかもしれません。美しい人もたくさんいますし若い子には出せない色気だったり高い技術をもった人もいます。なにより包容力があり甘えることができたり癒やされたりすることでしょう。逆に人妻や年上系ばかりという人は変化をつけて若い子を狙ってみると新しい発見や新鮮さを味わうことができていいでしょう。コスプレやSMといったサービスをしているところもありますし普通のプレイに飽きた方にはおすすめできます。お金に余裕があるもしくは大金が入ったといった場合是非おすすめしたいデリヘルが複数の女性に同時にサービスを受けるデリヘルです。女性が複数ですから確かに高額になります。しかしAVなどでみる複数の女性からあちこちを攻められたり奉仕をうける「ハーレム状態」を自身で味わえますし現実の付き合いではなかなかできない複数の女性とのプレイは刺激と共に新鮮さそして興奮をもたらしてくれることでしょう。,1,,渋谷エリアの風俗店一覧,http://fuzokudx.com/arealist/show/id/487,1,0
,32,初デリヘルは最高の体験でした。,,kinyuu,先日同僚に勧められてデリヘルを呼んで見ました。出張で東京に行ったときですがホテルにチェックインした後東京の同僚と飲みに行きました。その最中に「普段出張でこっちに来たときはデリヘルとか呼んでるの？」と聞かれてそれまで呼んだことが無かったので同僚に色々教えてもらいスマホを見ながらいろいろ一緒に検索して安くてよさそうなお店を選び同僚に電話してもらいました。ＡＶをちょくちょく見る僕の趣味に合わせて少し痴女的な要素のあるお店を選んでもらいました。夢の即尺サービスです。女の子が入ってきて一応簡単に挨拶お金を支払いますといきなり女の子がズボンに手をかけ膝まずいて来ました。パンツに手をかけた瞬間にはもう既に興奮でフルボッキです。「おっきくなってるね」といわれウェットティッシュで拭くことも無くいきなりパクッとしゃぶりついてきました。既に理想の展開憧れの展開ですが仁王立ちフェラも憧れの一つちょっと調子に乗って頭を軽く押さえても嫌がらず起こる様子も無いのでゆっくり奥までつっこんでみたらぎりぎりまで咥えてくれて大興奮でした。イラマチオ的なことも出来るなんてと一発発射してしまいました。そこからは落ち着いてベッドでのプレイです。なれない僕でも落ち着いて挿入が無い彼女とのプレイと思って素股をしてもらいフィニッシュでした。デリヘルは初めての体験でしたが最高の風俗でした。,1,,渋谷の風俗店一覧｜フーゾクDX,http://fuzokudx.com/arealist/show/id/487,1,0
,2,同級生がキャバクラで働いていました,,money,わたしは３０代前半の男性で大学を卒業してから就職の為地元を離れていました。数年後家庭の事情により実家に帰る事となりました。幸い仕事もすぐに見つかり毎日を楽しく生きていました。そんな時仕事の上司に連れられて市街地にあるキャバクラに行きました。（キャバクラというほどの華やかさはなくどちらかというとラウンジのようなイメージです。）あまりそういった店に言った経験がなく上司はお気に入りの女の子とカウンターで二人っきりで話しているのでどうしようかと思っていたら別の女の子が声をかけてくれました。その女の子がわたしを見ると驚いた顔をして小さな声をあげました。わたしはどうしたんだろうと思っていましたがその女の子は中学生高校生時代のクラスメイトの女の子でした。もともとは地味な感じの子だったのでびっくりしました。それから懐かしさもあり学生時代の事や仕事の事現在の事などたくさん話しました。その同級生は家庭の事情により昼の仕事の後週に３日程この店で働いているとの事でした。わたしはその子に会う為にお店に月に２〜３回くらいのペースで通うようになりました。娯楽の少ない地元ではそのこと会うのが唯一の楽しみになってきています。なんとなくですがこのままお付き合いするかもしれません。,1,,渋谷の風俗,http://fuzokudx.com/arealist/show/id/487,1,0
,2,私がはまったデリヘル嬢,,deli,もう4，5年以上前のことになりますが事情があって妻が長く里帰りしていたことがあります。その時期にインターネット上の広告で写真（顔は隠していた）で女性を選べるデリヘルについ電話をしてしまいました。金曜日の夜のことです。たしか90分で3万5千円だったと思います。まあ夫婦で暮らしていた部屋に別の女性を呼ぶのですから少しは罪悪感もありましたがそれよりも若くてセクシーな女性が来てくれるという思いのほうに圧倒されていました。そして来てくれた女性は思ったほどタイプでもなくサービスも型どおりのデューティをこなすという感じであまりいいとは思わなかったのです。それでもその翌々週の金曜日には性懲りもなくまた同じデリヘルに電話していました。そしてその時に来てくれた女性がまさに大当たりというのでしょうか。ショートカットでまあ10人並みの美人。年は25歳ということになっていましたが実年齢だと感じました。見事なヒップとくびれたウエスト肌の白さすべすべさきめ細やかさ素晴らしい女体を堪能できました。そして彼女の唇と舌を駆使したサービスそのテクニックに完全に翻弄されました。性格も愛らしく終わった後の会話も飽きさせず相当の知性が感じられました。こんな女性がお金で来てくれるのであればということでその次の週から毎金曜日は妻が戻ってくる前日まで彼女を呼び続けたのでした。,1,,渋谷エリアの風俗店一覧,http://fuzokudx.com/arealist/show/id/487,1,0
,2,性病にはご注意を,,,無店舗型として店舗を構えずお客側が指定した場所に女の子を送り届けるデリバリーヘルス。最近こういった業者が増えてきています。その背景には店舗側に比べ店に足を運ぶ手間がないためにプライバシーが守られる事が強いと思います。建前上本番行為は禁止されていますがホテルの密室のなか二人きりになるのであらぬ行為に走ることもあったりなかったり???男なんてそんなものです。そこで自分の経験を話してみます。あれは大阪の繁華街友達と年末旅行中の事です。食い倒れの町を一通り終えた後キャバクラも楽しみさて最後はといった状況でした。近くの風俗案内所にいくとお勧めの業者があるということで近くの事務所に行ってみました。事務所の話し方ではそれ以上の行為も･･･的な感じだったので期待しながら頼んでみることにしました。後悔するとも知らずに???。指定されたホテルにつき待っていると女の子が入ってきました。ランクは中の下まあ世の中そんなものです(笑)そして楽しんでいると向こうから『いいよ。』という囁きが???。まあいきますよね。だって男の子だもん(笑)結果お土産をいただくことに。。。これが最初で最後の性病です。自分は独り者でバレるとかはありませんし医者に行ってすぐ治りましたがこれが家庭持ちの方だったら大変な事になりかねません。遊ぶのは悪いとは思いませんが最低限のルールは守って遊んだ方がいいです。向こうが『いいよ』なんて言っても保護具着用は守らねばなりません。まあやらないのが一番なんですけどね。皆さんのもお気をつけて。,1,,渋谷風俗の女の子,http://fuzokudx.com/arealist/show/id/487,1,0
,2,田舎のキャバクラ,,,東北の田舎のキャバクラで働いたことがあった。当時の私は22歳。酒が好きで海外ドラマの「セックスアンドザシティー」の観すぎにより気軽にドレスを着れる生活にあこがれていた。そんなくだらない理由であった。実家から離れた大学に一人暮らしをしながら通っていたので夜の店に居ようとも飲んだくれて街で吐こうとも知り合いに会うことはない。毎日が「旅の恥はかき捨て」状態だったのでキャバクラ勤めを始めるには気楽であった。キャストのお姉さま方は生まれも育ちも地元で…な人から昔は六本木に…銀座に…という人まで。そんな都会にいたのにどうしてここで…？という疑問を持たずにはいられなかった。関東から来た女の子に「都会からわざわざ田舎に来た理由は？」と聞いたところ「彼氏に着いてきたから…」との答え。しかも付いてきたけれど彼氏はＤＶ。関東に帰ろうかと思っているとのことだった。その子は数日後にキャバクラを辞めた。地元密着のキャバ嬢はお客さんとの地元トークが盛り上がるのが強みであるように思った。一度キャストの元彼のお父さんが見せに来たことがあった。接客後接客をしていた女の子がバック（キャバ嬢が控える場所）で大泣きしているのを見た。なにやら「息子が君を傷つけてすまない」と謝られたそうだ。私が働いたキャバクラは女の園だった。土日の繁忙の曜日には美容師にヘアメイクしてもらえたしドレスも靴も借り放題気に食わない客は「私につけないで」とボーイに頼むこともできたしボーイを奴隷のように顎で使う女の子もいた。そんな女の子の中に「ママ」という立場の女がいたがこれが嫌な女だった。カワイイ女の子には優しくスタイルが悪いデブ不細工少しでもそんな要素がある女の子には厳しかった。それで「ママ」なんていう立場でいられることは甚だ疑問であったが下っ端の私にわかるわけもあるまい。私はママから見て「そういう要素」があったので厳しく当たられることが数度あった。「仙台ではナンバー１だった」が口癖の能面みたいな愛想のない女は一年後にナンバーワンの場所に戻っていった。田舎のキャバクラはライバルになるような多店舗も少ないためか客も多くお金をかせぐには簡単な場所だった。若さを武器に席につき適当な話をふって適当に盛り上がり客に好きな酒をねだり時間になったら会計をさせ必要であれば連絡先を好感し客の帰りを見送ってバックに戻る。毎日がその繰り返し人間関係を拗らせなければ業務内容は最高に楽だ。馬鹿でも覚えられるうえに時給が良い。22歳のままでいられるならば私は田舎のキャバクラで金をかせぎ続けたい。,1,,渋谷の風俗,http://fuzokudx.com/arealist/show/id/487,1,0
,32,現在就職活動中です,nobori-s,,私はほぼ毎日ハローワークに行っています。昨年の春に派遣の仕事を辞めてからハローワークにひんぱんに行くようになりました。すっかりハローワークの人と顔なじみになってしまいました。そしてようやく希望の職種の仕事が見つかりました。元の職場の人の紹介でした。しかし条件は５ヶ月間の短期の仕事でした。結局そのあとの延長はなく５か月で終了となりました。失業給付が少し残っていたもののその後なかなか仕事が決まりませんでした。今年に入ってからも決まった仕事は１カ月の短期のアルバイトでした。そして今また就職活動をしています。先週２か所の面接に行きましたが残念ながら両方不採用でした。あまりに長く就職活動が続いているとまた不採用になるのではないかというトラウマのようなものがでてきます。なんとか自分を奮い立たせてハローワークに通い続けて求人票をチェックしています。自分ではもう就職活動をしないでいいような期限なしのところに就職したいと思っています。就職活動に割く時間もバカになりません。希望の業界はありますがそれほど希望条件は高くないのですがいまだに決まっていません。そしてまた明日以降もハローワークに通い続けます。,1,,のぼり印刷,http://www.seriart.co.jp/?,1,0
,32,アルバイトに甘んじることなかれ,officework,,個人的にアルバイトの環境に慣れてしまうと人間は常に自分はこの程度の人間だと思ってしまいがちです。そうなってくると巡ってきてくれるべきお金も回ってこないし自尊心も育たないしでいいことはありません。今現在でも就職活動をきちんとして企業に入ることが望ましいと思われていますからそれをいやがってアルバイトに甘んじるのはとても危険だといえます。もちろん他にやりたいことがあってアルバイトで生活しながらやりくりしているという人もいるでしょう。そういった人たちを非難するつもりはありません。ただしアルバイトを続けていいことがあるかというと経験上あまりそうは言えないわけです。まず収入の面でまったくもって差が出てしまいます。将来のお金も変わってくるわけです。女性は特に年齢を重ねるごとに働けなくなりますし男性よりも長生きしますからそれだけ仕事をしなければいけないことになります。仕事ができる範囲は限られていますので他の方法でお金を担保する必要があるわけです。だからいつまでもアルバイトをするというわけにはいかないだろうなと個人的に思ったりします。今はアルバイトからの正社員登用とかもあるのでアルバイトから次のステップというのも考えるべきことだと思います。,1,,のぼりの印刷・製作なら専門店のセリアートへ,http://www.seriart.co.jp/?,1,0
,32,アルバイト経験は社会人になっても生かされる,inpakutokoukoku,,アルバイト経験って履歴書に書けないことが多いですが社会人になっても確実に生かされると思います。私も大学の頃には幾つものアルバイトをしましたが社会人の今でも本当にやってよかったと思っています。その理由はアルバイト経験って仕事の基礎だからです。例えばアルバイトでも職場の人と挨拶をしたり仕事上で話をしたりすることもあります。また仕事の進め方も大きく見れば正社員と変わらなかったりもします。特にアルバイトも入りたての頃は先輩に指導をしてもらいドンドン上達をしてきます。それは正社員でも同じなので入ってから仕事を覚えるまでのステップはアルバイトと変わりません。それからアルバイトをする事によりいろいろな業種の事を知る事が出来ます。例えばスーパーでアルバイトをすれば販売のお仕事全般に繋がる経験が積めます。レジうちにしても品だしにしても他の販売業でも必要な経験なのでアルバイト経験を積むことにより良い社会訓練になります。そしてそれ以外の業種でも同じことが言えるのでアルバイトって決して無駄なことではありません。つまりアルバイトの経験を参考にしていけば自分とマッチする仕事なども見つけやすいと思います。,1,,のぼりの印刷・製作ならセリアート,http://www.seriart.co.jp/?,1,0
