Post.id,Post.genre_id,Post.title,Post.pagename,Post.menu,Post.content,Post.public,Keyword.id,Keyword.keyword,Keyword.url,Keyword.visible,Arbitrary.keyword
,32,向いていたアルバイトについて,shigarec,,私が向いていると感じたアルバイトはこつこつと作業をする仕事ですね。例えば工場や物流倉庫のアルバイトは長く続きました。私は以前食品の工場でアルバイトをしていましたが結構自分には合っていましたね。特にこつこつ作業をする仕事って向き不向きがある物だと思います。合っていない人がすればそのような仕事って時間が経つのが大変遅く感じるそうです。そして私自身は一つ一つの商品が出来上がるのを見ると楽しく感じたので苦痛ではありませんでした。それから他に向いていたと感じるアルバイトは意外にも接客のアルバイトでした。私は人と接するのは得意ではありませんがアルバイトとしてはきちんと働けました。その理由は接客のアルバイトってマニュアルが定められていることが多いです。そんなわけで人と接するのが得意ではない人でも案外働ける事が多いですよ。私もはじめは苦手意識を持っていましたがやってみると結構長く続きました。特に私はコンビニとスーパーのアルバイトをしていましたがどちらも楽しいとさえ感じました。このように向いているアルバイトっていくつかあると思うのでそれを参考にしていけば自分の向いている分野も分かってくるはずです。,1,,滋賀のアルバイト情報,http://2010-shiga-kyujin.com/,1,0
,32,就職で優先させるもの,,office,就職といえば昔は一生の方向性を定める重大事でしたが就職難であったりブラック企業の問題であったりの様々な状況によって就職する段階ではまだその会社にどれだけ自分の人生を預けていいか分かり難い時代になっています。そんな中で就職しようと思ったらまず自分の中にある程度の基準が必要だと思います。多くの人にとって就職は生活を安定させるための手段であると思いますが好きでもない仕事を毎日続けているうちに心が病んでしまっては安定どころではありません。もちろん人によっては好き嫌いとは関係なくお金を稼ぐ手段として仕事ができる人もいるでしょう。まず自分がどういうタイプなのか何に価値を置いているかを見定める必要があります。生活できるお金があれば後は自由にできる時間の方がいいとかとりあえず遊ぶにもお金は必要なので仕事時間中はバリバリ頑張れるとか自分のやりたいことと仕事に求めるもののバランスを自分なりに考えてから就職活動をしていくと入ってからの失敗が少ないように思います。楽に稼げる会社に入りたいという優先順位が全部最大というタイプの人はどこでも苦労すると思うのでまずは自分を見つめなおすところからはじめた方がいい結果に結びつくと思います。,1,,滋賀エリアの求人,http://2010-shiga-kyujin.com/,1,0
,32,仕事をしていてやりづらいと思うとき,,school,アルバイトや派遣も含めて仕事っていろんな職場があります。私も数多くの職場で働きましたがその中でも働きやすいと思うところやそうじゃないところがありました。そして働きにくいと感じる職場はあまり仕事を教えてくれない場所です。これはアルバイトも含めて結構多いのでみなさんも経験があると思います。特に今までに経験がない業種で仕事をすると分からないことだらけですよね。そんな中であまり仕事を教えてもらえないと仕事が出来なくて困っちゃいます。特に多いのは見て覚えろという人です。単純な作業ならできるのですがちょっと複雑な作業は見るだけじゃ分かりません。そのためはじめはしっかりと教えてもらいたいですよね。他にも職場によっては十分に仕事を教えないのにいきなり現場に出されることもあります。そんな職場って案外多いのでやりづらいと感じることも多いです。そしてそれでも少しでもましに働くためにはやはりメモを取る事が大事です。全てではなくてもメモをすれば多少頭には残るので絶対に忘れてはいけないことですね。このように仕事をしていてやりづらいという職場は多いので自分達で何か対策を考えていくしかありません。,1,,滋賀のバイト検索サイト,http://2010-shiga-kyujin.com/,1,0
,24,一度止めた会社に就職する。,,live,色んな都合で会社を辞める人が居ます。自営業とかを始めたり転職したり色々ですが前に働いていた会社に戻るって悪く無い選択なんですよね。気まずいから戻れないと言う人もいます。その会社の辞め方によってはそういうケースもありますが会社にとっては基本的には嬉しい事です。特に中小企業の場合は即戦力を求めざるを得ません。働くスキルの低い人を育成していく余裕は無いですからね。でも以前働いていた人であれば知った仲でもありますし大体の事は働く側も知っているのでわざわざ説明したり教えたりする必要もありません。私が以前働いていた会社からは未だに勧誘が来ます。社長と顔見知りだったのもありますが最近どうなのか？という話から始まりもし戻りたかったらいつでも言ってくれと終わります。人情味の厚い人なので心配してくれてと言うのもあるのでしょうが要は戻ってくれという事でしょう。まぁまぁかそれ以上と言う前提条件みたいなのはあるかも知れませんが長く働いた人には戻って来てほしいと言うのが会社の人達の本音のようです。就職難と人手不足が混在している昨今では中々うまい話ではあると思いますね。昔は戻るというのは良い事だとは言われませんでしたが今はそんな事はないようです。,1,,滋賀のアルバイト情報,http://2010-shiga-kyujin.com/,1,0
,24,転職はもう大変です,,cosmetic,このあたりは仕事をしてきた人ならいいのかもしれませんがはっきり言って転職なんてすぐにできるものではありません。もちろん転職活動をすると決めたらきちんとサイトに登録するなりハローワークに行くなりすることが大切です。転職を成功させるためにはまず自分を知らなければいけなくてそのために自己診断とか就職活動に似たこともしたりします。でも転職で大変なのはマッチングなのであって就職活動とは違う自己分析が必要になってくることなんです。よく言われる自分にできることの棚卸しっていうのもくせ者でこれが役立つ会社ってどこだろう？なんて上手く合うことはほとんどありません。だから希望の業界等があれば自分から合わせにいくくらいしないと正直厳しいと思います。転職する人の多くは今よりも給料のいいところに進みたいという気持ちが強く職種よりもお給料って人も多いですよね。個人的には自分のやりたいことをしたいので転職したのですがやはり未経験だし苦労も多いですよ。今の会社でまだ出来ることはないかといった棚卸しもちゃんとしてみてから転職とかは検討した方がいいと思います。もしかしたら社内で上に行ける可能性もあるかもしれません。,1,,滋賀エリアの求人,http://2010-shiga-kyujin.com/,1,0
,20,プラモデルをひたすら組み立てるアルバイト,,,大学生の頃に経験したアルバイトで「プラモデルをひたすら組み立てる」というアルバイトをしたことがあります。大学のOBから紹介されたアルバイトなのですが履歴書を提出しておこなったアルバイトではありませんしいわば内職的なアルバイトであったと言えるかも知れませんね。ガンダムっぽいようなエヴァンゲリオンっぽいようなそんなロボットを組み立てるアルバイトです。細かい色づけや武器を持たせたりなどの本当に細かい仕上げ作業は私の雇い主である人がやっていたようですね。私が担当したのは大まかな骨格のみを組み立てるアルバイトです。その前に各パーツを切り離すことも私の仕事ではありました。ここで驚いたことは手でパーツを切り離してはダメなところでしたね。「当たり前だ！」と突っ込まれるかも知れませんがプラモデルは子ども時代で止まっていてそれ以降はプラモデルには全く縁のなかった私からすればちょっとビックリしたことだったのです。なんでも手で切り離すとまっすぐに縦にはプラスチックが切れないことがあるためきちんとハサミでパチンと切り離す必要があるそうです。またハサミで切り離さなかった場合そこからひび割れて肝心のロボットのパーツにも影響が出ることもあるのだとか。当時は「こんな知識今後は使わないだろうなぁ」などと思ったものですがちびっ子の親となった今このアルバイトで得た知識が結構役立っていますので人生とはわからないものですね。,1,,滋賀のバイト検索サイト,http://2010-shiga-kyujin.com/,1,0
,20,私が今までに体験したお仕事,,,私は今までに何回か転職していてアルバイトや正社員を経験してきました。仕事の種類も色々で飲食関係から医療系夜のアルバイトも少ししたことがあります。若いころは好奇心も旺盛でいろんな経験をしてみたいのもあってたくさんの仕事をしました。楽しかったのは飲食関係で年齢も同じくらいの人が多かったので仕事をするのがとても楽しかったです。それに厨房の人からいろいろ作り方を教えてもらったりもしたのでとても勉強になりました。居酒屋で大将に教えてもらったおつまみはいまでも大活躍です。医療系では資格のいらない歯科助手をしていました。それは自分に向いているなと思いがんばって経験を積み正社員でも長く働きました。だいたいは先生のアシスタントをするのですが歯医者によっては受付をしたりちょっとした作業なんかもします。患者さんとも仲良くさせてもらいとても楽しかったです。先生もとても優しい方だったので仕事もすごくやりやすかったです。出産で退職したのですがまたぜひ復帰してやってみたいお仕事です。でもやっぱりどうせ働くならアルバイトパートより正社員で働きたいです。社会保障も充実してますしボーナスもありますしまた子供が出来た場合は産休をとれるところもあります。またバリバリ働きたいなと思います。,1,,滋賀のアルバイト情報,http://2010-shiga-kyujin.com/,1,0
