Post.id,Post.genre_id,Post.title,Post.pagename,Post.menu,Post.content,Post.public,Keyword.id,Keyword.keyword,Keyword.url,Keyword.visible,Arbitrary.keyword
,32,インパクトのあったエントリーシート,entrynobori,,このような私が若い学生さんたちを審査するなんて非常に申し訳なく感じつつも仕事ですからとエントリーシートの審査をしていたことがあります。エントリーシートは形式張った履歴書とは違って私の会社の場合はある程度自由に書ける仕様でした。そしてエントリーシートに記載するお題のうちひとつは「アピールしたいことを自由に書いてください」といった感じで本当に応募者に委ねるといったいわばフリースペースのような箇所もありましたね。しかし一応罫線は引いてありますのでほとんどの人は小論文的に書いてきていました。しかしなかには絵画を描いてくれた人もいるのです。私がこれまで見てきたエントリーシートのなかでももっともインパクトがあったエントリーシートでしたね。なんと言うのでしょうか画力には迫ってくるものもありました。荒野にスカイツリーのようなものが立っている風景だったのですがやはり文字ばかりのエントリーシートのなかでの絵画はとにかく目を引きましたね。筆圧も厚くて軽く触ったら手には鉛筆の黒いのがついてきたのを記憶しています。その上に重ねていた他の人のエントリーシートの裏もかすかに黒くなっているほどにそのエントリーシートは主張していましたね。結果はさておきそのエントリーシートにそこまで注ぎ込んだということがすごいなぁと単純に思いましたね。,1,,のぼり印刷,http://www.seriart.co.jp/?,1,0
,32,お見合いパーティーの運営スタッフ,,travel,以前お見合いパーティー運営のアルバイトをしたことがあります。インターネットでアルバイトを探していた時に偶然見つけた案件だったのですが元々イベントの運営が好きだったのとあまり見かけない仕事内容ということもあって興味が湧き応募してみましｈた。具体的な仕事内容はパーティーに参加する方へのご案内誘導ドリンク提供片づけなどです。実際私も以前参加者としてお見合いパーティーに出席したことが１度だけあったのですがパーティーを運営しながら人間観察をしていると興味深い場面を度々見かけました。自分が女性だからかもしれませんが男性は自分のイメージとあまりかけ離れていなかったのですが女性の態度の違いにびっくりさせられることも多々ありました。男性にはステキな笑顔を振りまいていたかと思ったのに運営している私達が話しかけても完全に無視したりする女性気に入らない男性との会話は相手の方へ体も向けず目も合わせずなのに気に行った男性との会話はきちんと向き合って満面の笑みで話す女性など見かけることがありました。その度に女って怖いな〜と実感したものです。そのアルバイトの経験から他人と接する時は気をつけて接しなければと日々自分に言い聞かせています。,1,,のぼりの印刷・製作なら専門店のセリアートへ,http://www.seriart.co.jp/?,1,0
,32,転職は、転職先の風土にいかに慣れるかがキーポイント,,office,私は数年前に転職をしました。以前勤めていた会社が不況の煽りで倒産し転職をせざるをえなくなりました。最初は戸惑いどうしようと思いましたが求人雑誌インターネットでいろいろと探しいくつかの会社の面接を受けました。数社面接しようやく今の職場に。最初は以前のスキルを活かせる職場だと思い選んだつもりでしたがシステムも違うし同じ業種でも進め方が全然ちがうのです。それよりもまず思ったのが職場風土が全然違うということ。朝礼は必ずあり月に１回の全体会議があり社員旅行がありスポーツ大会があり。以前の会社は全体会議はあったものの朝礼なし社員旅行なしスポーツ大会なんてありませんでした。会社によっていろいろと違いはありますがまずこういった会社の企業風土になれるということが勤めてみて実感しました。最初は業務を覚えるということが重要ですがその企業風土に慣れるということが重要だと思います。よく野球の世界で外国人が日本になれたほうが成績を残すといいますが転職もそれと同じように感じます。早くその企業風土になれたほうが成績を残す。逆になれないと辞めてしまうということになってしまうと思います。,1,,,,1,0
,24,仕事では人に頼るのも大事,,live,例えば仕事で重要な責任あるポジションを任せられた時に自分の力を見せようとしてはりきることはよくあることと思います。自分の力を見せようと思うと自然と他人に何かをさせるよりも自分で納得いくまでやりきりたいと思うこともあるわけですが問題は自分にその能力があるかどうかだったりします。もちろん仕事を振った人はその能力があると見込んでくれているのだとは思いますがその能力の中に自分ひとりではなく周りの人も適切に動かせる能力というのもあるかもしれません。自分に責任がのしかかる仕事を他の人に任せるのはなかなか勇気のいることですが周りの人を信頼して一緒に仕事をするというのは会社で仕事をしていく上では重要な能力です。ひとりで何でもしようとすると必ずどこかで無理が生じます。なるべく早いうちに人への頼り方も身に付けておいた方が仕事をしていく上で役に立つと思います。それで失敗することもあるとは思いますがそこでの失敗とその解決もまた必要な経験になってくるはずです。自分の失敗を取り戻すよりも他人の失敗を回収することの方が手間がかかって面倒ですがそういう能力を身に付けた人が組織で上にあがっていく人になるのではないでしょうか。,1,,のぼり印刷,http://www.seriart.co.jp/?,1,0
,24,またやりたい治験モニターアルバイト,,collect,結婚して専業主婦になった今「またやりたいなー」と思うアルバイトは治験モニターのアルバイトです。結婚に際して仕事をやめてもう2ヶ月が過ぎました。ですから「もうそろそろ働きたいなー」と思う頃ですね。しかし前回の職場のようにハードワークですと家事に支障が出てしまいますからそこそこに働きたいのですよね。そうするとフルタイムの正社員勤務ではなくやっぱり短時間のアルバイトです。けれども専業主婦というありがたい身分ですから私の稼ぎに生活がかかっているわけではありません。しかし「なんらかの仕事をして社会に関わっていきたい」という欲求は最近では出てきてしまっているのです。もう無職になって二ヶ月も経ちますからね。そして思い出すのは学生時代にときどきやっていたあのバイトです。そうです「通称：治験バイト」です。治験バイトは決まって日時に会社へ行って採血健康診断を受ければ良いという非常に簡単なアルバイトです。しかし内容に反して報酬が高額なことでも知られていますよね。私も時間に融通のきく学生時代にやっていました。大学のOBOGの紹介ということもあるのですが求人情報誌に出てても人気が出るアルバイトだと思います。ただバクチ的なところはありますから具合を悪くする可能性もないとは言い切れない点が難点でしょうか。,1,,のぼりの注文もできます,http://www.seriart.co.jp/?,1,0
,25,ハローワークでのアルバイト探し,,,私は何度かアルバイトを探したことがあります。求人情報誌でも探すのですが今回はハローワークでのアルバイト探しです。ハローワークでもアルバイトの求人は出ています。職種を絞る時に休日を「日月火」などの３日以上で条件検索すると短期のアルバイトも見つかることがあります。これは意外と穴場です。そもそもハローワークに短期バイトを探しに来る人はあまりいないので長期バイトを探すついでに短期バイトを探しておけば長期の仕事が見つからなくても短期バイトでしのぐ事が出来ます。さてこの短期バイトいろんな仕事があります。私が見たものでは和菓子の販売餅つき機の実演アンケート回答者を抽出して回答してもらうバイト棚卸のバイトなど実に様々です。また１ヶ月単位のアルバイトもあります。プールの監視員イベント運営などこれも様々です。ハローワークを利用しての応募なら面接の申し込みの電話はハローワークの人が掛けてくれるので安心です。さらにハローワークでは履歴書の書き方もアドバイスしてくれます。求人票を窓口に見せる時に「履歴書の書き方に自信がないんですけど…」などといえばアドバイスしてくれます。ただハローワークの求人は急ぎのものもあるので履歴書の学歴職歴資格趣味特技欄はあらかじめ記入してからハローワークに行く事をおすすめします。,1,,のぼりはお任せ,http://www.seriart.co.jp/?,1,0
,25,アルバイトは大変だったけれど,,,アルバイトを始めるときは凄くドキドキするものです。面接の電話は声が裏返りそうになるし面接のときはひたすらドキドキしてしまい何を話したのか全く覚えていません。結果私はコンビニでアルバイトをすることになりました。家からも近くて疲れたときもすぐ帰れるのがいいなと思いました。しかしアルバイト先が決まったとはいえ安心はできません。色々なことを覚えなければいけないし先輩や同期ともちゃんと話をしなければなりません。最初は緊張しっぱなしでしたが先輩たちが話しかけてくれてなんとかなりました。あのとき先輩たちが話しかけてくれたおかげで私はアルバイト先に馴染めたと思ったので後輩が入ってきたときに今度は私が後輩に話しかけました。先輩から教えてもらったことを後輩の私が受け継ぎそれを私の後輩が受け継いでくれたらなと思います。アルバイトの中身についてですが思った以上に覚えることがたくさんあって大変でした。アルバイトをここにしたのは失敗したかなと思ったこともありましたが周りがみんないい人たちだったためここは離れたくないなと思い一生懸命覚えました。アルバイトは大変なことばかりじゃないと思えました。,1,,特殊清掃の神奈川,http://www.tokusyu99.com/,1,0
,32,一人暮らしで住みたいと思う条件,osouji,,一人暮らしをする際に住んで見たいと思う物件の条件ってまた変わってくるはずです。私も現在はひとり暮らしをしていますが家族と暮らしていたときとは求めるものが変わってきますね。それは一人暮らしの際は都心の近くなど便利なところに住みたいという事です。実家や家族と暮らす際はやはり閑静な住宅街に住みたいと感じますが一人の際は便利さを求めてしまうことが多いです。そして一人の場合は広い間取りの部屋に住まなくても良くなるので物件を選ぶときの選択肢は増えます。これが家族と一緒に住む場合ならば都心部は諦めなくてはいけませんよね。そのため一人暮らしをする際はなるべく都心の物件を選ぶようにしています。そして今私が一人暮らしをしているのも都心の駅から２駅の最寄り駅の地域です。それによって通勤もショッピングもデートも便利に行えています。また一人暮らしなので狭めの物件に住んでいますが普段の生活でも全く不便はないですね。このように一人暮らしで住みたいと思う地域や物件は比較的自分の思い通りになることが多いです。それにより自分の生活を何段階も便利にする事が出来るので一人暮らしって結構楽しいですよ。,1,,特殊清掃なら特殊清掃救急車-東京・神奈川・千葉・埼玉対応,http://www.tokusyu99.com/,1,0
,32,一人暮らしを始めた時の話です,fukifuki,,ずっと実家暮らしもなんか嫌だったので母が亡くなって兄が奥さんと一緒に同居を決めたのもあって一人暮らしを始めました。どうしていいかわからなかったので既に一人暮らしを始めている友達に相談してみました。とりあえず「保証人がいればどうにかなる！」と言われ兄に保証人になってもらう事にしました。父はもう退職していたので保証人としては難しかったのです。兄の奥さんは「保証人なんてロクな事にならないんじゃないか」と難色を示したのですが「じゃあこれからも私は実家に住み続けるよ」と言ったら「保証人になってもいいから早く出てって」と言われました。自分の家なのに追い出されるみたいでなんだかすごく嫌でしたが保証人にはなってもらえてよかったです。実家の近くはあんまり一人暮らしのアパートがなくて苦労しました。不動産屋も３軒くらいまわりました。１軒目では「女性の初めての一人暮らしですか…実家の近くでね…ウチはちょっと紹介できません」と断られてしまい悲しかったです。２軒目は「すいませんその近辺であなたの条件に合った物件がウチにはないんです」と言われ３軒目でやっと「その条件だったら２つしか物件がないのですが…」と言われ家賃の安い方を選びました。ワンルームのアパートです。住んでみたら道路や工場が近くて騒音がにぎやかで住みにくかったです。でも転職するまでそこに住みました。,1,,死臭の脱臭,http://www.tokusyu99.com/,1,0
,32,私の家,pika2room,,私は今賃貸アパートで生活しています。夫婦二人で生活するのには充分だと思っています。アパートの敷地内が広々としていて駐車場も広いです。近くに学校があるので治安もいいですし住みやすい場所です。部屋は1ＬＤＫですが今のところ二人なので足りてます。子供が出来たら確実に部屋が足りないと思います。私の住む街では一戸建ての持家の人が多くて賃貸だと家賃が高いのです。田舎町なのにこの家賃は高すぎです。都市部とあまり変わりないのが一番の不満です。それでも私達は気に入って借りたので住んでいますがもっと安い所があれば引っ越しも検討すると思います。一軒家を建てるのも考えましたが維持していけるか不安な面もあって断念しました。ほんとはお庭がある家に住みたかったのですが無理そうなので諦めます。今のアパートは見た目がオシャレなので友人に羨ましいと言われるのがちょっとした幸せです。都会に住んでいる人はもっともっとすごい家に住んでると思いますが。。。田舎ではこれで充分なんです。私は今の生活に満足しているのでこの状態を保ちつつ安心できる家であればいいかなと思います。旦那さんが仕事から帰ってきて疲れが癒えるような空間を作るのが私の仕事ですね。,1,,特殊清掃の神奈川,http://www.tokusyu99.com/,1,0
,32,中古マンションのリフォーム願望,,recycle,20代の頃に諸事情により親戚から譲り受けた中古マンションがあります。そして最近「使っていないにも関わらず毎年そこそこの金額の固定資産税を払い続けていくのも勿体ないよなぁ…」との思いが強くなっています。そこで本格的にこの中古マンションのリフォームをおこなってそして私が住んでしまおうとも最近では考えるようになりました。会社へのアクセスを考えるとなかなかスムーズではない場所にあるマンションなのですが使う駅を変えれば会社への通い辛さは多少は解決されますしそれよりなにより毎年かかる私にとっては無意味な固定資産税がネックとなっていました。かといって売却したくてもタダ同然の価格でないと売れはしないと思いますし。そういうわけで最近ではリフォームに関する雑誌を見たりインターネットで調べたりBSのリフォーム番組を録画して見たりと新たな趣味が見つかったように結構楽しんでいますね。いつリフォームするのかリフォームの予算がいくらなのかといったリフォームに関する具体的なことは何一つ決まってはいないのですがあれこれ考えたり情報収集したりしているだけでも楽しいですね。それにやっぱり新築マンションを購入するよりも中古マンションをリフォームする方がお得なようですし真剣に検討していこうと思っています。,1,,特殊清掃なら特殊清掃救急車-東京・神奈川・千葉・埼玉対応,http://www.tokusyu99.com/,1,0
,32,新しい家への引越し,,office,新しい家に引っ越すには引越し業者に依頼をしなければならない。以前引越しをした際は弟がトラックを仕事上運転することができなおかつ引越しを手伝えるということで弟に手伝ってもらい行ってので引越し業者には頼まずに引っ越すことができた。しかし今回は弟が仕事の関係で手伝うことができないということで引越し業者に頼むことになった。どの業者が良いのかいくつかの業者のホームページを検索し安そうな業者を探した。どの業者も大きな差はあまりなくとりあえず2つの業者に絞り見積に来てもらった。そして見積もりを出してもらったところでそこから値引き交渉を行った。まだどちらの業者に頼むかは決めていないため安くしてくれた方と契約する形を取った。ことらが優位であるため強気に半額以上値引きしてくれるように交渉した。なかなか「はい」とは言わないものの「下げてくれたらそちらの会社にお願いしますよ。」と言い上層部に相談させた。結果1つの会社が見積もり金額の半額以下の金額で引き受けてくれることになった。意外と簡単に安く出来たので拍子抜けしたが予定金額より大幅に減らすことができたのでとても助かった。次回引っ越す際も値引きはしようと思う。,1,,死臭の脱臭,http://www.tokusyu99.com/,1,0
,32,3Rのオススメ,,fudousan, 最近なんだかやる気が出ない疲れが溜まってるのかな温泉やスパに行ってもその時だけスッキリして長続きしないそんな気分になったことありませんか？ いっそのこと引越しできれば気分が変わる？でも今の場所は気に入っているしなんてグズグズのルツボにはまっていませんか？ そんな時オススメしたいのはおうちのリフォームです。といっても出費はピンからキリまでです。後で薄くなったお財布を見て余計にブルーになっても行けませんから事前の検討は大事です。 あなたが家の中で一番長くいる部屋はどこですか？まずはそのお部屋をリフォームして見ませんか？場所はどこでしょうか？寝室ですかキッチンですか？それともリビングでしょうか？広さによってリフォームするものも違います。インテリアのカタログを集めましょう。無料でカタログを出しているメーカーもありますしショッピングに出かけた際にいつもは立ち寄らないインテリア系のショップに立ち寄って見たらいかがでしょう。 えっいつもそのようなウインドショッピングしてるから気晴らしにならないわという方いつもより真剣に取り組んでください。 漠然とインテリアを見て歩くのではなく実際の置き場所を想像してサイズを検討したり購入する時の金額も計算してホラいつもと緊張感が違うでしょ？いつもと違う緊張感置き換えれば適度なストレスが倦怠感からあなたを解放してくれると思います。リフォームを考えることでリフレッシュして快適な場所でリラックスしてください。生活の質(クオリティ オブライフと最近はお医者様もおっしゃいます)が向上すると思いますよ。まずは計画から。,1,,特殊清掃の神奈川,http://www.tokusyu99.com/,1,0
,25,賃貸vsマイホーム,,,このまま賃貸にすべきかマイホームにすべきか社会人になってある程度の年数が経ったり結婚や子どもの誕生など自分の生活環境ががらっと変化するときこの問いかけで頭を悩ませる方も多いと思います。私の場合は結婚相手が比較的広いマンションに一人暮らしをしていたので結婚直後はそこに引き続き住むことにしました。彼は引越しをして新生活をスタートさせたかったようですが引越しだけで６０万円ほどかかるとわかり断念したのです。転機が訪れたのは家の更新時期が近づいてきた頃。入籍から１年経った頃でした。冒頭の問いに同じくらいの家賃を払うなら自分のものになるほうがいいという私の主張と彼ももしも転勤ということがあればそこを貸せばよいという考えがあったので我が家の場合は「このまま賃貸vs何が何でもマイホーム戦争」は勃発せずすんなりマイホーム探しに移れました。その念願のマイホームを購入して８ヶ月以上が経ちます。毎月のローンの支払い額が賃貸の時とそこまで大きく変わらないこと家自体もやはり賃貸と分譲では構造が違うのか冬は暖かく夏は涼しくとても快適ですしそもそもの設備もしっかりしています。それに何より「自分の家」という思いいれがあるせいか生活を大事に考えるようにもなりました。「賃貸vsマイホーム」迷っている方にはぜひマイホーム購入を前向きに考えていただきたいと思います。,1,,,,1,0
,25,大好きな家で大好きなものに囲まれて暮らしたい,,, 私は主婦なので自宅にいる時間がとても長いのですがもともと家で過ごすのが好きで休み日もあまり出歩かずになるべく家にいたいと思っています。そのため家を居心地よく整えることは私にとってものすごく大切なことです。好きな家で好きなものに囲まれて家族と過ごす時間は何よりも癒しになります。 我が家は中古の注文住宅です。子供が生まれたのを機に一戸建ての家を買おうということになり主人と一緒に不動産屋さんを周り内見もたくさんしてやっと見つけたこだわりの家です。どうせ住むなら愛着を持ってずっと住んでいける家がいいと決めていました。 そんな家なので自分たちで色々と手をかけるのがとても楽しいです。最近凝っているのは簡単な家の修理でウッドデッキやフローリングにニスやワックスを塗ったり先日は庭にレンガを敷いて小径を作りました。大掛かりなリフォームや修理は専門業者に頼まなければできませんがちょっとしたことはなるべく自分でやりたいと思いますし常に何か家のことをしていたいと感じています。 私達家族が成長していくようにこの家も成長して変化していくのだろうなと思います。もっともっと住み心地のよい家にしていくつもりです。,1,,死臭の脱臭,http://www.tokusyu99.com/,1,0
