Post.id,Post.genre_id,Post.title,Post.pagename,Post.menu,Post.content,Post.public,Keyword.id,Keyword.keyword,Keyword.url,Keyword.visible,Arbitrary.keyword
,32,IT企業のセキュリティーに関する取り組み,,office,IT企業に訪問する際良く入る前に自分の名前や企業名そして入館日時を記載する紙を書くように頼まれると思います。IT企業の一つの決まりとして貴重なデータを扱う場合部外者が室内に入る場合身元を確かめる必要があります。入る側からするとただ先の3つや入館目的などを書く紙を記入するだけですが企業側からすると入館時間を確認しそして退館時間も記載する必要があり部外者がどのくらい室内にいたかも分かるように書かないといけません。この入退館手続きだけでなくこの紙の保存そして月に1度セキュリティーの大本である本社に先の資料を届ける事をしないといけません。これにより入退管理だけかなりの手間をかける必要があります。他にはパソコンなどの管理だ。取引先に派遣されてるスタイルの場合自社のパソコンの持ち運びは重要だとされています。ただしその中には取引先のデータも入っている為パソコンを紛失すれば取引の打ち切りにまで発展するリスクを背負っています。その為少しでも手放す場合足元に置くビールなどをアルコール製品を飲んではいけない。万が一紛失した場合自社のマネージャーに連絡し詳細を伝えるなどの処置を行う必要があります。,1,,SEO対策のサービス一覧,http://seoanswer.jp/,1,0
,32,今の会社で長く在籍する方法,,school,今の会社に入社して15年になります。その間につくづく難しいと思った事は仕事の内容よりも人間関係です。他人と一緒に仕事をする事がこんなに難しいとは思いませんでした。まぁ所詮は他人ですから考え方もいろんな人がいるわけですよね。忙しそうに仕事をしている隣で暇そうにしている人もいます。人の仕事の出来具合とか対応の仕方を教育もきちんとせず他の人に愚痴を言う人もいます。自分は挨拶をしないのに人には挨拶を求める人もいます。いつもお金の事ばかり言ってくる人もいます。当然の事ですがみんな自分の事ばかりです。いちいち全てに腹を立てていては自分がしんどくなります。15年の間にたくさんの人が入社しては辞めていきました。ですが今さら他の会社を探すのも面倒ですし。履歴書を何度も書き直してドキドキしながら面接に行くのもイヤですし。なにより年齢的にも就職難の今せっかく勤めている会社を辞める勇気もありません。それにどこの会社に行ってもたぶん同じだと思います。だから今の会社で自分がどこまで我慢できるかではなく快適に仕事ができるように自分の考えを変えていかないといけないんでしょうね。イヤな事は深く考えず浅く流し何事も前向きに考えるようにしようと思います。やっぱり自分の気持ち次第なんでしょうね。,1,,SEO対策,http://seoanswer.jp/,1,0
,12,無口な上司,,poster,私の上司は無口で普段何を考えているのか全く分かりません。しかし仕事の指示は的確で部下を叱責する場合は感情的にならず何が悪かったのかを具体的に淡々と説明するといった感じです。そんな上司を私の同僚は不気味だと言いますが私はそうは思いません。人には性格というものがありお喋りな人も居れば無口な人も居ます。それは個性であって誰もが尊重しなければいけない部分であると思います。私の上司はたまたま無口な性格でしかし仕事はそつなくこなすため重役からの信頼を勝ち取ったのだと思います。私は上司のようなビジネスマンになりたいと密かに思っています。無口な部分は同じですが仕事に対する要領の良さでは上司に全く歯が立ちません。それは経験年数の問題で仕方ないとは思いますが何か根本的な部分で私は上司に敵わない気がしてなりません。上司はどんなに忙しくても決して感情的にならず部下の失敗にもおおらかですが私はそれとは対照的に忙しければイライラし後輩が失敗をすれば声を大きくして叱責する場面が多々あります。上司は感情のコントロールが非常に優れておりその術を会得する事ができれば私も上司に一歩近づく事ができるのではないかと思っています。,1,,SEO ANSWER | 東京渋谷のSEO対策会社,http://seoanswer.jp/,1,0
,12,オフィス環境について,,biz,事務仕事の場合職場にいる時間が長時間です。仕事するには机と椅子とパソコンがあれば大丈夫という職場も中小企業を中心に多いですがやはり働くモチベーションを保つには素敵なオフィスの方が俄然やる気は出ると思います。部屋の中に観葉植物がたくさん置かれていて窓からは植物や近所のビルや空も見えるという環境。実際はまぶしくてブラインドを下ろす時間が長かったりそんなに外の景色を見る暇も無かったりするのですが。でもそういう開放感ある環境にいると感じるだけで心理的に影響されるものはあると思います。おしゃれなオフィス街で働くとお金はかかりますが昼何を食べに行こうか？帰りはどこに寄り道して帰ろうかなじゃあなるべく仕事を早く終わらせるように頑張ろう！というような心理にもなります。仕事中にそんな事考えている暇はないという人もいるかも知れませんが毎日ルーチンワークを行う業種の場合そういう楽しみで少し心に変化を起こすこともできるのではないかと思います。なので一見重要に見えず経営者側としては一番削減したいと思っている部分はもしかしたら働く側にとっては一番重要な部分なのかも知れません。,1,,SEO会社の成果報酬について,http://seoanswer.jp/,1,0
,12,上司同士で高め合うことが大切,,,もしも自分が上司になったならば上司同士で至らない部分を指摘し合いお互いを高めていかなければなりません。上司が部下に至らない部分を直接聞いたとしても上司の前では本心を話せるわけありませんから本当の至らない点はわからないです。しかし上司同士であればどちらも基本的には同じ立場ですので部下よりはある程度本音で話すことができ仕事をどうやって進めていけば良いのかの参考にすることができます。ここでいけないのは上司同士でキズをなめ合うことです。そこで「最近の若い奴らは」と部下側を責めても問題の解決にはなりませんのでそうするのではなくたとえ部下に至らない点があったとしてもどうやったら上司がそれを正せるのか考えていかなければならないのです。上司だ部下だと役職は分かれているのかもしれませんが対外的に見れば同じ会社の一社員であることにかわりはありませんのでその一社員として今後どうなっていくのかを役職関係なく考えていかなければならないのです。それは上司にとって厳しいことかもしれませんがそれができなければ会社員として成長することはできませんので上司同士でしっかりと連携を取っていかなければならないのです。,1,,,,1,0
,12,新しいオフィスで,,,オフィス移転に伴ってデスクが変わってホワイトのものになりました。オフィスのイメージが明るく清潔なものになりテンションが上がります。デスク以外もきれいになったからかも知れませんが目に入る面積が大きい分デスクの存在は重要です。デスクの表面は梨地というのでしょうか小さな凹凸がついています。そのせいかよごれやすいのが難点ですシャープペンシルボールペンのインクのあとがすぐにつくのです。シャープペンシルのあとはウェットティッシュで拭けばすぐにとれます。ボールペンの方はアルコール入りのウェットティッシュで強く何度もこすればとれるのですが。椅子は当然ですが自分の好みに高さ調整ができます。たまに他の人の椅子に座って低すぎてバランスを崩しそうになることや高すぎてびっくりすることがあります。身長や足の長さに比例するということもなくそれぞれ自分にぴったりの高さがあるみたいです。窓にはブラインドが付けられていますが日差しが入らない時間帯は上げておきたくなります。景色がいいというわけではないのですが空と雲が見えるとほっとするのです。虹が見えたらいいなと思いますが難しい。珍しく虹が出たとしても残念ながら気がつかないかもしれません。新しいオフィスに慣れてきたこのごろです。,1,,SEO対策のSEO ANSWER,http://seoanswer.jp/,1,0
