Post.id,Post.genre_id,Post.title,Post.pagename,Post.menu,Post.content,Post.public,Keyword.id,Keyword.keyword,Keyword.url,Keyword.visible,Arbitrary.keyword
,32,どこかで成功するしかない,,,お金で困らない生き方をするためにはメディアに取り上げられる必要とかもないけれどどこかで成功するしかないと思うんですよね。その人の生き方っていうんですか？お金に縛られない生き方をするっていうのもかなりしんどいことだと思ったりもします。なぜならひとまずお金を稼ぐために生きるってことが分かればそのことだけに集中できますよね。あれこれ考えなくていいですしお金を稼ぎ出すことをせいいっぱいやるような気がします。余計なことを考えないという意味では時間の無駄も勘定の無駄もないっていうんですかね。とっても便利な事だって思います。とりあえずお金がないっていうのから脱出するためには自分のビジネスとかを持ったりちゃんと稼いでいる人のところにお嫁に行くとかそういったいわゆる成功が必要なんですよ。別に誰かに知られる必要もないんですけどお金との仲良くなり方って感覚的には成功と不可避なんだなって思います。どんな形でもいいですけどお金に愛されるためにはなりふりかまっていられないのかなって思いますね。人に見られている時もそうでないときも必死にならないといけないんだなって感じです。きっと派手な人でも努力しているんでしょうね。,1,,車でお金,http://www.naruto1010.com/ ,1,0
,32,初心者もできる簡単投資方法について,,,初心者にも簡単にできる投資方法として外貨預金を私はオススメします。基本的には外貨を保有するだけで毎日お金がもらえるので安定した収入になります。外貨預金をおこなう方法としては銀行などを利用するかFX口座などを活用するかになります。銀行などは手数料などが高かったりスプレッドが広いなどがありますが相談しながら外貨を購入できたりアフターケアなどを期待することができます。FX口座を利用した場合にはそういった手数料がないことやスプレッドが非常に狭いことがメリットとなっています。どちらが良いということはないですが自身に合った方を利用して外貨預金をしてみるのが良いです。こういった外貨預金を中長期的に続けていくことで安定した資産を形成することができますし将来のための貯蓄も可能なものとなっています。基本的にはリスクも低めのものとなっているので経験のためにも利用してみるのも良いと思います。FXトレードを利用して外貨預金する場合には口座開設をする必要がありますがそういった口座は無料で口座開設することができるので申し込んでみると良いです。自分にあったFXトレード会社を探すためにも複数口座開設してみると良いです。,1,,車金融の相談ならこちら,http://www.naruto1010.com/ ,1,0
,32,投資の始め方,kurumakinyu,,お金を稼ぐためには投資をやることが大事だと思います。そこで改めて投資を始めるために何が必要なのかを整理してみました。まず投資を始めるためには証券会社を選ぶところから始まります。今は既存店だけでなくネット証券も沢山あります。比較サイトもあるので情報収集をしてから自分に合ったものを選ぶだけでOKです。口座管理費用とかがかからないネット証券がやはりオススメです。証券口座を開設するのはネット上ですぐにできます。ただ住民票が必要ですので200円くらいかかりますね。あと身分証明書のコピーもいるので10円も加算すると210円くらい経費がかかります。申し込みをしてから口座が開設されるまでは目安として一週間程度かかります。基本的に重要書類なので本人が受け取るまで郵便屋さんは何度も来てくれます。口座が開設されれば自分のパスワードとかユーザーネームを入力して取引サイトへと移動します。実際に株を買うためにはお金を口座に入れる必要があります。私はSBI証券を使っているのでネット銀行から証券口座にそのまま移す事ができました。お金が口座に入ればあとは注文を出すだけで株銘柄の売買ができます。あとは総会に出たり優待もらったり投資家としての楽しみも待っています。,1,,車でお金を借りるなら車金融のナルトにご相談下さい,http://www.naruto1010.com/ ,1,0
,32,意外と女性向けサイトがオススメかも,narunaru,,お金にまつわることってお金のIQを高める意味でもとにかく勉強なんですよね。でもプロではない人にとってみればどうやって勉強したらいいわけ？って感じになると思います。いきなり高額なセミナーに行くのも勇気が要りますし最初は手軽に取り組みたいですよね。個人的にオススメなのが女性向け雑誌とかそのオンラインサイトだったりします。代表的なのは日経ウーマン。日経の雑誌やオンラインサイトは数多く存在していますがその中でも女性向けになっている日経ウーマンは女性なら「ああ分かる〜」っていうものが多いんですね。またDIMEの姉妹版であるSuitsも女性向けっていうのをかなり意識しています。マネーの達人と呼ばれる人がコラムを寄せていたりしてかなり勉強になりますよ。さらにいえばファイナンシャルプランナーの人が多いのですが女性なので分かりやすくをモットーに記事を書いている人が多いです。それゆえ私は数字に弱いから家計管理とかも苦手という人にもかなり参考になる内容だと思います。ひとまず。軽い気持ちで読み始めてみれば意外とはまってしまうかもしれませんよ。最初はサイトを利用してそこから書籍やセミナーへとステップアップすればいいと思います。,1,,車でお金を融資するシステムについて,http://www.naruto1010.com/ ,1,0
,32,堅実だけでは裕福になりませんね。,,zeiri,自分は以前はお金に関しては堅実な性格で買物はいつもニコニコ現金払いで貯蓄も高利子の銀行定期預金しかしていませんでした。なのであまり資産が増える訳でもなく世の中こんなものかと思ってましたがある人物との出会いで買物は極力クレジットカードで支払うことに変えポイントを貯めるようにしました。また貯蓄も安全なものは総資産の半分くらいに抑えて株や投資信託などをするようになりました。結果はカードポイントを日用品など購入の足しにしたり投資も儲かったり損したりですが以前よりは確実に目に見えるように資産が増えていると思います。投資をするようになって世界情勢や為替や様々な動向を意識するようになりサンクコストの考え方も出来るようになりました。宝くじや賭け事で一獲千金を狙うよりは色々な事を勉強して投資をするとよいと思います。１万円を１００万円にするには相当なリスクを伴いますが３００万円で１００万円儲けるのは時間は少しかかりますがそんなに難しいことではないと思います。そして儲けたお金はある程度は貯蓄するのはいいですがやはりパーっと使って還元しなければ次に入ってきませんね。金は天下の回り物と言います。さり気なく儲けて景気よく使いましょうね。,1,,ナルト株式会社,http://www.naruto1010.com/ ,1,0
,32,クレジットカード電子マネーのメリット,,kinyuu,家族がクレジットカード会社に勤めておりそのせいもあって日常の生活費用をとにかくカードで使うように心がけています。使い出せばこれ程便利なものもありません。カードは複数持っていますが基本はメインのカードに集約するようにしています。多数のカードをその都度使うと管理がしづらいしせっかくのポイントも有効期限などを忘れて失効するケースもあるからです。利用明細の確認も非常に面倒になります。ですので２枚のサブカード以外は全てメインカードを使用するようにしています。サブカードも一定の要件でしか使わないので管理が楽です。クレジットカードに併せて電子マネーも可能な限り利用しています。クレジットカードでチャージすればクレジットカードと電子マネーのポイントがついてお得だからです。コンビニや駅の売店などはほぼ全て使え最近はスーパーや量販店ファミリーレストランなど利用範囲も広がっていていつも多めにチャージしていつでも使える状態にしています。最近はネットショッピングや宅配などでも使えるようになりかなり利用頻度が増えているように思います。クレジットカードや電子マネーはその場でお財布のお金が減らないのが一番の落とし穴なのでカードを利用した日に家計簿をつけて利用額を把握しています。これだといくら使ったかが明確に分かるので月予算を大幅にオーバーする事もありません。オススメです。,1,,車でお金,http://www.naruto1010.com/ ,1,0
,12,長期的な資産運用は外貨預金がオススメ,,,長期的な資産運用をおこなうには外貨預金などがオススメの方法となっています。外貨預金は長期に続けていけばいくほど効果が高くなるもので長くポジションを保有することができればそれだけリスクも減っていくものとなっています。外貨預金は基本的には外貨を保有しているだけで毎日お金がもらえるものとなっており安定した収入に繋がるものとなっています。オススメの外貨としては先進国のニュージーランドやオーストラリアドルがオススメとなっています。こちらの通貨は先進国にも関わらず高い金利を維持しているので人気となっています。またこういった外貨預金をする場合には銀行などのような手数料が高いところよりもFX口座などを利用した方がお得でオススメなものとなっています。そういった場合にはスワップポイントなどが高い業者や会社の信頼度の高いところを選んで口座開設するのがオススメとなっています。口座開設などは無料でおこなうことができるので気に入る業者が見つかるまでは複数口座開設をしてシステムをいじってみたり実際にトレードしてみるのも良いです。また業者のランキングや評判などはインターネットで簡単にチェックすることはできます。,1,,車でお金を借りるなら車金融のナルトにご相談下さい,http://www.naruto1010.com/ ,1,0
,12,クレジットを上手に活用して行きましょう。,,,クレジットを上手に使って現金として使えるポイントを貯めるようにしましょう。大きな利益が出るわけではありませんが1か月に1000円から1500円の小遣いくらいにはなります。電気代やガス代携帯代や食費までもをクレジットで支払うことで少しずつポイントを貯めるのです。支払い口座を一つにすることでビックリするほどの金額を支払っているのだなと感じることがあります。問題だと思うことはクレジットでの引き落としでは実際にお金を払っている感覚が少ないということです。お金を払っている感覚が無いと思うのは実際に現金に触れていないからで財布から現金で払うようにすると出来るだけお金を払わないようにすると思います。クレジットでの心配はポイントに変換出来るからと言って使いすぎることはしないようにしましょう。現金のありがたみを知りたい人は財布の中に現金を入れてそのお金で生活するようにすることです。減っていくのが分かるとお金を使うこともためらうものです。クレジットのような便利なものもしっかりと活用することで無駄に現金をさわることがないようにしましょう。お金の大切さが分かれば現金を持つ必要がないのが現代のやり方です。便利なものは使う癖をつけていきましょうね。,1,,車でお金,http://www.naruto1010.com/ ,1,0
,18,お金があったらやりたいこと,,,お金があったらみんないろんなやりたい事が出来るんじゃないかなって思います。例えば家を買ったりしてみたいですよね。車だって買えたりすると思います。これはお金が出来たことによる二つの理由から買えるようになるんです。どういうことかというとまず家や車は負債と言われています。だから普通のファイナンシャルプランナーの人はなるべくそういったものを持たないようにしましょうって言いますよね。でもお金があればそういった負債を持っても大丈夫になるから心配がいらないということです。好きなものを好きなだけ買えますよね。お金があるからやりたいことができるということです。さらにいえばお金を持つから持っていた方がいいということになったりします。もちろんお金の有無でできるかできないかは分かれます。でも家や車が負債ではなくなり必要な消費や投資へと格上げさせるんです。それを投資にまで引き上げることができるのはその人次第って感じです。とにかくお金があると好きなように買えるといいつつ治安の悪いところには住めなかったりするっていう制限も出てきます。やりたいことのようで実は限定的だったりってすることを理解しておく必要もありますね。,1,,,,1,0
,18,フランフランの儲かりの秘密,,,お金の勉強のためにやっていることといえば経済系番組を見る事です。特にがっちりマンデーはマンデーとついていますが日曜日に勉強することができるので必ずチェックしています。一つの企業の儲かりの秘密を取材してくれているので面白いなって思うことが多いです。この前見た回はフランフランの特集をしていたのですが運営しているバルスは上場したりしないのかなぁって思ってしまいます。女性の人気も高いですし私も思わず買ってしまうんですよね。そういうの戦略にはまっている？って思うこともありますけど。お金がかかるなって思いつつフランフランのものが購入できると女性力が高まるといいますか。さらにいえばフランフランっていろんな店舗に行っても楽しいなって思っていたのですがお店によってディスプレイを替えているそうです。なるほどね〜って感じです。見ていて飽きないからみんな楽しい気分で買い物をするんだなって思います。こういうところで無駄遣いをするから経済が回るような気もするし自分のところにお金が残らないんだなって思ったりしちゃいます。番組で企業のからくりは分かるのですが無駄遣いしているなってことも同時に感じたりもします。,1,,ナルト株式会社,http://www.naruto1010.com/ ,1,0
,32,資格あるある,,,こんにちは27歳独身男です。今回のテーマは資格についてお話したいと思います。今の世の中資格がないといけないとすごく思います。パソコンやネットがどんどん仕事に進出してきている中今やパソコンは使えて当たり前！という記事が載る世の中です。就職活動していく中でやはり周りを見渡せばパソコンを使用した事がない人はまずほとんどいないと思います。ということは採用者の目につくにはプラスアルファー何か光るものを求めることになります。そのアピールを一番手っ取り早くできる方法は資格なのです。ここではパソコンの資格を例にあげたいと思います。職歴書を作るにあたってワードを使っての作成尚且つその作成したものが形となって採用者の目に止まる。アピールするにはもってこいです。そのワードの資格も折り紙つきで取得していれば証拠にもなりえます。これは企業にアピールするある種のポートフォリオです。その面接先の会社が事務職の場合なら絶対その文章の構成力レイアウト力は必要不可欠だからです。なので僕が取得（最低取得）してたほうがいいと思う資格はエクセル3級ワード3級パワーポイント3級です。これらの資格は絶対あるに越したことはありません。,1,,タレント・モデルキャスティング　株式会社イー・スピリット,http://www.e-spirit.jp/ ,1,0
,32,公務員試験の筆記試験対策,,,私は高校を卒業後一度社会人になりました。しかし入社した会社の将来性に不安がありました。サービス残業をさせられたりもともと出ていた夏と冬の年二回のボーナスも会社が経営不振になったので出なくなりました。そこで私は転職しようと考えました。その時まだ20代後半でした。転職するなら少しでも若いうちがいいけど何の仕事に転職しようか悩みました。そこで私は学生時代に体育会系のクラブに所属していたので体力に自信があったことと不景気の煽りを受けない公務員にその中でも警察官か消防士になりたいと思いました。しかし学生時代あまり勉強してこなかったので公務員試験の1次試験である筆記試験が難関だと考えました。なので公務員試験対策に特化した勉強の仕方内容を教えてくれる専門学校に入学しました。入学する前にネットや友達や知り合いからの評判を聞いて入る学校を決めました。そして昼は仕事をして終業後に公務員試験対策の専門学校に通う日々がスタートしました。それから授業の時間も含めて毎日45時間は勉強しました。そのかいあって約半年後の1次試験に合格しました。筆記試験が難関だと思っていたので専門学校に通ってよかったと思いました。公務員試験の筆記試験に不安がある方はぜひ専門学校で筆記試験対策をすることをお勧めしたいと思います。,1,,株式会社イー・スピリット,http://www.e-spirit.jp/ ,1,0
,32,結構役に立った公文式,geinoukai,,私は小学校６年生頃公文式を習い始めました。当時は中学校から英語の授業が始まっていたので今のように小学校ではまだ英語の授業はなかったのですが公文式では英語を習うことになりました。母の考えで今後は英語が必要になってくるからという理由だったと思います。しかしこの母の考えは的中し私はその後英語関係の大学へすすみ英語を必要とする職に就くようになりました。公文式の勉強方法は「とにかく何度も繰り返して体に覚えさせる」という勉強方法でした。英語では文法などは割と後回しでとにかく書いて書いて書きまくって覚えるというやり方でした。私はこの方法は割と良い方法なのではないかと思っています。小学生くらいの子どもに助詞や名詞や動詞など言っても通じるとは思えません。また言語はまず何度も繰り返して体に叩き込み当たり前のものにすることがはじめの第一歩だと考えています。公文式の英語では単語も文章も何度も何度も繰り返して書きました。本当に一文で２０回は繰り返して書いていたと思います。そこでテストを行いクリアし先生が次に進んでもよいと判断すれば次のレベルの文章にチャレンジするというステップアップ方法でした。１年くらいでしたが通って本当によかったです。中学校に入ってからも英語でつまづくこともなく英語は常に成績はよかったです。,1,,キャスティングを極めるならここ,http://www.e-spirit.jp/ ,1,0
,32,図書館司書の資格について,hanayaga,,私は今図書館司書の資格取得に挑戦しています！図書館司書は図書館で資料の整理やカウンターでの貸出返却や図書館利用者からの質問に答えるなどの業務を行っている人達の事です。カウンターでの貸出返却ぐらいだとアルバイトや契約社員に任せている図書館も増えていますがそのような人達にも最近は図書館司書の資格が求められています。図書館司書の資格を取るには大学で学ぶ事の出来る資格取得のために必要な科目の単位を取る必要があります。方法は大学の図書館司書課程で単位を修める通信教育で単位を修める仕事をしながら夜間大学で単位を修める司書補から始めるという４つがあります。私は図書館司書課程のない大学（正確にいうと文系なら図書館司書課程があるのですが私は理系）に通いながら別大学の通信教育学部の図書館司書コースで単位を修めて図書館司書の資格取得を目指しています。資格取得するには必修科目の基礎科目（生涯学習概論など）図書館サービスに関する科目（図書館サービス概論など）図書館情報資源に関する科目（図書館情報資源概論など）と選択科目２科目の合計２４単位を取る必要があります。その中には面接授業（スクーリング）もあり私は昨年の夏休みに受けに行きました。（今年から自宅でE-ラーニングも可能に）基本はレポートを提出して科目終末試験を受験し両方の出来が基準点を上回り合格したらその科目の単位が取得できます。どのくらいで取得できるかは人それぞれですが大体２年でできているようです。私も２年以内での取得を目指しています。,1,,キャスティング,http://www.e-spirit.jp/ ,1,0
,32,英検について,,biyou,私は英検準１級を持っていますが個人の考えでは英検は２級あたりからぐんと難易度があがります。初めて英検を受験したのは小学校６年生の時でした。その当時は英語は小学校の必須科目ではありませんでしたが公文式に通っていたため受験することになりました。余談ですが公文式で英語に通うとことあるごとに英検を受験することを勧められます。理由は定かではありませんが。しかし公文式で半年くらいの勉強で英検の５級くらいなら楽々取得できました。それから特に英検は受験していなかったのですが高校生の時に外国語学部を受験しようと思い実力試しで英検準２級を受験しました。こちらも大学の受験勉強をしていれば合格できるような内容でした。英検を受験するときに真剣に英検のために勉強したのはやはり準１級を受験するときでした。英検準１級の対策問題集１冊と過去３年間の過去問問題集を購入して１か月くらい勉強しました。私なりに考えているのですが英検は非常に出題問題に偏りがあります。どんな問題がでるか勉強していれば過去問に出ていた問題がけっこう出てくるので割と簡単に点が取れます。英検では級が進むと面接があるのですがこれがやっかいでした。勉強しようにも面接官役になってくれる人もいなくてひたすら発音と文章をすらすら読む特訓をしていました。,1,,タレント・モデルキャスティング　株式会社イー・スピリット,http://www.e-spirit.jp/ ,1,0
