Post.id,Post.genre_id,Post.title,Post.pagename,Post.menu,Post.content,Post.public,Keyword.id,Keyword.keyword,Keyword.url,Keyword.visible,Arbitrary.keyword
,12,季節の味覚,,poster,秋の味覚をご存知でしょうか。秋に旬を迎える食材は豊富でどれもおいしく食べられます。おいしいだけでなく栄養も非常に多く含んでおり健康にも美容にもいいです。例えば秋刀魚は主に塩焼きにして醤油と大根おろしで食べるととってもおいしいです。秋刀魚には脳梗塞や心筋梗塞を予防するといわれているエイコサペンタエン酸や悪玉コレステロールを減らすとされているドコサヘキサエン酸また頭の回転をよくするとされている成分も含まれています。栗だったらたんぱく質やビタミンＡカリウムが豊富でさらに食物繊維やミネラル類亜鉛が多く含まれており非常に豊かな栄養を含んだ食材です。ゆでて食べるのもいいですが市販の甘栗もおいしいし炊き込みご飯にするのも素晴らしいです。サツマイモだったらでんぷんが非常に豊富でさらにビタミンＣや食物繊維が多く含まれています。サツマイモを食べるだけでお肌はきれいになるしおなかの調子も良くなるので女性の強い味方です。サツマイモならふかして食べるのが楽でしかもおいしいですがてんぷらにすればおかずにもなります。また大学イモやスイートポテトなどのスイーツにもなるので非常に便利で料理のし甲斐があります。マツタケは非常に高価であまり一般家庭に出ることはありませんがマツタケにはビタミンＢやビタミンＤ食物繊維にナイアシンが多く含まれています。ナイアシンはアルコールなどの分解を助けるので肝臓にいいです。マツタケを食べることはめったにまれなことになるでしょうからもしも食べられるなら炊き込みご飯にして香りをご飯全体で味わったり土瓶蒸しでありがたく食べるのがいいかもしれません。,1,,食材の宅配なら夕食.net,http://www.you-shoku.net/,1,0
,12,ゴミでリサイクル,,,食べ物の廃材といいますと土の肥料にすることがほとんどですが肥料以外にも食材の廃材には活用方法があるのです。普段の掃除をする際や年末の大掃除の際は普段掃除していないところも掃除をするので掃除道具を買いそろえるだけでお金がかかってしまいますがこれではゴミが増えてエコではないですしお財布にもエコではありません。こんな時こそ普段は捨ててしまいがちな食材の廃材の出番なのです。いくつかあるのですがまず「ジャガイモの皮」です。ジャガイモに含まれている「サポニン」という成分が汚れを包み込んで落とす働きがあります。皮の内側で鏡磨きや曇り止めといった活用法があります。まさかジャガイモの皮にこんな活用法があったとは驚きです。次に大根の皮と卸し汁です。「ジアスターゼ」という成分が漂泊作用があってガラス磨きシンク磨き障子拭きなどの活用法があります。オレンジグレープフルーツみかんなどの柑橘系のフルーツには「リモネン」という精油成分が皮に含まれていまして酢と同じような漂泊作用があります。皮の内側でシンク磨きまな板洗い。2リットルの水に５６個のみかんの皮を入れて沸騰させて20分ほど煮出した「みかんの皮クリーナー」で畳の黄ばみ落としやフローリングのつや出しガス台の油落としなど用途は様々あります。時間と手間がかからない方法もありまして小麦粉をレンジ台や換気扇の油汚れの部分に水と小麦粉をふりかけて3時間ほど放置して湯洗いするだけで簡単に汚れを落とすことができます。小麦粉は使い切ることができず棚の奥の方賞味期限が終わってから見つかるなんてこともあるのでそのまま捨ててしまうのは何だかもったいないので最後にこのような活用法があるのはエコで素晴らしいと思います。,1,,新鮮な食材宅配について,http://www.you-shoku.net/,1,0
,21,井戸はエコにもなります,,repair,エコバッグを使っているという方は今はどのくらいいるだろうか。エコバッグを使うだけでもずいぶん自然にやさしいことだがどちらかというと家庭に優しい面が強いのかもしれない。なぜならレジ袋の有料化が進んでいるからである。一枚5円くらいの価格になっていると意外とつらいものだ。１回の買い物でレジ袋を２袋使うならばそれだけで１０円です。これを１月に１０回やれば１００円１２か月だから合計で１２００円になります。年間にレジ袋だけで１２００円使うとなると結構損をしているのかもしれません。大きなスーパーなどではレジ袋のほかに籠を取り扱っているところもある。イオングループはマイバスケットという買い物かごの色違いのものを販売している。このマイバスケットは買い物の際に店員に渡すことで通常の買い物かごの商品をマイバスケットに移してくれる。マイバスケットを使うとレジ袋を使わないのでそのぶんが安くなるのだ。マイバスケットはお店で購入できるので何度も来る予定があるなら買っておいてもいいかもしれない。肉や魚などの鮮度が大事なものは保冷バッグを使うのがいい。保冷バッグは中身がアルミでできているため食材を痛めることなく持ち運びができるのだ。念のために氷をいくつかもらっておいていっしょに入れておくといいかもしれない。年間で１２００円を使うよりはこのように工夫するだけで家庭にも環境にも優しいことができる。,1,,食材宅配サービスならいつでも,http://www.you-shoku.net/,1,0
,25,食の専門家を目指しています,,ecological,将来は食に関する仕事に就くことを希望しています。現在は４年生大学の３年です。父が飲食店を経営していて小さい頃から人への飲食の提供ということ見てきました。美味しい料理を囲んで楽しそうに会話する家族今にもキスをするんじゃないかと顔を寄せ合って食べているカップル会話することもなく静かに食事をしている老夫婦それぞれに思いが詰まったテーブルです。多くの人に憩いの場を提供する父を見て私も飲食の仕事に就きたいと考えていました。最初は高校卒業後は調理師学校に進みデザートを学びたいと思っていました。しかし父が調理だけでなくもっと広い視野から勉強しなさいと言われ４年生大学経済学部に進学しました。大学では勉強の他に友達と遊ぶことにも励んでいます。進路を考える中で専門分野の調理師では食をプロデュースしたいと考えるようになりまた。その結果昼は大学に行き夜は調理師学校のフードコーディネーターコースに通っています。フードコーディネーターというのは 食全般に関して商品やサービスの企画開発マーケティング販売促進プロデュースまで手掛けるのが仕事です。飲食店のメニュー開発店舗デザイン経営コンサルから食材メーカーで企画開発まで食に関することなら全て含まれます。私が漠然と考えていた食に関する仕事がフードコーディネーターの仕事だったのです。昼夜の勉強で大変ですが毎日が楽しくて仕方ありません。,1,,夕食のおかずに食材宅配,http://www.you-shoku.net/,1,0
,1,僕の知り合いは京都で歯医者やってます,,datsumou,目が悪いのにオシャレを優先して普通のカラーコンタクトを入れていましたがもう3度ほど車にはねられているので体が持ちません。歯科医がぼやけてかろうじて信号機が見えるかどうかというくらい。だったら諦めて普通のコンタクトレンズにしろよと思うかもしれませんね。確かに普通のコンタクトにマジックで色を塗ってみたこともありましたが全体が染まってしまうだけで失敗。だから最近ネットで検索して見つけた度ありカラコンを使ってみますよ。来週の頭くらいには到着するはずなので今から度ありカラコンが楽しみー。歯茎にネジを打ち込んでインプラントにするのをテレビで見ていましたがまさしくあれってサイボーグですよね。ロボコップとか大好きなんで歯科技工士の資格を取って今では毎日入れ歯を触っていますよ。マイ入れ歯の中には食らいついたらどんなものでも噛みちぎってしまうスーパー入れ歯名付けてデビルファングがあります。あなたもオシャレな入れ歯を作ってみませんか？,1,,どうせなら名古屋市西区にある歯科が良い ,http://www.nozomi-dental.jp/,1,0
,1,いつまでも届けオシュコシュの心！,,,桜新町のサザエさん通りにある歯科医院です。無痛治療に自信があります。ホストクラブ求人警察官のような社会的地位の重要な職業って借金するのが難しい。そのためのクレジット現金化です。表向きにはクレジットカードで物を買うってだけだから当然借金ということにはならない。業者にお金を返す必要もないしクレジット現金化は借金ではないのです。遊びに行くお金が急に必要になったらクレジットカード現金化ですよね?。家族みんながクレジットカード現金化でリッチな生活をしています。まさかこんな単純なシステムで現金化できるなんて夢みたい。もうサラ金や闇金に手を出さなくてもクレジットカード現金化を使えば楽勝ですな。カード現金化俺は浮気調査のプロ探偵さ。たった一つの真実を見抜くために今日も依頼者を尾行して証拠写真を撮る。しかしこの仕事は多くの危険をはらんでいるこの前なんて尾行がばれて囲まれてリンチされるかと思った。でも依頼者の安心した顔や憤怒した顔を見ると面白くてやめられない。池袋風俗麻雀で大敗して帰りの交通費が無くなっちゃったときはクレジット現金化に救われましたよ。初めて使ってみたんですがこの現金化を利用すればもっと高レートの勝負もできるのではないか。友人にもクレジットカード現金化のことを教えてあげようかな。ギャンブルってのは額が大きくなればなるほどにヒートアップしちゃうもんだし。あの時に買っておけばと後悔しないためにもカード現金化の利用方法を知っておきましょう。給料の前借だと思って気軽に使えるのがカード現金化の強いところ。直感的に良いと思う商品があったら躊躇せずに現金化して買ってしまいましょう。衝動買いを続けていると画期的なアイデアが生まれやすくなる気がしますしね。,1,,名古屋市西区なら歯科です,http://www.nozomi-dental.jp/,1,0
,1,ブランド物の買取ってないですか？,,,アフリカ旅行から帰ってきた彼女からアクセサリーをプレゼントされた。なんでも水牛のツノらしくてかなり大きい。僕はもっと無難なシルバーアクセサリーが良かったのですがこれはこれでいいものですよ。使い方がよくわからないけれどアクセサリーなんて使い方次第でどうとでもなる。まあたしかにちょっと上級者向けのアクセではあるものの雑誌では上手く着こなしている人もいますしね。僕もそろそろステップアップするタイミングかと思っていますしたまには上級者向けアクセにも挑戦してみたっていいでしょう。旅行で札幌の結婚式場前をブラブラしていました。結婚はまだしていないのですが他人の結婚式にならよく呼ばれますね。式にはお金を包んでいきますが毎回何万円か消えていくから大変ですよ。結婚式の参加費用だけで10万円は軽く飛んでるかな？いつか自分が結婚することになったら逆に参加者からいただくことになるが料理代等で差し引きするとほとんどプラスにはならないらしい。歯医者さんでもたまに間違えて見当違いなところを治療してしまうことがあるそうです。私が東京にやってきてから見つけた歯科医院だとマイクロスコープを使った歯科治療を行っているので安心できます。でもあのスコープをつけるとどんなふうに見えるんだろう？一度でいいからあのマイクロスコープを借りてみたいが商売道具はなかなか触らせてもらえないですしね。お金を貯めて自腹で買うことにしよう。丁度妹と同じ視力なので度ありカラコンを買うときは一緒の製品を買っています。何気に眼球のカーブも同じなので本当に助かっている。見れば見るほど妹とそっくりなのでてっきりクローンか何かかと不安になったこともありました。ちなみに妹は30人ほどいて身長から手の大きさなど全て私と一緒。違いがあるとすれば性格と声がちょっと違うくらいかな？でもコンタクトレンズを買うときはまとめ買いができてお買い得ですよ。,1,,名古屋なら西区の歯科が評判,http://www.nozomi-dental.jp/,1,0
,1,ハーブティーのデトックス効果,,,人口の歯って近い将来ファッションになるとにらんでいる。新江古田の歯医者には普通の虫歯治療の他インプラントもあるけれど見せるための歯があってもいいんじゃない？現に八重歯が可愛いと人口の八重歯をつくることがあると聞いたし。サメみたいなインプラントを付けてワイルドさを強調する時代がやってくるやもしれん。歯周病が酷くなっちゃって練馬区の歯科に予約する頃には歯が全部無くなっていた。テレビｃｍで見た時はこんなボロボロ歯が抜けるわけねーだろと歯周病を舐めてました。もう歯が抜けてしまってからはどうしようもないという感じですがインプラントを埋め込めば義歯で生活ができるのだと。入れ歯を覚悟していただけにインプラントの提案はありがたいものでした。,1,,丁寧診療は名古屋市の西区にある歯科へ ,http://www.nozomi-dental.jp/,1,0
,7,資格があって良いねと言われるけど…,,est,私が持っている資格は歯科衛生士の資格。私が取得したときは専門学校に2年間通って卒業だったかど今はほとんど3年間なんだね。あの頃は大学生のお友達より2年も早く社会に出て「遊びたい羨ましい」と思う反面「お金持ってる〜」っていう優越感もあった。卒業してからもう12年10年間ずっと働いてきた。今は結婚して子育て真っ最中なので仕事はしていない。今思うことは「働けるときにしっかり働いておかなきゃならない資格だな」ということ。よく看護師と似てる感じに捉えられて「子どもいても働ける資格あるから良いな」って言われるけど…看護師さんよりは楽だと思いますよでも今の歯医者の現状って夜間診療してるところがほとんど。小さな子どもがいるうちはもちろん子どもが少し大きくならないと現場に戻るのって大変なんですよね。子どもいたら午前中のみか夕方までのパートがいい。でも子どもが体調崩したりしたら休む社員の子達からしたら「急に休まれたら大変」って思われる。当たり前ですよね私も社員の時はパートさんにそんな風に思ったこともあります。だからこそ今あと何年かしたらまた歯科衛生士の仕事をしたいなと思いつつも人間関係のことを考えたらなかなかパートに踏み込めない自分がいる。親と同居してたり保育園に入れていたら働けるかな？と思うけどそれでもやっぱり子どもの為に休むこともあるだろうし。でも週に1〜2回のパートはたまーにしか募集していない。それでも歯科衛生士の仕事は大好きです。本当にこの資格を取って良かったと思います。でもやっぱり女性というのは妻であり母でありいろいろと大変だなぁとしみじみ思うのでした。,1,,名古屋市の西区にある歯科に通ってます ,http://www.nozomi-dental.jp/,1,0
,5,健康第一,,,美しくになる方法は毎日早寝早起きしたり食べ物の偏りをなくすなど方法はいくらでもあります。でも素人ができる範囲だけではモデルや女優さんのようなきれいな肌を手に入れることは難しいんですよね。職業として肌の手入れが必要不可欠な役者さんだったら面倒くさいとか関係なしにエステに通うのが義務。自分の体見た目が商品なのだからこれにお金を掛けて勿体ないという話はないです。母の日にミネラルチークという自然素材のチークをプレゼントしました。化粧品についてそれほど詳しい方ではないですが高価なものは本当に天井知らずですよね。高いチークと安物のチークの何が違うのかは分かりません。多分不純物の多さとか使われている材料や添加物の多さで決まって来るのでしょうがあの価格差は未だに謎。不況であっても女性は化粧せずに遊びに行ったり会社に行く事はできない。男性でもメンズエステに通ったり美容機器を購入して毎日熱心に肌の手入れをしている人もいるくらいです。女性がプールや海に遊びに行くとなればこれは遊びでは済まない努力が必要です。まず第一に無駄毛の脱毛をしてこなければならないのですが自分の手が届くスネや腕の毛くらいは楽勝。ついでわきの下の処理も何とかできます。,1,,にきびの治療なら京都で,http://www.webyamate.com/nikibi.htm,1,0
,5,マニキュアペディキュアの前に。,,healthy,オールインワンジェルと聞くと昔一つのカセットに１０本くらいゲームが入ったパチモンファミカセを思い出すね。オールインワンジェルっていうからには成分が別々のものもあったのかな？もしそうならそいつらの立場はどうなるんだろうか？マルチビタミンがあるのにそれぞれ別個にｃとかｂを取る必要って薄いじゃん。まあものぐさな性格の僕だったらオールインワンジェル一択ってことですな。子どもから言われて気が付いたのですが最近顔の肌のたるみが激しくなってきたようです。もともと太り気味の体質だったので顔面の皮膚が垂れ下がってくるのは普通なのですが。鏡を見ていたらこれがどんどん下がってくるのではないかと恐くなったくらいです。美容整形できるのなら一番ですがそんなお金も度胸もなし。たるみに効果のある都合のいい化粧品があったら手に入れてみたいところ。スキンケアを怠っているつもりはないけれど毛穴のたるみがどんどんひどくなっている。もちろん洗顔はしているし食生活やビタミンバランスも気を配っている。となるとやはり加齢によるものなんでしょうか？年寄りになったらこういう毛穴のたるみは仕方がないけれどまだそんな歳を取っているという自覚もないんですよね。何か毛穴を目立たなくさせる方法があったら知りたいなぁ。原宿を拠点にして活動しているモノですが原宿はメンズエステが多くありますね。美意識の高い男性が多いエリアなんでしょうか？思えばうちの会社の男性も鏡を見て化粧をしたり女性ものの服を着ている方が多い。もちろんメンズエステにも通ってらしてお昼時にはプロテインや美肌グッズの話で盛り上がっています。普通の女性よりもコスメに詳しい方ばかりなので最近の男性は本当におしゃれですよ。,1,,にきびは京都で,http://www.webyamate.com/nikibi.htm,1,0
,1,サプリメントの効果,,supli,通常の数倍の効果があるとかインチキな謳い文句を載せた商品って本当に許せない。僕の会社ではヒアルロン酸やビタミンのサプリメントを扱っている会社で世界平和のためにはビタミンが必要だという社長の価値観に痛く感銘を受け入社することになった。たまにリサイクルトナーの回収に来るお兄さんにもビタミンや乳酸菌とってますか！？と聞くと苦笑いするんですよね。それは本気で健康のことを考えていない証拠！恥ずかしがっていては健康な体を維持することなんてできるはずがない。私は近所にある大きめの公園で声を上げながらスキップする独自の健康ウォーキング術を開発実行しているから人間ドッグも余裕で問題なし。ただし脳に深刻なダメージが見受けられると言われた程度で頭以外は何の問題もないのです。子供の頃に階段を後ろ歩きして遊んでいたらそのまま転落して脳を損傷した時から今の性格になっちゃったんだよね。引っ込み思案であった性格が頭をぶつけてからものすごく積極的になったしむしろこっちが本来の時分だとさえ思ってます。頭と首を痛めた時は三軒茶屋の交通事故治療院で見てもらったもののたしか手遅れだとかそんなコメントを聞いた。家族からはこの性格をうっとおしく思われているがこれだけ社交的な性格を元に戻すなんてもったいないのではないか。人間は外見も大事だがそれよりも僅差で内面の方が大事だと思っている。だから美容整形で顔を整形手術してもらった妹には内心憎々しく思っているのだが多分本心を伝えることは一生ないだろう。外見にこだわるのは中身が不十分な証拠だと東京の通信制高校の先生も言っていた。,1,,ひどいにきびも京都の病院で解決！,http://www.webyamate.com/nikibi.htm,1,0
,20,プラセンタサプリを選ぶ。,,,プラセンタサプリというものが最近流行っています。動物の胎盤から作られるサプリメントで美容にも健康にも効果が高いので最近は女性にも男性にも注目が集まっています。プラセンタサプリには他のサプリメントには入っていない成長因子というものが含まれています。成長因子は細胞の生まれ変わりを助ける効果があるので美肌効果がきわめて高いです。他にもきれいな髪を作る効果やダイエットにも役立つ効果がたくさんあります。一粒でこれだけたくさんの効果が得られるのがプラセンタサプリの素晴らしいところです。プラセンタサプリに使われる胎盤は主に動物のものですが馬豚羊のものが使われます。これらのほかにも人のものを使うこともありますが人のものは飲用ではなく注射器による注入に使われます。プラセンタサプリの中で最も効果があるのは馬のものです。次いで羊最も効果が低いのが豚です。しかし馬のプラセンタサプリは高価となります。逆に豚のプラセンタサプリは安価でお求めやすい金額となります。羊は効果も値段も中間といったところです。馬のプラセンタサプリが効果なのは馬の出産量が少ないせいもあります。そのためどうしても主原料の胎盤の入手がしにくいのです。またサラブレッドの馬だと育てられている環境がいいのでサプリメントも良質なものとなります。少々お値段が高いとしてもいいものを選ぶのがいいですね。,1,,京都でにきび治療,http://www.webyamate.com/nikibi.htm,1,0
