Post.id,Post.genre_id,Post.title,Post.pagename,Post.menu,Post.content,Post.public,Keyword.id,Keyword.keyword,Keyword.url,Keyword.visible,Arbitrary.keyword
,5,時代の一歩先をゆく歯科医院,,,時代の一歩先をゆく歯科医院はマイクロスコープを治療に役立てています。僕もマイクロスコープには小学生のころから興味を持っていて大人になったらボーナスで買いたい物リストに入れてましたよ。そんな魅惑のマイクロスコープが歯医者さんで使われていると聞き感銘を受けました。ああ時代がとうとうマイクロスコープに追い付いてきたのだなと。苦労もあっただろうがこれでこの業界も一歩前進したと思います。会社で強烈な眠気に襲われそのまま目覚めると次の日になっていました。これは巷で有名な睡眠時無呼吸症候群というものなのでは？そう思うや否や上司に有給を願い睡眠時無呼吸症候群の治療に行くつもりでしたが上司も寝ていました。変ないびきもかいていたしこりゃあ僕の上司も無呼吸症候群なんじゃないかなぁ？ちょっとした振動が加わるだけでも奥歯が痛いです。よく見ると歯がドロドロに溶けていて虫歯で神経が見えそうな状態でした。こりゃあすぐにでもホワイトニングや！,1,,名古屋で診療するなら西区ののぞみデンタル,http://www.nozomi-dental.jp/ ,1,0
,5,歯科医師になりたい,,,ようやく自分にも孫ができまして子どもの頃に習わせるものとしてはピアノが良いですよね。脳の発達にも影響するそうですし。丁度娘が昔使っていたグランドピアノがあるのでこれをあげようかとも思ったのですが長年ピアノ調律していなくて音がおかしい。プロではないので何となく音が違う程度の間隔ですがちゃんと調律されたピアノでないと意味がないですしね。兄と弟兄弟三人そろってサポート校に通っています。全員見事に高校受験を寝過ごしてこうなってしまったのですが通信制高校は気楽でいいですよ。普通の高校に行きたいと思ったこともありますが今となってはどうでもいいことです。僕の頭の中には東大に合格して楽しいキャンパスライフを堪能する自分の姿しか描かれていませんしね。,1,,子供にも優しい。名古屋の西区にある歯科へ ,http://www.nozomi-dental.jp/ ,1,0
,20,新しい歯科医院,,,なぜか社内でモテるオレ。最近メッセンジャーバッグにハマっていると言ったら会社の女の子が次の日大量に持ってきてくれた。数だけで13個くらいあるんだがこれを全部持って帰るのは恥ずかしいなぁ。でも有名ブランドのバッグもあったしこれは大きな収穫。最近自転車通勤を始めた部長も欲しがっていたから会社の子に断って部長に一つあげてしまおう。悪質な出会い系サイトの被害に遭ったようでちょっぴり気分はブルースカイよ。出会い系サイトなんて絶対に利用しないとか出会い系では騙されない自信があったのにこのざまです。振り込め詐欺はあちこちから借金をしていたので無視していましたけれど出会い系のくせに出会えないとは。これならいつも通り町でナンパしてた方がよかったよ。雑誌だとかネット上で電話占いが当たる当たらないと言われていますが試してみた感じだと当たりますね。私って声だけだと男か女か分かりづらいんですが声を聴いただけで男性だと当ててきました。心は女性なのにすごいです！私の悩みも恋愛関連だと伝える前にズバリ言い当ててきましたしここまで当ててこられるとちょっと怖いくらいです。とぼとぼと兄が自宅に戻ってきました。何があったのか聞いてみると出会い系詐欺の被害にあったらしい。出会い系なんて小学生の時から怪しいと思ってましたがそんなもんに出し抜かれるとは兄も老いたな。お互いに連絡し合って実際約束通り相手がいたのですが顔が全然違うとのこと。よく見たら髭も生えているしそりゃあ出会い系詐欺ってやつだな。,1,,丁寧診療は名古屋市の西区にある歯科へ,http://www.nozomi-dental.jp/ ,1,0
,20,名古屋市西区の歯科でいいとこある？,,,通信カラテで鍛えた実力を発揮しようとホッキョクグマと対決した結果一撃で前歯全部折られました。戦意を喪失しもはやこれまでと思った瞬間白金歯科医院の先生が突然現れあっさりと熊を倒してしまいました。歯医者は体力勝負だと聞いていましたがこれほどとは。その折れた前歯インプラントで直しませんか？とさわやかな笑顔を向けてきた命の恩人の言葉に背くことなどありえませんでした。去年歯科検診で虫歯を削ってもらったのにまた歯が痛くなっちゃった。白金の歯医者さんに見てもらいたいがスケジュールの調整が難しいですね。僕は多忙な人間で朝起きるのは夕方ごろなんですよ。起きたらすぐにネトゲに参戦しなきゃならないし僕がいないとギルドが回らないんですよ！白金の歯医者さんのとこにはなんとか予定を作るとしてちょっと世界救ってきます。,1,,名古屋市西区の歯科医について?,http://www.nozomi-dental.jp/ ,1,0
,12,良い人材を望む歯科,,biz,憧れのモデルさん益若つばさのカラコンに私も挑戦してみました。ガラッと周囲の目も変わってこれがモデルさんの気持ちなのか…！君サッカーうまそうだね。と地元の小学生にサッカー誘われました。いつか決めるぜイナヅマシュート♪と勢いがついてしまい夜中までサッカーやっていました。益若つばさにはなれなかったけどカラーコンタクトでここまで素直になれるとは新しい発見でした。あんなに瞳が大きく見えるとは…カラーコンタクトを入れるだけであんなきれいな瞳が手に入るんですね。でも私って物の管理をするのがあんまし得意じゃないから買うとしたらワンデーカラコンがいいかな。コンタクトレンズで面倒なのは二つあるということ。もし人間の目が一つだったらカラーコンタクトも一個だけで済むのにね。,1,,名古屋市西区の歯科クリニック,http://www.nozomi-dental.jp/ ,1,0
,12,知覚過敏になったので名古屋の歯科へ,,,女の子っていちいちムダ毛を脱毛しないといけないなんて面倒くさいとは思わないのかな？僕も脱毛したことがありますが小さい頃に頭の手術で毛をバリカンで刈ったくらいですね。まあそれ以来ボーズ頭が便利だと気付きそれが僕のデフォルト髪型になりましたが。もしできるのなら頭を完全にスキンヘッドにしてみたいとも思うのですが永久脱毛って頭の毛もやってくれるのかね？僕のあだ名は納豆や下駄箱だったほど体臭とくに加齢臭がひどかった。今は加齢臭の石鹸を使ってこの臭いを抑えられていますが他人から臭い臭いと言われるのって傷つくんですよね。そのせいで高校時代は非行に走り万引きや放火売春のあっせんに核兵器の密造世界各地の紛争幇助などありとあらゆる悪事を施してきました。僕が悪人として人生を終えることがなかったのはこの加齢臭石鹸があったからなんですよね。今体臭に悩んで悪事に手を染めようとしている人がいたらぜひこの石鹸をオススメしたい！,1,,どうせなら名古屋市西区にある歯科が良い,http://www.nozomi-dental.jp/ ,1,0
,2,衣装のコレクションが楽しいキャバクラのアルバイト,,deli,おしゃれのためにカラーコンタクトをしているのを見かけたことがあります。毎日毎日つけては外しの生活をしてちょっと苦労がある生活をしていることでしょう。そこでカラーコンタクトを入れなくて良い生活があるかもしれません！目の色を変える手術があるようです。「黒目と黄色」とか爬虫類みたいな目とかもあるのでやりすぎると「キモッ」みたいなことが起こるので注意が必要です。ちなみに手術時間は片目で15分程で終わり痛みもなく終わり安全も保障されているようです。目にあわなければ外すことができるので気軽にやることができます。ただし目の視力が回復するわけではないので視力が低いかたは「メガネ」「コンタクト」を使用する必要があります。手術は日本ではなく「アメリカ」「インド」「トルコ」「メキシコ」など許可を受けた国で手術が可能となっています。ベリーダンス衣装の魅力は可愛い痩せれる姿勢が良くなるといいコトづくし！買っていて損はないです！,1,,横浜デリヘル?,http://club-charmer.net/,1,0
,2,キャバクラに興味があります。,,bar,最近はカード現金化の業者も増えてきましたが昔に比べると優良な現金化業者が多いですね。となるとカード現金化の業者選びに必要なのはその換金率ということになります。僕が毎月お世話になっている業者さんは業界でもトップクラスの換金率を誇っているので当分ここ以外の現金化業者は使う気にならないですよ。風俗やデリヘルのことを知ることができます。http//www.bigdesire.co.jp/私はクレジットカードを5枚くらい持っていますが全て現金化のために作りました。何となく不安だから使ったことがないという人も多いですが現金化なんて簡単ですよ。学生やご年配の方まで幅広い世代に利用されている現金化は昔よりもさらに身近な存在になりつつあります。手続きも簡単だしこの機会に皆さんもクレジットカードを沢山作っておいてはいかがでしょうか。,1,,デリヘルは横浜っしょ,http://club-charmer.net/,1,0
,2,キャバクラ勤務のこと,,fuzoku,眼が痛いなあ新しいコンタクトレンズ試してみようかなあ。ドライアイ気味だから本当はコンタクトよりメガネの方がいいんだけどコンタクト便利なんだよね〜。それに他にもそういうのない？金属アレルギーが心配だから身につけるならゴールドの方がいいんだけどデザインが素敵だからシルバーアクセサリーを通販しちゃったとか。あれ私だけ？でもゴールドよりシルバーの方が好きなんだもの好きっていやあ今の携帯気にいってたんだけど長く使いすぎてみすぼらしくなってきちゃったんだよね。いっそのこと白ロムを購入してみようかなと思う。できるだけ安く新しい携帯手に入れたいの。携帯も簡単に変えられるようになったから世の中またしても便利になったものですよ。顔も簡単に変えられたらなあ。美容整形が簡単に受けられるようになったらもっといいと思うのですが。そうしたら美男美女がわんさか出現するってことか。そしたら逆にブサが流行ったりしてｗｗｗ渋谷のデリヘルで人気なのもブサちゃんとかになる時代がいつかくるかなあ。それともその世界ではブサは「美人」と言われるんだろうか？複雑じゃけえ。-----,1,,横浜でデリヘル?,http://club-charmer.net/,1,0
,2,キャバクラで働く時に大事な事,,tantei,夜の仕事の1つにキャバクラがあり人気のキャバクラ嬢になるほど収入が高くなり高収入が期待できる仕事になってきます。そこでキャバクラで働く時に大事な事についてお話します。まずはお酒が飲めるという事です。キャバクラ嬢になりますとお客さんにお酒をつぐという仕事もありますけどキャバクラ嬢も一緒にお客さんとお酒を飲む事も多いです。その時にお酒が苦手ですと楽しく飲む事ができずにお客さんを楽しませる事ができないです。たしかにお酒は飲めない事をお客さんに言うと飲む必要性はなくなりますけどそうなると中にはキャバクラ嬢にも一緒にお酒を飲んでほしいと思っているお客さんもいますのでなかなか人気が出ない事もあります。そうなると収入が減る可能性があります。ですのでお酒が飲める事が大事になってきます。お酒に強いですと有利になってきます。次にコミュニケーションがうまいという事も大事です。基本的にはお客さんと会話する仕事になってきますのでお客さんとうまく会話できなければいけないです。うまく会話してお客さんを満足させる事ができますと次第にあなたを指名してくれるお客さんも増えますので人気のキャバクラ嬢になっていく事ができます。積極的にお客さんと会話する事が大事ですし楽しめるような話題も作っておくと良いです。またどうやれば会話を楽しめるのかも勉強しておく必要もあります。楽しい会話ができるかできないかは大きく違ってきます。,1,,デリヘルなら横浜はいいですぜ,http://club-charmer.net/,1,0
,2,キャバクラはこまめに連絡が必要,,,キャバクラは誰でもが簡単に仕事ができると考えている人が多いです。確かに働きはじめることは簡単かもしれません。けれども売れっ子になるにはそう簡単にはいきません。何もしなくてただ単にお客さんの横でお酒を作って話しているだけでは売れっ子には到底なれないのです。自分で掴んだお客さんに来店してもらうためにこまめに連絡が必要になります。相手の生活スタイルがどのようなものでどういった仕事をしていてといったこともしっかりと把握をしてメールや電話をすることが大切です。だからお客さんとの会話を覚えておくことはとても大切なのです。会話を忘れないようにするためにも話した内容をノートに書いておくなどしましょう。お客さんの特徴を掴んで営業をすれば相手の心を掴むことができるのです。例えば毎週月曜日は家族でごはんを食べることにしているということを聞いていれば月曜日は連絡をしないように気をつけることができます。仕事の休憩はいつも何をしているのか外回りが多いかを把握しておけばその時間に連絡して営業をすることができるのです。相手も都合の良い時をしってくれているのはうれしいものです。そして前に話した会話を覚えていてくれるのはもっと嬉しいのです。たくさんのお客さんがいる中で自分との時間を大切にしてくれたからこそだと感じるからです。このように売れっ子になるためにはお客さんの心を掴むためにしっかりとお客さんのことを知ることが大切なのです。,1,,大好きな横浜デリヘルでの出来事,http://club-charmer.net/,1,0
,12,パソコンを使おう,,poster,私は数年間パソコン教室に通っていました。WordやExcelといった基本的なソフトを扱えるようになりたいという思いからです。それまでパソコンはほぼ独学でメールのやり取りをするネットを使うといったごくごく簡単なことしか出来ませんでした。そんな状態でしたので初日はとても緊張していたことを覚えています。先生はとても基本的なところから「これは出来ますか？あれは出来ますか？」と尋ねて下さって私がブラインドタッチは出来ますとお答えしたところ「それはすごい。ならすぐに上達しますよ」と笑顔で請け負って下さいました。この言葉に安心を貰いやってみようという気になったのです。結果として色々な種類の資格を取得することが出来ました。WordExcelPowerPointAccessと様々なソフトに触れ一度も失敗することなく４つのソフトの検定に合格することが出来たのです。最初はわからなかったのですがやっているうちに自分はこういうことが好きでこれは苦手だということが少しずつわかってきます。私の場合は数字や計算よりも文章を打ったり画像を組み合わせたりすることのが好きでした。勉強してみなければ気がつかないこともたくさんあります。何事もやってみることが第一なのだなと今でも思います。,1,,ビジネスパソコン,http://pcbiz.shop-pro.jp/,1,0
,12,大きなホワイトボード,,money,私が勤務するオフィスでは何かにつけてレビューを行う事が多くそれに使うための大きなホワイトボードが常備されています。書き心地はイマイチですがとても大きいので様々な情報をまとめる際には非常に役立ちます。私の自宅にもノートパソコン程の大きさのホワイトボードがあります。開発職である私は勉強のためにホワイトボードに様々なメモや技術的な情報を殴り書きしています。しかし職場の大きなホワイトボードのように多くの情報をまとめるのには不向きであり度々もっと大きなホワイトボードが欲しいと感じています。しかし個人で使うにはそのようなものは贅沢品ですし物欲が高まる度に我慢をしています。いつかはオフィスにあるような大きなホワイトボードを手に入れたいと思っていますがそれはかなり先の話になりそうです。オフィスで実際にホワイトボードを使っていると多くの意見が出されてもそれをまとめるのに十分すぎる広さがあるためストレスを全く感じません。これは実は重要な事で新しい事にチャレンジする際に如何にストレスを排除できるかが成功への鍵になるのです。私も今以上に偉くなったら業務用の大きなホワイトボードを手に入れてやろうと思います。,1,,ビジネスパソコンならNECへ?,http://pcbiz.shop-pro.jp/,1,0
,12,仕事とはいえオフィス用品を見るのは楽しい,,,以前の職場では私が文房具などの消耗品を発注する係でした。とは言え大本の発注は総務部がおこなうのですが「うちの部署ではどれとどれが要る」といったような総務に伝える発注書は各部署でつくっていたのです。そしてその担当が私だったのですが結構時間を忘れるぐらいにオフィス用品の発注は楽しかったですね。インターネットでも手軽に簡単にオフィス用品を発注できるとは言えしかしながら分厚いオフィス用品のカタログを見ているのも楽しいのです。必要なオフィス用品を必要な分だけ手間なくピピピッと発注できることも確かに便利ではあるのですが若干の遠回り無駄な時間であっても分厚いオフィス用品カタログをペラペラめくりながらときどきは寄り道をしながら選ぶのはなんとも楽しい作業ですね。「おお今はオフィス用品カタログにジュースまで入っているのか！」ですとか「オフィス用品のデスクの種類も今では種類展開豊富だなー」ですとか明らかにうちの部署の発注品とは関係のないページを見ているのも楽しかったですね。そして今のオフィス用品会社はどこもものすごく速いスピードで発注したオフィス用品を届けてくれますね。「忍者か！」というぐらいに。夕方にファックスを送って翌朝に持ってくるとは忍者ですよ。,1,,ハイスペックなビジネスパソコン?,http://pcbiz.shop-pro.jp/,1,0
,12,オッサン研究家の僕なら楽勝の仕事だけどね,,,私は自分の才能が恐い。とんでもない商売を思いついてしまった。友達からテレビゲームを借りたとしてそれを返さずに近所の中古屋に売ってしまうというのはどうだろう？ただで借りてそれを売る…。僕の中学ではこういうことが当たり前のように行われていたし僕もそれで新作ゲームをいくつも撮られてしまった。一つ引っかかることがあるとしたら僕にはゲームソフトを貸してくれる友達が一人としていないということだ。こういう寒い季節は並みのエアコンではなかなか温まらねえ…。そこで業務用エアコンの登場です！さすが喫茶店やオフィスで使われるエアコン名だけあってすぐに部屋が暖かくなりますね〜。さっきまで凍える寒さだったのにエアコンからはものすごい熱気が！？というかよく見たら炎が噴き出しているではないか…。これが業務用エアコンのエクセレントパワーってやつなのね。,1,,ビジネス用の一押しパソコンはこちら?,http://pcbiz.shop-pro.jp/,1,0
,21,オフィス用品発注担当のささやかな喜び。,,buy,オフィス用品ってどのように購入されていますか？オフィス用品の注文って会社によってさまざまですよね。一括で購入しているところもあれば部署ごとに購入しているところもありますし。また購入も担当の方にお願いすれば買ってくれるところもあればちゃんと上長などに許可申請を出したあとに購入担当の方にお願いする。っていうところもありますよね。購入先はやはりアスクルが多いのでしょうか。アスクルのカタログって見るハマリますよね。自宅で必要ではないけれども自宅からも注文してしまいたくなっちゃいます。でもよくよく考えるとそんなに安くはないかったりもするのですが。アスクルだと品物を買うごとに「スイーツポイント」というものがたまっていくのも嬉しいですよね。スイーツポインがたまるとこっそり品物と引き換えてしまっています。みんなそんなポイントがたまるってことは知らないしこれくらいならばいいかなぁ~許されるかなぁ。と自己解決して勝手に使ってしまっています。事務標用品も交換できるようですがやはりここはスイーツと交換するのが妥当ですよね。今まで食べたことりないお菓子を注文するむことが多いです。担当者だけが知っているささやかな喜びですよね。,1,,ビジネス向けのパソコンなら?,http://pcbiz.shop-pro.jp/,1,0
,7,結婚式に関する記事,,bridal,みなさんこんにちわ。みなさんは結婚式とくればウェディングドレスとかを思うかもしれませんよね。結婚は人生の中で本当に一度の大きな出来事ですよね。その結婚をしたものでないとわからないのかもしれませんが私は二年前の３０歳の時に結婚をしました。妻は４つ上の妻をもらいましたが本当に結婚式のことを懐かしく思います。今は子供が１０か月の子供がいるのですがわきあいあいとやっていますし子供の成長は本当に速いですよね。結婚は私は神社でしたが和風な感じでやりました。衣装屋さんに着物を選ぶ日にちを決めて妻のご両親さんと実家の両親さんをいれて衣装をみてもらいお互いに納得のいく衣装を選びました。それで結婚式場の披露宴会場も決めて予約をとって料理などの手配もしました。しかし人数がすくなかったので招待状はかかなかったですよね。電話で日にちと時間を伝えることにしました。総勢で２０人でしたから今の結婚式にすればこじんまりですよね。でも私の両親が結婚した神社ですので本当にご縁があるのだなとあらためておもいました。神社であげたいと妻はいっていました特に住むところの氏神様で結婚式をあげたいといっていてよろこんでいました。私としてはウエディングドレスをきせてあげたかったのですが妻はウエディングドレスよりも着物がいいといったのでしかたなくといったかんじでしたよね。でも本当に思い出にのこったいい結婚式でしたよ。,1,,結婚に向けて二次会の幹事探し,http://www.anet-nijikai.jp/  ,1,0
