Post.id,Post.genre_id,Post.title,Post.pagename,Post.menu,Post.content,Post.public,Keyword.id,Keyword.keyword,Keyword.url,Keyword.visible,Arbitrary.keyword
,7,ウェディングドレス選びについて,,gift,結婚式でどんなウェディングドレスを着るかはとても楽しみなことでした。結婚が決まるとゼクシイを読んだりしてどんなドレスがあるのかなどと色々見ては楽しんでいました。そんな状態でしたがいざドレスを決める時にはバタバタでした。結婚式の前に長女を出産していたためドレスを選んだのは長女が生後3ヶ月くらいの時でした。実家の母も一緒に式場に出向いてドレスを選びましたが私がいないと長女が泣くので大変でした。ウェディングドレスはたくさんあって目移りしてしまいました。どれも良さそうな感じで困ってしまいさらに長女も泣くので式場の方に私に似合いそうなドレスを何着か持ってきてもらうことにしました。さすがは式場の人たちで持ってきてもらったドレスを試着するとどれも何となく私に合っている感じがしました。シンプルなデザインからフリルのついたものまでな種類がありましたがドレスにリボンとレースがついているデザインのものに決めました。そのドレスを着て鏡を見るといよいよ結婚式だなという実感が沸いてきました。3ヶ月の娘が私のドレス姿を見るとニコニコ笑ってくれたのがとても印象的です。ドレス選びにはバタバタしてしまいましたが最終的に納得のいくデザインのウェディングドレスを選ぶことができて良かったです。,1,,結婚式の二次会幹事?,http://www.anet-nijikai.jp/  ,1,0
,7,白熱のウェディングドレス選び,,,5年前に結婚式を挙げました。準備が大変なのは友人から聞いていたのでそれなりに覚悟はしていました。いざ始まると想像を軽く越えてきました。日取り人数料理演出など決める事が多過ぎてその度に値段の計算。時には会社を休んでやらなくてはならず同僚にも迷惑をかけたと思います。中でも一番難航したのがウェディングドレス選びでした。自分と妻でも意見がわかれ妻が義母に相談したらそこでも意見がわかれてしまいました。先に結婚式していた義姉もそこに参戦して選択肢は増えていく一方です。女性が三人集まると男の声など届かず真っ先に俺の案は却下。女性家庭だったので義父に慰められそういう物かと納得するしかありませんでした。もめて何回目かの試着の日。自分は会社で一緒に行けませんでした。その日は妻と義母義父義姉の4人で行っていました。もめてるんだろうなあと思いながら仕事をしているとメールが一通。添付してある写真を見ると今まで誰も選んでいないドレスを着ていました。それに決めたとのメッセージもあり何故？って思いました。あとあと理由を聞くとそのドレスを着たときに義父が涙を流したらしいです。そして綺麗だねの決定的な一言。女性家庭の中での男の生き方を学んだ気がします。,1,,大変な結婚式の二次会幹事も解決,http://www.anet-nijikai.jp/  ,1,0
,7,晴れ着の日,,,晴れ着の中でもウェディングドレスというのは特別な意味があって結婚する女性は選ぶのにものすごい時間をかけるのも珍しくありません。でもフォトウェディングだったら候補を一つに絞らなくても好きな衣装で撮影できるからオススメ。男性もオシャレな人が多くなったしいろいろなデザインの結婚衣装を着てフォトウェディングをやってみたいんじゃないかしら。葬式と違って結婚式は晴れの舞台だから派手にお祝いしたくもなりますよね。でもいちおう披露宴の時は控えめに祝っておいて二次会でどんちゃん騒ぎをするのが一般的。僕も披露宴って堅苦しくて二次会に移った時は気が楽になりますよ。二次会代行業者なんてものもあるくらいでどれだけ日本人が結婚式の二次会に情熱を持っているかがうかがえますね。,1,,結婚式幹事の二次会について,http://www.anet-nijikai.jp/  ,1,0
,22,結婚式は１年前から予約しました,,traveler,７年間つきあった主人と結婚しました。ずっと結婚するつもりでつきあっていたので準備期間もたっぷりとあり１年前から結婚式場もよやくし余裕で準備ができてよかったです。周りの友人はできちゃった結婚が多くて急いで準備していたのをみて絶対に妊娠だけはしないと決めていました。だって新婚旅行もいけないし大きなおなかでウェディングドレスなんてやはりカッコ悪いですからね。ですから私たちは絶対に避妊していましたし結婚するならば親にもはずかしくない式にしようと二人で着々と準備をしました。アパートも決めないといけなかったしなんでも早いほうがよかったですね。新婚旅行も場所も決めていたのでもめることもなくスムーズに計画はすすみました。途中主人の母親がなんだかんだ言ってきたことはありましたが主人がうまく話してくれて解決してくれたり頼もしい一面も見れたし結婚の準備っていろいろな人間模様が見えたので勉強になりましたね。仕事もしていたので休む間は手伝ってもらったので引き継ぎもできましたしあわてて結婚式をする人の気持ちがわかりませんね。周りに迷惑をかけないのが前提だと思うので結婚はしっかりと余裕で準備することをおすすめします。,1,,結婚式の二次会幹事?,http://www.anet-nijikai.jp/  ,1,0
,1,エステに対して思うこと,,shibou,男と女では住む世界が違うのだと思う。 何と言っても女性は外見に関して非常にシビアな世界である。 今は男性でも美容にこだわるメンズエステなどがあるくらいだが やはり女性の美容に関するこだわりとは比較にならない。 特に流行のファッションに関しては非常に敏感で常に最新情報を入手し続ける必要がある。 男で服装に興味がないのと女性で服装に無頓着なのでは周囲からの見る目が違う。 よく割り勘では男性が多く払うあるいは女性に支払いはさせないというルールがあったりするが 化粧やおしゃれが半ば義務になっている女性の話を聞くと納得できる面も多い。 美容というのは健康とも密接なつながりがあり美容に良い生活というのは概して健康にも良いことが多い。 適度な運動が代謝を上昇させ結果として美容に良いということでモデルは運動するもの仕事のうちらしい。 自分としてはアクセサリーを身に着けたことはないがそれを作る職人の技には注目している。 装飾品は特にセンスが問われる作業なのでただ作ればそれでいいというものではない。 主張しすぎても地味になりすぎてもいけない絶妙な塩梅で細工する必要がある。 そんな引き立て役のアクセサリーを作る人からはいぶし銀の空気が感じられる。洗顔石鹸はここ数年人気のある基礎化粧品です。価格も様々で使い心地も様々。比較的安価なものが多くどんな世代の人でも手軽に使いやすいです。でもどれが自分の肌にあっているかは分からないと思うのでまずはランキング上位にランクインしているコチラの石鹸でお試しください。彼にカッコ良くなってもらいたいときはこちらのメンズエステへ。男だってキレイになってもいいでしょ？彼女も喜ぶしモテ度アップ！もはや男のエステはジョーシキです！ampgt地元を歩いていて昔の知り合いに出会いたくない人はカラーコンタクトが良い変装アイテムになるよ。過去の自分や友人と決別したいあなたのために優良なカラーコンタクト通販のサイトを見つけました。普通のコンタクトに色を塗ってごまかしているあなたamphellipやめといた方がいいですよ。ampnbspカラコンはオシャレですhttp//celebrityeyes.jp/メガネの子よりもカラコンの子の方が可愛く見えますこちらのミネラルファンデーションなら見かけだけでなく潤いのある肌が手に入る！ファンデーションでエイジングケアするという新しい発想。しかも日本人にあわせて作られたミネラルファンデーションだから肌色も自然な仕上がりになります。ampnbspこちらのエステ店へ行って全身脱毛を大阪でお得に受けちゃいましょう！低価格のコースやお安くなるオンラインクーポンもあるからエステに行く前にサイトを要チェック！ampnbsp,1,,男性のエステ?,http://luxia.jp/,1,0
,1,気軽に行けるエステ,,,エステってごく一部のお金持ちが通うところだと勘違いしていました。たしかに高級なエステは料金も高いですが探せばだいぶ庶民的なエステというのもあるんですね。エステのメニューでは美白エステや痩身エステなどが人気で私は全部やっています。テレビでめっちゃ腰が細い女性がいて毎日コルセットを巻いているとそうなるんだと聞きました。それを真似して毎日やっているのですがなかなか成果が出にくいですね。エステの人に腰が細くなる方法を聞いてみたいわ。ヒアルロン酸注入で顔のへこみを修復できますが脂肪注入でもそれが可能。もともとヒアルロン酸は体への害はないものですが脂肪注入ならば自分の体にあるものを別の部分に注入するのでほとんど無害。中年に差し掛かった母も顔が痩せてきたのでこの脂肪注入をやりたがっています。注射器を使った簡単な施術ですから日帰りで済ませることができるのも一つの魅力ですね。gt花粉症予防とアンチエイジング両方叶えましょう。,1,,男性専用のエステサロンなら?,http://luxia.jp/,1,0
,24,ブライダルエステ,,cosmetic,ブライダルエステ。結婚するにあたって新婦にはブライダルエステをしてもらうところが多いしブライダルエステを扱っているお店も増えている。ブライダルエステは普通のエステと何が違うのだろうか。違うのはブライダル結婚に向けてのエステであるということである。エステは日ごろからの美容のためのものだがブライダルエステは結婚式のためでまず目的が違う。そして内容も結婚式に向けての美容のフルコースとなっている。通常のコースメニューで同じサービスをしてもらおうとすると大枚をはたくことになるがブライダルならお求めやすい価格となっているとされている。しかし結局は合計で相当な金額になってしまうので大きな出費といえる。しかし新婦からしたらせっかくの結婚だからということでもある。本来の結婚は生涯一度きりのためブライダルエステも結婚までの期間しか受けることができない。しかし式のほうでも相当お金がかかっている。指輪を買いドレスを買い式の予約をするとなると生涯で最もお金を使う瞬間になるかもしれない。冠婚葬祭は参加だけでもお金がかかるが自分たちが主体となるとその金額は計り知れない。結婚式も例外ではないのでこれからの生活のためには少しでも節約したいところでもある。とはいえ結婚の資金を節約してしまうのはいかがなものだろうか。節約するべきところと奮発するべきところをしっかりと見極め無事にそして思い出に残るように努めるのが幸せになる努力ではないだろうか。,1,,今エステは男性も！？?,http://luxia.jp/,1,0
,24,結婚式のウェディングドレスとは,,,男の場合顔のシワは一つの勲章として考えられるがどうせなら若い方がいいに決まってるよね。 後輩が自分よりも先に結婚して東京で見つけたブライダルエステを利用してみたという話を聞いた。 普通のエステとそのブライダルエステってのは何が違うのか自分にはよくわからなかった。 結婚式の前にエステで色々ときれいにしておきたいってのは分かるよね。 主にシェービングを中心としたエステをしてくれるようで彼女は美白コースのエステを受けたようだ。 思えば結婚式でガングロメイクの人ってさすがにありないよね。 ウケを重視した結婚式であればそんなネタに走った行為もできるだろうが自分の結婚式だぜ。 もしブライダルエステを受けるとしたら自分なら美白か毛穴が目立たなくなるコースでいきたい。 結婚式では新郎新婦が主役なので常に彼らにライトが当たるようなセッティングになっていることが多い。 しかも白を基調としたウェディングドレスが多いので光の反射で顔のシミだとか吹き出物などが非常によくわかる。 地デジでも女優やアイドルの毛穴まで見えるから化粧が以前よりも気合が入っているというのもあながちウソではないかも。 ウェディングドレスではそのデザインによって露出している肌の箇所が違いますよね。 背中が広く開いていたりわきが見えるような特殊なタイプであればその部分のケアは万全にしておかないと恥では済まない。 そこで脱毛やシェービングにネイルケア等結婚式を万全なコンディションで臨めるように準備するのがブライダルエステなんだとか。 花嫁ってのはただ座っていればいいだけのものでもないんですね。 結婚式の前にエステサロンに行くのは普通だとしても美容外科で整形手術というのはむしろ交際を始める前が多いのかな。 自分の母親の世代では美容整形をやるなんて親からもらった体を傷つけているだけだって意見が多かった。 今でも変わらず整形手術に対してそういう考えの人は存在するがプチ整形くらいは容認してもらいたいもの。 誰だって不幸になりたくて美容整形をしてもらうわけではないしそうした方が幸せなのだから整形しているだけ。 人間離れした存在になりたくて体を改造する人間が世界にはいるらしいがあれはかなり特殊な部類かな。 整形ってテレビ番組を見ていてすごいなぁと思わされることがよくあるんだよね。 ぶっちゃけもともと美人な人がちょっとだけ顔をいじって完璧な顔にするのもいいが年寄りが20歳くらい若返るとかそっちの方が面白い。 テレビでははっきりと不細工だとか説明されているのがどうかなとおもったけれどテレビで整形してもらえるのならそれも仕方ないか。 美容整形院の先生はこれ以上ない大きな宣伝活動になるし手術を受ける人はきれいになれるから誰も悲しまない。 びっくりしたのが男性が豊胸手術を受けるという奴だったかな。 もちろんオカマとかニューハーフ系の人だけど自分の脂肪を胸に注入するというやり方で豊胸していたのを覚えている。 ベースの顔が良かったので胸以外はそんなにいじっていなかったけれど肩幅や体格も女性そのものでホルモン注射もやっていたのかも。 この調子でもっと美容整形を受ける人が増えれば整形手術も進歩していくだろう。 そうなったらフェイスリフトのやり方が根本から変わったようにすごく簡単で安く若返りの美容整形が受けられるかもしれない。健康に気を付けているというアナタビタミンB12は足りていますか？野菜からは摂りにくいこのビタミン摂りたい方はぜひこちらへ！自宅で白髪を染められる利尻ヘアカラートリートメントは無添加なので髪や頭皮を痛めることなく白髪染めができます。まさかあの子がっていうことありますよね。夏休み明けに度ありカラコンにしてきた子が3人くらいいました。でも一番すごかったのは先生が性転換してたことかな。肌に優しいだけでなくカヴァー力も抜群のミネラルファンデーションが欲しいならこちらのサイトを見てみてね！メイクのプロにも選ばれているその実力をあなたも試してみてください。ファンデーションいらずのプロポリスプロポリスを飲んでいればファンでなしでも外出できるかも。http//www.simoncen-propolis.com/名古屋大阪神戸そして渋谷で脱毛したいとお思いの殿方必見！こちらのメンズエステ店ではヒゲはもちろんOラインIライン脱毛もOK！ホームページを見るとさらにお得なサービスも受けられるので行くのなら是非こちらをご覧になってから！,1,,男性のメンズエステについて?,http://luxia.jp/,1,0
,5,脂肪吸引の病院,,detox,元々太っていたのですがあることを思いついて脂肪吸引しておきました。あれは僕の好きだった女の子に告白した時ですね。私デブが好きなのそんなガリガリのトリガラボディに興味ないわ。とフラれた次の日こんなこともあろうかと自分の脂肪を注入。一夜にしてデブゴンと化した私を見てその子は一瞬で落ちましたね。どんな状況にもフレキシブルに対応できる男。それがこれからのスタンダードになりつつあるのです。 彼女は脂肪吸引ダイエットに成功し90キロあった体重がたったの38キロまで痩せた。しかしダイエットすると胸からやせてくるようでバストサイズは以前とは比較にならないくらい小さくなったとか。それが嫌で胸だけ脂肪注入して豊胸しました。痩せるべきところは痩せて脂肪を付けるべきところにはつける。こんな画期的な肉体改造法があるとは女性ってうらやましい。,1,,肥満と脂肪肝,http://www.medicare-clinic.com/,1,0
,5,男なら鍛えろ！脂肪を捨てろ！,,,男なら鍛え上げた身体に憧れるそれは当然のことですしかし数年前の私は筋トレなんて無縁の酷く醜い身体をしていました典型的なビール腹で用を足すとき自分のアレが見えない思い出すだけで恥ずかしくなるほどですそんなになっても気にせず過ごしていたのですが服を買いに行って試着室で服を脱いだ時です「ここんな酷い身体で俺は過ごしていたのか！？」自分の身体を見て愕然としましたその日私は自らを鍛え上げることを決意したのです早速ジム通いを始めました。幸いなことにジムは家から15分の位置にありました（市営体育館付属のジム）仕事（アルバイト）も午後からだったので午前中にしっかりと鍛えることができる状態でしたつまりやる気さえあればかなりハードに鍛えることができるのです私は自らを鼓舞し週4回のジム通いと週2回の有酸素運動を開始しました最初のうちはもう辛くて辛くて何度ジム通いをやめそうになったか分かりません「こんな重いバーベルを持ち上げて何になるんだ」自問自答の日々でしたしかし自分の身体を鏡で見るとやる気は戻りました。こんな醜い身体から1日も早く脱してやる！とその生活が約半年続きましたジム仲間のおじさんが一言「いい身体になったねえ」と私に言ってくれましたその時ほど嬉しかったことはありません。苦労が報われた気分でしたそれでさらにやる気になった私はそれから数年間身体を鍛えつづけました今では体重75kgで体脂肪率15％誰が見ても筋肉質な身体を手にしたのですちなみにジム通い前は88kgで体脂肪率25％でした忌むべき過去です,1,,肥満と脂肪肝,http://www.medicare-clinic.com/,1,0
,1,脂肪吸引の経験,,shibou,お洋服のリフォームというのをみなさんはご存知でしょうか。古くなったお洋服を洋裁で別のお洋服にしたり全く別のものにもできます。長年履いていて自然にできたダメージジーンズがたくさんありましたがいよいよ履くのも困難なほどダメージを受けていたのでこちらをリフォームしました。専門店で綿と糸といくつかのアップリケを買ってくればあとは作るだけです。まずはジーンズを切り開いて型紙に合わせてさらに裁断します。次に形になるように塗っていきある程度の形になったら綿を中に詰め込みます。最後にダメージ部分にアップリケを縫い付ければリフォーム完了です。ダメージジーンズを使ったちょっとワイルドなぬいぐるみの完成です。もともとのデニム生地の固い色合いとぬいぐるみの愛らしいラインがいい感じにまとまっています。綿と型紙があればだいたいのものが作れます。ぬいぐるみクッション座布団枕と元がお洋服とは思えないものまで作れます。なかでもお気に入りなのが古くなったスーツ一式を上下まるまる使って作った座布団です。苦楽を共にした思い出の品物だったのでこれは別々のものを作るのではなく一つにまとめたいと思っていました。スーツ部分が相当大きいので相当裁断しましたが生地を余すことなく使って最後にネクタイをリボン結びに縫い付けて完成しました。使うたびにあの思い出がよみがえる一品です。最近は服装も多様化してきたことで街行く人もとても個性的な時代となってきましたね。男性専用の化粧品男性専用のショップモール等amphellip女性だけでなく男性もおしゃれになっていてバッグや小物にも手を抜けなくなってきました。ampnbsp最近ではオシャレで可愛いのに非常に安価で購入できるショップも増えてきたということでお金を切り詰めなければいけない人も目を惹くような服装をしていらっしゃるように感じます。また服装だけでなく雑貨も時代とともに非常に多様化したデザインとなってきております。少し前まではケーキ型のタオル等が贈り物としてものすごく流行りました。ampnbspこのようなちょっと可愛いのに変わったデザインは変化していく時代とともに今後も増えていくでしょう。当ページではおすすめのバッグ機能的な服 装個性的なカラーコンタクトなどお気に入りの身の回りの品物を見つけておすすめしていくコラムを記入しています。,1,,脂肪肝って何？,http://www.medicare-clinic.com/,1,0
,1,脂肪吸引バンザイ,,,中野区に引越してきた時に実家の荷物を処分しろと家族から抗議された。不用品回収に出すにはもったいないと思いきやたしかにマンガもギターもいくつか処分しないとね。小学生からの学習机とうるせぇからやめろ！と隣のオッサンが怒鳴り込んできた銅鑼は惜しまれつつも処分…。何がしたくてこんなもん買ったんだろう…？そういう自分でも理解に苦しむものはまとめて不用品処分に電話ですよ奥さん。ゴミ拾いが生きがいの父はゴミ捨て場からいろいろなものを拾ってきます。杉並区の不用品回収業をやっていた時ゴミも売れることを知ったらしくそれ以来売れないようなゴミも拾い続けています。いいかげん庭にも置ききれなくなってきたし不用品回収を呼ぼうと提案したが捨てようとすると烈火のごとく怒りだす…。近頃は資源ごみの持ち去りが問題化しているし手が後ろに回らんうちにゴミ集めは控えてもらいたい。,1,,肥満の原因、脂肪肝,http://www.medicare-clinic.com/,1,0
