Post.id,Post.genre_id,Post.title,Post.pagename,Post.menu,Post.content,Post.public,Keyword.id,Keyword.keyword,Keyword.url,Keyword.visible,Arbitrary.keyword
,2,キャバ嬢は決して軽くない,,tantei,キャバクラなどの風俗で働いていると女性というとなんとなくだらしない生活をしているなどと思ってしまう人は今も少なくないと思います。が実際に話してみると案外しっかりしてる子が多かったりします。もちろん何となくお金が欲しくてやっているという子もいますしそういう子が急に大金を手にする事でだらしない生活に転がり落ちて行くという事もあるようですが最初から目的があってお金稼ぎのために選んでいる子も確実にいます。そういう子は目的のために短期でスパッと稼いでいこうとしているのでサービスに対し積極的だったりもして不快な思いをさせられることも少ないように感じます。キャバ嬢に求めるものは人によって違うとは思いますが女の子と楽しく会話したいタイプの人ならばこういうタイプの方がいろいろと楽しめるのではないかと思います。あんまり深い話をするのは疲れるという人にはお勧めできませんがしっかりした子の夢の話を聞くことで自分が若かった頃の記憶が刺激されて活力がわくんじゃないかと思います。あと全てのキャバ嬢に対して最初から軽く見ることなく接すると不思議ともててる感じになったりもします。単純に扱いやすいからやさしくしてくれてるだけかもしれませんが。,1,,交際クラブなら大阪のここがオススメ,http://sin-yugurezoku.com/,1,0
,2,飲みまくった日々！,,money,私は18歳〜24歳までの6年間スナックやキャバクラで働いていました。大学進学のために上京してアルバイトで始めたんですけど大学4年生のときにこのまま就職して良いのか迷ってしまって「どうせだったら今までやってきたことを突き詰めてやろう！」と思ってそのまま夜の世界に･･･。大学卒業後の2年間は日曜日以外ほぼ毎日出勤してNo1目指して飲みまくってました！！お客さんの中には本当に素敵なおじさまもいらっしゃいますしエッチなことしか言わないお客様も･･･。でもエッチなことしか言わないお客様やお触りをたくさんするお客様って実は単純でとってもお相手しやすいんですよね。にこにこして恥ずかしがって何とか時間を延ばす･･･ちょっと困るのは「本当にお前が好きだー！」っていうお客様。こっちも友達みたいに接するけどフっちゃったらそこでおしまい。会う度に告白されたり･･･正直ちょっと面倒でした。そんな日々を送りながらNo1を目指して私がやったのはとにかく飲む！飲んで飲んで飲みまくる！結構内気な性格だから飲まないと上手におねだりできないくて＞＜飲んでからあの高いワインが〜とかねだっちゃってましたねｗ肝臓負担がすごかっただろうなと思いつつ今では良い思い出です。もう一度やってみたいなって思ってることは旦那には内緒です♪,1,,大阪で自由恋愛の交際クラブはこちら ,http://sin-yugurezoku.com/,1,0
,2,最近のキャバクラ,,,男性の多くの人はキャバクラに行った事があると思う。先輩会社の上司に連れて行ってもらって逆に自分が後輩を連れて行ったこともあると思うが最近のキャバクラは私達お客様がお金を使って嬢の機嫌を取っているような接客をする嬢をちょいちょい見かける印象がある。私はキャバクラはそれほど回数は行ったことはないがその中での感想である。昔若い時に行ったキャバクラではどの嬢も最低限の接客をしていたし失礼な事をされて気分悪くなった事はなかったと思うしこちらを立ててお客様がしたい話しに合わせて気分よく話しを聞いてくれててノリもよかったと思う。そしてたまにお店での勤務が終わってからアフターに行けたりもして楽しかった。だが最近のキャバクラは私が若かった頃よりは楽しくないし気分悪くなってお店を後にする事もある。お金を払っているのに話しをふらなければあまり話さないお客様のお金でお酒を飲ましてもらう時だけちょっと笑顔になるだけのような態度を取ったりする。ただ単に私の最近の運が悪いだけかもしれないがキャバクラにもゆとり世代が入ってきているのかとも思う。ぜひお店そこで働く嬢にはもう少し仕事という意識をもってほしいと私は思う。,1,,ハイクラスな大阪交際クラブ,http://sin-yugurezoku.com/,1,0
,2,風俗で働くメリット,,,風俗やデリヘルキャバクラといったお仕事の利点はやはりなんといっても高額な給料が得られる点です。月収４０万円や５０万円までならば普通の職種においても得られる金額ですが風俗デリヘルキャバクラといったお仕事は月収１００万円２００万円も可能な世界です。だからこそ風俗やデリヘルキャバクラといったお店で働く女性が絶えません。昔はお水系のお仕事はなんとなく怖いアングラといったイメージもありましたが現代においては普通の大学生や普通のＯＬが副業として気軽に行なうような仕事にもなりまた現アイドルが昔アルバイトとして働いていたなんて事も多く決してマイナーなお仕事ではなくなりました。可愛い子や派手な子はこういったお水系で働いている事が多いですよね。可愛いからこそ容姿を活かしてお水系のお仕事で働くのかそれともお水系のお仕事をしているからこそ容姿が磨かれるのか定かではありませんが私はきっと両方ではないだろうかと思います。年収１０００万円以上も可能であるお仕事アルバイトとしてカフェなどで働くよりもずっと効率的ですよね。稼いだお金を何に使おうといった楽しみも膨らむようです。風俗やデリヘルですと病気といった懸念がありますが最近は診察代を負担してくれるお店も多いのでお金の面ではとっても安心ができます。病院に行けば殆どの病気はすぐに治るために定期的な病院通いだけはしておきたいですね。,1,,新夕暮れ族 ,http://sin-yugurezoku.com/,1,0
,12,大阪北新地で働こう！！その２,,poster,初めて新地の店に入ったのは確か月曜日。一般的に月曜日は暇だと言われる魔の曜日。理由としてはいつかメディアで言っていた『月曜日は１週間の始まりなので体力を温存しておきたい』。しかし私が勤めているキャバクラよりもはるかに広い店内。卓に置いてあるのは高級なブランデーやウィスキー。そう言う私が着ているドレスも今まで着ていたものよりも何倍も高級感の漂うもの。『でも新地ってこんなドレスじゃダメなんじゃないですか？』私は安い自分のドレスを指差した。『最初はこちらで用意しましょう！！』用意されたドレス。布の質自体がもう違うんですけど…。私は今まで来てくれていた社長が普段どんな場所で飲んでいる人なのかと思うと今までの振る舞いに罪悪感さえ感じた。勿論社長が来店する日だ。同席した女の子は驚く程綺麗でスタイルも抜群。女の子同士が並ぶようなシステムじゃなくて本当に良かった…。煙草に火を点けるのはライターではなくマッチ。私デュポンしか持ってませんが…。接客するより女の子の方が気になって仕方がない。私が働く店にいる女の子とは全く違う。話を聞いて下手に口出す事はない。そして時には私にも上手に話を振ってくれる。かと言って無言で微笑む人形ではなく時に言う事は確実に的を得ている。いや的しか得ずに簡潔に言う。“こうなりたい”素直に思った。後に知った事だけど彼女はNo.１だった。彼女に惚れ込んだ私は後に新地で本格的に働く事になる。バブル全盛期では『パパ?旅行に行くの?』と言っては旅費として平気で５万貰ったりしていたらしい。１０年前はそんな事はなかったけれど。バブルの残り香は確かにあった。それが北新地。,1,,高級会員制の大阪にある交際クラブ ,http://sin-yugurezoku.com/,1,0
,12,豊胸手術で気持ちも大きく,,biz,純正のトナーじゃないとインクが漏れたり故障の原因になると聞いてリサイクルトナーは使わないでいました。でもお隣の会社では普通に使われているらしく現に今は再生トナーしか買っていません。まず第一にメーカー純正のインクトナーともなると値段がべらぼうに高い。これ一つでコピー機が買えてしまうのでは？と思うくらいに高いですね。その点リサイクルトナーは価格もこなれているしビンボー会社の必需品です。普通のトナーとリサイクルトナーって何が違うんでしょうね？昔は私のオフィスでもメーカー純正のトナーを使っていたようですが不景気になってからはずっと再生トナーだとか。自宅のプリンタではメーカー品のインクを使っているけれど印刷の美しさにこだわっている人なんているのかな？ほとんど文章しか印刷しないし求めるのは印刷の速さだね。レジスターを中古で安く買ってもこのソフトを導入すれば最新万能レジに早変わり！ネットにつなげばどこでも売り上げ状況が分かるから便利！経理ソフトで会社のレジも経営もこんなに変わります。ノベルティで会社の印象を深く良くしましょう！ストラップやエコバッグバッグハンガーなど実用的でついつい使ってしまう欲しくなってしまうノベルティが格安で制作できる会社です。魅力的なノベルティがあれば商品の売り上げアップや会社の知名度アップ好感度アップにもつながります！こちらで質の高いユニークなノベルティをぜひ作ってみてください。大切なペット葬儀は神奈川県のこの専門会社に依頼しましょう。神奈川県全域で訪問火葬を行ってくれ受付も２４時間対応してくれます。ペットとお別れするのにどうしたらいいか迷ったときはこちらのサイトをまずは見てみてください。いろんな不安や質問に対する答えが載っています。悲しくて火葬に立ち会えないという方も信用できるこの会社に任せれば大丈夫。仏壇通販するなんて罰当たり？仏壇ない方がずっと罰当たり！伝統とテクノロジーを融合させて便利で文化的な生活を！,1,,有限会社スキル,ttp://www.neckstraps.jp/ ,1,0
,12,ちょっと人気のオフィスグッズ！,,,オフィスは洋服だけでなくサンダルもおしゃれにする方もいます。サンダルといっても今人気の美脚に見える「クロスサンダル」やキラキラしていて可愛い「ビーチサンダル」ではありません。オフィスに履いていくようなサンダルはそんなに踵【かかと】が高くないワンポイントの部分が大人ぽく美脚に見えたり足が長く見えたりするといった感じで足が疲れにくく防臭の役目も果たしてくれる優れたサンダルです(｀)ここで今オススメのオフィスサンダルを紹介します！1位つま先踵【かかと】がないので脱ぎ履きが楽で大人ぽいデザインの「ストラップサンダル」2位赤黒茶の3色がありワンポイントのリボンが可愛い「美脚サンダル」3位消臭抗菌美脚の3つが手にはいる「美脚サンダル」私もいつかオフィスサンダルを履く日が来るのだろうか()のぼりの印刷をするだけである程度の集客効果が望める。のぼり広告事態が大きいため人の目に入ることが多いからである。人の目に多く入れば人は少なからず興味を持つのだ。そして歩を店に向け進み出すというのである。,1,,ネックストラップ,ttp://www.neckstraps.jp/ ,1,0
,24,お母さんとお揃いのオシュコシュパンツ！,,,腕時計がおすすめです。いつもと同じスーツ同じネクタイで日常にマンネリを感じましたら腕時計の装着がお勧めです。スマホの普及で時間を見るのはスマホでいいという方が多いと思いますが腕時計は時間を見るためだけのものではありません。腕時計はつけているだけで自分がどのような人間なのかを見る指標になります。スーツやネクタイでもそれなりに指標にはなりますが腕時計が圧倒的に印象の違いが出ます。というのは腕時計をつける人の数が減少傾向にあるためです。腕時計は見ただけで高級だとわかるものもありますしつけている＝おしゃれということでもあります。パッと見ただけでその人がどれだけの生活水準なのかどれだけおしゃれなのかがすぐにわかるというのがビジネスでも日常でもお役にたつことでしょう。普段からＰＣをよく利用したりスマホをよく使う方には文字盤もお勧めです。デジタル画面ではないので見づらいかもしれませんが芸術的な意匠をしたものも多いため目にするだけで気分が変わるでしょう。日々の時間管理が大変な方にはデジタルがお勧めです。いちいちスマホを取り出し時間を確認してまたしまう時間を確認するだけでこれだけの工程を踏まなければならないのは帰って非合理的ですし業務中に取り出す姿は見栄えが悪いと思います。時間の確認だけならデジタルのが圧倒的に便利ですのでぜひともご利用ください。またデジタルも文字盤も両方ついているものもあるので迷ったらこちらのほうもお勧めです。ビーズアクセ作りませんか？職場のママさん方にお知らせです。今度の当社でのフリーマーケットにてビーズアクセの作成と販売を行おうと思います。ママさん方には作成したビーズアクセを家族に見ていただいて感想を聞いていただきたいです。また作成したものの一部はお手伝いのお礼として無償にて差し上げます。フリーマーケットでは例年女性と家族連れの方が多いですがこれらを対象とした商品を私たちは提供したことがないので今回ビーズアクセの作成に挑戦したいと思います。今回作成いたしますのはアクセサリーの中でも比較的に小さいリングやネックレスストラップなどです。これらは小物ですので女性にも子供にもお買い求めできますし作るのも容易だと思うからです。ママさん方にはみんなで協力して一つ一つ丁寧に作っていこうと思います。目標は一人当たり１日５つです。買い出しや当日の売り子のお手伝いもよろしくお願いします。またママさん以外の方でビーズアクセの作成経験がある方はぜひご協力ください。また万が一売れ残りが出てしまった場合はみんなでお金を出し合って均等に分け合おうと思います。もちろん売り切るように頑張りますが。例年通りだと男性社員の焼きそばやたこ焼きといった飲食物のみが当社の出せるものとなってしまうので我々女性社員がそれの手伝いでは面白くないと思います。,1,,有限会社スキル,ttp://www.neckstraps.jp/ ,1,0
,23,オフィスの引越しも,,,名刺印刷が格安でしかもとってもキレイにできるのはこの会社だからこそ！100枚380円からという驚きの価格で人気です。なんと当日発送もしてくれるので欲しいときにすぐ自分の名刺が手に入りますよ。飲食店のposレジを替えれば経営も変えられる！？ただのパソコンすらposレジへと変えるこちらの経理ソフトを使えば経営を上向きに変えられるかもしれません！ポスレジ機能だけでなくタイムシフトや仕入れ発注の管理そして税務申告までこなせるこの経理ソフトをぜひお試しください！販促として定番のノベルティ安く作るならこちらへ。定番のストラップは特に激安。バッグハンガーや3Dグッズなど新しいノベルティとして人気のアイテムもオリジナルで製作できます。数多くの種類の中から御社にあった販促品が作れるノベルティ製作会社です。オフィス移転のLAN工事や電話配線などオフィスの配線工事をするならこの会社にお任せください。オフィス移転のコストを削減したり業務を効率よく進めたいならこちらです！引越しに必須のlan工事をココでhttp//www.comnysystem.com/,1,,印刷物のネックストラップを作成 ,ttp://www.neckstraps.jp/ ,1,0
,21,手作り勢ぞろいのフリーマーケット,,buy,フリーマーケットでは着れなくなった子供服をよく売っています。１枚の値段はそんなに高いものではないけど子供服を処分したいと思ったのでちょうどいいと思いました。着てくれる人がいるなら無償でも譲りたいくらいだと思っていたので売れたときはすごく嬉しかったです。手作りのストラップやキーホルダーも何気に売ってみると全部ではありませんがかってくれる人がいて嬉しかったのを覚えています。フリーマーケットはなかなかお客さんが来ないときの方が多いです。結構暇なのですが1人でしているとトイレに行けないということもあるので出展する際には誰か他の人に頼める人がいるかもしくは２人で出展するほうがいいと思いました。ならべ方もお客様の目を引くようにならべないといけないと思いました。服ならたたんでおいておくかハンガーにかけておいておくのもいいと思います。お客さんが商品を見ていたらさりげなく説明をしてもいいと思います。フリーマーケットでは同じ出展する物同士仲良くなることもあり次は一緒に出展しようといった話になったりする事もあるんです。手作りのハンドメイドを一緒に出展するのはすごく楽しいだろうなと思いました。出展する方もかう方もすごく楽しめるのがフリーマーケットのいいところです。そしていろいろな人とのつながりもできる魅力的なイベントでもあると思っています。出展する際には小銭もしっかり用意しておかなければいけないとも思いました。,1,,大好きなストラップネックについて,ttp://www.neckstraps.jp/ ,1,0
,12,自宅でエコ,,biz,普段のライフスタイルの中でできるエコ活動は外出の際はマイボトルマイ箸を持参し割り箸をなるべく使わないようにすることはエコです。割り箸といっても日本中の人々が利用することによって木が伐採され山が削られてしまいます。木が一本育つのに何十年何百年もの月日がかかってしまいます。夏は毎日のように猛暑が続き寝苦しい日々が続きますがエアコンの温度設定をなるべく27から２８度に設定したりゴーヤを自家栽培すれば食べることもでき緑のカーテンができて2から３度も部屋の温度が下がるそうです。とってもエコです。リサイクルショップやフリーマーケットを利用すればゴミにならずに地球にやさしいですし自家用車をなるべく利用しなければガソリンを使うことがないので地球にやさしく健康やダイエットにも適しています。お風呂のお湯は洗濯をする際に利用すればお水の節約につながります。食器洗い機は電気代と水道代がとてもかかるので食器を洗う前に汚れをふき取り低温で洗うことが最適です。テレビはテレビの横を横切ると分かるのですが電気をたくさん使うので特に見たいものがあまりないときはつけないだけでもとってもエコです。冷蔵庫は食材を常に一定の温度で冷やしているため食材や調味料を詰め込みすぎると必要以上に電気代がかかり野菜などを腐らせてしまいますので空に近い状態を心がけることが理想です。他にもついついやってしまいがちなことですが顔や歯を洗うときは水を流しっぱなしで洗うのでなくコップに水を入れて洗うことは水道水節約に大きく貢献できます。自宅の掃除って面倒くさくて気が付くとゴミの中で寝てたりしますよね。不用品処分でそんな日々ともオサラバしましょう！東京埼玉エリアを活動拠点としゴミ処理や不用品回収のスペシャリストがあなたの不用品を待ちかねています。仏さん以外なら何でも回収！そんな頼れる不用品処分業者といえばここ！引越しをしたら廃品やら粗大ゴミやらが沢山でてきた。流石に新居にゴミを持ってくるのも気がひけるので横浜の業者の人に連絡しておこうと思う。数えただけでも粗大ゴミが数百個早く不用品回収してもらないと今の家がゴミ屋敷と誤解されてテレビに取材されちまう！安くて即日で持って行ってくれるところを探してこよう。不用品処分うちの会社で一番の自慢はコピー機にリサイクルトナーを使っていることです。会社を訪問される方にはさりげなくコピー機を開けてリサイクルトナー入ってますけど？みたいなジェスチャーを見せます。驚いてリアクションが取れないお客さんを社員みんながドヤ顔で迎えるという流れ。愛想笑いが得意なあなたはぜひ一度わが社のリサイクルトナーを見に来てくださいね。再生怪人は大抵弱い法則だが再生トナーは純正品よりも高性能かもしれないですよ。一度使ったトナーを回収してもらうたびに再生トナー回収の業者さんには心から感謝しています。地球の100年200年6億5000万年後のことを考えるとエコって大切ですからね。再生トナーを利用することは小さな行いだが私の聡明さはそんなことよりももっと偉大だ。,1,,食材宅配,http://www.you-shoku.net/,1,0
